Episode,Date,Review
61,"Sep 1, 2021","I'm so slow at this, why can't Dokja kill when he a lot of people in the station"
61,"Sep 1, 2021",this is wonderful
61,"Aug 31, 2021",WOWOW
61,"Aug 30, 2021",This chapter was beautiful
61,"Aug 30, 2021","Webnovel reader here!! I love how this chapter was done, however! I don't like that the sparks are blue. Novel readers know that those are supposed to be very special sparks, and blue magical effects are really common in the novel. So unless the artists have a way in mind to properly distinguish the sparks aside from color, I would have preferred to see them in yellow."
61,"Aug 29, 2021",This chapter was Beautiful
61,"Aug 29, 2021",THIS CHAPTER IS SO EPICCCC!!!!
61,"Aug 28, 2021",ayo why he slowly turning like Solo leveling
61,"Aug 26, 2021",woah
61,"Aug 26, 2021",OMG the undead scene remembered me of Solo Leveling. Even the art is similar!
61,"Aug 25, 2021",[The constellation Skaterkk is intrigued by KDJ’s actions.]
61,"Aug 25, 2021",dang it.. 
61,"Aug 24, 2021",When you read the webnovel and you know whats gonna happen: pain
61,"Aug 24, 2021",SUNG JIN WOO?????
61,"Aug 24, 2021",name a better combo than this manhwa with their female swordswomen (jihye n huiwon)
61,"Aug 20, 2021",someone tell me what does it mean by regressions....and relevation.....it's my biggest doubt since the start. .. T.T
61,"Aug 19, 2021","Art is dope, but the story keeps going wherever MC needs it to go. No struggle, no hurdles, no fun for me :/ But that's for me personally. I dislike things going THAT smooth."
61,"Aug 18, 2021",is that...Kaz? my baby?
61,"Aug 18, 2021",Deym~ [Dokja become Yusin Kim] 
61,"Aug 11, 2021",skeleton army go brrrrrr....
61,"Jul 24, 2021",i thought dokja's sword name was unbreakable faith why was it named as unbreakable trust? or i just missed something
61,"Jul 24, 2021",Man that was awesome 😃👍
61,"Jul 22, 2021","This chapter was amazing, story just keeps getting better and better"
61,"Jul 18, 2021",Where can I buy the web novel?
61,"Jul 15, 2021",Wow this chapter was amazing 🤩
61,"Jul 15, 2021",Again Dokja brings together the best squad and takes another amazing victory. More Coins to our fellow Reader!
61,"Jul 14, 2021","when dokja had glowing eyes and said ‘attack’ with the army of corpses around him, he’s kind of giving sun jinwoo ‘arise’ vibes from solo leveling... 😳 protagonist thingz "
61,"Jul 14, 2021",Wow!! This chapter!!!
61,"Jul 14, 2021",Holy shit
61,"Jul 14, 2021",YASSS!!! Epic battle completed in 1 chapter! So happy I read this!!!! 
61,"Jul 14, 2021",Dokja playing StarCraft now too???
61,"Jul 14, 2021","I was not expecting that, nice chapter!!"
61,"Jul 14, 2021",「The Constellation Neptune’s」 Has finally brushed up on the Three kingdoms Era in Korean history from last chapter🤦🏻‍♂️… and finally somewhat understands what’s going on with Gwanchang vs. Gyebaek….but I don’t want to get too A HEAD of myself…. Ha that was a Decapitation Pun…🤭 [5 coins have been sponsored.] (For Compensation of that terrible joke)
61,"Oct 7, 2021",Author please explain about the whole real world/ novel. You’re hurting my head
61,"Aug 26, 2021","this definitely isn't getting seen but since when did Blade of Faith become ""Blade of Trust""?I was mildly upset with the translation on Judgement Time being ""Time of Judgement"" but this is apparently where my line is drawn"
61,"Aug 25, 2021",should've paid attention in my korean history course goddamn
61,"Aug 20, 2021",[the constellation Baz Sato smiles upon the blood bath]
61,"Aug 19, 2021",wow this is such a cool reaneactment of a historical event 😮 and the art of this episode is AMAZING !!
61,"Aug 18, 2021",I got solo leveling vibes from that battle
61,"Aug 18, 2021",DOJKA USED ARISE!!!!!! 
61,"Aug 17, 2021","[The constellation ""KeeperOfTheBookHoard"" can't wait to read more] [5 coins have been sponsored]
[""KeeperOfTheBookHoard"" is now broke]"
61,"Jul 14, 2021","Dokja has noticed [Lazy Broke Weeb's] sponcer,""hold up wait a min there's a F****** god of Weeb's hell yeah"""
61,"Jul 14, 2021",Damn he’s smart AF
61,"Jul 14, 2021",The power of knowledge rises again
61,"Jul 14, 2021",omg this chapter is intense af. DIE FOR OUR KING!! Oh my heart.....
61,"Jul 14, 2021","Im getting a tattoo of Kim dokja based off the novel this week, it’s gonna be my first tattoo😳"
61,"Jul 11, 2022",it's getting harder and harder to keep with the names of people and places 
61,"Dec 18, 2021",i had a solo leveling vipe
61,"Aug 21, 2021","who else thought of ""arise"""
61,"Aug 18, 2021",Dokja looked especially handsome while being possessed 🤭✨
61,"Aug 18, 2021",Arise
61,"Aug 18, 2021",Dokja used Arise
61,"Jul 14, 2021",I’m really curious to see more constellation interactions
61,"Jul 14, 2021","“ I call upon you, a literal GOD. Help me wi-“ “nah fam I’m good.”"
61,"Jul 14, 2021","I’ve made 13 different playlists on Spotify for all the main characters of orv novel and I have a couple for the side characters😮‍💨
If u wanna listen to any it’s under kttburke the profile photo is Kim dokja, I don’t think there are really any spoilers other then there are playlists for characters that haven’t appeared in the WEBTOON yet"
61,"Jul 31, 2022",solo leveling one Word 
61,"Jun 14, 2022","Why do I feel like if I had finish the kdrama Hwarang starting my babies, BTS:V, SHINee: Minho, Park Seo-Joon, I would have gotten more of an understanding on this chapter"
61,"Feb 17, 2022",Dokja be going full Jin-Woo mode(ARISE)
61,"Feb 10, 2022",The sky was so beautiful 😍 And this Chapter makes me feel Dumb😁 I can't understand anything But this Chapter was very good ig 
61,"Dec 13, 2021",what in the solo leveling
61,"Oct 8, 2021","Did anyone else notice that Dokja's sword changed names? Is that a possession trait, or a mistranslation?"
61,"Aug 25, 2021",Gonna stop reading now this fight just fealed like a giant filler for me. Have fun all other readers.
61,"Jul 26, 2021",I am so confused 🤠
61,"Jul 25, 2021",Bruh Dokja lost his invincibility.. 
61,"Jul 14, 2021",Love how author is not making all his plans perfect but they only work because of the new characters he helped on the train
61,"Jul 14, 2021","craaap, necromancer spotted. well played"
61,"Jul 14, 2021","check, this is when you concede"
61,"Jul 14, 2021",We are already at 60 episodes!?!? Time flies. 
61,"Aug 18, 2021","Gee, I've never had top comment! "
61,"Jul 14, 2021","""the prisoner of the golden headband"" is impressed donates 5 coins "
61,"Jul 14, 2021",A
61,"Aug 24, 2021",This is like reading solo leveling except with twitch chat
61,"Aug 23, 2021",Did dokja just pull a sung Jin-woo?
61,"Aug 19, 2021",Seeing Kim Dokja and the skeleton army reminded me of Sung Jinwoo and his shadow army 😩. Wish Webtoon would add Solo Leveling.
61,"Aug 24, 2021","hohoho, here is a Future man I'll enlighten u all with a knowledge that we can read past the chapters from other sites like toonily, webtoon.xyz ... there are korean-english scanlations of this seriesalso its free of cost
hurry up and get free from cliffhangers...
signing off FUTURE MAN 3.0"
61,"Aug 24, 2021","THIS SHIT IS ASSS 









(jk)"
61,"Aug 18, 2021",Dokja entered a Solo Leveling state and I love it 😂
61,"Aug 18, 2021",I just got sung Jin woo vibes
61,"Aug 19, 2021",Dokja really just pulled a fourth wall and turned into sung jin woo
61,"Aug 19, 2021",Arise!??
61,"Aug 18, 2021",I always thought sung jin woo and dokja were similar but damn
61,"Aug 18, 2021",Anyone getting solo leveling vibes when he rose the dead lol
61,"Aug 18, 2021",Wow two filler episodes in a row. Amazing.
