Episode,Date,Review
27,"Dec 31, 2020","yesssss i was hoping to see that girl and now she’s here. when i first saw her kill the girl in the beginning, i really liked her. she’s so badass"
27,"Dec 29, 2020",can we appreciate how Dokja keeps making constant preparations for anticipated scenarios that he will clear due to his foresight
27,"Dec 25, 2020",[エンヤ火炎 is also sad that they did not get to peek into your past]
27,"Dec 25, 2020","*Cries because Gilyoung is just a sweet little kid who didnt deserve all that trauma and abuse from his mom, but now he has Dokja-Hyung*"
27,"Dec 25, 2020","Such a good episode is a great christmas, present and Merry Chirtsmas everyone 🎄🎉🎁🥳🥳🥳"
27,"Dec 24, 2020",I can't wait until we unlock [Dokja's Tragic Backstory]™
27,"Dec 24, 2020","Hopefully we get more badass female characters. killing your best friend for survival,,, hmmm,,,,, hopefully she’s strong at least"
27,"Dec 24, 2020","dokja is a very interesting character. I'm very curious as to how he will progress in the future, both mentally and physically."
27,"Dec 24, 2020",“Survived by killing her closest friend”....GUYS I-
27,"Dec 23, 2020",I can’t believe she killed her closest friend holy sh- I get that she did it to survive and in that peak moment of live or die you make a choice and just damn 
27,"Dec 23, 2020","Every time I read an episode of this I imagine this happening in our lives, and it just freaksme out imagining killing your closest friend"
27,"Dec 23, 2020","Gilyeong is such a puppy, I just want to hug him and protect him all the time, even though I know he has the guts to survive and defend himself is just... He's so precious. 😭💜"
27,"Dec 23, 2020",protecc Gilyeong!
27,"May 17, 2022","everytime Gilyeong hugs Dokja, I melt 🥺"
27,"Jan 13, 2022",Gilyeong sees Dokja as a parental figure and you can’t tell me otherwise.
27,"Oct 6, 2021",She had a whole classroom of people she could kill and she picks her best friend?
27,"Sep 29, 2021",I love how Sang Ah is the most realistic female character. She isn't a little mainiatic and oddly badass. But she has strong knowledge and good adaptation skills. And a gorgeous face too ofc 
27,"Jul 27, 2021",Ah so the 4th wall skill is just plot armor. So I guess Dokja is our MC after all...
27,"Jul 2, 2021","if i was there i would've been embarrassed of myself Abt how much i cried lmao, I'm around the same age as Gilyeong and I'm actually surprised about how brave and smart he is considering the fact that there's a lot of gory stuff that's happening around him, I'm glad he got away from his abusive mother :) "
27,"Jun 8, 2021",when gilyeong hugged our mc i feel like my heart's full of rainbow and fluffy stuff
27,"Jun 7, 2021",must protect gilyeong hes so cute.dokja seems like a brother/father figure
27,"May 22, 2021",Poor Gilyeong idk what he went through but he's a must protect kind of a character. He's so cute n it's also cute how he always hugs Dokja whenever he's sad and scared. They're like brothers.
27,"May 11, 2021",MY BOY GILYEONG BETTER STAY SAFE AND SOUND THROUGHOUT THE SERIES 
27,"May 6, 2021",aww I love Gilyeong's relationship with Dokja. it's nice they're able to stay together during this apocalypse
27,"May 1, 2021",Bro a couple chapters ago I thought what if someone’s mum told their child to kill them to survive the train event (1st one) since I saw parents still had their children and now I’m sad thinking about the possibility since the child is one of my favourites :'(
27,"Apr 30, 2021",So Bald Leader of the Peasant's Army and Jihye's Constellation are besties?? How adorable ❤️
27,"Apr 28, 2021",Gilyeong and Dokja's relationship is so WHOLESOME! TwT
27,"Apr 28, 2021",only survivor of a school?! 
27,"Apr 27, 2021",ahhh dokja and gilyeongs relationship is so cuteee
27,"Mar 28, 2021",I could SO see Dokja becoming a father figure for Gilyeong
27,"Mar 26, 2021",gilyeong has my entire heart idc
27,"Mar 24, 2021",poor kid ._. hope you'll heal as time pass by
27,"Mar 19, 2021",Dokja looked like a genuine father for a second there. I would have never guessed that before the appocolps he jus read Web comics!
27,"Mar 6, 2021","keep your eye on that item, it will no doubt be important (specter stone thing)"
27,"Mar 6, 2021",[CONTELATION CRAZY WEEB SEMPAI IS TEARY FROM GILYEONG'S REACTION 😢]
27,"Feb 24, 2021",the fact that most of thr comments are about Dokja and Gilyeong just makes this episode better LMAO
27,"Jan 15, 2021",I would literally die for Gilyeong
27,"Dec 31, 2020","Ohhh my goodness, that was adorable. Dokja is like Hyeonseong’s big brother that everyone has a crush on... Am I right or am I wrong?!"
27,"Dec 29, 2020",I hope it will get anime an  adaptation  soon 
27,"Dec 28, 2020","SPOILERS SPOILERS SPOILERS 
Oh yes, the small army of children has started"
27,"Dec 28, 2020",I think I need a dokja
27,"Dec 25, 2020",if that child dies I will not answer for myself. 
27,"Dec 24, 2020","come here my baby... why would u hurt such a precious kid?! (ノಥ,_｣ಥ)ノ彡┻━┻"
27,"Dec 24, 2020",Killer girl looks pretty 😳 I actually thought she was a boy when I saw her lol
27,"Dec 24, 2020",Gilyeong is precious 💖And the part where he hugs Dokja..i always love their moments
27,"Dec 24, 2020",If literally anything bad happens to Gilyeong I will die
27,"Dec 24, 2020",Dokja adopting Gilyoung 😌
27,"Dec 23, 2020",just waiting for gilyeong to start calling dokja big bro lol
27,"Dec 23, 2020",Love seeing Kim Dokja and gilyoung bonding
27,"Dec 23, 2020",If anything bad happens to Gilyeong - like pulling a Glen for example - I will fucking riot. That insect loving bean must be protected at all costs.
27,"Dec 23, 2020",illusions:  Be traumatized. Dokja: No♥️
27,"Dec 23, 2020",Dokja with Gilyeong just . . . ❤😭
27,"Dec 23, 2020",gilyeong is so adorable. why are kids in real life such demons?
27,"Dec 23, 2020",I canny believe it’s only ep 26
27,"Dec 23, 2020",[Constellation Curious Reader 2.0] also wants a peek at Dokja's past.
27,"Dec 23, 2020",gilyeong went through a lot when he was so young.
27,"Dec 23, 2020",tokyo ghoul intro playing
27,"Dec 23, 2020",I am intrigued by every character in this comic and that’s why I love it so much.
27,"Nov 4, 2020",[A CUROUS READER IS SAD THE CHAPTER ENDED SO SOON]
27,"Nov 4, 2020",I'm too far into the fast pass :(
27,"Dec 23, 2020",i want Dokja to become Gilyeong's father somewhere in the story :v 
27,"May 29, 2022",im going to be so sad if/when something happens to gilyeong ;^;
27,"May 14, 2022",AY SHE IS SO FRIKING HOOOTTTTTT AAAAGGGHHHHHH
27,"May 12, 2022",The kid is my favorite character and I wish the story would go into more depth about him. 
27,"Mar 11, 2022",gilyeong my poor child :') can i adopt him?
27,"Mar 4, 2022","I love how dokja doesn't really talk to gilyeong he just looks at him and pat his head.. their interactions are very heartwarming
"
27,"Nov 8, 2021","Ngl,the constellations interacting with the incarnations and also with each other,is probably one of the best things in this series,in my opinion"
27,"Oct 17, 2021",Another badass female yuss
27,"Oct 13, 2021","I swear if something happens to the kid, I won't be able to live with myself! I have grown just so fond of Gilyeong! 😭😭"
27,"Sep 29, 2021",Dont know why but i also want to know about dokja's trauma 😭😭
27,"Sep 22, 2021",awww dokja and gilyeong looks like brothers. cute
27,"Aug 31, 2021",GILYEONG HUHU PRECIOUS BOY
27,"Aug 13, 2021","I absolutely adore Gilyeong and Dokja’s relationship, it gives me brotherly vibes. "
27,"Aug 8, 2021",Dokja turned from office worker to op character
27,"Aug 2, 2021",ik it's all fiction but I wonder what girls would do for their periods in case of an apocalypse like this. sanitary pad companies would not be producing their products right so what do they do in this case? 
27,"Jul 26, 2021",I want to see gilyeong grow..¡_¡
27,"Jul 15, 2021",Gilyeon hugging dokja was so sad and wholesome </3
27,"Jul 9, 2021",I swear if Gilyeong dies I will be in tears
27,"Jul 2, 2021",i love gilyeong and dokjas relationship. they’re like brothers. 💞
27,"Jun 17, 2021",If Gilyeong dies I will cry
27,"May 17, 2021","first scenario: *summons a deus ex machina (?¿) bridge* |                     | second (?) scenario: *secretly tracked their location/route through a rope that materialized from nowhere* |                 | third (?) scenario: *casts protection through the ""bald leader of the peasant army's"" beads*.... sangah, dear, when are you going to reveal the fact you are the true op?"
27,"May 7, 2021",I agree that the kid must’ve had the most trauma; he’s never once complained or cried that he’s away from his family.
27,"May 3, 2021",DOKJA & GILYEONG ｡ﾟ(ﾟ´ω`ﾟ)ﾟ｡
27,"May 1, 2021",Gilyeong😭😭😭i want to hug him
27,"May 1, 2021",i can't stop reading... this is so good
27,"Apr 30, 2021",atleast I think we’re not  seeing that Mr Han dude around 😹 he’s so annoying 
27,"Apr 30, 2021",that hug 😭❤️
27,"Apr 29, 2021",WHO HURT GILYEONG
27,"Apr 29, 2021","Ok, i wanna ""meet"" the bitch who HURT GILYEONG!!!🙂🔪"
27,"Apr 29, 2021","gilyeong...is...idk, my heart and sOul ❤️❤️"
27,"Apr 29, 2021","I think what Dokja saw at first was his mom. She said ""You haven't seen anything, okay?"" which makes me think that he witnessed his mom getting beaten up by his father, and his mom made him stay quiet about it. EDIT: Wait nvm didn't Dokja think something like 'mother shouldn't have any problem killing' earlier??? So I think, because of the abuse, his mom killed his dad and made Dokja not tell anyone about it? Maybe?"
27,"Apr 28, 2021",Is it just me or the specters really looks like a dementor from Harry Potter? 
27,"Apr 28, 2021",I can't stop reading this. I was waiting for an excellent webtoon like this one. Thank you author!! 
27,"Apr 27, 2021",I'll wait for you Gilyeong! damn cutie be one of my husbands(｡・//ε//・｡)
27,"Apr 26, 2021",Now I'm curious about Dokja's character profile
27,"Apr 26, 2021","Huiwon's trauma was still fresh that's why she's the most affected by this Illusory Prison. It makes a lot of sense for her to react like that. And Gilyeong as well, since he's still a kid. God! this was written so well. You'd think this was just a game looking from the outside but there's a lot of hidden meaning and message. "
27,"Apr 26, 2021",Dokja tryna act like he's not catching those found family feelings but he can't fool us 
27,"Apr 21, 2021","Awwwww the poor boy, he is so precious :,)"
27,"Apr 16, 2021",Everytimes Guilyeong go to hug Dokja I'm 🥺 He is his caretaker now
27,"Apr 11, 2021","Nothing else. Just Gilyeong and Dokja. They are soooo cuteee  (Not a ship, I am weird when it comes to ships but not in this case-)"
27,"Apr 10, 2021",I didn't realize how scary the girl is. She literally got up out of nowhere and strangled her classmates.
27,"Mar 31, 2021",[constellation ‘I need sleep and therapy’ shows interest in Gilyeong’s past and expresses concern for him]
27,"Mar 6, 2021",this is so good that it blows my mind
27,"Mar 6, 2021","all yall in these comments are like ""*big words/complicated words*"" i swear i could never 😭"
27,"Feb 27, 2021",I really like Gilyeong  I'm glad he is in Dokja's team ! :)
27,"Feb 27, 2021",yo jihye kinda pretty 
27,"Feb 25, 2021",The constellations are truly funny. I admire and give all my respect to the author. He had such a brilliant idea to put constellations thoughts and behavior in details. They are making my stomach hurt🤣🤣🤣🤣😂😂😂😂😂🤣🤣🤣🤣🤣🤣🤣
27,"Feb 18, 2021","It's ok gilyeong, come here "
27,"Feb 18, 2021","That constellation who is curious with Dokja's past, I feel you. "
27,"Feb 18, 2021",Him saying that Gilyoung has the worst trauma is....Dokja must know how it feels then.
27,"Feb 18, 2021",pls I'm thriving on Dokja giving Gilyeong headpats every few episodes 😭✋
27,"Feb 18, 2021",Dokja I love how he is realistic but caring. He works as a big brother figure. Honestly this comic book has taught me a lot. Thank you author 
27,"Feb 18, 2021","Gilyeong my baby, Dokja is like a big bro for him"
27,"Feb 14, 2021",we need to know who that girl In Dokja's traumatic illusion
27,"Feb 12, 2021",Females from this weebtoon are making me gay
27,"Feb 11, 2021","Did this man legit just report for duty and say he didn’t copy right after 👀
Gotta love the close ups of Dokja’s eyes ✨✨✨✨✨"
27,"Feb 8, 2021","Is it weird that I've been taken a liking to gilyeong because he reminds me of another fictional character? from the moment I first saw him I just that ""that gin from yttd"".  and even now he keeps reminding me of one of the sweetest, of my favorite characters"
27,"Feb 5, 2021",So bald leader of the peasants army is friends with the god of naval warfare
27,"Feb 5, 2021",Why is nobody talking about how amazing Jihye looks
27,"Feb 3, 2021",I like her already just because Admiral Yi is such a legend
27,"Jan 23, 2021",Ohh they translated Maritime War God to God of Naval Warfare. ig its fine but the former has more pizazz to it :((
27,"Jan 16, 2021","If the monk constalation was fighting in the Japanese invasion of Korea and the god of naval warfare constalation is his friend. That means that the god of naval warfare is Admiral Yi! I apreciate historical referances, especially of people as great as Admiral Yi"
27,"Jan 14, 2021",I’m guessing Dokja saw his mom then?? 
27,"Jan 12, 2021",That poor child 🥺 no child should go through what gilyeong had to go through bc of his stupid mother who can't take care of a child
27,"Jan 11, 2021",My heart breaks seeing Gilyeong .·´¯`(>▂<)´¯`·.
27,"Jan 9, 2021",“By killing her best friend” I don’t ever wanna imagine how that would feel like
27,"Jan 9, 2021",Who’s excited for when everyone else figures out why Dokja knows so much? You all know it’s gonna happen.
27,"Jan 6, 2021","This feels like it’ll get a live action, it just feels like it idk"
27,"Jan 6, 2021",I'm kinda gay for jihye
27,"Jan 4, 2021",Gilyeong and Dokja are the cutest little duo ever!!!! ❤❤ And Gilyeomg is such a precious bean!!!!! 
27,"Dec 31, 2020","if Gilyeong dies I will gift Dokja 1,000 coins to break the 4th wall and change the plot"
27,"Dec 30, 2020",ive only had gilyeong for a day but if anything happened to him i would kill everyone in this room and then myself 
27,"Dec 29, 2020",Congratulations L7 and Redice studio in finally getting the chance to Adapt this series in series or film format!!!👏
27,"Dec 29, 2020",y'all here me out dokja is the real protagonist of this story... it says so in the description of the story 
27,"Dec 29, 2020","this story is genuinely so good, i’m glad it got adapted into a manhwa :] this chapter was so cool"
27,"Dec 28, 2020","I just love how adventurous the story goes by each chapter. Definitely, a page turning series"
27,"Dec 28, 2020","bro, I would hug the little kid 99999999999+ times over, he's an angel."
27,"Dec 28, 2020",i binged read this and i just finished and now im sad
27,"Dec 27, 2020",ONE GIL YOUNG FOR TAKE OUT PLEASE SIR! 
27,"Dec 27, 2020","Tbh I have horrible memory so I wonder if I would be affected by the prison thing. Like would it make me go through something that I had no idea about and it be either horrible or not so bad Bc my life is boring, or would it not affect me at all? 🤔😳"
27,"Dec 27, 2020",Me with my daddy issues loved this one ;v;
27,"Dec 25, 2020",Gilyeong is so precious 
27,"Dec 25, 2020",merry christmas
27,"Dec 24, 2020","im angry... you want to know why? because... i dont have any coins (ノಥ,_｣ಥ)ノ彡┻━┻"
27,"Dec 24, 2020",The main character reminds me of sung jin woo 
27,"Dec 24, 2020","I'm happy there is a child character like Gilyeong, I want to hug him 😭"
27,"Dec 24, 2020",THE CLIFFHANGERS!!!!!!!!WWWWHHHYYYYYYYYY😫😫😫😫😫😫😫
27,"Dec 24, 2020","There is ONLY ONE upside in being a high-school student. I have soooo much homework that I can't even go on Webtoon, and when I come back, I get to read plenty of episodes in a row (8 is cool, no?) 🥰🥰"
27,"Dec 24, 2020",Everyone loves gilyeoung
27,"Dec 24, 2020","Dokja has such an overpowered ability that nullifies almost everything but he is not the protagonist? Come on man, even Junghyeok would want to get hold of his ability. Also, could I get a pet on the head as well?"
27,"Dec 24, 2020",my heart is soft for Gilyeong I wish I could give him a hug
27,"Dec 23, 2020","Dokja better adopt Gilyeong, istg-"
27,"Dec 23, 2020","Man, Gilyeong is just a kid, but he's a beast."
27,"Dec 23, 2020","*idk if this is a spoiler but, it's better to scroll down if you don't want to see it*















Actually, Dokja has the most traumatizing backstory in this group- "
27,"Dec 23, 2020",If this won’t have an anime the fandom be like 😵🔫😠 
27,"Dec 23, 2020",in the start I thought jihye Lee was a guy but she's pretty handsome 
27,"Dec 23, 2020",ok another hot character
27,"Dec 23, 2020",Aww Dokja is the best dad for Gilyeong!!!! That hug was so cute! 🥰 
27,"Dec 23, 2020",when gilyoung hugged dokja 🥺
27,"Dec 23, 2020",this deserves to be in the top popular ranking..........I dunno why people are crazy over predictable romance series only..!!!....This is an epic masterpiece!!!
27,"Dec 23, 2020","I like how Dokja literally planned everything including different situations. Also minor detail that they glossed over, but the skill Demon Slaying is different from the skill Judgement Time. Both are buffs against evil opponents but Judgment Time requires permission from the constellations of absolute good and Demon Slaying doesn't and is just a good buff when fighting evil enemies."
27,"Dec 23, 2020",I’m getting more and more curious about the penalties for failure of a scenario because now every consequence is ???
27,"Dec 23, 2020",I think Dokja can somehow relate himself to Gilyeong.. that's why he understood his traumatic experience and pain.. 
27,"Dec 23, 2020",I KNEW she was going to become relevant! 😆
27,"Dec 23, 2020",Demon Slaying??! Where's Tanjiro at
27,"Dec 23, 2020",I wanna know what was Dokja's past for some reason to see how he became a cold yet smart person.  he seems like a character with an interesting past and I wanna know more about it.
27,"Dec 23, 2020",I love Gilyeong. That poor boy really needs a hug
27,"Dec 23, 2020",I love that his trauma was just the military itself🤣
27,"Dec 23, 2020",Naval commander... Korea... Admiral Yi? Hmm... Turtle ships and advanced medieval Naval Warfare... I’m very excited
27,"Dec 23, 2020",YEAH BOI ONE OF THE BEST CHARACTERS HAS ARRIIIIVEDD!!!! WOOOOOO
27,"Dec 23, 2020",demon slayer???? is that you?
27,"Dec 23, 2020",That curious constellation is me.
27,"Dec 23, 2020",I really like the girl with the super bad ass power but my gut tells me that she’s going to die. Also who the hell kills their best friend? What? I would never! I would rather die! Omg! Also I feel like badass judge girl and new girl that seems sick are going to be my favorites. What suprises me is that we haven’t met the actual main character yet. But I think he’s the master that she talked about. At least we met another main character besides crazy dead boy. I think girl power will win this.
27,"Dec 23, 2020","Damn, now I’m invested into their backstories. "
27,"Dec 23, 2020",Every time Gilyeong hugs Dokja my heart does backflips. He's so precious🥰
27,"Dec 17, 2020","I just want to say, Koreans are so lucky they got to read this novel, but it’s worth the wait. Sooooo excited for the movies too 💜"
27,"Nov 4, 2020","[Constellation ""Prisoner of The Golden Headband""  pulls out his hair awaiting the next story]"
27,"Nov 4, 2020",This story so far has been extremely well balanced overall I’m addicted and iv spent 50$ a month in coins just to read these and other stories 🙃
27,"Nov 4, 2020",IM USING SO MANY COINS ON THIS STORY BECAUSE I LOVE IT SO MUCH!!!
27,"Nov 4, 2020",Isnt it great to find a friend in a stream chat? 
27,"Nov 4, 2020",it would take me almost two months to get here free lol 🤣 coins are a need now. but this troubled constellation loves this story. Gives 500 coins
27,"Aug 30, 2022",The child is exceptionally calm and composed for a child............. Loving it
27,"Jul 14, 2022", I would protect gilyeong with my life 
27,"Jul 1, 2022",I'm always soft for Dokja and Gilyeong moments. 
27,"Jun 30, 2022",Gilyeong is too precious ;_;
27,"Jun 30, 2022",if anything happens to gilyeong im rioting
27,"Jun 1, 2022",I swear if Dokja dosent adopt that child he will have to receive my slap AND my mom's chappal ✋😊👡
27,"May 17, 2022",gilyeong :(((
27,"May 9, 2022","Don’t you love how everybody’s wearing pants???? Weird pet peeve of mine, sorry guys. Going through an apocalypse sounds aweful by itself, but dealing with thigh chaffing too? Just the worst."
27,"Apr 12, 2022",Bruv if the kid dies I’m going to kill the author- cause that would be so RUUUUUDE-
27,"Feb 27, 2022",gilyeong ma bby ಥ_ಥ
27,"Feb 23, 2022",Dokja is best bro TwT✨
27,"Feb 22, 2022",my poor baby gilyeong TT
27,"Feb 20, 2022","that thing with hyungseung.. he kept saying, he ""doesn't copy"", as in, he can't hear him or there's something wrong with the communication devices.. does this have smth to do with the way he ""turned away from the injustice"" in the first scenario? he also displays a strong sense of loyalty... this is just a theory, but was he involved in a mission where he lost his teammates, becuz of a bad decision or smth? Idk, this is just a guess anyway..."
27,"Feb 8, 2022",SHE'S SO PRETTYYYY
27,"Feb 8, 2022",I love gilyeong so much he's so cute :(( I hope he doesn't die plsss T___T
27,"Jan 28, 2022",The hug omgg so cutee
27,"Jan 20, 2022",Gilyeong so much he’s like a brother to Dokja and I wish I had something like Gilyeong and Dokja maybe if they were my brothers that would be AWESOME
27,"Jan 12, 2022",the way gilyeong sees dokja as someone who will keep him safe
27,"Dec 10, 2021",Why is meeting other survivor a mission? Something's fishy here🤔
27,"Dec 9, 2021",I think Gilyeong was abused by his mother. Idk that just makes the most sense to me given how he acts
27,"Nov 7, 2021",Aahhhhh I wanna hug Dokja like gilyeooong 🥺
27,"Nov 5, 2021",I love seeing the constellations just interacting with eachother like the naval commander and bald leader saying hi or when the golden headband laughed when the bald dudes statue was destroyed 
27,"Oct 20, 2021",Ahhh gilyoung-ah out babyyyy huhu must protect at all cost
27,"Oct 19, 2021",gilyeong so cute my heart ..
27,"Oct 16, 2021",I just love dokja and gilyeong being father and son relationship <33
27,"Sep 6, 2021",rn we all are that curious constellation
27,"Aug 15, 2021",gilyeong must protect :((
27,"Aug 14, 2021",I LOVE DOKJA AND GILYEONG SO MUCH
27,"Aug 6, 2021",gilyeong is baby U-U<3
27,"Aug 3, 2021",Dokja is the best protagonist!
27,"Jul 29, 2021",im crying 
27,"Jul 6, 2021",i love Gilyeong shoooo much
27,"Jul 2, 2021","Aaaaw, look at the monk and god of naval warfare greeting each other like old friends. ...you know the odd thing is that I find myself really liking the constellation's personalities even I know that they are basically watching this for sport. Probably because we're all technically in the same boat except we can't really help even if we wanted to. Looks like we met the girl we were introduced to in the first scenario, and possibly the last girl was her best friend. Ouch. Poor kid."
27,"Jun 18, 2021",HOLD UP SANGAH IS DOING ALL THIS IN FLATS?!?!?
27,"Jun 16, 2021","everyone going about the kid and MC moment and here I'm awwing over the reunion of the constellations.. on another note, I can't imagine having to kill my closest friend to live.. (I'd like to think I'd have us both die from letting time run out.. sure that means friend dies anyways, but at least it won't be by my hand o-o)"
27,"Jun 10, 2021",[A constellation who has never wanted to have kids wants to adopt Gilyeong right now.]
27,"Jun 6, 2021",....she killed her closest friend. wow. oof.
27,"May 18, 2021",okay but she killed her closes  friends. ummmmmmm how 
27,"May 13, 2021",JSJZJZJXJXJ STOP DOING MEAN THINGS TO MY BABY GILYEONG. HE IS VERY PRECIOUS—
27,"May 8, 2021",That hug 😭
27,"May 1, 2021","we're all simping for those dokja-gilyeong moments, aren't we"
27,"Apr 30, 2021",I was thinking she's cute but probably would've killed me😭
27,"Apr 30, 2021",Anyone else thing that part where the bald leader of peasants was moved by reuniting with god of naval war kinda wholesome? I thought it was sweet that they meet again
27,"Apr 30, 2021","I love the dynamic between gilyoung and dokja (I'm not shipping them, you pervs. I mean brotherly dynamic.)"
27,"Apr 28, 2021",Gilyeong has the same experience i experienced when im with my grandma but i do something wrong or assumed without evidence it was me or i did not get what she exactly wanted
27,"Apr 28, 2021",jihyee looks so cool
27,"Apr 28, 2021",This is just a hunch but what if that lady dokja was seeing was his mom and she had died someway and that’s why dokja kinda knows what gilyeong is feeling
27,"Apr 28, 2021",DO Y'ALL EVER HAVE GOOSEBUMPS WHENEVER U READ THIS WEBTOON..  DAMN 
27,"Apr 28, 2021","[The Constellation, 𝙁𝙞𝙧𝙚𝙁𝙤𝙭 𝙤𝙛 𝙅𝙪𝙨𝙩𝙞𝙘𝙚, is very intrigued and excited for what may happen next.]"
27,"Apr 28, 2021",Doesn’t the head thing that Gilyeong is holding looks like a stuffed toy 🧸 
27,"Apr 27, 2021",Jihye Lee low key looks like female Dokja
