Episode,Date,Review
61,"Jul 14, 2021","Man not only did Dokja use him to get out of the current fight, he also used him to fight the other stations???!! King moves only…"
61,"Jul 14, 2021","Ooh I love how they portrayed everything in this episode! It was so pretty when the sky turned into the galaxy/stars! It was also cool to see how a constellation would possess an incarnation like that. This makes me so excited to see future events! Oh also, MVP Sangah 😍 ⚠️ Edit: future character spoiled in replies"
61,"Jul 14, 2021","[The constellation ""Lazy Broke Weeb"" was amazed that the incarnation ""KDJ"" could handle a constellation's possession for such duration.] [5 coins have been sponsored. ]"
61,"Jul 14, 2021",Dokja signed a contract that made it so he couldn't have any constellation. But this new item just made it so he could talk to any constellation. And a lot of constellations are watching him. This kinda shows how much Dokja really thought this through
61,"Jul 14, 2021","Man i can’t understand the people who stopped reading this webtoon, pfff renouncers "
61,"Jul 14, 2021",when you take your roleplays way too seriously
61,"Jul 14, 2021","Man, don't you just hate when you're recreating a historical battle and the enemy raises the dead? Feels bad, man."
61,"Jul 14, 2021",ok but dokja's possessed eyes p-pretty 😳👉👈
61,"Jul 14, 2021",PowerPoint the real MVP here.
61,"Jul 14, 2021",dokja really said “arise”
61,"Jul 14, 2021","Dokja is basically just a gamer breaking the game before the patch notes hit, I wonder how his character and approach will change once he is at a point in the story where his current future has strayed too far from the original story"
61,"Jul 17, 2021","this entire chapter gave me CHILLS. I ESPECIALLY loved when he said ""Lend me your voice... so that i may unleash my anguish"" i LOVE this series so much"
61,"Aug 18, 2021","Sangah is the MVP here, without her the General won't help Dokja winning this battle."
61,"Jul 14, 2021","And thus, Dokja checkmated the board."
61,"Jul 14, 2021",the panel where Dokja gets possessed by the general is amazing. sleepy-C *really* knows how to do his job
61,"Jul 14, 2021",*Sangah used Talk-No-Jutsu* *It was highly effective*
61,"Jul 14, 2021",*now researching korean history
61,"Aug 18, 2021",Noticed the translators changed “Immortal King” to “King of No Killing” per commenters’ request! Thank you translators for all of your hard work!
61,"Jul 14, 2021",Can I just say this webtoon is amazing! I really want them to adapt this into an anime it would be soooooo good
61,"Jul 14, 2021",Little history lesson / reenactment before going back to being a total badass
61,"Aug 18, 2021","Appreciation comment for Sangah. She doesn't get a lot of fight scenes, but she's smart and she gets people to listen to her. Dokja better keep her around! "
61,"Aug 14, 2021",I still can't get over this kid running with Mjolnir lol
61,"Jul 14, 2021",Endlessly scrolling for Lazy Broke Weeb’s comments….🥺
61,"Jul 14, 2021",chapter 46 of waiting for yoo sangah in a black chinese dress and garter belt
61,"Aug 18, 2021","wait... anyone noticed that the Webtoon translators read the comments and Dokja's skill is changed to King of No Killing now!!!! it got changed in the previous chapters as well, this is so amazing omg"
61,"Jul 14, 2021",If only Gyebaek said a dirty joke before his last breath ……I would have told him to get his Head out of the gutter 😂🤭
61,"Jul 14, 2021",[The Constellation BadWolf has been immersed into historical context & has enjoyed this dramatization] [5 coins have been sponsored]
61,"Jul 14, 2021","They really pulled a move from Solo Leveling, I could almost hear Dojka say “Arise”"
61,"Jul 14, 2021",happy 60th episode
61,"Jul 14, 2021","The constellation only talks through him right? Because if they just merged, does that constellation have info on twsa?"
61,"Aug 18, 2021","Sangah is really helpful as a history knowledger (it's really a thing with all that historic constelations) and charismatic person, she is upset and worring for nothing as not everything is about battles.
I m very happy because the author sheers for his country history and make all seens so powerful, all the pop media is so euro-north american centered that stories well produced like this are very important."
61,"Jul 16, 2021",The money I would pay to see this webcomic become an anime... 😭 
61,"Aug 18, 2021",Am I the only one who completely switched the voice and accent of Dokja's dialogues in their head after the constellation possessed him? 
61,"Aug 18, 2021","Just a heads up, I'm disliking every ""This is similar to Solo Leveling."" comments cos the fact that you read this far BUT still failing to comprehend the astronomical differences of the two series makes it apparent that (either intentional or not) youre just pulling the legs of the readers of this series atp. I also urge everyone to do the same. To hopefully stop the highkey carelessness of those kind of people."
61,"Aug 11, 2021","sangah, saving everyone with the power of presentations"
61,"Jul 14, 2021","As a DnD GM once said: ""Roll a Nat 20"""
61,"Jul 14, 2021","""Attack.""how powerful is that??!!
 btw,, Lazy Broke Weeb,,  where you at?😆😆"
61,"Aug 18, 2021","gotta say.. I looooove this chapter/arc.. Sangah gets to shine with her historical knowledge and being able to convince the constellation of the king to step in.. and to witness, in a way, history. Sounds weird, but I like that the king had one of his undead men to execute Gyebaek. I dunno.. maybe I just think the skeleton looked way awesome o-o and makes it so eerie to watch.. anyways.. I'd honestly be happy even if just this chapter was animated o-o"
61,"Aug 18, 2021","Incredible use of Asian history. Brilliant. Coolest graphic serialization since Death Note. I love Tower of God, too, but OR is at least that good. Why isn’t the “likes” tally maxed out?"
61,"Aug 18, 2021","Ah, I've seen too much fanarts of this story that that one single panel of a star glimmering in it and they look up to the sky to talk to the constellation are enough to make me go emo 😂 come to think of it, the pseudo-direct interaction between an incarnation and a constellation is rather melancholic, right. they look up to the sky and talk, knowing there are someone up there who is also looking at them. that's why simple line of [the constellation ""xxx"" is looking at you] is so damn deep"
61,"Aug 18, 2021",This was insane!!!! The artist really is amazing because there’s not many who can direct a scene so well. This was a phenomenal chapter 
61,"Aug 18, 2021",Ok but Dokja with blue eyes tho <3
61,"Aug 19, 2021","This has got to be the best comic I've read on webtoon!!! I'm truly addicted and there are a lot of addicting stories on here. The writer of this webtoon seriously worked their a**es off. I'm getting a history lesson as well, my God. IDK whether this is real history but I'm convinced just by how much depth the writer puts in. "
61,"Aug 18, 2021",Classic Dokja move. A plan inside a plan inside a plan
61,"Aug 18, 2021",Sangah is too OP lmao. I'm always jealous of people who can do presentations properly ugh. Also her historical knowledge and the ability to recall it ✨✨
61,"Aug 18, 2021",For once I feel sorry for the constellations ... knowing they too were once mortals who have endured pain and suffering ...
61,"Aug 18, 2021","Yo, the undead army thing coming up was pretty cool. Go Dokja. And kudos to Sangah (sorry if I misspelled it) for convincing the Constellation too. Dokja couldn't have done it without her."
61,"Aug 18, 2021",Sangah is queen✨✨👑👑
61,"Aug 18, 2021",Sangah always come in handy in unexpected situations 😂
61,"Aug 18, 2021","""Those who do not study history are doomed to repeat it."" Good thing Dokja has Sangah! 😃"
61,"Aug 18, 2021","The sky suddenly showing the stars was breathtaking. If this got animated, oh my god..."
61,"Aug 18, 2021","Not going to lie. Dokja being ""possessed"" was really cool and if they make an anime  of this I have high hopes for this scene."
61,"Aug 18, 2021",His moves are so calculated.. Sangah deserves a praise here eshh
61,"Aug 18, 2021",I always love when authors bounce off of history for their stories and I know nearly nothing about history around Asia so this has been a lot of fun.
61,"Aug 18, 2021",I’m just now realizing that dokja hasn’t directly killed anyone this far (could be wrong though 😅)
61,"Aug 18, 2021","Sangah uses ""Talk no Jutsu"", it's super effective!"
61,"Aug 19, 2021",Happy Anniversary to the English webtoon version of Omniscient Reader!
61,"Aug 18, 2021",We ought to appreciate Dokja Kim's intelligence and beauty more as a community
61,"Aug 18, 2021","Dokja is going to become a constellation at the end of this series, I think. Just a fan theory, but I truly think that that is the direction we’re going towards. "
61,"Jul 14, 2021",I would insert a decapitation joke…..but I don’t want there to be any Spoilers A HEAD🤦🏻‍♂️😂
61,"Aug 22, 2021","Sangah finally getting the spotlight she deserves, yaaassss"
61,"Aug 19, 2021",Stage Transformation = Dramatization? Aight no problems there. Also Sangah 💕💕
61,"Aug 18, 2021",I sometimes forget how handsome Dokja is... also can someone remind me what his oath was?
61,"Aug 18, 2021",Dokja: so we have two options😊 one is 100% chance of minor sacrifice the other is a toss up for major or none. What do you choose? Min Jiwon: cool can I go with the fir—Dokja: jk there’s no choice we’re doing the second. 
61,"Aug 18, 2021",Sangah shows us that every person counts. Even the smallest help. You go girl!
61,"Aug 18, 2021",Every time I see that underwear dude I die of laughter 😂😂🤣🤣poor thing I would’ve lent him some pants 😂😂
61,"Aug 18, 2021",they should show history using comics like this so kids get more interested in learning history 
61,"Aug 19, 2021",this comic/book not only has amazing art but you get history lessons too 🤩 I was enlightened while reading 🤣
61,"Aug 19, 2021",ok but why is know one talking about sang ha speech 
61,"Aug 19, 2021",Can we just appreciate how wonderful this webcomic is like 😔😔😔😔😔
61,"Aug 18, 2021",Idk about you guys but that was unexpectedly heart warming…like it was very satisfying to read but at the same time I kinda do feel bad they he never got a chance to fight him personally but oh well…it is what it is 
61,"Aug 18, 2021","Wow thanks Webtoon for changing 'Immortal king' to 'king of no killing' 💕tho there's some kind of typo in Dokja's sword name, it is 'Unbreakable Faith' up to the last chapter and in this chapter it change to 'unbreakable trust's???"
61,"Aug 18, 2021",Sangah MVP
61,"Aug 18, 2021",This episode. This. Damn. Episode. 💯
61,"Aug 18, 2021","thank you so much author for not leaving us on a cliffhanger before the fight, i loved to learn more about Korean history through this amazing episode!"
61,"Aug 18, 2021",Why isn’t this an anime yet?
61,"Aug 18, 2021",Props to Sangah for keeping constellation dude with them. Dokja getting possessed was pretty lit. No doubt this'll all make the lady like Dokja even more...
61,"Jul 18, 2021",[The Constellation Impulsive Spending Weeb is satisfied with the Chapter] [5 coins were sponsored]
61,"Aug 19, 2021",**unbroken faith** please god unbreakable trust sounds like a shonen manga episode title
61,"Aug 19, 2021","Rip that guy, he just wanted a 1v1, instead he gets 100v1 by skeletons."
61,"Aug 18, 2021",girlboss sangah
61,"Aug 18, 2021",Dokja being the king of the saying “killing  2 birds with one stone “
61,"Aug 18, 2021","I like that they fixed the translation and now it’s King of no Killing, but did they have to change Unbreakable Faith to Unbreakable Trust?"
61,"Aug 18, 2021","Wait a minute, di-did they changed Immortal King to King of No Killing? Yippeeee"
61,"Aug 18, 2021","This has to be my new favorite episode! I love the bit of history in this chapter! It was new to me. I also love how the author gives the other characters the spotlight every now and then. Also, the skeletons looked so cool!"
61,"Aug 18, 2021",This is one of the only webtoons that manages to constantly leave me in awe with every episode... The story and art are just fantastic!
61,"Aug 18, 2021",[The Broken Delusional god] is upset that you didn't call me!
61,"Aug 18, 2021",This episode gave me chills! Even more so than some of the more “epic” or dramatic fights in the series so far. “Lend me your voice that I may unwind my anguish” is just top-tier dialogue
61,"Aug 23, 2021",Can we just talk about how much research the author must have done to write this webtoon? Literally incredible. And the world building aspect is amazing too
61,"Aug 22, 2021",noooooo I caught up after binging this series for a while 😩 now I have to wait?? 🤧 tis a shame
61,"Aug 21, 2021",That moment when you've binged this webtoon for two days and you finally hit your first pay wall 
61,"Aug 21, 2021","[The Constellation, ""The Lonely Siren,"" sings a song of passing for the fallen warriors of Hwangsanbeol to guide them safely into the afterlife.]"
61,"Aug 19, 2021",This whole WEBTOON is badass and keeps getting better 
61,"Aug 19, 2021",Sangah and her historical background always coming through in the clutch 
61,"Aug 19, 2021",the way that the webtoon portrays Korea's history is really refreshing and interesting to see!!
61,"Aug 19, 2021","I cannot explain how much I LOVE this chapter- from the language, to the constellations in the background, to the eerily beautiful way the skeleton warriors arose- I really cannot imagine a historical battle being redone in any more of a breathtaking way!!! 👏🏽👏🏽👏🏽"
61,"Aug 19, 2021","this chapter read like a movie. I was in shock. the visuals, the immersion, the dialogue.  this has been one of the better chapters. (and that's saying a lot, because so far no chapter has been wasted in this webtoon). I'm so glad to be reading this."
61,"Aug 18, 2021",THIS IS...... THIS WEBTOON DESERVES TO BE MADE INTO AN ANIME.... I WOULD CRY HAPPY TEARS. IT'S SOO GOOD
61,"Aug 18, 2021",Ahh he is more likely to save the world than Jungyeok 😂
61,"Aug 18, 2021",Sangah’s an mvp though.
61,"Aug 18, 2021","None of the top comments even mentioned Dokja with blue eyes like SIR?!? Mans was good looking before but goddamn😭❤(I have a weakness for blue eyes with dark hair, or red eyes with dark hair but obviously only one of those is actually realistic for our world)"
61,"Aug 18, 2021","For anyone confused, like me, by the historical context of the constellations, Queen Jinseong was the last Queen of Unified Silla in the late 800’s before it split in the Later Three Kingdom Period. Yusin Kim, Gyebaek, Gwanchang, and the battle of Hwangsanbeol are from the Three Kingdom Period in the mid-600’s nearly 250 years earlier that lead to the formation of Unified Silla. So the author is mixing things up a bit. I assume Korean readers aren’t confused by this, but I had to look it up 😅"
61,"Aug 18, 2021",That was an interesting way to get me to read Korean history
61,"Aug 18, 2021","Don't forget to like every week! The more we like, the more constellations will watch Dokja's stream and gift him coins!"
61,"Aug 18, 2021","Wasn’t the sword called unbreakable faith, not unbreakable trust"
61,"Jul 15, 2021",moooore i need moooore!
61,"Sep 22, 2021","Man, I'm learning so much about wars I can't pronounce "
61,"Sep 1, 2021",dokja with them serious eyes tho-
61,"Aug 24, 2021","I'm so used to read it as [stage transformation] in the novel that reading it as [Dramatization] feels kinda odd xDBut I'm really enjoying this webcomic adaptation, I can't wait to see how they draw certain parts of the novel!!! 8(>~<)8"
61,"Aug 21, 2021",This chapter was actually so epic like omg yes army of skeletons ✨🕺🏻
61,"Aug 20, 2021",[The constellation Webtoon Devourer is pleased with the story] [The constellation Webtoon Devourer is interested in The last queen of Silla and her incarnation]
61,"Aug 20, 2021",Wasn’t the sword called Unbreakable Faith?
61,"Aug 19, 2021","Dokja aka true king 

👍🏻"
61,"Aug 19, 2021",I need Sangah's persuasion skills for my presentations...also the battle and dramatization in this chapter is just ✨✨✨
61,"Aug 19, 2021",Dokja looks extra handsome this chapter 
61,"Aug 19, 2021",Dokja just pulled a Yamamoto from Bleach's blood war arc. my lord this chapter portrays it so well. 
61,"Aug 19, 2021",Great to see Sangah getting to shine! 
61,"Aug 19, 2021","Sleepy-C, thank you for this beautiful art 🌌 I also love how we are kept surprised: at first, it looks like some apocalyptic/video game-like story, but there are many references to Korean history and recreations of battles!"
61,"Aug 18, 2021","after watching the k-drama ""Hwarang"", this was really more fun (same uniforms and hairstyles) if not i wouldn't understand 🤗"
61,"Aug 18, 2021",I would so binge watch this if it were a series... 
61,"Aug 18, 2021",damn that was so cool I got emotional for the constellation 😶 I love this webtoon
61,"Aug 18, 2021","A generals work is not The frontlines, but to lead the army to victory"
61,"Aug 18, 2021","This was so cool!! I’m glad the constellation was Courteous enough to withhold Dokja’s deal, it was rather nice."
61,"Aug 18, 2021",sir...... where do you get the inspiration to write this amazing book... I'm literally feeling lucky that i can read this story... 
61,"Aug 18, 2021",Why was the possessed Dokja more handsome than our normal DokjaTT
61,"Aug 18, 2021","The constellation ""Giver of chocolate chipped circles"" thinks about possessing a possible incarnation to provide the world with infinite cookies. "
61,"Aug 18, 2021",Sangah yasss history and persuasion queen!!
61,"Aug 18, 2021",We’re nearing the Absolute Throne Arc!! (ﾟ∀ﾟ)
61,"Aug 18, 2021",Some of the names switched around like [Unbroken Trust] got me messed up also “Plausibility” instead of Probability too. I do love the webtoon version tho it’s amazing seeing previously read scenes visualized so kudos to the artist and TL and anyone else who works on this
61,"Aug 18, 2021","I just realized something-at this point, the main character is essentially a constellation. He has the 3rd person thing, can take over people's bodies, can distribute items and grow people's skills, can't die, can be affected by immersion, not bound to any constellation, isnt a character but rather a part of the world. He's kinda a living constellation."
61,"Aug 18, 2021",But why change scene transformation to dramatization? I like the former so much more
61,"Aug 15, 2021","I like how we get a history lesson even if it isnt real, lol, PLEASE AUTHOR! make this into an animation series, I love this story so so so much it's so amazing!!!!! "
61,"Aug 14, 2021","Damn, sometimes Dokja is scary smart. For him to use unrelated to his channel contelations to bend the rules of the historical battle and to even kill another constellation. Bravo my man, bravo"
61,"Aug 13, 2021",I love that the traits of all the characters get to shine while we also get to learn more about the world this all takes place in. This webtoon is so incredible and its creator even more so for making it.
61,"Aug 12, 2021",Dokja eye's is beautiful in here
61,"Aug 9, 2021",Did anyone else give the king that possessed dokja an awesome voice in their head or just me?
61,"Jul 15, 2021","can we pls just appreciate the art of this webcomiclike
take a moment and sing a prayer or smth"
61,"Sep 19, 2021","that was... epic.... i dont even know that much ab korean history but wow, so many emotions... i kinda feel bad now for gyebaek :( seems like he rly wanted that rivalry thing w yusin but he wouldnt let him get close 😢 im such a sucker for stories like that"
61,"Sep 1, 2021",bro my heart was racing for this chapter! amazing work freakin loved this chapter! Sangah the queen of history amazing speech! 
61,"Aug 27, 2021",I just went on pinterest and searched 'omniscient reader' to get a cool wallpaper................. most of the stuff there was dokja x junghyeok😭 at this point like what else did I expect lmao
61,"Aug 26, 2021",This needs to be animated !!!!!
61,"Aug 23, 2021",Who else understands almost everything they're talking about without the explanation cause they've watched hwarang ✋
61,"Aug 22, 2021","binged this series. now, the waiting game begins😭"
61,"Aug 20, 2021",I probably wouldn't survive if this was happening irl.
61,"Aug 19, 2021",Wow the scenes are really really amazing!! The way they pose and the art is really good!! THANKS FOR THE EPISODE!! 
61,"Aug 19, 2021",the panel star scenery was so beautiful 😍
61,"Aug 19, 2021",[Pumpkin king likes this webtoon and sponsored 10 coins]
61,"Aug 19, 2021",anybody read the novel?
61,"Aug 19, 2021",Ah yes the good ole GAMERS…ASSEMBLE never fails
61,"Aug 19, 2021","I understand that the main was afraid of braking his oath but that is a good question. Just the same as ordering someone else to kill for you is indirectly killing, would having a constellation possessing your body kill with your hands be the same?"
61,"Aug 19, 2021",yes let's get the chungmuro flag with the skeleton army!!
61,"Aug 19, 2021","Unrelated but every time I read ""Silla & Hwarangs"" it makes me remember the K-drama 'Hwarang' lol. Anyway, I'm really amazed by how this is beautifully drawn & written. I really do love the art style here & of course the story itself. ^^"
61,"Aug 19, 2021","How many other non-Korean people also get lost in toons when the author writes about or uses Korean history in their works? It's all good though, I tried my best to follow along. Also, I'm from Texas, where y'all from?"
61,"Aug 18, 2021",I really like that we can learn more about Korean history with this webtoon 
61,"Aug 18, 2021",Dokja became a temporary necromancer for a few minutes just like that. Thanks to Sangah for carrying! 😎
61,"Aug 18, 2021",I love how in the middle of his epic speech they just. Show his perfectly normal and beat up sneakers.
61,"Aug 18, 2021","The summoning of the dead warriors reminded me of Return of the King (LOTR), when the OP skeleton army appears to set things right. Beautiful and excellent way to learn about Korean history for us constellations coming from other parts of the world. Hermoso todo!"
61,"Aug 18, 2021","""Arise"""
61,"Aug 18, 2021",it's been so long since I've been so excited to read a comic series like this.... thank you dear author 🙏🏻
61,"Aug 18, 2021",i have learned so much history about this region that I hope is historically accurate bc its so cool
61,"Aug 18, 2021","wow, this was phenomenal (as this story always is)"
61,"Aug 18, 2021",sangah mvp!!! she's so smart ma'am I'm in love 😍
61,"Aug 18, 2021",Happy Anniversary! I can't believe it's been a whole year of Omniscient Reader already!
61,"Aug 18, 2021",dokja make me feel sum kinda way man
61,"Aug 18, 2021",Sangah is also v smart.
61,"Aug 18, 2021",I love sangah I hope we get to see more from her
61,"Aug 18, 2021","another awesome chapter, dokja is always one step ahead 😭"
61,"Aug 18, 2021",That was hot ngl dokja with the sword ✨
61,"Aug 18, 2021","In this battle, one of the “captains “ of hwarang fought geybaek (they are probably arch nemesis), the captain killed geybak during the battle - not directly- . In the scenarios when a constellation is in-tune with his incarnation, and is also presented with a story about him( a battle he fought) with another constellation that will trigger the (dramatization) which wraps the reality of the place to that same battle they fought. And the story will lean towards the winner in the battle."
61,"Aug 18, 2021",This ep was so epic
61,"Aug 18, 2021",This episode gave me Thor ragnarock vibes. Anyone else? 
61,"Aug 18, 2021",Dokja really became Wei Wuxian with the skeletons huh
61,"Aug 18, 2021","Everyone else in that fight were thinking the same ""is that even legal"" then proceeds to get impaled."
61,"Aug 18, 2021",Dokja you're having to many bad a$$ anime moments to the point its getting illegal-
61,"Aug 18, 2021",damn.... that possession over Dokja brought me chills...
61,"Aug 18, 2021","That was amazing, I got the chills. Also, go Sangah! Mad persuasion skills"
61,"Aug 16, 2022","even in this manhwa, history is really not for me T^T AS MUCH AS I WANT TO UNDERSTAND, but it seems that my brain cannot"
61,"Dec 22, 2021","this is such a good story. everything in here is just so unpredicatble and interesting. it's like knowing you already know all the toppings in the bread but in reality there's so much more filling inside it that can't be seen. what add more to it is it's taste is just bizzare but delicious, not your typical sweet desert. "
61,"Oct 12, 2021",Checkmate.
61,"Oct 9, 2021",i REALLY love the in between situation likeeeee everyone seems no hope but you've DOKJAAA KIM😍 ( i salute all the authors out there esp. on this story ) i remember when minseob said that he feels what the authors feels like when they're writing the story. 👐
61,"Oct 1, 2021",I'll always stand for Sangah MVP! I mean... HAVE YOU SEEN HER?! SHE IS THE MASTER OF POWERPOINT PRESENTATIONS LMAO
61,"Sep 30, 2021",I really love everything they portrayed in here it’s really amazing and you go sanga she’s so talented and dokja being possessed that was so beautifully done and I love how smart he is and think everything through instead of rushing in to things 
61,"Sep 30, 2021",Dokja: I never asked you to choose. (I don't need your opinion)Jiwon Min: *Falls in love deeper to Dokja*
61,"Sep 26, 2021","Dokja is already a king by himself, he doesn't need a throne"
61,"Sep 17, 2021",I love the little history lessons sprinkled throughout this webtoon. Also I like that side characters get their chance to shine.
