Episode,Date,Review
27,"Apr 27, 2021","The type of heroes like here and in solo lvl is really great. They’ve found out a perfect recipe for mc and I think such characters will do great in slice of life, it’s just in this genre they can shine to the fullest. At least for me idk if it possible do create a better personage "
27,"Apr 26, 2021",Gilyeong :(
27,"Apr 26, 2021",awww.. Dokja was like an onii-chan for Gilyeong 🥺🥺🥺 awww.. that's so sweet 🥺🥺💕
27,"Apr 26, 2021","hello ptsd. oh, your name is illusory prison now? a shit by any other name would still stink."
27,"Apr 26, 2021","""maybe it was gyleong who had the most traumatic experience"" I wanna die"
27,"Apr 23, 2021",omg him and Gilyeong hugged us the SWEETEST   😢😢😩
27,"Apr 13, 2021","HUh, is her patron Admiral Yi? I remember watching a video on tht guy being pretty amazing"
27,"Apr 11, 2021",Dokja é o protagonista mais equilibrado em termos de personalidade na minha opinião.
27,"Apr 11, 2021",I love the relationship between gilyeong and dokja ♥️
27,"Apr 9, 2021","Gilyeong is my favorite, must protect that baby.[constellation Lonely Weeb cheers for Gilyeong] "
27,"Apr 9, 2021",did anyone else think that Jiyhe looked hot in the last panel because i thought she was good looking
27,"Apr 8, 2021",this got me addicted
27,"Apr 2, 2021",I hope we get to see a peek into Sangahs and Dokjas backstorys as well. 
27,"Mar 26, 2021",gilyeong has my entire heart idc
27,"Mar 18, 2021",Poor little Gil 😟
27,"Mar 11, 2021",poor gilyeong 😭
27,"Feb 24, 2021",this is so fun but it's 4AM and i have 7AM classes later :'D
27,"Feb 18, 2021","the constellation 'simping and shipping' is enraged that their child has any trama, and sponsors the idea of killing ""mom"", they also wish to give their child a hug"
27,"Feb 17, 2021",She just had to kill anyone why chose her best friend wtf
27,"Feb 14, 2021",I want a Dokja in my life 
27,"Feb 5, 2021",She killed her closest friend to survive :0
27,"Jan 28, 2021",I like how the bald dude and the Demon constellation greeted eachother like war buddies
27,"Jan 27, 2021",WAAAHH JIHYE LEE SEEMS SO COOL (except for killing her closest friend ofc 😓)
27,"Jan 27, 2021","I wonder what happend to him, because of his trauma 🤔"
27,"Jan 21, 2021",Illusory Prison more like Panic Room
27,"Jan 12, 2021",Probably the most realistic depiction of being KOed with a chop to the back of the head.  There’s always that chance of concussion
27,"Dec 29, 2020",lol will someone give me all the character's full names? i tend to forget all of them exept for dokja and sangah  haha. im sowwy
27,"Dec 29, 2020",best...series...ever😍😍😍
27,"Dec 29, 2020",Jihye Lee is stunning. far from what I imagined but still her character fits well. crushing hard
27,"Dec 29, 2020",Has anyone else realized as you go from the very first episode that the likes slowly start going down. Just me ok 👍🏾 
27,"Dec 28, 2020",Gilyeong 🥺
27,"Dec 28, 2020",SOMEONE PLEASE TELL ME IF I SHOULD USE MY 5 COINS AAAAA
27,"Dec 28, 2020",omg just thought of this but did dokja not take a constellation coz later down the line the boss of the apocalypse can't be killed by someone with a supporting constellation!?
27,"Dec 27, 2020",amazing manga!
27,"Dec 27, 2020",Daddy Dokja!
27,"Dec 27, 2020",I HAD TO WAIT 42 DAYS TO SEE THIS because I didn't wamt to spend anymore coins. At least I fell out of the coin trap though
27,"Dec 26, 2020",Gilyeon is my baby. I want him to live until the end
27,"Dec 26, 2020",she's hot
27,"Dec 25, 2020","Seeing the characters that I have read come alive in art form is incredible. I can't wait to see Han Sooyoung, Archangel Uriel and others."
27,"Dec 25, 2020",Remember guys: all of them except the army guy are supposed to be dead. He’s messing with the plot and the timeline.
27,"Dec 24, 2020","I really love this webtoon,  even though I absolutely hate the ending parts coz it give a trauma and anxiety against being alone *sigh*"
27,"Dec 24, 2020",I love gilyoung and how dokja comforts him. It's nice to see how much they trust each other
27,"Dec 24, 2020",I like how op dokja Is like he is not only good to have as a free cuz he knows whats gonna happen but he also is like super godly at fighting and is good for emotional help
27,"Dec 24, 2020",I swear Gilyeong never fails to touch my heart and make me happy <3
27,"Dec 24, 2020",Poor Gileyoung! At least he’s got a bit of protection now
27,"Dec 24, 2020",Looking forward for lee jihye battle 
27,"Dec 24, 2020",ANGEL
27,"Dec 24, 2020",I hope we see more of gilyeong in the later chapters 
27,"Dec 24, 2020",Can’t believe that their missions so far have been level F-D and they’re all super exciting and dangerous...can’t imagine what level B or A means 😨
27,"Dec 24, 2020","Blade Proficiency, Perfect Senses, and Ghost Steps - now THAT is an impressive skill combo."
27,"Dec 24, 2020",Poor Gilyeong TwT
27,"Dec 24, 2020","I'll say it once, I'll say it a trillion times.... PROTECC THE CHILD!!! 😰😰😰❤❤❤❤"
27,"Dec 24, 2020",naval warfare ?!!!!! what the F word ?!!????? XD now wut!? japan is going to attack korea again and she is going to be general yi ?????! lol that was good. i liked it.
27,"Dec 24, 2020",Best early Christmas present: This Webtoon Updating 
27,"Dec 24, 2020",Gilyeong is so cute 😭 he must be protected
27,"Dec 24, 2020",now i'm curious to know Dokja's trauma 
27,"Dec 24, 2020",Poor kid
27,"Dec 24, 2020","its honestly really terrible gilyeong had the most traumatic event cuz he's only a kid, so he shouldn't have to face something so terrible at such a young age."
27,"Dec 24, 2020","I'm very like attached to Gilyeong that like that scene was hard to read (lol) and I imagine his animal skull weapon as like a teddy bear, idk why"
27,"Dec 23, 2020","Seeing a girl with that hairdo, it's kind of weird when I have seen a lot of swordman with long hair.I hope that the other women won't be on a rampage when she wakes up"
27,"Dec 23, 2020","i love gilyeong and I love the artistic choice of the design of his weapon. He has a club made from the skull and spine of a beast when he's of the age where he should be carrying a stuffed animal. And I like the dynamic between him and Dokja. Though Dokja took him on because he remembered him from the story, Gily just trusts him."
27,"Dec 23, 2020",i REALLY wanted to see dokjas past but it was still an amazing chapter
27,"Dec 23, 2020",I love this webtoon. I love it.
27,"Dec 23, 2020","gilyeong hugs dokja,,,,, im- 🥺🥺🥺🥺🥺"
27,"Dec 23, 2020",i love gilyeong so much
27,"Dec 23, 2020",I really like/love this comic
27,"Dec 23, 2020",I want this to get updated.every single hour of the day. this series is sooo amazing. i am crying 😭
27,"Dec 23, 2020",gilyeong is great. he feels so much purer compared to the corrupt adults in this story :') can't wait to see him grow up too
27,"Dec 23, 2020",I hope we get a gilyoung backstory soon
27,"Dec 23, 2020",I Will Protect Gilyeong untill the end of my days. THIS IS AN OATH!
27,"Dec 23, 2020",Who is the 'master'? Is it that regressor guy? If she's one of the character then shouldn't she go with the regressor
27,"Dec 23, 2020",I wonder other the that you may lose their support what are the consequences for pissing off your supporting constellation
27,"Dec 23, 2020",I’m so touched when Gilyeong hugged Dokja. It’s like he always trust him.
27,"Dec 23, 2020",Gilyeong is so precious 🥺 Must. Protecc.
27,"Dec 23, 2020","been watching too much anime. i see a child hug an adult and think ""is the child plotting something? """
27,"Dec 23, 2020",[sub scenario - wait until next week for the new episode]
27,"Dec 23, 2020",i read TWSA as 'twasa' ahahha
27,"Dec 23, 2020",peek at that tragic dokja backstory😳 
27,"Dec 23, 2020",ah this comic is addiction 
27,"Dec 23, 2020","Wait, so was Gilyoung just on the subway alone in the beginning? Like who was watching this child? Was he with his mom? Dad? Sibling? Someone who’s like a sibling? Grandma?"
27,"Dec 23, 2020",Well.......dokja cleared that quest instantly 
27,"Dec 23, 2020",When Gilyeon and Dokja hugged I cried and awwwwed so hard because they just too cute!
27,"Dec 23, 2020",Awww brown haired boy had an abusive mom 😢 cri-
27,"Dec 23, 2020","Stayed up to 12:00AM to read this comic, and it was worth it"
27,"Dec 23, 2020",I knew she would come ....I was waiting for her really hehehehe
27,"Dec 23, 2020","AHHHHH Lee Jihye is finally here!!! i’m so excited, i’ve read a bit of the novel and the upcoming arcs are going to be AMAZING "
27,"Dec 23, 2020","Lee Jihye came, oh my god, this episode marks the entry of the new member in Dokja's team!"
27,"Dec 23, 2020","Not gonna lie, I agree with that one constellation, knowing his past would've been cool-"
27,"Dec 23, 2020",Gilyeong keeps the humanity in dokja 
27,"Dec 23, 2020","Damn....Vegeta killed Nappa, a person who travelled with him for a long time, then there's this girl who straight up killed her closest friend. I'm not gonna judge entirely cuz there must be more to it, but I got questions nonetheless."
27,"Dec 23, 2020",Another permanent member of Kim Dokja's Company!!Maritime admiral OP!
27,"Dec 23, 2020",I’m so curious about Dokja’s past... Any web novel readers want to tell me what chapter we learn about it on  (and where to read the web novel lol)
27,"Dec 23, 2020",I feel like Dokja and Gilyeong protect each other mentally 
27,"Dec 23, 2020",Wut??!!just like that!!!lools like its not wut it seems.And yeah that hug was everything!Poor boy...I wany to jive him a hug too tho I am also disappointed lile that constellation...I wanted to see wut happend with dojka!!!
27,"Dec 23, 2020",DEMON SLAYER
27,"Dec 23, 2020",I feel like a bAd a$s reading this!
27,"Dec 23, 2020",When all is said and all is done Dokja is pretty badass 
27,"Dec 23, 2020",I'm the curious constelation 👍🏼
27,"Dec 23, 2020",I love the Secretive Plotter! And the Prisoner of the Golden Headband!
27,"Dec 23, 2020",Is it me or did the chick who showed up in Dokja's hallucination look like Jung Heewon with her hair down?
27,"Dec 23, 2020","the hug tho, awww ówò"
27,"Dec 23, 2020",dang don’t we all want a dokja in life 
27,"Dec 23, 2020",Aw Gilyeong and Dokja 
27,"Dec 23, 2020",My baby boy. I’m sorry what did your mother do to you my sweet child 
27,"Dec 23, 2020",dokja has unlocked: eye of the supreme king
27,"Dec 23, 2020","I started reading the LN because of this series, and going back to this chapter makes me realize how epic the art style is and how well it captures the tension!"
27,"Dec 23, 2020","*A new sub-scenario has arrived*Dokja: Sorry, I'm too op for that."
27,"Dec 23, 2020","The interaction between Kim Dokja and Lee Gilyoung warms my heart, they look like a perfect father-son duo. This episode clearly shows that Kim Dokja is truly cares for gilyoung and it also shows that gilyoung himself regards Kim Dokja as someone he can trust. Look at how comfortable he is when hugging Kim Dokja or getting head pat from him"
27,"Dec 23, 2020",this new girl looks just like Dokja I’m-
27,"Dec 23, 2020",MAN I LOVE THE FEMALE CHARACTERS THEY'RE SO WELL WRITTEN
27,"Dec 23, 2020",gilyeong better not die
27,"Dec 23, 2020",Can’t wait to see how she fights 
27,"Dec 19, 2020",Gilyeoung is too pure!!!!
27,"Dec 9, 2020","A constellation just has a crush on Dokja, and that's me 🤫"
27,"Nov 6, 2020",I'm I using coins to bury myself two months wait deep just to continue one more chapter? Yes I am.
27,"Nov 5, 2020",I'm honestly surprised the constellations aren't suspicious of Dokja knowing so much about all these scenarios. Maybe they just assume he's getting lucky? I dunno..
27,"Nov 5, 2020",The constellation Lazy Bum has been please so far. You have been gifted 5 coins
27,"Nov 4, 2020",Needed this to distract me from the election 🥴
27,"Nov 4, 2020",the constellation greedy storyarc devourer alpha  is extremely  glad to have coins to pay for this every Wednesday  
27,"Nov 4, 2020",Dokja took care of them spectres quick like lol! Mental trauma is something we can't runaway from and can haunt you forever. Dokja came prepared and still came away by the skin of his teeth group wise. God I love this story! 
27,"Nov 4, 2020","Worth every coin, thank you for the meal."
27,"Nov 4, 2020","Can’t wait for this to to get far into the story, I’ve read the novel and it gets amazing "
27,"Nov 4, 2020",I miss 1chapter per day :(
27,"Nov 4, 2020",another 5 coins from me
27,6 days ago,Dadja moment.
27,"Oct 10, 2022",aww gilyeong is so cute receiving comfort from dokha 🥺
27,"Oct 8, 2022",I love his brotherly relationship with Gilyeong♥️ I want them two to be good pals they deserve someone to trust
27,"Aug 21, 2022",i love gilyeong and dokja’s relationship it’s soo cutee like sibs
27,"Jul 21, 2022","""I'm sorry! I'm sorry, mom!"" Gilyeong must protecc... : (( "
27,"Jul 10, 2022","Listen to me Dokja Kim, Gilyeong is now your son. There is no room for arguments. "
27,"Jun 19, 2022",I am glad to see the new character JIHYE LEE is appeared 😀 
27,"Jun 9, 2022","I love how he still comforts the child. Perhaps because he experienced something similar. He cares for his personal gain, yes. But from the moment of the train station he’s been very nice to the child. Even lied when being questioned by the child. He cares very much. He’s a likable character even with his sociopathic tendencies "
27,"May 27, 2022",if there is no time limit how can you fail?
27,"May 4, 2022",dang jihyu lee kinda hot😍😍😍😍
27,"Apr 19, 2022",Me whenever I see dokja-gilyeong moments: that's your son now😀
27,"Apr 10, 2022",Hmmmmmm... looks like Dokja has an interesting back story.
27,"Apr 5, 2022",th constellation that was sad we didn't see his past is legit me
27,"Mar 26, 2022",Dokja is Gilyeong's safe place :(
27,"Feb 25, 2022",if gilyeong dies on day I die too
27,"Feb 20, 2022","I love Gilyeong, his just a kid and his going through that kind of stuff with her mother.  this honestly hurts me, even though this is just a book. I wanna hug him so bad </3"
27,"Feb 13, 2022",I like how Dokja was like a big brother to Gilyeong!
27,"Feb 5, 2022",Baby gilyeong 🥺🥺🥺 the way he hugs dokja 😭😭😭😭 dokja is like his comforting older brother 😭
27,"Jan 23, 2022",looks like someone found himself a caring older brother🙂
27,"Jan 8, 2022","That thing about high school was very confusing as someone who only went to a secondary school. I'm just gonna say she's 17, OK."
27,"Dec 22, 2021",that little boy is so adorable
27,"Dec 14, 2021",Man Gilyeong is going to ruin my life when he dies 😭😭
27,"Nov 26, 2021",DOKJA AND GILYEON ARE SO CUTE I LOVE THEM
27,"Nov 13, 2021",no bec i love the relationship between gilyeong and dokja <33
27,"Nov 4, 2021",i love how Dokja has so many girls
27,"Oct 31, 2021",we must protect our baby gilyeong with our lives
27,"Oct 31, 2021",omg what did the brown hair kid go through????
27,"Oct 23, 2021",that was absolutely adorable and wholesome with that tight squeeze of a hug to let Gilyeong know he is safe with Dokja
27,"Oct 17, 2021",I love the brothely bond between Dokja and Gilyeong. (so cute)
27,"Sep 30, 2021",ahh that's so heartwarming the hugging.
27,"Sep 23, 2021","Author, I hope you know you made me cry this episode. But thanks 🤡😚💋🥴🙏🥴😕😤😡🙏😡🥴😡💓😏🥳😕😡😤💥😌😧🥴👿😟😔😔🥳😌😔😊😏🥴🥵🥵👹👹😟🥵👹"
27,"Sep 23, 2021",I feel like secretive plotter isn’t as weak as initially thought but honestly it’s just off the name
27,"Sep 21, 2021","gilyeong you are the best of them. please live. 🙏
🙏
🙏"
27,"Sep 7, 2021",...I can't Gilyeong is so cute ;w;
27,"Sep 6, 2021",When Jihye apperared I thought she was a boy lol
27,"Aug 28, 2021",OMG I KNOW WHO THE GOD OF NAVAL WARFAR IS! I JUST CAN'T REMEMBER HIS NAME CRAP! That man is a legend on par with otto von bismark and general moltke the first!
27,"Aug 26, 2021",It seems like Dokja's mother is a victim of abuse. I wonder who that curious constellation was. I wonder how the relationship with Jihye will pan out. She has the same Demon Slaying attribute so she could pose a threat and become unhinged as well. Must be a traumatic past thing (like killing your best friend 😭)
27,"Aug 22, 2021",I'm kinda scared for gilyeong...i hope he will not die at one moment of the story... i would be destroyed..
27,"Aug 15, 2021",Protect our cinnamon roll!
27,"Aug 13, 2021",that hug tho😫😭😭😫😭😫😭
27,"Aug 6, 2021",Day 26 of voicing all the characters 
27,"Aug 1, 2021",God of Naval Warfare? I thought it was Poseidon 😂
27,"Jul 17, 2021",gilyeon is so cuteeeeeeeee 🤧 i love how dokja is like a father or brother figure to him 🥺 
27,"Jun 21, 2021","Ok but like if you guys think abt it without gilyeongs trauma with his mom, he’s still severely traumatized. He’s a little child who has had to watch people killing each other and all those blood bath scenes. But with his past trauma with his mom i feel like he prefers the world as it is right now than how it was before bc he doesn’t have to deal with his mom and he has Dokja. I can tell he looks up to him and sees him as comfort"
27,"Jun 14, 2021",gilyeong I feel ya with the mommy issues :') 
27,"Jun 7, 2021",The bean is sad ;-; poor Gilyeong
27,"Jun 6, 2021","[The Constellation, Simp for 2D, pledges to protect Gilyeong Lee.]"
27,"Jun 6, 2021",God of Naval Warfare is Admiral Yi Sun Shin
27,"Jun 1, 2021",GILYEONG WAIT FOR ME I'LL GIVE YOU THE WHOLE WORD
27,"May 28, 2021","I feel ya, Gilyeong buddy. life sucks. "
27,"May 20, 2021",Don't fucking die gilyeong
27,"May 13, 2021",i knew she was gona reappear
27,"May 13, 2021",I see it... they are going to kill our Gilyeong to make us suffer
27,"May 13, 2021","I know this webtoon is not about romance, but I really ship Sangah and Dokja ✌🏻"
27,"May 6, 2021","Ah, naval combat finally getting some love in apocalyptic fiction, i see 😊"
27,"May 3, 2021",the constellation [team blue turtle] enjoys the slow development
27,"May 2, 2021",Gilyeong ur oppa Dokja is there to save u baby
27,"May 2, 2021","Does anyone else get weird vibes from Sangah ? Not untrustworthy or anything yet, but just an unknowing feeling 🤔 "
27,"May 1, 2021",it's so cute when gilyoung hug dokja...that softened me abit...I love dokja's character too and all of them of course no biased...hehe but I like dokja more
27,"Apr 30, 2021",Id really wish that none from his party would die
27,"Apr 29, 2021",I'm pulling my hair in excitement 🤩😈
27,"Apr 28, 2021",dang dokja is so smart!! what the fudge...⁉️NICE!
27,"Apr 28, 2021","yoooo, Admiral Yi, is that you!!"
27,"Apr 27, 2021",I just started this today and I’m already on chapter 6 😂
27,"Apr 26, 2021",aww gilyeong(ㄒoㄒ)
27,"Apr 26, 2021",Anyone else notice that it said that high school in Korea only 3 years? I'm so jealous!
27,"Apr 24, 2021",eyyy i have a feeling we just met a new inclusion to our badass squad
27,"Apr 19, 2021",This is better then weed
27,"Apr 8, 2021","now that I think about it, wasn't that Sub Scenario, 'Illusory Prison', a bit too difficult? well, to be fair, it would only be difficult for people with intense trauma or weak mental fortitude, so more ""normal"" people wouldn't have too much difficulties, but can we really expect people like that to exist if they were able to come that far? but then again, the penalty for failure was just ""???"" and not death, so it could've been difficult on purpose."
27,"Apr 7, 2021",Oh No she's HOT
27,"Apr 7, 2021",I love how  Dokja always is taking Care of Gilyeon
27,"Mar 26, 2021",thanks to the brilliant author :D
27,"Mar 5, 2021",i like every chapter before i start cause i know it’s gon be good
27,"Mar 3, 2021",I'm not ready for another character OMG 
27,"Feb 23, 2021",The constellation A humble reader wants you to adpt the child already
27,"Feb 19, 2021",remember to comment and like every episode so that the artist will help you survive the apocalypse. Thank you for this episode! I look forward to finishing the series
27,"Feb 14, 2021",I'm curious about dokja past
27,"Feb 10, 2021",Did Hyeongseong's worst trauma him copying? Lol I like him
27,"Feb 2, 2021",NOOOO GILYEONG so far hes been my favorite character and i already loved him but now that i can relate to a small aspect of him (assuming he has trauma from parents) ive grown so attached to him
27,"Jan 28, 2021",omg i’m so glad we get to see her again i’m excited for the next chapters!!
27,"Jan 26, 2021",Dokja talking about who has the worst trauma... Hello dear 
27,"Jan 24, 2021",I'm lowkey shipping everyone 
27,"Jan 20, 2021","Don’t you just like the sibling relationship between gilyeong and dokja, gilyeong is like a little brother, this is so cute😩😩"
27,"Jan 16, 2021",AAAAAA YES JIHYE ANOTHER BEST GIRL LET'S GOOOOO
27,"Jan 14, 2021",se parecen un poco xd
27,"Jan 11, 2021",your my dad oggie woogie
27,"Jan 9, 2021",Gilyeong is an admirable character. he goes through tough times but stays courageous whatever the circumstances. 
27,"Jan 8, 2021",hyunsung carrying heewon.. AKJDJS AM CRYING AHHH (i finished the novel a few days ago and its so good :”)
27,"Jan 8, 2021",Yi sun shin!!
27,"Jan 1, 2021","Ahhhhh gilyeong, I hope he turns out ok"
27,"Dec 30, 2020","I'm Gilyeong. I think there are many among is who are also Gilyeongs. 파이팅, 길영아! 우리 너 사랑해!"
27,"Dec 29, 2020",The constellation of royals would spent all their coins on a bicycle race and cannot reward you with coins so they feel disappointed in themselves
27,"Dec 29, 2020","i love it, thank you"
27,"Dec 27, 2020",I love Gilyeong so much I would consider myself a mother hen for him but seeing him like that really makes me sad and I’d like to just have a little.. chat with his mother yk 🤵‍♀️
27,"Dec 27, 2020",why do I have a foreboding feeling about Gilyeong's fate....
27,"Dec 26, 2020",He legit judo-chopped Huiwon 😂😂
27,"Dec 26, 2020",She sounds like a bad bitch ion know 
27,"Dec 26, 2020",The Constellation Fans wants and needs more eps
27,"Dec 25, 2020",only made it a 1/4  of the way through the web novel before I could not afford to read further. -_- 
27,"Dec 25, 2020",I like ya cut G
27,"Dec 24, 2020",I kinda hoped that we would see their traumatic moments but I think Gilyeong had an abusive mother or sum
27,"Dec 24, 2020","Maritime Admiral vs Naval Commander...Also, Gilyeoung!!!!!!!!!!"
27,"Dec 24, 2020",The constellation Gymnast For Life vows to protect Gilyeong with her life
27,"Dec 24, 2020",I need to start a star stream to get coins so I get to read more of this awesome webtoon
27,"Dec 24, 2020",I can't wait till the best girl shows up webnovel readers know who I'm talking about
27,"Dec 24, 2020",I hope Gilyeong is okay :(
27,"Dec 24, 2020",They need a break 
27,"Dec 24, 2020",This story never ceases to amaze and intrigue and touch me deeply. I could root for all these characters till the end of time.
27,"Dec 24, 2020","« You haven’t seen anything, okay ? » mmmmh... "
27,"Dec 24, 2020",i want to protect Gyleong at all cost 
27,"Dec 24, 2020","Oh cool, Jihye. Lol she’s easily one of the funniest in the group"
27,"Dec 24, 2020",Ahhhh I want to see his background story :(
27,"Dec 24, 2020","[Constellation Blood Queen Empath], is satisfied with story progression and gifts 5 coins for more next."
27,"Dec 24, 2020",Lee Gilyoung wont die. Dont worry!
27,"Dec 24, 2020",I love this webtoon (╥﹏╥)
27,"Dec 24, 2020","Pls, I hope nobody will hurt our precious gilyeong 🥺"
27,"Dec 24, 2020",I think we are going to see Jungheok Yu in next episode 🤔🤔😎😎
27,"Dec 24, 2020",I wonder why there are so many sub scenarios. if not for dokja almost everyone would die before hitting a real scenario then channel closes end of story. 
27,"Dec 23, 2020",author!!! I seriously want to follow all ur works!!! what's ur name!!!! 😭😭😭
27,"Dec 23, 2020",I AM ALSO A CONSTELLATION DISAPPOINTED THAT I DID NOT TO SEE HIS PAST. GIFTED YOU 5 COINS
27,"Dec 23, 2020","aww, gilyeong's a precious child"
27,"Dec 23, 2020","Boy owh boy, Dokja's past is hella spicy, but we will never see it too early"
27,"Dec 23, 2020",‘Maritime war god’ was so much better than ‘god of naval warfare’...I don’t get why the webtoon translators don’t use the already existing scanlations...tbh they are managing the name translating much better.
27,"Dec 23, 2020",Don't trust her .
27,"Dec 23, 2020",I swear to all that is good if anything happens to my precious little bean Gilyeong I will never be happy again.
27,"Dec 23, 2020",I feel so bad for them going through traumatic events are the worst 
27,"Dec 23, 2020",So it seems butterfly effect doesn’t exist in this world. Things about the story only change until he interacts with them himself. 
27,"Dec 23, 2020","based on what dokja is saying, I feel like junghyeok is ""the master"" that jihye is referring to. maybe he rushed to where he knew she was and set up a survivors base there so he could get her on his side"
27,"Dec 23, 2020","Poor Gilyeong I feel so bad, he’s so young and has to go through this 😔 I’m glad Dokja was able to make him feel better"
27,"Dec 23, 2020",if anything happens to this squad I'mma be torn
27,"Dec 23, 2020",i forgot i shared a name w a character!! cant wait to see more of jihye :) 
27,"Dec 23, 2020","""Don't you know that these hunting ground belong to us?""Lady how the heck is anyone supposed to know? The apocalypse literally happened yesterday or so"
27,"Dec 23, 2020",Jihye is different from how I pictured her haha
27,"Dec 23, 2020",man forth wall one of the OPiest skill there is
27,"Dec 23, 2020",This is the earliest I'll be to read a webcomic because it's 6am where I currently live because a stupid blocked nose woke me up :(
