Episode,Date,Review
104,"May 11, 2022",Come on! nooo MORE I Need MORE 
104,"May 11, 2022",GOSH I'M STARTING TO GET ANGRY WITH HOW FAST I WAS ABLE TO READ EVERY CHAPTER AND NOW I HAVE TO WAIT FOR A WEEK AGAIN....PLEASE HELP ME😭😭😭😭
104,"May 11, 2022",The time is almost here and I’m excited
104,"May 11, 2022",He just wants to keep his new beast waifu
104,"May 11, 2022",even the dokkaebi know he's more than just a regular guy now. they are starting to have expectations.
104,"May 11, 2022",Props to the author. I'm incredibly hyped for what's to come.
104,"May 11, 2022",can i just skip this week to next wednesday
104,"May 11, 2022",this guy is a asshole
104,"May 11, 2022",The Dokkaebi need to leave KDJ's found family ALONE ✋🏻✋🏻 I will fight 
104,"May 11, 2022",JkYu with the words of wisdom over here 🥹
104,"Jun 16, 2022","yes. he's been far away ahead, you have no idea. king things 👑"
104,"Jun 16, 2022",love the series I started to reread it
104,"Jun 16, 2022",I did that didn't I 🐛🐛🦗
104,"Jun 15, 2022",you guys should watch badly explain omniscient reader in 6 minutes it's actually really funny(Edit: I don't know if I contains spoilers or not because it says all 500+ chapters of it)
104,"Jun 15, 2022","icant do this anymore, my phonesded and im writing this using remote and our tv"
104,"Jun 15, 2022",I'm a hard-core shipper for dokja and junghyeok to be together 
104,"Jun 15, 2022",The way she looks at him makes me feel like she was lost for a long time but finally sees the hope as the end of the tragic tunnel.
104,"Jun 13, 2022",[A constellation constantly lacking coins wants the intermediate Dokkaebi Paul to get punted into the Sun.]
104,4 days ago,"Sir, if you farted in year 2078 and it’s 2022 right now… Dokja would already have a counter 😂"
104,"Oct 11, 2022",Good chapter!
104,"Oct 8, 2022",lol
104,"Oct 7, 2022","I don’t remember what this dokkaebi was punished for before.
He’s not the red one with a single horn.

I don’t think he’s the one that stuttered and was Bihyeong’s replacement while he was being punished."
104,"Oct 6, 2022",hes just pissed he got played 
104,"Oct 2, 2022",bihyong gonna die of stress 😅
104,"Sep 21, 2022",Where is lazy broke weeb? 
104,"Sep 1, 2022",Dude you don't know how far ahead I am thinking lol 😂😂😂😂
104,"Aug 31, 2022",how did my heart went thru this chapter 🥺😫
104,"Aug 30, 2022",Just let it be sir...Dokja has plans and backups for days 😭😭
104,"Aug 28, 2022",how soft was Junghyeok's hair? i want to touch his curly hair 🥺
104,"Aug 24, 2022","ohhhh my sweet dear dokja, I will do anything for u to be my bitch 🛐🛐🛐, I will slay any monster, run over anyone u name it it's urs ❤️✨"
104,"Aug 21, 2022",Dokja💗
104,"Aug 17, 2022",BRO HIS DAMN WAIST AAAAAAAA
104,"Aug 15, 2022",Dokja looking extra
104,"Aug 12, 2022",I just cant help getting excited when something new about this world/system is about to be revealed
104,"Aug 11, 2022","if one of my companions got killed by the catastrophe, I'll be so pissed at kdj 😅😅"
104,"Aug 8, 2022",ugh Paul is so annoying 
104,"Aug 6, 2022",103
104,"Aug 5, 2022",I kinda miss Huiwon... where is she?
104,"Aug 3, 2022","but– k!lling isn't the only way to defeat someone, is it? how things happened count as a defeat situation in my opinion... plus dokja definitely is the main character jjajajaja "
104,"Aug 2, 2022",i hate him so much
104,"Jul 30, 2022","actually he's farther away from that ""far ahead"" of yours💀"
104,"Jul 24, 2022",I won’t spoil I read like the next 10 episodes downloaded and came back to check the comments 😭😭 this stupid dokkaebi 
104,"Jul 22, 2022",Lol faceless background Dokja clone (near where the dokkaebi says “how disappointing”
104,"Jul 21, 2022",Nice.
104,"Jul 20, 2022",OH I'VE MISSED SO MUCH 😭😭😭
104,"Jul 18, 2022",very nice
104,"Jul 14, 2022",This is just too good🍿
104,"Jul 13, 2022",my king is too powerful 
104,"Jul 13, 2022",losing my shi
104,"Jul 10, 2022","everyone's is so loyal dokja has some great ""followers"""
104,"Jul 9, 2022",Don't forget to like the episodes! It's one of the ways to support the creator!
104,"Jul 8, 2022",dokja's the king after all ¯\(ツ)/¯ 
104,"Jul 6, 2022",gilyeong is learning art of being a troll and pissing off dokkaebi's from his dad
104,"Jul 4, 2022",They have been playing checkers while he has been playing chess
104,"Jun 24, 2022",♡ ♡ ♡ ♡ ♡
104,"Jun 23, 2022",There was a random guy in the crowd with the same face as dokja
104,"Jun 22, 2022",I have a feeling than Junghyeok has far more regressions and the number he shows is to keep his two information hidden. that's why he was familiar with the catastrophe girl and maybe.. just maybe.. he always knew Dokja and knew he was an ally as strong as him but by trial and error knew that only get stronger by letting him travel in his own like he does with the shield guy?
104,"Jun 16, 2022",I'M ON 23 WHOOOO
104,"Jun 15, 2022",Yeseung is so beautiful
104,"Jun 15, 2022",in curious to see how the young and oast catastrophe will convive together 🤣
104,"Jun 15, 2022",I think at the end of the series the protagonist dies.
104,"Jun 15, 2022",FRICK YEAHHH
104,"Jun 15, 2022",damn goats
104,"Jun 15, 2022",dokja playing 5d chess
104,"Jun 15, 2022","BTW Dokja be like ""on your left!"" to the mid lvl Dokkaebi 😂"
104,"Jun 15, 2022",the art is so delicious 
104,"Jun 15, 2022",yes sirrrrrrr
104,"Jun 15, 2022",Ah man here we go :^) gonna absolutely despise a certain dokkaebi from this point on. 
104,"Jun 15, 2022",Everyone just needs a friend to have by their side
104,"Jun 15, 2022",hooh
104,"Jun 15, 2022","[Oravis anum, the ship god, is currently LIVID at the mid tier dok being a little prick]"
104,"Jun 15, 2022",have you been thinking that far ahead?me: I have no god damn idea
104,"Jun 15, 2022",I'm glad they're saving her.
104,"Jun 15, 2022",tell us more 😡😡🤜🤜
104,"Jun 15, 2022",ah as cunning as always
104,"Jun 15, 2022",Big brain alert
104,"Jun 15, 2022","Oh, this little jerkbag."
104,"Jun 15, 2022",wbat did you get your self into reader kim...
104,"Jun 15, 2022",it's just been a second and its already finished 😭
104,"Jun 15, 2022","I read it, IN ONE FREAKING MINUTE, OR LESS, AAAAAAAAAHHHHHHHHHH I NEED TO WAIT FOR ANOTHER WEEEEEEEEEEEK"
104,"Jun 15, 2022",WHY CLIFFHANGER WHYYYY
104,"Jun 15, 2022",*peace*
104,"Jun 9, 2022",Wow! I think the story just slightly deviated from the novel! interesting... 
104,"Jun 9, 2022",dang it... i just want more 😭😭
104,"Jun 9, 2022","couldnt resist using a fast pass, this story is so good 😭😭 thank goodness for launch week free coins!! "
104,"Jun 9, 2022",6 coins left… *maniacal laughter*
104,"Jun 8, 2022","Applause for the king of beauty, neural king and maitreya king! And I love all Dokja gang so much! "
104,"Jun 8, 2022",i love how they trust dokja so much :DD
104,"Jun 8, 2022","Seriously Mid-Dokkaebi, take the L. You cant force things to go the way you want it to"
104,"Jun 8, 2022",I need more episodes😩but I have no coins😣😭😭
104,"Jun 8, 2022","I only had 6 coins and decided to use it on this ( ╹▽╹ ) No regrets, awesome chapter as always. I hope the catastrophe woman joins the team and becomes friends with her younger self and Dokja and everyone else ✨"
104,"Jun 8, 2022",Just spent my last five coins and still aaarrrggghhh.
104,"Jun 8, 2022",my coins👼
104,"Jun 8, 2022",Little did the dokkaebi know... he knows almost everything
104,"Jun 8, 2022",I mean it says DEFEAT HER not kill her. So just have a game of chess and win than she is technically defeated. 
104,"Jun 8, 2022",I took a screenshot of Gilyeong sticking his tongue out because he looked so cute but now I’m afraid I’ll go to court😭 Author I promise I won’t post it I just thought gilyeong looked cute
104,"Jun 7, 2022",NO IM OUT OF COINSSSS 
104,"Jun 6, 2022",I just wanna say that the neutral king is my favorite character 
104,"Jun 4, 2022","Yeap, and with this I've used up all my coins. But it was worth it☺️"
104,"Jun 2, 2022",There is still no time limit!
104,"May 31, 2022",Dokkaebi- “Have you bern thinking that far ahead?”Dokja-“its all part of the plan! (Unlocked Aizen mode)”
104,"May 30, 2022",L🍩L
104,"May 30, 2022",I think the mid-level dokkaebi is named 'Paul' in the novel. He's a big jerk.
104,"May 29, 2022",aw man the episode is already over? i guess you know what that means…
104,"May 19, 2022",So that's why he's such a dixk
104,"May 17, 2022",everything is within my calculation
104,"May 15, 2022",I NEED MORE COINS!
104,"May 15, 2022",Lee Gilyoung be like: 😛
104,"May 15, 2022","[The constellation ""The Red King"" is impressed with the Death Note level chess game that incarnation Dokja is playing. 6000 coins have been sponsored.]"
104,"May 14, 2022",just a w
104,"May 14, 2022",Its so interesting that a dokkaebi with glasses is talking shit. Yep real interesting.
104,"May 13, 2022",Anyone else here want the Devs to create a Webcomic of Three Ways to Survive the Apocalypse? As in the ACTUAL story that Dokja read?
104,"May 13, 2022",Man this one gets devoured so quick 😍
104,"May 12, 2022",MORE GIVE ME MORE EHHABITURH
104,"May 12, 2022",I live for the chaos Dokja manipulates 🤣
104,"May 12, 2022",I hate how fast my money leaves me 😞
104,"May 12, 2022","for ahead of what, omg why is this series always so exciting... I can't wait for the next ep"
104,"May 12, 2022",DOKJAA ILSM 🥲🥲
104,"May 12, 2022",This was such a good read 😭 I’m planning to read novel but I have to pay 🥹
104,"May 11, 2022",My man playing 4D chess
104,"May 11, 2022",this comic consumes my coins at a terrifyingly fast rate.... but it's so worthwhile!
104,"May 11, 2022",I can't wait for time dokja just blows up yhe whole game and reveals to everyone that's he's literally omniscient and knew it all along 
104,"May 11, 2022",Loyal followers and companions 💕
104,"May 11, 2022",i am now out of coins but it was worth it :)
104,"May 11, 2022",Dokja got a set  of 🔩on him that no other has……
104,"May 11, 2022",Cant wait to see what Dokja is scheming 
104,"May 11, 2022",Someone is gonna come in 
104,"May 11, 2022",kdj: this is an on-fire garbage can... could be the star stream once i'm done with em hoes
104,"May 11, 2022",yea I can't wait to see Dokja own this fool
104,"May 11, 2022",LETS GOOOO
104,"May 11, 2022",YAAAYY
104,"May 11, 2022",Let’s gooo!!!
104,"Jun 16, 2022",I LOVE IT:)
104,"Jun 15, 2022",WAIT SHIT WHAT DAY IS IT TODAY *aggressively searches*
104,"May 12, 2022",Just hoping that this dokaebi won't be a huge bitch about Dokja getting away with not killing Catastrophe!Yuseung. That poor woman deserves a break
104,"Jun 15, 2022","they removed ""Don't forget that we will die together"" this is homophobic /j (to be fair the line basically means the same thing, it's just that ""we will die together"" sounds weirdly romantic compared to ""i'm taking you with me"")"
104,"Jun 16, 2022",Dokja seems to be doing pretty well and he must believe the majority of the constellations support him.     There is a mild spoiler after this so please stop reading if you don’t want that.    Unfortunately the majority of the constellations don’t send indirect messages. He does not have the whole picture here and he will realize that in the next chapter.
104,"Jun 15, 2022","I WAS GOING TO RECOMMEND BLUE PERIOD AGAIN BECAUSE I'VE BEEN HYPERFIXATING ON IT AGAIN. THE REREAD VALUE IS SO HIGH. ANYHOW, WE MADE IT! HAPPY NATIONAL FUDGE DAY!"
