Episode,Date,Review
102,"Jun 1, 2022",he truly cares for his party 🥺 and his party members care for him too!! i love that they are not his subordinates but COMPANIONS. this story is soo good 😭💕
102,"Jun 1, 2022",what they mean by the fourth wall shaking is that he is getting too immersed in her character right? I mean it only started to shake once he say that he was her.
102,"Jun 1, 2022",I am shook. Shock is me. Thanks for the amazing episode authors and translator-nim 💫💫💓🌹
102,"Jun 1, 2022",Holy shit this was so epic. Reading with goosebumps all over
102,"Jun 1, 2022",so when they touched tiny yeseung is giving catastrophe yeseung all her memories
102,"Jun 1, 2022",dude. it's actually pretty bad ass doing the power line up with Dokja's team. I mean technically even Junyeok is technically his team
102,"Jun 1, 2022",I'm crying. AND THE ILLUSTRATIONS??? Damn.
102,"Jun 1, 2022",Favorite episode so far
102,"Jun 1, 2022",I must admit this chapter make me tear up *sob* *sob*
102,"Jun 1, 2022",bro the next episode is going to be interesting I wish I had fast pass 
102,"Jun 1, 2022",What is it that I have to do to get the top comment🥺
102,"Jun 1, 2022","I feel so bad for other yesueng. just imagine getting used, thinking you had friends only to be left behind for hundreds of years. 😭"
102,"Jun 1, 2022","whenever the fourth wall's shaking, a shiver goes down my spine. it's absolutely uncanny."
102,"Jun 1, 2022",who is Dokja? he's the best dad and husband you've ever seen XD
102,"Jun 1, 2022","long story short, don't even think about hurting gilyeong or yuseung."
102,"Jun 1, 2022","now that is what i call... a paradox. and now i'm just waiting for dokja to go ""not quite..."" heheh."
102,"Jun 1, 2022",what they mean by the fourth wall shaking is that he is getting too immersed in her character right? I mean it only started to shake once he say that he was her.
102,"Jun 1, 2022",I am shook. Shock is me. Thanks for the amazing episode authors and translator-nim 💫💫💓🌹
102,"Jun 1, 2022",Holy shit this was so epic. Reading with goosebumps all over
102,"Jun 1, 2022",so when they touched tiny yeseung is giving catastrophe yeseung all her memories
102,"Jun 1, 2022",dude. it's actually pretty bad ass doing the power line up with Dokja's team. I mean technically even Junyeok is technically his team
102,"Jun 1, 2022",I'm crying. AND THE ILLUSTRATIONS??? Damn.
102,"Jun 1, 2022",Favorite episode so far
102,"Jun 1, 2022",I must admit this chapter make me tear up *sob* *sob*
102,"Jun 1, 2022",bro the next episode is going to be interesting I wish I had fast pass 
102,"Jun 1, 2022",What is it that I have to do to get the top comment🥺
102,"Jun 1, 2022","I feel so bad for other yesueng. just imagine getting used, thinking you had friends only to be left behind for hundreds of years. 😭"
102,"Jun 1, 2022","whenever the fourth wall's shaking, a shiver goes down my spine. it's absolutely uncanny."
102,"Jun 1, 2022",who is Dokja? he's the best dad and husband you've ever seen XD
102,"Jun 1, 2022","long story short, don't even think about hurting gilyeong or yuseung."
102,"Jun 1, 2022","now that is what i call... a paradox. and now i'm just waiting for dokja to go ""not quite..."" heheh."
102,"May 17, 2022",I find it badass to see Dokja looming over the her.
102,"May 14, 2022","didn't even have the time to wave goodbye to my coins this time 😭 the build in these last couple episodes is just so perfect, thank you author!"
102,"May 13, 2022",That's mind  blowing woww
102,"May 12, 2022",awee gilyeong is like a pokemon trainer LOL
102,"May 12, 2022",im going to read this like Dokja read TWSA
102,"May 12, 2022",They connected the film 🎞
102,"May 11, 2022",so he's made a difference. he was different because he cared for her when she was asking for death whereas junghyeok selfishly sent her to die. dokja is changing it by caring (and their other reasons too haha)
102,"May 11, 2022",this episode got me tearing up 😭
102,"May 11, 2022",this is my favorite webtoon hands down I consider dis like ah top tier manga it sucked me in the first episode and I've been here ever since 
102,"May 10, 2022",This series is always good but these past couple of chapters are just knocking out of the park! Its absolutely epic
102,"May 5, 2022","Yuseung: ""Dokja this, Dokja that. Just who is he?"""
102,"May 5, 2022",Cliffhanger argh😩[5 coin have been gifted]
102,"May 3, 2022","This chapter, Dokja definitely in Constellation mode.🤣🤣 One step closer to having his own fable. Can't wait for the next chapter."
102,"Apr 29, 2022",RIP Titano...
102,"Apr 28, 2022",good god what a cliffhanger. 
102,"Apr 28, 2022",This is quite honestly very exciting I can't wait to see what Dokja will do next
102,"Apr 28, 2022",take my freakin money!!!
102,"Apr 28, 2022",They shared memories on contact.  This is about to get really ugly.
102,"Apr 27, 2022",man I just wanna say how much I support and love this series!
102,"Apr 27, 2022",This chapter was so good😭❤
102,"Apr 27, 2022",OH MY GOD! ITS AMAZING AND I CANT WAIT FOR THE NEXT ONE! 😖
102,"Apr 27, 2022","Amazing! 💀 Left me wishing I could read just one more chapter, what a cliffhanger. 😭🤝"
102,"Apr 27, 2022",[The contellation of the Rcb's is wondering what the memories really are.][5 points have been sponsored]
102,"Apr 27, 2022",This kind of cliffhanger should be illegal
102,"Apr 27, 2022",chills bro chills
102,"Apr 27, 2022","It’s not much, but it’s just enough to change the outcome "
102,"Apr 27, 2022","I have the feeling that both versions of Yuseong will fuse or something now that they touched each other; if that happens is gonna be wild. Aside from that, HOLY SHIT, THIS IS SUCH A GOOD CHAPTER, and now I feel empty knowing that I can't read any further lmao. "
102,"Apr 27, 2022","I am Dokja Kim.I am Dokja Kim.
I am Dojka Kim!"
102,"Apr 27, 2022",Dokja's Avengers have assembled 
102,"Apr 27, 2022",this chapter literally gave me shivers it's so good!
102,"Apr 27, 2022",Dang what a cliffhanger what a great episode I love how it’s all led to this and the impact we get to see from Dokjas actions throughout finally manifesting
102,"Apr 27, 2022",seeing this all drawn out is going to make me cry...i was not ready to see it😭
102,"Apr 27, 2022",the timestream is probably correcting itself 
102,"Apr 27, 2022",Solid chapter. But I'm also 90% sure I don't know 50% of what's actually happening.
102,"Apr 27, 2022","This was the best chapter so far, I’m speechless"
102,"Apr 27, 2022",poggers
102,"Apr 27, 2022",that scene where both sys from the past and from the present standing in front of each other while debris of ice shattered around is fantastic 
102,"Apr 27, 2022",TITANO NOOOOO 😭 THE POOR INSECT—JUST LIKE KIM DOKJA—GOT THE DONUTJA 😭
102,"Apr 27, 2022",King Masswood and Queen Mirabad biting each other? How kink— jk
102,"Jun 5, 2022","i mean,, we all just need to heal from the traumas of our inner child"
102,"Jun 5, 2022",This has Thanos “I don’t even know you” vibes
102,"Jun 1, 2022",[Constellation Stormy Ram King is eating his popcorn at the speed of 10 cheetahs]
102,"Jun 1, 2022","Happy Pride Month, friends!!! ORV has been updated at the start of this month. clearly, this is a win for the lgbtq part of the ORV fanbase (approx 90% lol)"
102,"Apr 28, 2022","[Constellation ""Holy Sword of the Emblem of Fire"" wants to give Catastrophe Yuseung the hug she desperately needs]"
102,"Apr 27, 2022","So...I'm gonna make a wild guess here...is Gilyeong's Constellation...""Lord of The Flies""?"
102,5 hours ago,NOOOOOOOOOOOOOOOO- NOT TITANO TOO
102,13 hours ago,missing dokja headpats moments 🥺
102,1 days ago,the roles in the story are shifting… and all I can say is that everything about this is so. insanely. badass. i can’t wait to catch up with this comic and begin the novel
102,1 days ago,oops
102,6 days ago,Noooooooo rip titano
102,"Oct 11, 2022",Good chapter!
102,"Oct 8, 2022",lol
102,"Oct 8, 2022",NOT DOKJA AND TITANO BECOMING A JJBA REF💀💀💀
102,"Sep 28, 2022",who's bawling their eyes out? huh? only me?? NO WAY???
102,"Sep 25, 2022","HOY NAIIYAK AKO HABANG BINABASA TO😭😭😭 ANG DAMI TALAGANG NAKAALALA SA KANYA, SOBRANG NAKAKA OVERWHELMED 😭💗💗💗"
102,"Sep 25, 2022",This scene reminds me of the one from doctor who when the dalek keep saying Dr Who?!? DR WHO?!?!?
102,"Sep 24, 2022",I was so worried about Gilyeong 😂😂 I was like noo anyone but him! Not my creepy bby!
102,"Sep 24, 2022",This reminds me of In the Multiverse of Madness with Wanda 😲
102,"Sep 20, 2022",She got abs♥️💙
102,"Sep 15, 2022","my my. it's 5 months after the release of this episode, yet when i pressed the heart icon, it jumped from 92769 to 92772. in the time i was reading, 2 fellows constellations have smashed that like button! "
102,"Sep 10, 2022",It's just so heartwarming to see how Dokja has influenced the story so much that me managed to make an army who care for him and have grown so much to the point that they are brave enough to take the strongest catastrophe head on.
102,"Sep 10, 2022",I feel like I feel like I wanna commit
102,"Sep 9, 2022",too good
102,"Sep 8, 2022","I gotta say i kinda miss the hyung-nim, the oppa and the other honorific, especially when the kids talk about dokja, i think with those the respect this characters have for dokja is better shown "
102,"Sep 5, 2022",☆☆☆
102,"Sep 4, 2022",yoo... HOW THE HELL AM I SUPPOSED TO SLEEP NOW 
102,"Aug 30, 2022",Bruh tht scene when he connects to future Yuseung and his eye is glowing is just 😌👌🏾 ...I feel bad for her tho having to suffer through all tht and being tossed away...I'd probably hold a grudge too
102,"Aug 25, 2022","the paradox... because the yooseung of this world has a very close bond with dokja, is that why dokja's voice is affecting the disaster like this? "
102,"Aug 25, 2022","Here wee gooooo, emotional train incoming 🚂🚂🚂🚂🚂🚂"
102,"Aug 24, 2022","I notice the condition is defeat, defeat is an interesting term."
102,"Aug 24, 2022","ma'am, it's a no no to touch Gilyeong. okay????? the audacity of this female animal."
102,"Aug 21, 2022","""Stop, Yuseung."" "
102,"Aug 21, 2022",omagashhhhhhhhhhh
102,"Aug 20, 2022","Woah congratulation to me for being able read to this chapter and Happy Birthday to Jess, Dokja is such a gift for me, thank you.. 🤗😘😍"
102,"Aug 17, 2022",Gosh.. this episode actually got me emotional..
102,"Aug 15, 2022",H
102,"Aug 9, 2022",everyone just loves Dokja
102,"Aug 6, 2022",101
102,"Aug 3, 2022",Just wondering if anyone could help me. I joined back on to WEBTOON and for some reason everything I read had reset like I had never read them. Can someone tell me why that happened?
102,"Aug 2, 2022",This readers mother is shaking her phone violently. I think I should sleep now
102,"Jul 30, 2022",TITAANOO😭😭😭😭😭😭😭. We will remember you. Rip..
102,"Jul 30, 2022",this episode makes me cry
102,"Jul 30, 2022",Dokja is... Sans!
102,"Jul 28, 2022","This is the best thing I have ever read, I don’t even want to classify it since it’s the best thing I’ve ever seen.😭😭😭😭😭😭😭😭😭😭😭😭😭 A ton of appreciation for the author, you’ve got immense talent. And I can spot it, trust me I find every little thing amazing. Especially the feels this story gives off, it’s exciting and makes my stomach hurl, and my heart pace.         Take the word of a future psychologist."
102,"Jul 26, 2022","I love how Yuseung is like ""JUNGHYEOK YOU BASTARD"" and everyone's like who tf is that, literally never heard of him, we stan Dokja"
102,"Jul 26, 2022",Not the squad coming together to fight for their leader/ friend and the kids for their dad😭😭
102,"Jul 26, 2022",Dokja is such a fcking genius i cant
102,"Jul 25, 2022",I havent even played the games and i swear thats a sans ref
102,"Jul 25, 2022",not titano I loved him
102,"Jul 24, 2022",Did the Catastrophe of Floods just become a Mirror Match or Pokemon Trainer  against your other self Battle?
102,"Jul 23, 2022",the way they drew yoosung when she realized dokja was communicating in 41st yoosung and 41st yoosung remembering the headpat and missing him WHY WOULD THEY DO THAT TO ME..
102,"Jul 23, 2022",JESUS CHRIST😭😭😭😭
102,"Jul 15, 2022",Titano's dead? And how did Gilyoung defeat the parasite queen? So many questions 
102,"Jul 10, 2022",its so deep
102,"Jun 30, 2022",so epic so sad
102,"Jun 29, 2022",There was so much resemblance to AOT in this chapter. When dokja watched over yuseongs shoulder and manipulated her and when younger yuseoung showed her older self her memories by touching her. AGHH I love it sm
102,"Jun 26, 2022",poor yuseung 😭😭 i feel so bad for her
102,"Jun 23, 2022",[The Constellation 'Unproductive Reader' is applauding the art of the Webtoon for this chapter]
102,"Jun 20, 2022",omg it's happening!!!
102,"Jun 17, 2022",We out here cryin
102,"Jun 16, 2022","""The Fourth Wall is shaking violently."" Gave me chills!"
102,"Jun 14, 2022",seeing everyone react to Dokja's deathman imagine if he dies for real
102,"Jun 12, 2022",Just when i thot the art couldn't get any better-
102,"Jun 12, 2022",me juego mi riñón a qué ahora el prota controla a la catástrofe 
102,"Jun 11, 2022",My appreciation for Kim Dadja continues to climb. 
102,"Jun 10, 2022",I thought he was going to posses small Yuseung. Never crossed my mind that he would control the catastrophe. His skills are really elite. And the sharing of their memories was genius! I feel bad for older Yuseung. She’s just hurt that Junghyeok never considered her a companion after all the sacrifices she made for him
102,"Jun 9, 2022",i literally had goosbumps reading this episode 😭
102,"Jun 9, 2022",Omg I had an inkling that he was going to end up possessing the catastrophe but it’s still so much better than I ever could have imagined
102,"Jun 9, 2022",This is so crazy man😭
102,"Jun 9, 2022",I’m not exactly sure.. but I think I see two characters from ‘the world after the fAll’ in the backround from the authors other comic… is it jsut me?
102,"Jun 8, 2022",this chapter was flat out the best one so far❤️
102,"Jun 8, 2022","Oh, the people who theorized about Dokja possessing the adult Yuseong were right. That's very interesting. But it would have been so unexpected if he possessed Suyeon xD like ""WHY THE HELL IS SHE THINKING ABOUT ME?! WHERE IS SHE?! WHAT DO I DO NOW?!"""
102,"Jun 3, 2022",My god.. that was a rush
102,"Jun 3, 2022",Awwwww Gilyeong is so strong now I love him so muchhhhhh
102,"Jun 2, 2022",Boutta buy 2 more chapters because this getting to good
102,"Jun 2, 2022",Oh that was a really good chapter
102,"Jun 2, 2022",this is such an AMAAAAAZING CHAPTER!!!!! 😍😍😍😍😍
102,"Jun 2, 2022","This give me shivers!! Oh my goood, I want more(╥_╥)"
102,"Jun 2, 2022",Ayeeee I saw that JOJO panel while she was walking up to Gilyeoung 😎😎😎
102,"Jun 2, 2022","This is one of my favorite webtoons. The story is so good and every time I feel like, can it get more hype than this? and then it does,  every time"
102,"Jun 2, 2022",Protagonist can't be stopped DON'T YOU KNOW THE RULES!!!!!!!!😎😎😎😎😎
102,"Jun 2, 2022",Gilyeong out here being a bug type Pokemon trainer
102,"Jun 2, 2022",Dokja was scary in some panels. I loved it 😍
102,"Jun 2, 2022","Oh, damn... 😱"
102,"Jun 2, 2022",Woah…
102,"Jun 2, 2022","Brilliant as always !
"
102,"Jun 1, 2022",.
102,"Jun 1, 2022",titano. ☹️
102,"Jun 1, 2022",WTF!? who is dokja kim!? 
102,"Jun 1, 2022",This ep was sooooo good
102,"Jun 1, 2022",ADFHGEGSVSHZVEK
102,"Jun 1, 2022",I... AM... SCREAMING!!!!
102,"Jun 1, 2022","ok hear me out, older yuseung is kinda-"
102,"Jun 1, 2022","Dokja Kim be like -Cause I'm Slim Shady, yes, I'm the real ShadyAll you other Slim Shadys, are just imitating🤣🤣🤣"
102,"Jun 1, 2022",i got goosebumps 
102,"Jun 1, 2022","[the ship god, Oravis Anum, is currently cackling at the fact that dokjas very existence is fucking with the catastrophe. fifteen coins 🪙 have been sponsored]"
102,"Jun 1, 2022",I don’t know what’s going on but I feel very conflicted just by looking at it
102,"Jun 1, 2022","they are getting connected, so in the first place they should have in contact?"
102,"Jun 1, 2022",Gilyeong 🤗
102,"Jun 1, 2022",What an episode 👏👏
102,"Jun 1, 2022",Dokja became amogus
102,"Jun 1, 2022",Noooo- mantis frend
102,"Jun 1, 2022",this episode was so exciting bro i love this webtoon so much ❤️ 
102,"Jun 1, 2022",Oh how I enjoy this story so
102,"Jun 1, 2022",THAT IS SO TWISTY
102,"Jun 1, 2022",The pain😭😭😭
102,"Jun 1, 2022",It's hard to answer your question while being choked ya know
102,"Jun 1, 2022",this series is lit af
102,"Jun 1, 2022",i think i may have a new fav ep...
102,"Jun 1, 2022",titano.. may u rest in peace 🥀☹
102,"Jun 1, 2022",oh my goddddd this ep is so freaking good 
102,"Jun 1, 2022",TITANO 😭 🪦 R.I.P YOU GLORIOUS BEAUTY 😭
102,"Jun 1, 2022",may all the bugs that was in here be miss😞
102,"Jun 1, 2022",Damn  this chapter completely blew me away! 
102,"Jun 1, 2022",DONUTJA KIM IS BACK PEOPLE
102,"Jun 1, 2022",Hol' up how was she able to tell that Dokja was possessing her future self jgvjhchc
102,"Jun 1, 2022",Ah The Kids Are Here
102,"Jun 1, 2022","Ayo, at the beginning, I thought Dokja went Sans mode. "
102,"Jun 1, 2022",a new tape is spliced 
102,"Jun 1, 2022",noooooooooooooooooooooooooooooooooo
102,"Jun 1, 2022",ok yuseung's character arc is legit making me cry
102,"Jun 1, 2022",pouring one out for Titano
102,"Jun 1, 2022",ı cant even breathe why... why did it have to end here
102,"Jun 1, 2022",Parry this ya filthy casual
102,"Jun 1, 2022",🤩
102,"Jun 1, 2022",A LONG CHAPTER AAAAAAAA
102,"Jun 1, 2022",When it ended I also screamed “AHHH!!”
102,"Jun 1, 2022","This was a fantastic chapter. excellent job. There's a sense for me that the true strength of the reader is from understanding and empathizing with the characters, they become real to you. This is so much more interesting than Dokja just knowing some weakness of hers from the story and expoliting it."
102,"Jun 1, 2022",awesome 
102,"Jun 1, 2022",Dokja’s gonna not be wearing any clothes next chapter is he…
102,"Jun 1, 2022","it can't just end there, I need to see more but I lack the money"
102,"Jun 1, 2022",Ah so are their memories colliding?
102,"Jun 1, 2022",my guess was correct i figured he'd posses her in as right heck yeah!
102,"Jun 1, 2022",Waited for a week only to read it for 3 minutes. DAMN WHY DO I READ SO FAST
102,"Jun 1, 2022",next ep better be not yet THAT scene
102,"Jun 1, 2022",the illustrations of this event is so much better than what I have in mind when reading the novel 
102,"Jun 1, 2022","I love orv so much, this adaptation was so amazing "
102,"May 29, 2022",Damn all of singNsong’s manwhas are so good!!!
102,"May 29, 2022",damn read through it already
102,"May 29, 2022",i just did a free coin event to read this early
102,"May 28, 2022",AHHHHHH this WEBTOON is so good!!!!!
102,"May 28, 2022",Thank you for the free coins webtoon 🙇
102,"May 28, 2022","[5 coins sponsored]edit: Guys, like/heart the chapter to motivate them! ❤️👍"
102,"May 28, 2022","5 coins worth the wait, but in need of 5 more🥲Past, present and future intertwine damn!!"
102,"May 28, 2022",FASTPASSED AND DEAD 
102,"May 26, 2022",i want to read more ughhh *cries in broke
102,"May 25, 2022",Titano wanted to be like kakyoin from jjba 
102,"May 20, 2022","when I tell you I got chills this chapter, I got CHILLS"
102,"May 15, 2022",The feeling this webtoon and the characters give 🧎
102,"May 14, 2022",uwah this is so intense T^T i can't help but use more of my coins
102,"May 13, 2022","dokja's just like ""im so glad you asked. allow me..."""
102,"May 13, 2022",Ngl -why do I feel like I miss him- made my eyes waterrr 
102,"May 12, 2022",Kim Dadja looked so good in this chapter 😭❤
102,"May 11, 2022","""Have I been infected by a parasite?"" so that's who he was able to possess!! No, not a parasite, not exactly"
102,"May 11, 2022","""Just... Who is that?"" the best, that's who"
102,"May 11, 2022","""Olympus?"" right, these two you haven't met, you're gonna be really surprised with how things have been going in this regression"
102,"May 5, 2022",Looks like *somebody* is becoming the main character 😎
102,"May 4, 2022",The disconnected film theory is happening
102,"May 4, 2022",:(
102,"May 4, 2022","[the constellation of curious lazy ass hates cliffhangers, cries in pain][5 coins have been gifted] "
102,"May 2, 2022",I have read this episode like 5 times already!!🤣
102,"May 1, 2022",Oh my dayyyss…. I’m shookk
102,"May 1, 2022",Kim Dokja is the father/brother that I wanted bruh
102,"May 1, 2022",the constellation lonely Heartbreaker is pleased by the pain in this story you have been gifted 5 coins
102,"Apr 30, 2022",this is good enough for me to buy coins I am literally tearing my hair out in suspense this is amazing it better become an anime
102,"Apr 29, 2022",Noooooooo. NOOOOOO. Don’t end it there!
102,"Apr 29, 2022","Just wait till she realizes even her younger self is talking about Dokja when she says ""Mister."" She's gonna lose it XD"
102,"Apr 29, 2022",So did they just share each others memories..? seems like it to me...🤨
102,"Apr 29, 2022",Hmm. The scenario description says “defeat the catastrophe” but that doesn’t necessarily mean kill. I wonder if they’ll merge.
102,"Apr 28, 2022",Tbh when i first read this i didnt expect him to possess her and i was so hyped bro! Im so glad im a stupid ass and these things surprise me to the point of hype 😂‼️🔥🔥🔥🔥
102,"Apr 28, 2022",suchhhh a good episode!
102,"Apr 28, 2022",Why is this series so good 😭
102,"Apr 28, 2022",this chapter honestly got me excited. I knew that Dokja was going to possess the catastrophe and honestly I'm very excited for the next chapter 😌
102,"Apr 28, 2022",I love this series
102,"Apr 28, 2022","[The constellation ""The Red King"" is surprisingly sympathetic Towards Catastrophy Yuseung's past, and her confusion over her future and what she should do. 1000 coins have been sponsored.]"
102,"Apr 28, 2022",I was stressed and depressed as hell but this chapter helped me feel a lot of feels again aaaajh
102,"Apr 28, 2022",she must love making donuts🤣
102,"Apr 28, 2022",Dokja is so amazing!
102,"Apr 28, 2022",Dokja's so pretty. 
102,"Apr 27, 2022","I swear, with every chapter I'm getting more and more impressed by how good this webcomic is!"
102,"Apr 27, 2022",AOT moment.
102,"Apr 27, 2022",Some high levels of cognitive dissonance happening here phwew 
102,"Apr 27, 2022",I have goosebumps
102,"Apr 27, 2022",The omniscient reader power really is amazing
102,"Apr 27, 2022",so many donuts first rengoku then dokja now titano 🥲
102,"Apr 27, 2022",holy fuock. why did it have to end when the story was getting so good. I guess time for bed now after fast passing all of this :')
102,"Apr 27, 2022",now that Dokja is in yuseung body he's has perks
102,"Apr 27, 2022",man I wanted moreee. but that cool how he saved his friends.
102,"Apr 27, 2022",This is very interesting wonder if she going to join them
102,"Apr 27, 2022",this chapter is KICKIN
102,"Apr 27, 2022","WOW I am living for this. Amazing, the movie reel, the memories, everything is just … just wow. 🤩 🥹"
102,"Apr 27, 2022","take my 5 coins, and leave me and my tears alone!"
102,"Apr 27, 2022","Yuseung getting her younger self’s memories 😭 I want her to see the difference, plus I want her to know that her current self has it better being involved with Dokja. Poor girl 😭😭"
102,"Apr 27, 2022",Water Works
102,"Apr 27, 2022",THE CLIFFHANGER IS MELTING ME NOOOOOOOOOO
102,"Apr 27, 2022",I've never spent so much money on Webtoon befote. This story is too addicting!!!
102,"Apr 27, 2022","Man, this series is so good! RIP Titano 😭"
102,"Apr 27, 2022","NNNNNOOOOOOOOOOOOO, I NEED MORE :("
102,"Apr 27, 2022",great chapter. but sadly it ended too soon. wish there were more chapters available. 
102,"Apr 27, 2022",I NEED MORE
102,"Apr 27, 2022","Yuseung: ""Who are you?""Dokja: ""I am your father"""
102,"Apr 27, 2022","I have felt chills from an antagonist wanting to know who the hell the protagonist is since Psyren. And like that story, looks like she about to get a history lesson."
102,"Apr 27, 2022","nahh if i were shin yoosung i would be thrilled too, like, imagine the damn kim dokja is in your head. i'd be scared shitless. nightmare."
102,"Apr 27, 2022",these kids got a lot of heart!
102,"Apr 27, 2022",don't you just love it when they all fighting together it's really nice to see
102,"Apr 27, 2022",THE ART OF THIS CHAPTER IS FIRE 🔥🔥🔥🔥🔥🔥🔥
102,"Apr 27, 2022",this damn dokja possessed the DISASTER he's nuts
102,"Jun 1, 2022",HAPPY PRIDE TO JOONGDOK AND THEIR GAY ASS SHITZ
102,"Jun 5, 2022","YOU NEED TO SEE THIS CHEESY AS PIE, AND EVERYONE TOO OMG vm.tiktok.com/ZSdppW6Kx/"
102,"Jun 2, 2022","Haha yay, Happy 1k lolol"
102,"Jun 1, 2022",I called it previous episode he possessed the catastrophe!
102,"Jun 7, 2022","I binged the whole series today
And Wow, I have so much respect for the author "
102,"Jun 5, 2022",i’m in love with this webcomic 
102,"Jun 3, 2022",Illegitimate daughter of Gordon Ramsay
102,"Jun 6, 2022",I HAVE FOUND A VERY GOOD TIKTOK vm.tiktok.com/ZSdsdx5Cn/
102,"Jun 1, 2022",anyone. waiting for chapter 110 I'm at chapter 109 rn SPOILERS dokja is going to find a way to revive the catastrophe by meeting the ruler of the. under world also he beat little white fuzball up becaus3. he. manually messed with the catastrophe so dokja had to kill it
