Episode,Date,Review
61,"Sep 13, 2021","bruh dokja really just went ""yugiohhhhh"" and transformed into some guy with a deep voice"
61,"Aug 30, 2021",Wow... So we're learning Korean history now? Cool! 
61,"Aug 28, 2021",that's some intense live action roleplaying
61,"Aug 28, 2021","I miss the way they said Stage Transformation instead of Dramatization in the novel, but the way the stars lit up the sky and dokja’s glowy eyes was worth ittt"
61,"Aug 23, 2021",[ The constellation King Of The Endless Storm kneels down for the fallen warriors and is praying for their safe passage to paradise ] [ 700 coins has been sponsored ]
61,"Aug 22, 2021",loved the art 
61,"Aug 21, 2021","QC, isn't ""Unbreakable Trust"" supposed to be ""Unbreakable Faith""?"
61,"Aug 21, 2021",I love this emotionless Dokja 
61,"Aug 19, 2021","Genryūsai Shigekuni Yamamoto: Bankai!! ....Zanka no Tachi!
(^^)"
61,"Aug 19, 2021",okay the pirate lookin dude was kinda hot tho
61,"Aug 19, 2021",i'm excited for this webtoon to be a series *u*
61,"Aug 19, 2021",is it just me or this war dramatisation was shorter than how how it was in the novel??
61,"Aug 19, 2021",😮😮😮😮😮😮😮 De los mejores capítulos hasta ahora! This episode was super awesome! It was the most emotive episode (at least for me) I loved it! I totally got inmerse on the story. 
61,"Aug 19, 2021",Just want to say thank you for the footnotes ❤   very much appreciated!! 
61,"Aug 19, 2021",best manwha
61,"Aug 19, 2021","Okay the whole episode just gave me insane chills especially because of how it was executed. This is by far the best of the series, keep up the good work author!! ^_^"
61,"Aug 19, 2021",I had no idea what they where talking about. But i still loved it.
61,"Aug 19, 2021",The art is always impressive but DANG did the backgrounds look beautiful this episode! The possessing of incarnations is also really interesting. I wonder if we’ll see more of that in the future.
61,"Aug 19, 2021",wow one of the best episodes by far. i love seeing new things like directly asking constellations for help
61,"Aug 18, 2021",Dokja planning ten steps ahead like a real ruler. 
61,"Aug 18, 2021","I know i could learn History the old fashion way, but learning it, as brief as it is , this way is pretty awesome. "
61,"Aug 18, 2021","Geybaek I pity him, he couldn’t fight the hwarang leader head-on, and died on the hands of one of his zombies rather than hwarang killing him directly "
61,"Aug 18, 2021",I think Dokja is pretty much the most OP character I’ve ever seen tbh
61,"Aug 18, 2021",It's cool that Sangah got a big moment here while Dokja had something go slightly against what he had expected. 
61,"Aug 18, 2021","""I am Optimus Prime, and I send this message to any surviving Autobots taking refuge among the stars."" - Optimus Prime, 'Transformers', 2007.
kinda like dokja looking up to the skies for the constellations?"
61,"Aug 18, 2021",wow! i got goosebumps for this whole chapter 👏👏 it was amazingly portrayed 💙
61,"Aug 18, 2021",THIS WAS AMAZING!!!! I LOOK FORWARD TO EVERY SINGLE WEEK !!!! I hope you're all having a good day :)
61,"Aug 18, 2021",Did his eyes change when the constellation inhibited his body? They look blue-grey.
61,"Aug 18, 2021","Lmaoooo ""I didn't ask you to choose"" biiiiiitch"
61,"Aug 18, 2021",Could he call Hitler?
61,"Aug 18, 2021",rip my 5 coins goodbye I always remember the time we spent together 🥲🥲🥲
61,"Aug 18, 2021","Wait, wasn't the name of Dokja's weapon [Unbreakable Faith] ?    For some reason, I'm reading [Unbreakable Trust] . A translation thing maybe?"
61,"Aug 18, 2021",I understood nothing but this was cool~
61,"Aug 18, 2021",Pretty much how I imagined it while reading the original novel. Amazing work
61,"Aug 18, 2021","Another awesome chapter, can't wait for next week! Remind me though, who's the one in the invisibility cloak? "
61,"Aug 18, 2021","""the power of the blue dragon sword has entered unbreakeable trust"" what? Wasn't it unbreakable faith ? Idk what's the original name of that sword in the corean version but please, translators, I'm thankful for your work but if you are going to change the names you used previously, write a notice or something like that. As someone who study translation, your work should be kept coherent, not having things changed without any apparent reason..."
61,"Aug 18, 2021","When dokja said ""attack"", it reminded me of Sung Jinwoo's ""Arise"" 😳"
61,"Aug 18, 2021","SANGAH AND DOKJA ARE BIG BRAINS, I LOVE IT!"
61,"Aug 18, 2021",I'm learning so much about korean history from this webtoon...
61,"Aug 18, 2021","Damn the author is brilliant to put their own history into their fiction stories, I'm in love❤️"
61,"Aug 18, 2021",I watched the live action series of this particular story about Queen Silla and Kim Yushin...it Korean series
61,"Aug 18, 2021",Dokja with blue eyes 🤤
61,"Aug 18, 2021","did anyone else notice how at the beginning it said ""episode 60 chapter 13""?? like wasn't the og book over 1000 chapters long....🤪 I'm totally up for reading that much👏"
61,"Aug 18, 2021",King moves indeed goooo Dokja! And dang I wanna learn history now
61,"Aug 18, 2021",Nerds of Korean History will be going mad with this episode. Sadly I'm not one of them.
61,"Aug 18, 2021",this was such a wonderful chapter! I'm interested to see how the indirect death will affect dokja and hist contract
61,"Aug 18, 2021",I felt the chills mehn I love this webcomic so much!
61,"Aug 18, 2021",Dokja when he rised the dead was so cool giving me Nico di Angelo vibes and Hwarang vibes hehe~
61,"Aug 18, 2021",so basically- nico di angelo?
61,"Aug 6, 2021",I saved up so much and now I am broke :(I have to wait so long for the next episodes now T-T
61,"Aug 6, 2021","These last few chapters were so exciting to read (I mean so is the whole webtoon). I loved the art, how they incorporated the history into the story, the epic showdown; all of it truly amazing! One thing I always appreciate about Dokja is his ability to use the information he has. Sure he's read all of Twsa but it's another skill knowing how to apply the information. "
61,"Jul 15, 2021",Sangahhhh!!! Mvp!!!
61,"Jul 14, 2021","The art, the story, the historical accuracy, the attention to detail - 10/10 amazing"
61,"Jul 14, 2021",Getting your companion to kill people for you in Skyrim so you don't get charged with the crime
61,"Aug 19, 2021","I call upon the Great King of Seijoh, Oikawa."
61,"Aug 19, 2022",Yooo this man’s still going on quests in boxers !!!! 🤣🤣🤣🤣🤣🤣🤣🤣
61,"Aug 7, 2022",was i in history class just now?
61,"Jan 24, 2022","necromancer skill!!!.. 

everyday I'm reminded of jinwoo"
61,"Jan 21, 2022","Me, nodding along as if I know sh!t about Korean history"
61,"Jan 19, 2022",man imagine the amount of history knowledges the author has 😂
61,"Nov 4, 2021",why did I cry when the hwarang leader accepted 😭 this made me so emotional 🤣
61,"Oct 25, 2021",I WILL READ THE NOVEL ONLY FOR SANGAH MY LOVE
61,"Oct 15, 2021","Dear translators, it’s unbreakable faith, not unbreakable trust!!"
61,"Oct 9, 2021",Dokja is so smart and I'm glad he has such good friends and has a plan
61,"Oct 6, 2021","I’m waiting for the day the monkey king gets out from behind his keyboard and interferes more directly.
That said the king doesn’t need to respect his own laws 😂"
61,"Oct 1, 2021",Bro I thought he was gonna ask Jesus for help
61,"Sep 30, 2021",ahh it's so nice to see it in webtoon form
61,"Sep 16, 2021",I got chills with the battle scene THAT WAS SO COOL :')
61,"Sep 11, 2021","I love how even if they are the supporting cast, characters like Sangah are given opportunities to prove themselves. Yusin Kim really arrived on the battlefield like Thor too"
61,"Sep 11, 2021",Looks like Dokja turned into sung jin woo...Raise your hand if you're a dokja simp✋
61,"Aug 19, 2022",Yooo this man’s still going on quests in boxers !!!! 🤣🤣🤣🤣🤣🤣🤣🤣
61,"Aug 7, 2022",was i in history class just now?
61,"Jan 24, 2022","necromancer skill!!!.. 

everyday I'm reminded of jinwoo"
61,"Jan 21, 2022","Me, nodding along as if I know sh!t about Korean history"
61,"Jan 19, 2022",man imagine the amount of history knowledges the author has 😂
61,"Nov 4, 2021",why did I cry when the hwarang leader accepted 😭 this made me so emotional 🤣
61,"Oct 25, 2021",I WILL READ THE NOVEL ONLY FOR SANGAH MY LOVE
61,"Oct 15, 2021","Dear translators, it’s unbreakable faith, not unbreakable trust!!"
61,"Oct 9, 2021",Dokja is so smart and I'm glad he has such good friends and has a plan
61,"Oct 6, 2021","I’m waiting for the day the monkey king gets out from behind his keyboard and interferes more directly.
That said the king doesn’t need to respect his own laws 😂"
61,"Oct 1, 2021",Bro I thought he was gonna ask Jesus for help
61,"Sep 30, 2021",ahh it's so nice to see it in webtoon form
61,"Sep 16, 2021",I got chills with the battle scene THAT WAS SO COOL :')
61,"Sep 11, 2021","I love how even if they are the supporting cast, characters like Sangah are given opportunities to prove themselves. Yusin Kim really arrived on the battlefield like Thor too"
61,"Sep 11, 2021",Looks like Dokja turned into sung jin woo...Raise your hand if you're a dokja simp✋
61,"Aug 19, 2021","""let's go collect some flags""in other word : ""it's farming time :)"""
61,"Aug 19, 2021",I love how the author portrayed Korean history
61,"Aug 19, 2021",When is ma boy going to put on some pants 
61,"Aug 18, 2021","I love this webcomic. I'm not a fan, at all, of action genre but this story is clearly an exception."
61,"Aug 18, 2021",THIS EPISODE WAS EPIC
61,"Aug 18, 2021",Dokja said “Arise”
61,"Aug 18, 2021",who is the guy under the invisibility cloak?
61,"Aug 18, 2021",Dokja looks even more handsome when he’s intense 
61,"Aug 18, 2021",This EP was amazing as a drama lover of HWARANG I really was amused
61,"Aug 18, 2021","This battle is so epic!! I can't wait until next week but I don't have coins to use fast pass 😭😭 [The spectator ""Chrispey"" is devastated by not being able to sponsor.]"
61,"Aug 18, 2021",anything you say about how great Dokja was and its also true but can we just appreciate SANGAH because of whom this was possible......
61,"Aug 18, 2021",i just have to comment about how beautiful the artwork is. thank you so much to the artist/artists of this because they must have worked very hard
61,"Aug 18, 2021","COME FORTH, PERSONA!"
61,"Aug 18, 2021",SANGAH🐐🐐🐐🐐🐐🐐🐐
61,"Aug 18, 2021","god,,,dokja is such a badass!! what a king!! and sangah too!! I love everyone in this webtoon!! "
61,"Aug 18, 2021",i have caught all the way up I now have nothing left to read and I'm sad y'all are gonna love this story I kid you not
61,"Aug 18, 2021",beautifully done.
61,"Aug 18, 2021","""maitreya"" remind me of  god of highschool :"""
61,"Aug 18, 2021","this and the kdrama Hwarang is just giving me all the  ""oooooh thats why"" reactions lol "
61,"Aug 18, 2021",That was an epic battle!
61,"Aug 18, 2021",Dokja is giving me big monk vibes with those robes he’s been wearing for the past few episodes
61,"Aug 18, 2021",Happy one year anniversary Omniscient Reader!
61,"Aug 18, 2021",You are special. You are loved. 
61,"Aug 18, 2021","LESSGO yet another masterpiece! Can’t wait another week, can I-"
61,"Aug 18, 2021",F*CK english este webtoon es buenísimo vieja 🔥
61,"Aug 18, 2021",This is like your average best intense drama show ever 
61,"Aug 18, 2021",I've just watched hwarang !
61,"Aug 18, 2021",I’m only summoning this constellation to fight this one battle… and steal every flag.
61,"Aug 18, 2021","I dont know how to feel, this is amazing but, it's like chest when you use one piece at a time, and this time, we just put the enemy in check."
61,"Aug 18, 2021","Ah, I was waiting for this! Sanga speaking and convincing the General...I don't know, I just really liked it."
61,"Aug 15, 2021",Quite amazing to know a bit of Korean history 
61,"Aug 14, 2021","loved this episode so so much, gave me chills, and loved how sangah was so powerful here despite not being physically strong herself "
61,"Aug 12, 2021","I don't have knowledge in other country's history but when I read about them, it give me goosebumps coz it so cool ⭐✨"
61,"Jul 21, 2021",Isn't the sword called Unbreakable Faith? Says Unbreakable Truth this time. Something I noticed.
61,"Jul 19, 2021",damn they seriously rewriting history in a webtoon ep tho
61,"Jul 15, 2021",I am absolutely entranced when reading this comic and always eagerly waiting for the next update!
61,"Jul 14, 2021",this chapter had me legit gasping! Bravo! 
61,"Jul 14, 2021",I feel like Korean Winter Soldier with all these history lessons
61,"Oct 5, 2022","OMG!!!! SANGAH!!! i love her, i love her that speech! shes amazing 😍 "
61,"Oct 5, 2022","[The constellation ""0utcastar💫"" is impressed by the results of the matter.]"
61,"Sep 16, 2022",A r i s e (rereading 
61,"Aug 27, 2022",Y’all rm when dokja said he wasn’t a main character?
61,"Aug 17, 2022","That was so cool that they called upon the dead!! Really, this was amazing."
61,"Aug 15, 2022",This episode of the book reminds me of solo leveling even more!
61,"Aug 11, 2022",Can we talk about the guy defending the King still in his boxers? Someone please get him some pants
61,"Jun 5, 2022","WHY DID I PUT OFF READING THIS?!! I JUST SPENT THE WHOLE NIGHT READING THIS, WITH EVERYTHING OFF, INCLUDING THE WIFI!!! It's that good."
61,"May 29, 2022",I love the little history treat in this one!! This webtoon is amazing I regret not reading it sooner
61,"May 26, 2022",Dokja with blue eyes 🙇🏻‍♀️🙇🏻‍♀️🙇🏻‍♀️
61,"Apr 9, 2022","""unbreakable trust""? it was faith"
61,"Mar 11, 2022","YEEEEEEEEEEEEEEEEEEEEEEEEEEEEEEEEEEEEEEEEEEEEEEEEEEEEESSSSSSSSSSSS!!! SLAUGHTER EACH OTHER MY CHILDREN!!!!!!!!!!!! BUWAHAHAHAHA--OUGH, COUGH, COGUH!!!!*"
61,"Feb 6, 2022",dokja marry me
61,"Jan 5, 2022","""unbreakable trust""? I thought the sword was called ""unbreakable Faith"". (that's what it's been called for the last few dozen episodes)"
61,"Dec 16, 2021",This will be pretty cool when turned into an anime 😍
61,"Dec 10, 2021","this webtoon doesn't have much comment but ,,, its is because the readers keep continuing the episode  "
61,"Dec 7, 2021",woahhh this gave me the chills! it's like ghost fleet vibes and with the history as well. and possessed dokja's eyes really are pretty 😔
61,"Nov 24, 2021","Hooo, Sangha is so cool! She's doing great just as she is but i would love to see her grow further. Oh and Dokja, get some clothes."
61,"Nov 11, 2021",Damn that was hot
61,"Oct 23, 2021",more in love with sangah now<33
61,"Oct 17, 2021",I'm pretty lost in all this history but it's really cool thing to include! this story has everything. also damn you spoiler repliers! do you enjoy screwing with people??
61,"Oct 13, 2021","The Constellation ""Insane Lifemaster"" is impressed at the skill and intelligence of the incarnation Dokja Kim. 
Dokja Kim has received a skill, ""Noice"""
61,"Oct 8, 2021",WOAAAHH THIS EPISODE IS SO COOL also if i were in that situation i probably would've forgotten that i couldn't kill anyone HAHAHA 💀💀
61,"Oct 7, 2021","The author should add a second genre tag for fantasy. Also, THIS IS FUCKING EPIC!"
61,"Sep 30, 2021",CHILLS?! LITERAL CHILLS!!
61,"Sep 15, 2021",RATTLE ME BONES
61,"Sep 11, 2021","Ah, this was one of my favorite parts from the early novel. …it’s unbreakable FAITH"
61,"Sep 9, 2021",That calling all hwarang stigma really reminded me of jinwoos shadows from Solo Leveling 
61,"Sep 5, 2021",Unbreakable Trust? Hope that name doesn't stick and they revert back to Unbreakable Faith
61,"Sep 3, 2021","THIS IS SUCH A WELL MADE STORY. I’m obsessed with the authors intelligence and creativity. Ughhhh, I don’t mind having a writers block if this is the type of content I can produce lmao 🤣 "
61,"Aug 30, 2021",the chills i felt while reading this chapter omg
61,"Aug 28, 2021","wow i never expected the author slip a history like that. we got general yi sun shin before, but to think we'll get it again.. it's amazing!! good job author!"
61,"Aug 26, 2021",Damn kinda feel dirty for the guy who was possesses by the incarnation. He didn't have to die like that because if a spirits selfish whims 
61,"Aug 26, 2021",Man I almost teared up
61,"Aug 25, 2021",IM SO CONFUSED WTF IS HAPPENING 
61,"Aug 25, 2021","oh I love this webtoon very muchthis one is among the ones I enjoy the most!
I really wish it had more likes! pleople have no taste
"
61,"Aug 23, 2021",This is my favorite manhwa
61,"Aug 23, 2021",Ah yes this manhwa never ceases to amaze me
61,"Aug 23, 2021",i love this more than my entire life
61,"Aug 22, 2021",W O W 
61,"Aug 22, 2021",I WAS SHIVERING THE WHOLE TIME AS I READ THIS- This is the first time I've been so hyped!
61,"Aug 22, 2021",Banger
61,"Aug 21, 2021",Soooo cool OwO
61,"Aug 21, 2021",anyone know another good action webtoon? Since I don't have free pass or the app.
61,"Aug 21, 2021",that was dope!!!
61,"Aug 20, 2021","i have never regretted reading this webtoon, the story is getting more fun 👏👏"
61,"Aug 20, 2021","dokja really went ""off with your head!!"""
61,"Aug 20, 2021",When the roleplay is so good that you forget you're role-playing 
61,"Aug 20, 2021",damn Dokja ur so hot and smart
61,"Aug 20, 2021","A necromancer, i see."
61,"Aug 20, 2021",amo este webtoon lo amo me encanta gracias creador por esta obra de arte 😍😍😍😘
61,"Aug 20, 2021",Adore how generally respectful and well read the depiction is.
61,"Aug 20, 2021",Never expected this to become one of my favorite webtoons but alas. So glad I ran out of webtoons to read that one time and started this 
61,"Aug 20, 2021",dokja cool boi
61,"Aug 19, 2021",I wonder if Dokja will retain some of the power of this high constellation.
61,"Aug 19, 2021",“Thanks for the leash.”
61,"Aug 19, 2021",why do I feel some army of the darkness vibes here
61,"Aug 19, 2021",wait---does that mean dokja lose his attribute of immortal king?
61,"Aug 19, 2021",So exciting!
61,"Aug 19, 2021","Man, I’m kinda lost because of all of the history references, but I think it turned out well."
61,"Aug 19, 2021",I like the reenactment thing
61,"Aug 19, 2021","[The constellation ""Obsessed Shipper"" is impressed with your mental Calvary] {5 coins have been gifted}"
61,"Aug 19, 2021",Can someone explain to me why he cannot kill anyone it seems i forgot
61,"Aug 19, 2021","OH NO!!! After 60 chapters, here it is... I reached the free pass limit.But I'm a patient woman... 
Time to wait "
61,"Aug 19, 2021",Not him having an Aragorn moment
61,"Aug 19, 2021","He wished for a character and got a 5 star constellation. Amazing and lucky! Jokes aside, Dokja is like king in chess, because the king in chess doesn't attack. Maybe that's why he is called king of no killing :O"
61,"Aug 19, 2021",i’ve been reading this episode over and over ahh i can’t get over it 😭 it’s too good 
61,"Aug 19, 2021",I love when the constellations come into fights. it's a really cool concept how they incarnate into their incarnations
61,"Aug 18, 2021",I love the build up. So many stories form from the main story. 🤗
61,"Aug 18, 2021","this is like star wars the clone wars season 4 when the nightsisters were battling the separatists on dathomir after ventress got baptized by her kin, and she challenged grievous to a duel. if she wins, the droids leave. if he wins, then the witches die, but he cheated when he called for reinforcements and defeated old daka,the zombies and their living in got shot,and ventress was abandoned and mother talzin told her to make a future for herself, that's what happened on massacre"
61,"Aug 18, 2021",Ugh I wish the chapters were longer 😔
61,"Aug 18, 2021","Wow, dramatic indeed! Nice 👍"
61,"Aug 18, 2021",I AM SO OBSESSED WITH THIS WEBTOON !!!!!
61,"Aug 18, 2021",I wish Dokja had blue eyes normally because he really looked cool with blue eyes
61,"Aug 18, 2021",I love this episode.
61,"Aug 18, 2021","phew still save, didn't kill a human 👀"
61,"Aug 18, 2021","this,,, was so beautiful. I actually imagined that when they said ""stage"" in the novel, there would be a legit stage, or a ring, forming 😭"
61,"Aug 18, 2021",I like these inserctions of history inside of a videogame in real life and action comic!!This is so cool!
61,"Aug 18, 2021",I was in awe seeing the scenes I've imagined when I'm still reading the novel. Can't wait for more scenes that I've only imagined!!!!
61,"Aug 18, 2021",Okay but this episode thoooo 🔥🔥 
61,"Aug 18, 2021",Dramatization?? Is that what it was called? 🤔 
61,"Aug 18, 2021","he calls it his ""dokja life hack"" ""ugh, he would"""
61,"Aug 19, 2021",I love when the constellations come into fights. it's a really cool concept how they incarnate into their incarnations
61,"Aug 18, 2021",I love the build up. So many stories form from the main story. 🤗
61,"Aug 18, 2021","this is like star wars the clone wars season 4 when the nightsisters were battling the separatists on dathomir after ventress got baptized by her kin, and she challenged grievous to a duel. if she wins, the droids leave. if he wins, then the witches die, but he cheated when he called for reinforcements and defeated old daka,the zombies and their living in got shot,and ventress was abandoned and mother talzin told her to make a future for herself, that's what happened on massacre"
61,"Aug 18, 2021",Ugh I wish the chapters were longer 😔
61,"Aug 18, 2021","Wow, dramatic indeed! Nice 👍"
61,"Aug 18, 2021",I AM SO OBSESSED WITH THIS WEBTOON !!!!!
61,"Aug 18, 2021",I wish Dokja had blue eyes normally because he really looked cool with blue eyes
61,"Aug 18, 2021",I love this episode.
61,"Aug 18, 2021","phew still save, didn't kill a human 👀"
61,"Aug 18, 2021","this,,, was so beautiful. I actually imagined that when they said ""stage"" in the novel, there would be a legit stage, or a ring, forming 😭"
61,"Aug 18, 2021",I like these inserctions of history inside of a videogame in real life and action comic!!This is so cool!
61,"Aug 18, 2021",I was in awe seeing the scenes I've imagined when I'm still reading the novel. Can't wait for more scenes that I've only imagined!!!!
61,"Aug 18, 2021",Okay but this episode thoooo 🔥🔥 
61,"Aug 18, 2021",Dramatization?? Is that what it was called? 🤔 
61,"Aug 18, 2021","he calls it his ""dokja life hack"" ""ugh, he would"""
61,"Aug 18, 2021",In this webtoon I really like how they show Korean history like they hype me and I actually enjoy
61,"Aug 18, 2021",Wait so what is the no killing path he is under again? I don’t remember 
61,"Aug 18, 2021",potatoes
61,"Aug 18, 2021","can't wait for chapter 65, it's gonna be hype boys"
61,"Aug 18, 2021","KDJ really called it out! ""ARISE, ASSEMBLE, ATTACK!"" - Amazed by his tactics! Hats off to the creators!!!"
61,"Aug 18, 2021",OH MY GOODNESS this episode was so awesome!
61,"Aug 18, 2021",Ahhhhh! Seeing the stage as art is so cool ✨
61,"Aug 18, 2021",Well damn Dokja
61,"Aug 18, 2021",This man be like the king in chess summoning the queen to checkmate him.
61,"Aug 18, 2021",It seems the general that possessed Dokja pulled a Sung Jin Woo
61,"Aug 18, 2021",FOR GONDORRRR 😂
61,"Aug 18, 2021",Power move right here
61,"Aug 18, 2021","my boi really became a D&D Necromancer's wet dream. 
Although said Necomancer would ""never financially recover from this""."
61,"Aug 18, 2021",AHHHH I LOVED THIS SCENE IN THE NOVEL I’m glad to see it drawn
61,"Aug 18, 2021",I have never been more attracted to dokja I have literal chills
61,"Aug 14, 2021",when did dokja got a pair of shoes?!😂😂
61,"Aug 14, 2021",Hey you yes youlook the likes of the episode 1 ok? Look the likes of episode 46 and 47 Ok? Now look the likes of episode 59 do you remember any novel start with t? 
61,"Aug 12, 2021",My first time using a fast pass :D
61,"Jul 29, 2021",wow!! I did not see that coming. Great chapter!
61,"Jul 17, 2021",well. i bought coins. i got caught up. and now I'm addicted
61,"Jul 17, 2021",remember to like each chapter to show your support! this story is amazing
61,"Jul 16, 2021",Dang…that was some mad fighting skills too. 
61,"Jul 15, 2021",I love this comic. like how can it be this good? I forgot I could feel like this.
61,"Jul 14, 2021","[The constellation ""Child of The Chaotic Mask"" was pleased with this turn of events.]  5 coins were gifted."
61,"Jul 14, 2021","[The Constellation FreeBowlPack expresses interest in possessing an incarnation as well, but will settle for gifting 5 more coins]"
61,"Aug 18, 2021",tf is dramatization 😭 why can't they stick to the novel please this is so confusing. Why keep changing things from one chapter to another like...there's already the translated novel just USE THOSE TERMS. Not everyone is gonna reread chapters to see what's changed every two chapters
61,"Jul 14, 2021",where is my boi LazyBrokeWeeb at
61,"Jul 14, 2021","Damn! Ancient artifacts, reincarnations, now undead armies: what’ll they think of next in this arc?"
61,"Jul 14, 2021","[the constellation ""PotatoInTrash"" is delighted with the chapter] [5 coins have been sponsered]"
61,"Oct 3, 2022","about that 'no killing' thing, does it not apply when a human dies later on? earlier on in the story Dokja cut off both arms of a gangster, since this is a most severe injury and there are no hospitals or any real intention to help the weak, wouldn't his man have dies within minutes, hours or days at the very least? so as long as someone doesn't die on the spot, Dokja is free to inflict fatal injuries?"
61,"Sep 21, 2022",Dokja with the ruthless killer eyes is kinda...
61,"Aug 29, 2022",[the constellation young obsessed reader is thrilled at the 'incarnation dokja Kim''s decisions
61,"Aug 21, 2022",oooohsmart Dokja
