Episode,Date,Review
14,"Oct 16, 2020","Dokkaebi: So, you want to make a deal.
Dokja: Actually, I have a counter proposal.

Dokkaebi: *Surprised Dokkaebi face*"
14,"Oct 16, 2020","Enter a contract with me, and I’ll make you the king"
14,"Oct 16, 2020","I just saw a comment and your telling me is there actually going to me 3,149 chapters ??👁👄👁💧"
14,"Oct 16, 2020",My guy really do b calm after seeing a bunch of corpses
14,"Oct 16, 2020",moment of silence for those who used their coins for these chapters😂
14,"Oct 16, 2020",NOT WHAT I EXPECTED BUT OH THIS IS GETTING GOOD
14,"Oct 16, 2020",Dang the author really wants to spoil us with 3eps in a day rn huh?
14,"Oct 16, 2020",He’s playing it smart yet taking a hecking huge chunk out of the risk cake. Save some death or glory moments for the next couple hundred episodes. 
14,"Oct 16, 2020",He's one manipulative little shit. I love it so much!
14,"Oct 16, 2020","Dokkaebi Bihyeong, you're making a deal with the devil"
14,"Oct 16, 2020",YES DOKKABEI THE KING OF PLUSHIES
14,"Oct 16, 2020",Ahhh I love this so much...honestly this is my favorite novel and I’m so happy it has a webtoon and is gaining more attention cause it really deserves it
14,"Oct 16, 2020",t-t-THREEE UPDATES?!?!? *coma*
14,"Oct 16, 2020","Dormamu, I've come to bargain. I can make you the very best, like no one ever was"
14,"Oct 16, 2020",he said 👀👄
14,"Oct 16, 2020",I literally drooled while reading this wtf
14,"Oct 16, 2020",bruh he looks so cute in the end panel
14,"Oct 16, 2020",This is so well thought out giving him that info is SO smart and everyone knowing he know GINEUS and still leaving us in the dark SO GOOD and the whole story and how thought out this is AMAZING (k I’m done being a simp) 
14,"Oct 16, 2020","Best scene ever! Man, his face reminds me of a dog seeing a bone, lol."
14,"Oct 16, 2020",alright since there was a series before this one how much will this one have more then the old 1 or less and if this is based off the older one then how many episodes have pass in one episode of this 
14,"Oct 16, 2020","Plss his smile when he said ""i said kill me"" help asgshdhsjj"
14,"Oct 16, 2020",Damn these constellations are huge simps
14,"Oct 16, 2020",hahahahahahah those eyes XD fool
14,"Oct 16, 2020",I CANT BE THE ONLY ONE WHO JUST HAD A MENTAL BREAKDOWN BECAUSE THEY LOVE THIS DAMN WEBTOON TO MUCH I-
14,"Oct 16, 2020","3,149 episodes, man I’m starting to wonder if that’s the amounts of episodes this WEBTOONs gonna have"
14,"Oct 16, 2020",Scam all his money kdj... SCAM THEM ALL AWAY
14,"Oct 16, 2020",Bihyeong is about to be robbed of everything he owns ✌️😔
14,"Oct 16, 2020","I’m sorry, I fell into the temptations and ended up reading the light novel. Would recommend reading it tho "
14,"Oct 16, 2020",dokja is boutta break the system
14,"Oct 16, 2020",the dokkaebi can go from demon to adorable pet dog lol
14,"Oct 15, 2020","ThE fAcE aT tHe EnD pErFeCtLy IlLuStRaTeS tHaT ""i WaNt CoOkIeS fAcE""-"
14,"Sep 24, 2020",the eyes of the constellation secretive plotter ✨sparkle✨
14,"Sep 10, 2020","step 1: buy coins for new chaptersstep 2: read new chapters
step 3: wait 48 days for new free chapters cuz you broke"
14,"Sep 10, 2020",love how true to the light novel the web comic has been so far. can't wait to see how certain things look in the webcomic as I picture them from the light novel.
14,"Sep 9, 2020",dAmn our wallets really are going to be dead :)
14,"Sep 9, 2020",I love how smart this protagonist is
14,"May 22, 2021",The Dokkaebi is sooooooooooo cute!
14,"Oct 21, 2020",He so hot he seduced the damn devil
14,"Oct 17, 2020",how can someone so cute be so ugly 😔✊
14,"Oct 16, 2020","I just thought of a theory. What if the Secret Plotter guy thing is actually just like our main? He also was a reader, and maybe he survived when he was cast in, so now he is a constellation?"
14,"Oct 6, 2022",I understand Dokja's feelings towards wanting to make Yu Junghyeok recognise him as his companion. When you spend such a long time with a character that character becomes a part of you..You wish to be there for them through thick & thin & actually become their companion. I think Dokja's intentions here towards Yu are very pure
14,"Jul 28, 2022",He's so cute that's what I said from the start and that what I'm still thinking
14,"Jul 25, 2022",bihyung really went from looking like a murderous psycho to looking like an adorable puppy
14,"Jul 19, 2022",i just know dokja's phone is Nokia.
14,"Jul 5, 2022","i want to enter a contract with you dokja, a marriage contract"
14,"Jun 27, 2022",I want a Dokkaebi Bihyeung pulshie *pweeezzz* @~@
14,"Jun 24, 2022",A HAHAHAHA THE DOKKAEBI SO CUTE
14,"Jun 22, 2022",Bihyung finally looks so cute lmao
14,"Jun 18, 2022",DONT REGRET READING THIS OMGG!! AND THE DOBBAEKI WHITE IDK THE SPELLING IS SO CUTEE
14,"May 21, 2022","Bihyeong is so cute sometimes, it looks so fluffy and I love it"
14,"May 7, 2022","I don't care if he's a genocidal murderer that puts human beings into dangerous situations just for views, I want to and will give up my soul to hug Bihyeong."
14,"May 4, 2022",gyaaaah the dokka-chu face too cute (dies)
14,"May 4, 2022",bihyeong's face hahaha lmao such a cutie
14,"May 4, 2022",mah man Bihyung hearing hallelujah chorus from everywhere 
14,"Mar 22, 2022",HE LOOKS SO INNOCENT OGMDJFHJDBD
14,"Mar 21, 2022",I have the feeling  maybe the constellation secretive plotter is the author idk
14,"Feb 19, 2022",He so manipulative I like it
14,"Feb 18, 2022",his face was cute in the end 
14,"Jan 17, 2022",i feel like the secretive plotter is a lot more powerful and important than dokja gave them credit for
14,"Dec 11, 2021",Hes so cute
14,"Nov 25, 2021","bro this side character really pulling more weight than the protagonist, what we seen is our guy kim (main character/ side character to protag.) demolish everyone's expectations even the actual main character, this is wild"
14,"Nov 19, 2021",OMG HOW CUTE
14,"Nov 17, 2021",I WANT A DOKKAEBI PLUSHIE!!!
14,"Nov 12, 2021",Bihyeong is so cuteee omg
14,"Nov 6, 2021",Oh yeah... The negotiator
14,"Nov 5, 2021",“ i’ve been waiting for you”the dokkeabi: huh?😃
14,"Nov 4, 2021","The more I see Bihyeong, the more Monakuma vibes I'm getting🤣🤣🤣 #cutebutpsycho"
14,"Oct 30, 2021",we looove a smart protagonist 😍
14,"Oct 26, 2021",OK THE WAY THAT THING’S EYES SPARKLE IS TOO CUTE-
14,"Oct 19, 2021",oh damn im finding comments I left here exactly one year ago
14,"Oct 14, 2021",THAT DOKKAEBI IS TOO CUTE TO BE EVIL
14,"Sep 24, 2021",when you can clearly hear angels sing in dokaebi go✨🎶Aaahhhhhh🎶✨
14,"Sep 24, 2021","omg both are so hot.....the pose.
and the story, just so perfect omg."
14,"Sep 22, 2021",It's like the Dokkaebi is the protagonist and Dokja is the one sponsoring him.
14,"Sep 12, 2021",capitalism at its finest
14,"Sep 11, 2021","“In galaxies far, far away…” STAR WARS?"
14,"Sep 10, 2021",is that a car inside that snake monster 
14,"Aug 25, 2021",I love that Wukong and Uriel are proud of his actions towards Junghyeok. Meanwhile the secretive plotter is a wet blanket up until it's time to plot secretly. then their eyes sparkle 🤣 Everybody gangsta til they get called by their full name. Dokja managed to get Bihyeong in the palm of his hands tho 👌
14,"Aug 19, 2021",yk the dokkaebi is actually pretty cute when it isnt killing people
14,"Aug 17, 2021",DOKKAEBI face was like😳🤣🤣
14,"Aug 16, 2021",my man Dokja got no chill he a straight savage
14,"Aug 13, 2021",Make me important and I will give you ✨ clout ✨ 
14,"Aug 8, 2021","Damn ,where can I buy a Brain like that? "
14,"Aug 5, 2021","this webtoon is made with so much knowledge, best artwork nd of course with top class twists. Their contract jst gave me chills😣😣😣😍"
14,"Aug 4, 2021",MC: Kill me. dokkaebi: *surprised dokkaebi face*
14,"Aug 3, 2021",i thought he'll be taking his titan form now
14,"Aug 2, 2021",the dokkaebi is looking real cute rn
14,"Jul 28, 2021",bihyung is cutee..no one can deny that
14,"Jul 27, 2021",Bihyeong is simple-minded isn't he?
14,"Jul 27, 2021","BRO THE MC IS SMART HOLY SHIT, IF I WAS IN HIS POSITION I'DE BE IMMEDIATELY DED "
14,"Jul 26, 2021",Streamers are all over the world! Also in universe. Lol
14,"Jul 25, 2021",Omgosh he's so cute
14,"Jul 25, 2021",Big brain boy
14,"Jul 22, 2021","that secretive plotter👀 hmmmmmmmmm....that's suspicious, that's weird"
14,"Jul 21, 2021",Aww Dokkaebi Bihyeong is so adorable omg i love him already.
14,"Jul 15, 2021",the dokkaebi is so cute 😭😭
14,"Jul 14, 2021",dokkebi is too cute. I can't hate him. He looks adorable🤷😂😊😊❤️
14,"Jun 27, 2021",anyone else think that the Dokkaebi is starting to look cute ? No? Just me ? OK. so just gonna thrown myself in the garbage. 
14,"Jun 27, 2021",awwww the dokkaebi is so cuteee
14,"Jun 17, 2021",I GET SUCH A RUSH AFTER READING THESE EPISODES AHHH I LOVE THIS
14,"Jun 16, 2021","He’s actually adorable, if only he dont have a bloodlust🧘‍♀️"
14,"Jun 15, 2021",hahaha he's cute and fluffy 
14,"Jun 3, 2021",ooaaoo you got him he wants to be the doabakii king or whatever
14,"May 27, 2021",😍
14,"May 17, 2021",The face at the end was cute ngl.
14,"May 14, 2021","Damn even I am touched by his plan 😆😆 this is absolutely amazing, it’s like the gamer but better 👍🏻"
14,"May 13, 2021","the more I look at the dokkaebi, the more i think it looks cute-"
14,"May 11, 2021",do you know how much of an ass you are Junghyuk yu
14,"May 8, 2021",This is such a strange conceit.FASCINATING and Entertaining...but very strange.
14,"May 7, 2021",I AM SCREAMING
14,"May 5, 2021",When U Try To Rob Something From A Robbery King🤣 Poor Buhyung
14,"May 5, 2021",Dokkaebi or what it's name is.. a scary double edged life form... cute but deadly.. but still PLS LET ME PET ONE 😭
14,"May 4, 2021",Bihyeong is so cute
14,"May 3, 2021",Do whatever it takes Dokja
14,"May 1, 2021","""You shameless sob"" PFFFTTT... "
14,"Apr 30, 2021",Wait his phone still works after being through this big of a digestive system? Where do I get a phone like that?!
14,"Apr 29, 2021","It is interesting to see the readers partially portrayed as constellations. I will be keeping my eye on this ""dokkaebi"". "
14,"Apr 29, 2021",he wants to be the very best that no one ever was
14,"Apr 29, 2021",Star Stream? Probably just a euphemism for the dark web...
14,"Apr 29, 2021",This world is so interesting! 
14,"Apr 29, 2021",dokja.. you really are ge-ge-ge-ge-geniuss
14,"Apr 29, 2021",I LIKE HOW HE'S NOT THE PROTAGONIST OF THE STORY WHERE HE HIMSELF IS THE PROTAGONIST.
14,"Apr 29, 2021",THIS IS SO GOOD 
14,"Apr 29, 2021",I’m fricking enjoying the constellations remarks 😂
14,"May 7, 2021",I AM SCREAMING
14,"May 5, 2021",When U Try To Rob Something From A Robbery King🤣 Poor Buhyung
14,"May 5, 2021",Dokkaebi or what it's name is.. a scary double edged life form... cute but deadly.. but still PLS LET ME PET ONE 😭
14,"May 4, 2021",Bihyeong is so cute
14,"May 3, 2021",Do whatever it takes Dokja
14,"May 1, 2021","""You shameless sob"" PFFFTTT... "
14,"Apr 30, 2021",Wait his phone still works after being through this big of a digestive system? Where do I get a phone like that?!
14,"Apr 29, 2021","It is interesting to see the readers partially portrayed as constellations. I will be keeping my eye on this ""dokkaebi"". "
14,"Apr 29, 2021",he wants to be the very best that no one ever was
14,"Apr 29, 2021",Star Stream? Probably just a euphemism for the dark web...
14,"Apr 29, 2021",This world is so interesting! 
14,"Apr 29, 2021",dokja.. you really are ge-ge-ge-ge-geniuss
14,"Apr 29, 2021",I LIKE HOW HE'S NOT THE PROTAGONIST OF THE STORY WHERE HE HIMSELF IS THE PROTAGONIST.
14,"Apr 29, 2021",THIS IS SO GOOD 
14,"Apr 29, 2021",I’m fricking enjoying the constellations remarks 😂
14,"Apr 27, 2021",Yo this dude is smart
14,"Apr 27, 2021",so..... where is this story that he's been reading cuz it sounds quite interesting 🤔 
14,"Apr 27, 2021",What the..is this allowed? Lol no but for real this is hardcore meta gaming 😂
14,"Apr 27, 2021",Wow ..knowledge is really the greatest power 
14,"Apr 27, 2021",I don't know about you guys but I kinda find Bihyeong cute༎ຶ‿༎ຶ
14,"Apr 27, 2021",He's amazing and yu is hot.
14,"Apr 27, 2021",🤣🤣 that final faceeee ❤️❤️❤️❤️
14,"Apr 27, 2021",This is what happens when you know what's going to happen in the future 
14,"Apr 27, 2021","Lol, even other worldly beings have greed"
14,"Apr 27, 2021",Everyone here is take my coin while I get to know about this webtoon because I want to earn free coins. 
14,"Apr 27, 2021",I want this dudes brain. 
14,"Apr 27, 2021",He's so freaking smart omg I want to be him. Also why on earth is the dokkaebi so cute??? I wanna pet him
14,"Apr 27, 2021","Hey Dokkaebi Bihyeong, would you like to be my pet ,😃"
14,"Apr 27, 2021",Bihyeong looked so cute for a moment
14,"Apr 27, 2021","this is very...cosmic horror like, huh? the way they describe bihyeong as a streamer, the Constellations the viewers...the humans the actors... how the onlookers are mythical creatures beyond space and time...and how these humans are made to live in this horror show, hosted by a small, failing streamer that also happens to be a sadistic demon like entity...to the humans, at least. "
14,"Apr 27, 2021",The dokkaebi is kinda cute...it looks so fluffy
14,"Apr 27, 2021",beyeong face at the end is cute🥺🥺
14,"Apr 26, 2021",hmm secretive plotter.. could that be the author of the novel he's read? just a guess 😅
14,"Apr 26, 2021",This man got beauty with brains no wonder! 
14,"Apr 26, 2021",the dokkaebi's eyes is ✨glowing✨
14,"Apr 26, 2021",EGG EYES AND BLACK YOLK
14,"Apr 26, 2021",Dude literally went both 🥺 and 😮 lmao. Dare I say it almost looked cute. Our MC is pretty smart.
14,"Apr 26, 2021","Guy, I want your phone. That one that does not die in contact of water and extreme monster acidity"
14,"Apr 26, 2021","GEINUSE WE HAVE OUR SELVES A MASTER OF MANIPULATION, THE SECETIVE PLOTER HIMSELF IS SMILING RICGHT NOW CACKLING LIKE I AM"
14,"Apr 26, 2021","even though I don't like jeonhyuk he is so handsome I am in love with this comic
"
14,"Apr 26, 2021","Ah, the beginning of the dumb ass duo"
14,"Apr 26, 2021",awww.. the dokkaebi is so cute~ 😆😆😆 comellllll kawaiiiiii 😆😆😆 that last face that is 🥰🥰🥰😍😘
14,"Apr 26, 2021",All Hail to the Dokkaebi King!!!!
14,"Apr 25, 2021",what a smart ass !!
14,"Apr 16, 2021",i fill midly in danger for finding the Dokkaebi cute
14,"Apr 10, 2021",This reminds me of this episode of Rick and Morty « Get Schwifty » with those big heads aliens pitting planets against each other for a tv reality. 
14,"Apr 9, 2021",Wait a minute. Why is the dokkaebi sorta cute tho.... 
14,"Apr 2, 2021",this is SO GOOD
14,"Apr 1, 2021",he is awesome lol🤣🤣🤣🤣🤣🤣
14,"Mar 31, 2021",He’s gonna help him become the Hokage what I nice MC 
14,"Mar 16, 2021",Bihyung's face at the end is just too cute lol
14,"Mar 9, 2021",Dokja: Hey wanna be *~king~*???? ||Bihyeong:  💫 👁👄👁 💫 🌟 
14,"Feb 28, 2021",Im ammm hyping!!!!!!!! thiss isss soo lit!!!
14,"Feb 27, 2021",imagine if when this webtoon is over the last panel says 'if youre reading this you will survive' 👁️👄👁️ nu uh im deadddddd
14,"Feb 26, 2021",i like this white cuteeeee.😍😍🤩🤩
14,"Feb 26, 2021",i like this white cuteeeee.😍😍🤩🤩
14,"Feb 26, 2021",i like this white cuteeeee.😍😍🤩🤩
14,"Feb 25, 2021",wait the little guy is so cute 
14,"Feb 25, 2021",i love how he surprises even the dokkaebi (did i get the spelling right?)
14,"Feb 25, 2021",perhaps im reaching but could it be that the ‘Secretive Plotter’ is the author of the novel? 
14,"Feb 25, 2021",Wait the dokkaebi is sorta cute... you know when he's not plotting to maliciously kill people.
14,"Feb 20, 2021",This has the same potential of solo leveling and I am here for it.
14,"Feb 19, 2021",remember to comment and like every episode so that the artist will help you survive the apocalypse. Thank you for this episode! I look forward to finishing the series
14,"Feb 18, 2021","ahh yes, contracts"
14,"Feb 18, 2021",I love this WEBTOON OMG
14,"Feb 18, 2021","Omg, so much protag and meta gaming, I almost can't stand it"
14,"Feb 15, 2021",damn this is getting better and better
14,"Feb 15, 2021",one day you'll see... Kim Dokja will become a millionaire 
14,"Feb 13, 2021",turns out bihyeong can be cute hahahah
14,"Feb 13, 2021","his mouth, mind and plan are so creative🤣 owemji I stan"
14,"Feb 9, 2021",awww cute
14,"Feb 6, 2021",I felt that broke bitch energy
14,"Jan 29, 2021","So like I know hes lost all humanity and whatever, but he's hot."
14,"Jan 27, 2021",That's so freaking cute
14,"Jan 27, 2021",well that's an adorable dokkaebi king
14,"Jan 24, 2021",Not Dokja and Dokkaebi becoming besties 👯‍♂️ 
14,"Jan 24, 2021",that was cute
14,"Jan 23, 2021",These sparkling eyes of the Dokkaebi are cute and I love Dokja ￦.￦ He's badass enough to be like a king. 
14,"Jan 22, 2021","wow I can't believe Dokja really got eaten, lmao the dokkaebi is surprised; Dokja is now using the cards in his sleeve, acting his reader part, so cool; Looks like Dokja will team up with that Dokkaebi, I wonder what will the contents on their contract be"
14,"Jan 20, 2021",idc how evil that white fluff ball is its cute
14,"Jan 18, 2021",THE THING IS CUTE WTGDJSHF
14,"Jan 15, 2021",Scenario: must kill one living organism to survive...Cut to me holding a jar of yeast with malicious intent.
14,"Jan 14, 2021",he knows what he’s doing lolll
14,"Jan 10, 2021","this is my first time reading webtoon and im starting to love it lol,any good luck message for a new reader or something i need to know?"
14,"Jan 8, 2021",why does Bihyung look kinda cute tho XD
14,"Jan 8, 2021",damn that tiny little shit is so fucking cute
14,"Jan 6, 2021","""The Secret Plotter's eyes sparkle at your plan""...my eyes when I see food"
14,"Jan 6, 2021","ok, dokkaebi is back at being cute. his eyes is ✨ shining✨"
14,"Jan 1, 2021",This is sheer genius! I love this! 
14,"Jan 1, 2021",Shit. I didn't think he'd make use of the streamer himself like this and reveal some of his cards.
14,"Dec 28, 2020",BiHyeong is kinda cute with his tiny little horns and fingers. 
14,"Dec 27, 2020",Ill never see *tutorial guides that kill you before the main stroyline begins* the same way again now ill think they are killing the mob character for more stream viewers
14,"Dec 26, 2020",The agreement of the prisoner is funny because Sun Wukong was the most provocative God in all of Chinese mythology. No wonder he approved.
14,"Dec 25, 2020",Bihyeong you cute lil dokkaebi 
14,"Dec 24, 2020",he contract with a devil!!! he lost his mind??? 
14,"Dec 23, 2020",How dare you question his career choice. 
14,"Dec 22, 2020",He's now like the devil lol
14,"Dec 19, 2020",I wish this was real it’d be so interesting!!
14,"Dec 18, 2020",selling him the dream lolllllll 
14,"Dec 13, 2020",The reaction of the constellation to Dokja's decision are so hilarious 😂😂😂😂😂 
14,"Dec 12, 2020",Bihyung is so adorable in this form 😍 
14,"Dec 1, 2020",The secretive plotter lines are hilarious. 
14,"Nov 30, 2020",Awwww. I can't believe Bihyeong can also be adorable
14,"Nov 28, 2020",Loving the fact that I read this whole story already so am just enjoying the eye candy of seeing the scenery and the characters. Bihyung is such a cutie pie ahahah
14,"Nov 25, 2020","I want a Bihyeong doll , he’s so fluffy and cute."
14,"Dec 28, 2020",BiHyeong is kinda cute with his tiny little horns and fingers. 
14,"Dec 27, 2020",Ill never see *tutorial guides that kill you before the main stroyline begins* the same way again now ill think they are killing the mob character for more stream viewers
14,"Dec 26, 2020",The agreement of the prisoner is funny because Sun Wukong was the most provocative God in all of Chinese mythology. No wonder he approved.
14,"Dec 25, 2020",Bihyeong you cute lil dokkaebi 
14,"Dec 24, 2020",he contract with a devil!!! he lost his mind??? 
14,"Dec 23, 2020",How dare you question his career choice. 
14,"Dec 22, 2020",He's now like the devil lol
14,"Dec 19, 2020",I wish this was real it’d be so interesting!!
14,"Dec 18, 2020",selling him the dream lolllllll 
14,"Dec 13, 2020",The reaction of the constellation to Dokja's decision are so hilarious 😂😂😂😂😂 
14,"Dec 12, 2020",Bihyung is so adorable in this form 😍 
14,"Dec 1, 2020",The secretive plotter lines are hilarious. 
14,"Nov 30, 2020",Awwww. I can't believe Bihyeong can also be adorable
14,"Nov 28, 2020",Loving the fact that I read this whole story already so am just enjoying the eye candy of seeing the scenery and the characters. Bihyung is such a cutie pie ahahah
14,"Nov 25, 2020","I want a Bihyeong doll , he’s so fluffy and cute."
14,"Oct 24, 2020",Bihyung really Pikachu faced like four times now! 😦
14,"Oct 22, 2020",I looooooooove this series
14,"Oct 21, 2020","Wow he looks so innocent, you would have never guessed that he is partly evil from his innocent face.😇"
14,"Oct 21, 2020",I’m glad they did a coin event or I may have never seen this series. It’s soooo good. I hope they make dokkaebi plushies
14,"Oct 21, 2020",Dokkaebi Bihyeong is cute. Wish he's a stuff toy but not when he's in massacre mode. 😍
14,"Oct 21, 2020","please author WE are thank you ans beg you to continue to give us such Amazing episodes like this other thing streamer !!!😂😂
si this think is like a youtube or Twitch for extraterrestrial 
the streamer king 😂 the dokkabi was so cute when he heard that word as a baby who wants to ask something he knew we have refused him"
14,"Oct 20, 2020",hey dokkaebi or whatever that monster name is. he is adorableee. sometimes. i guess
14,"Oct 20, 2020",YALL DONT UNDERSTAND HOW MUCH I LOVE BIYEONG
14,"Oct 20, 2020",he's so cuuuuuuuttttttttteeeeeeeee bihyeong is so cute. After reading the novel I'm curious how they will look like.
14,"Oct 20, 2020",👏HOT DAMN!! He basically just made a deal with a TV director/YouTuber who wants to be the next Pewdiepie
14,"Oct 20, 2020",OK soooo the end panel was sooo cute🥺🥺🥺🥺🥺🥺🥺🥺🥺🥺🥺🥺🥺🥺🥺🥺
14,"Oct 20, 2020",That face was priceless! For once this menacing danger muffin became a cute lil kitty😺!!! ^_~
14,"Oct 19, 2020",damn i love this smartass
14,"Oct 18, 2020",This is like I'm watching an anime
14,"Oct 18, 2020",THIS IS AMAZING. PLEASE CONTINUE IT ❤️
14,"Oct 18, 2020",DAYUUUUUUM HE ALSO A CUTIE 🥺🥺🥰🥰🥰🥰
14,"Oct 18, 2020",I just got the strong feeling that future Dokja wrote this story and sent him self back to fix what ever happens later and as a price they wiped his memory.  Which is why he wrote the story. 
14,"Oct 18, 2020",I also don't have coins can I offer my life to read the next episode?
14,"Oct 18, 2020",ugh junghyeok is so pretty tho
14,"Oct 17, 2020",THE DOKKAEBI IS SO CUTE HUHUHU
14,"Oct 17, 2020","[The Eyes of The Constellation, “Secretive Plotter”, Sparkle At Your Plan]
As someone that read the novel until the end... This part made me chuckled a lot.. "
14,"Oct 17, 2020",👁️👄👁️
14,"Oct 17, 2020",that dokebi face at the end is so cute 
14,"Oct 17, 2020",Wow this is amazing storytelling!!! One minute I’m shook... the next i’m dying laughing 😭😭.  Dokja is so different as a MC in this genre. He isn’t OP in terms of strength but his mind puts him at an advantage. He’s so clever
14,"Oct 17, 2020",IT'S AN UNO REVERSE CARD SITUATION HERE
14,"Oct 17, 2020",He's making quite the deal there.
14,"Oct 17, 2020",HE WANTS TO BE THE VERY BEST THAT NO ONE EVER WAAAAASSSSSSS
14,"Oct 17, 2020","""the constellations are having a blast"" welp guess we are the constellations 😂😂"
14,"Oct 17, 2020",hes so cute at the end wtf
14,"Oct 17, 2020","aw, the face~"
14,"Oct 17, 2020","Them yung streamers, smh. lol"
14,"Oct 17, 2020",guys were so 14 I need to know
14,"Oct 17, 2020","Wait, so that little fluffy guy isn't writer of TWISTA? then who send Dokja story? "
14,"Oct 17, 2020",what happen to 14
14,"Oct 17, 2020",Aaah
14,"Oct 17, 2020",Well shit he a smooth talker- 
14,"Oct 17, 2020",i don't know but bihyeong kinda look cute without all his threats gahhahahh he turned into a baby at the last scene 😂
14,"Oct 17, 2020",Plot twist all the people reading this webtoon are constellations
14,"Oct 17, 2020",I Want to be the very best (streamer) that no one ever was! To get them subs is my real test And to get them likes is my cause!🎵🎶🎵🎶🎵
14,"Oct 17, 2020",Biyungs face on the last panel is kinda cute :)
14,"Oct 17, 2020","Lmao, he really just about to make the dokaebi the best twitch streamer out there"
14,"Oct 17, 2020",This guys ballsy I like em
14,"Oct 17, 2020",his eyes on the last panel: all i needed
14,"Oct 17, 2020",BIHYEONG!!😭😭💖💖💖
14,"Oct 17, 2020","This is kinda like the hunger games, also I totally thought the TWSA protagonist was gonna be our MC lol oh well. The regressor looks so good tho"
14,"Oct 17, 2020",I just think dokaebi was so cute.. Anyone agree? 
14,"Oct 17, 2020","I know he was the only reader and all, but it's still strange that he is so calm of the whole situation. I mean, if my favorite webtoon or story suddenly became reality and it was something like this, I would be a bit freaked"
14,"Oct 17, 2020","CLEVER!! Because he is very popular. With the constellations, he can keep doing what he's doing, and the streamer dude will keep him alive for him to get more consolation to see him, then lots of people will like him, because, you know, he's very popular, and then they're like, wow, you're doing such crazy things, so they'll like him, and he'll become, I don't remember his name, but he will be kind dude!! "
