Episode,Date,Review
88,"Feb 17, 2022",[a constellation who likes to change genders is intrigued] is my favorite lmao
88,"Feb 13, 2022",I love how dokja doesn’t let go of the fact he’s owed a reward hahahaha
88,"Feb 5, 2022",Yea he looks hoooot😍
88,"Jan 27, 2022",Sangah my girl 🥺
88,"Jan 19, 2022",LETSSSS GOOO DOKJA GOT HIS WHITE COAT 
88,"Jan 19, 2022",this just keeps getting better
88,"Jan 19, 2022",I gotta say I'm very excited to see what happens next
88,"Jan 19, 2022",I genuinely had a panic attack when I saw the white lapels of his coat. H e l p
88,"Jan 19, 2022",Sangah's heart is so pure🥺
88,"Jan 19, 2022",White-coated Kim Dokja 🌟🌟🌟 SUPREMACY 🌟🌟🌟🛐🛐🛐🛐🛐🛐
88,"Feb 23, 2022",please tell me i wasn't the only one who saw [A CONSTELLATION WHO LOVES K-POP WANTS TO BE YOUR SUPPORTING CONSTELLATION] in the first few slides- please I'm rofl rn- also- singularity- I-
88,"Feb 23, 2022",LMAO DID YOU SEE THE CONSTELLATION THAT LOVES KPOP?THATS SO WHOLESOME 
88,"Feb 23, 2022",WHY FOCUS IN CLASS WHEN THERES AN ORV UPDATE 
88,"Jan 19, 2022","bruh this ""Natsumi_i"" chick in the comments needs to relax god damn 500 comments about how she wants to blow dokja"
88,"Jan 19, 2022","FINALLY!! KIM DOKJA WITH WHITE COATTT!! Also, I'm gonna say this again, Kim Dokja is the BEST WINGMAN LMAO.Btw, her constellation sponsor is a whole Olympus family? Damn "
88,"Oct 8, 2022",[the constellation that likes to change genders] 😂 
88,"Sep 23, 2022",Bihyeong cutie though scary 🤧
88,"Sep 23, 2022",i think the constellations forced her to take them
88,"Jan 19, 2022",LETSSSS GOOO DOKJA GOT HIS WHITE COAT 
88,"Jan 19, 2022",this just keeps getting better
88,"Jan 19, 2022",I gotta say I'm very excited to see what happens next
88,"Jan 19, 2022",I genuinely had a panic attack when I saw the white lapels of his coat. H e l p
88,"Jan 19, 2022",Sangah's heart is so pure🥺
88,"Jan 19, 2022",White-coated Kim Dokja 🌟🌟🌟 SUPREMACY 🌟🌟🌟🛐🛐🛐🛐🛐🛐
88,"Feb 23, 2022",please tell me i wasn't the only one who saw [A CONSTELLATION WHO LOVES K-POP WANTS TO BE YOUR SUPPORTING CONSTELLATION] in the first few slides- please I'm rofl rn- also- singularity- I-
88,"Feb 23, 2022",LMAO DID YOU SEE THE CONSTELLATION THAT LOVES KPOP?THATS SO WHOLESOME 
88,"Feb 23, 2022",WHY FOCUS IN CLASS WHEN THERES AN ORV UPDATE 
88,"Jan 19, 2022","bruh this ""Natsumi_i"" chick in the comments needs to relax god damn 500 comments about how she wants to blow dokja"
88,"Jan 19, 2022","FINALLY!! KIM DOKJA WITH WHITE COATTT!! Also, I'm gonna say this again, Kim Dokja is the BEST WINGMAN LMAO.Btw, her constellation sponsor is a whole Olympus family? Damn "
88,"Oct 8, 2022",[the constellation that likes to change genders] 😂 
88,"Sep 23, 2022",Bihyeong cutie though scary 🤧
88,"Sep 23, 2022",i think the constellations forced her to take them
88,"Jul 11, 2022","I just realised.. did dokja just describe hyeonseong as a ""sad-looking soldier"" 🤣"
88,"Jul 11, 2022",ooh nice a constellation that likes to change genders so like gender fluid like me :D
88,"Jul 8, 2022",the fact that greek mythology is involved brings me so much joy.
88,"Jul 1, 2022","Ah yes, the white coat. Prepare for pain worse than Banana Fish (apparently- somebody on TikTok said that it’s worse than Banana Fish but who knows? I’m scared TwT)"
88,"Jun 30, 2022","THE CONSTELLATION LIKES K-POP, THIS IS CONFIRMED."
88,"Jun 30, 2022","shit i feel bad for sangah, those are some of the worst gods who use humans as nothing but toys"
88,"Jun 24, 2022","""A CONSTELLATION WHO LOVES K-POP"" ???????? "
88,"Jun 23, 2022",The demonic judge of fire is shipping Dokja and junghyeok hard
88,"Jun 8, 2022",uriel is and will continue to be a great wingwoman
88,"Jun 4, 2022",Couple outfit: the Light and the Dark
88,"Jun 1, 2022",I still ship dokja and junghyeok
88,"May 30, 2022",‘a constellation who likes to change genders is intrigued’ we love a genderfluid icon
88,"May 30, 2022",The iconic white coat>>>>
88,"May 26, 2022",I absolutely LOVE the Constellations' names ♡
88,"May 25, 2022","that constellation that likes to change genders... me too... only once, tho."
88,"May 24, 2022","who else thinks bihyeong is too cute
"
88,"May 21, 2022",OMG OMG OFFICIAL FAN PF THE CONSTELLATION THAT LIKES TO CHANGE GENDERS
88,"May 20, 2022",Explain to me why there is a constellation who likes to change genders?
88,"May 12, 2022",as an avid trench coat wearer I can vouch for that SSS items inventory capacity.
88,"May 11, 2022","sangah is so cuteee and aww she's gone thru a lot,,,, and why are so many constellations in her what?????"
88,"May 11, 2022",a constellation who likes to change genders???? souNDS FUN
88,"May 11, 2022",hahahaha love the new black n white dynamic between kdj and yjh
88,"May 6, 2022",a constellation that likes kpop hahahah
88,"May 6, 2022",Man's finally got the drip. Huzzah.
88,"May 5, 2022",holy cow where's the holy water! 
88,"May 5, 2022","Lmao did anyone notice it saying ""the constellation that likes K-pop"" 😂😂👌👌"
88,"May 4, 2022",greek mythology was the only thing missing!!
88,"May 3, 2022",They're finally a matching couple
88,"May 3, 2022",Dokja softly smiling is so cute??
88,"May 3, 2022",“A Constellation Who Loves KPop” i bet with my life its an american constellation lmao
88,"May 3, 2022",How is no one talking about how cute Bihyeong was when he was sulking?😭 
88,"Apr 30, 2022","Admit it! Suhyeon is just like most of us! We ship them together,  and even think they're wearing matching coats! 😂😂😂"
88,"Apr 30, 2022","""[A Constellation who likes KPOP would like to be your supporting Constellation]"" Excuse me what lmao"
88,"Apr 27, 2022",THE CONSTELLATION WHO LIKES TO SWITCH GENDERS IS ALSO A JUNGHYEOK X DOKJA SHIPPER SLAAYYYYY 
88,"Apr 24, 2022","A constellation who likes to change genders? Loki, is that you?"
88,"Apr 20, 2022","I'm sorry, constellations of Olympus? LIKE ALL OF THEM?"
88,"Apr 19, 2022",finally I can see that white coat coat 
88,"Apr 19, 2022",I am most definitely not shipping our 2 MCs and i a tottally not writing a bl fanfic about them （⌒▽⌒）
88,"Apr 16, 2022",look at them in their couples fits 😍 
88,"Apr 11, 2022",[The constellation 'Mentally Ill Non-binary' is excited over the possibility of an ennemies to lovers plot.] [The constellation 'Mentally Ill Non-binary' looks forward to seeing how Dokja's plan unfolds.] [100 coins have been sponsored.]
88,"Apr 10, 2022",MATCHING COUPLE COATS OMG 🥺🥺🥺🤧🤧🤧🤧
88,"Apr 9, 2022",I hope the kiddo is alright… now that one problem is solved I hope Dokja is going to reunite at least with him!
88,"Apr 8, 2022",Must be a major group constellation thing like with the stars of the big dipper. Awwww there's the adorable Sangah we all know and love. The things she must have seen must have deeply affected her. Knowing there's nothing she could do and how quickly people are to turn on each other and abandon their humanity. I hope her and Dokja can reconcile. Sangah appreciation: She got curves for days 😍
88,"Apr 8, 2022",[construction royal nurse who has lost her sense of taste] was caught in 4K jotting down the recipe. Why? They can't taste...
88,"Apr 3, 2022",dokja with a white coat 😭
88,"Apr 2, 2022",The Constellations of Olympus are so hot kkk
88,"Apr 1, 2022",“The Constellation Who Loves K-pop wants to be your supporting constellation” Am i the only one who seen that🤔
88,"Apr 1, 2022",That demonic what of fire constellation ship the mls and meanwhile we are surprised by sangah having these many constellations supporting her why do i get this feeling she is the fl i had this from the beginning. Btw love how she was jealous of our plagiarising(not sure if the word fits the sentence) girl. 
88,"Mar 30, 2022",So it WAS the whole main pantheon!
88,"Mar 30, 2022","I see you ""Constellation Who Likes Kpop"""
88,"Mar 27, 2022",when the lil demon was crying wahh!! he's so goddamn cute!!!🥺📸✨
88,"Mar 25, 2022",yeeessss....! the iconic White Coat is Finally here!!!! 😭👍👏👏👏👏
88,"Mar 24, 2022",bihyeong is lowkey cute tho😔🤚🏻
88,"Mar 20, 2022","""A CONSTELLATION WHO LOVES K-POP WANTS TO BE YOUR SUPPORTING CONSTELLATION"" HAHAHASDHSKLH probably referring to me lmao "
88,"Mar 20, 2022",YESSSSSSS DOKJA'S SIGNATURE COAT IS HERE ☺☺☺ Matching with Junghyeok hehehehe
88,"Mar 18, 2022",ITS ME. IM THE CONSTELLATION WHO LIKES TO CHANGE GENDERS
88,"Mar 15, 2022",Did someone else notice ? A constellation who loves k-pop is that me ?
88,"Mar 14, 2022",the couple outfits we stan
88,"Mar 14, 2022",Stop I'm literally just too obsessed with Sangah😭
88,"Mar 13, 2022",Goodbye dokja’s beautiful brown suit😭😭
88,"Mar 13, 2022",sangah.
88,"Mar 13, 2022","I feel like people aren't appreciating this artwork enough, especially with the whole Constellations of Olympos. This is a beautiful Webtoon"
88,"Mar 13, 2022",THAT LAST PANEL OH MY GOD
88,"Mar 12, 2022",I wanna hug you...too cute...
88,"Mar 10, 2022","Sangah and her lil nom nom face is just too cute.. I guess I should've phrased that as;{ [Sangah]'s passive skill [being cute] has taken effect, skill was [highly effective] }"
88,"Mar 10, 2022",DANG SARAH IS SO PRETTY 😩😩😩
88,"Mar 10, 2022",DOKJA'S SMILE WHEN HE SEES BIHYEONG HAPPY AND BIHYEONG BEING HAPPY IS THE BEST THING EVER
88,"Mar 10, 2022","On Oct 26, 2020, I posted a comment on chapter 18 asking how long would it take for us to see Dokja in his white coat. And here we are with the white coat~ It sure took a long time but it was worth it."
88,"Mar 9, 2022",BIHYEONG'S CUTENESS IS WHAT I LIVE FORRRR!!!💗💗💗💗
88,"Mar 9, 2022",I HAVE WAITED FOR THE WHITE COAT FOR TO LONGG
88,"Mar 9, 2022",THE WHITE COAT IS FINALLY HERE
88,"Mar 9, 2022",DOKJA IS SO HOT OML and oohooo:3 they're matching coats.. ehe hehe and that one constellation is happy abt it lmaooo 
88,"Mar 9, 2022",it's olympus fjhdkla where'd they get olympos from
88,"Mar 9, 2022",The traslaters are anti-jungdok. :''''(((
88,"Mar 6, 2022",She doesn’t have that many supporting constellations it’s just showing the Olympia gods as constellations 
88,"Mar 13, 2022",sangah.
88,"Mar 13, 2022","I feel like people aren't appreciating this artwork enough, especially with the whole Constellations of Olympos. This is a beautiful Webtoon"
88,"Mar 13, 2022",THAT LAST PANEL OH MY GOD
88,"Mar 12, 2022",I wanna hug you...too cute...
88,"Mar 10, 2022","Sangah and her lil nom nom face is just too cute.. I guess I should've phrased that as;{ [Sangah]'s passive skill [being cute] has taken effect, skill was [highly effective] }"
88,"Mar 10, 2022",DANG SARAH IS SO PRETTY 😩😩😩
88,"Mar 10, 2022",DOKJA'S SMILE WHEN HE SEES BIHYEONG HAPPY AND BIHYEONG BEING HAPPY IS THE BEST THING EVER
88,"Mar 10, 2022","On Oct 26, 2020, I posted a comment on chapter 18 asking how long would it take for us to see Dokja in his white coat. And here we are with the white coat~ It sure took a long time but it was worth it."
88,"Mar 9, 2022",BIHYEONG'S CUTENESS IS WHAT I LIVE FORRRR!!!💗💗💗💗
88,"Mar 9, 2022",I HAVE WAITED FOR THE WHITE COAT FOR TO LONGG
88,"Mar 9, 2022",THE WHITE COAT IS FINALLY HERE
88,"Mar 9, 2022",DOKJA IS SO HOT OML and oohooo:3 they're matching coats.. ehe hehe and that one constellation is happy abt it lmaooo 
88,"Mar 9, 2022",it's olympus fjhdkla where'd they get olympos from
88,"Mar 9, 2022",The traslaters are anti-jungdok. :''''(((
88,"Mar 6, 2022",She doesn’t have that many supporting constellations it’s just showing the Olympia gods as constellations 
88,"Mar 2, 2022",Just marry him already we ship you
88,"Mar 2, 2022","[Constellation ""The Opal Fox"" is pulling their hair out in anticipation]"
88,"Mar 1, 2022",I wonder how the other are doing (T.T)
88,"Mar 1, 2022",love the new fit 😘… especially since it completes the couple look 😏
88,"Feb 28, 2022",UGH I FORGOT HE SMILED AT THE TRAILER OMG THE SMIRK https://vm.tiktok.com/ZMLSPYDbJ/
88,"Feb 28, 2022",LOOK AT THIS LMAO CAUSE NAHH FR https://vm.tiktok.com/ZMLSfEvWn/
88,"Feb 28, 2022","Oh man, are those guys evil or something is Sangah gonna be okay?"
88,"Feb 28, 2022",The dream of matching opposite coats i've always wanted is finally coming true in a webtoon 
88,"Feb 28, 2022",Sangah still best girl😭😭😎.
88,"Feb 28, 2022",the mc just needs to eat and sleep coins aren't a issue with him
88,"Feb 28, 2022","i don't want to be that kind of person but it bothers me how they made a typo with Olympus as ""Olympos"""
88,"Feb 28, 2022",bihyeongs so happy🥺
88,"Feb 28, 2022",SHE HAS 5 CONSTELLATIONS 
88,"Feb 28, 2022",R.I.P Yanaspleta.
88,"Feb 28, 2022",A constellation who likes what.
88,"Mar 2, 2022",Just marry him already we ship you
88,"Mar 2, 2022","[Constellation ""The Opal Fox"" is pulling their hair out in anticipation]"
88,"Mar 1, 2022",I wonder how the other are doing (T.T)
88,"Mar 1, 2022",love the new fit 😘… especially since it completes the couple look 😏
88,"Feb 28, 2022",UGH I FORGOT HE SMILED AT THE TRAILER OMG THE SMIRK https://vm.tiktok.com/ZMLSPYDbJ/
88,"Feb 28, 2022",LOOK AT THIS LMAO CAUSE NAHH FR https://vm.tiktok.com/ZMLSfEvWn/
88,"Feb 28, 2022","Oh man, are those guys evil or something is Sangah gonna be okay?"
88,"Feb 28, 2022",The dream of matching opposite coats i've always wanted is finally coming true in a webtoon 
88,"Feb 28, 2022",Sangah still best girl😭😭😎.
88,"Feb 28, 2022",the mc just needs to eat and sleep coins aren't a issue with him
88,"Feb 28, 2022","i don't want to be that kind of person but it bothers me how they made a typo with Olympus as ""Olympos"""
88,"Feb 28, 2022",bihyeongs so happy🥺
88,"Feb 28, 2022",SHE HAS 5 CONSTELLATIONS 
88,"Feb 28, 2022",R.I.P Yanaspleta.
88,"Feb 28, 2022",A constellation who likes what.
88,"Feb 26, 2022",i like this constellation who likes to switch genders
88,"Feb 26, 2022",So does Sangah have 7 constellations?
88,"Feb 26, 2022",[The constellation Miss of Donuts with Jelly has been left speechless] [The constellation Miss of donuts with jelly is very confused and awaits with emotion the next chapter] [The constellation Miss Donuts with Jelly is happy to see their favorite characters in couple outfit lol] 
88,"Feb 26, 2022",Uriel (Demonic judge of fire) shipping our MC cuz of the coats😍
88,"Feb 26, 2022",wasnt expecting Sangah has multiple constellations behind her 👁👄👁
88,"Feb 26, 2022","They didn't just have a white coat, the author probably chose white to have it contrast Junghyeok so when they fight it is easy to tell who is who, also just in general it makes it easier."
88,"Feb 26, 2022",The art for the Olympus constellations is so amazing
88,"Feb 26, 2022",“A constellation who likes k-pop” “A constellation who likes to change genders” lmaoooo the descriptives are cool
88,"Feb 26, 2022",Reincarnator is a great web novel.
88,"Feb 25, 2022",That last panel was gorgeous 😭😭😭😭
88,"Feb 25, 2022",OF COURSE THEY LEAVE A CLIFFHANGER!the consolation of Manga reader is displeased
88,"Feb 25, 2022","Thinking about it, I haven't seen the sweet newcomer to the city and the dude who wants to become the mayor yet...."
88,"Feb 25, 2022","Lee Jihye: Master, did you know ""thot"" means ""thoughtful person."" //Yoo Jonghyuk, skeptical: Really? //
Lee Jihye: Yes! ///
(later) ///
Yoo Jonghyuk: Thank you for helping me with wrapping the dumplings, Sooyoung. //
Yoo Jonghyuk: …You're such a thot. //
Sooyoung, wheezing: I'm a WHAT?"
88,"Feb 25, 2022","Yoo Jonghyuk: now why. god forbid HOW. did you TAPE YOURSELF UPSIDE DOWN TO THE CEILING?! //Kim Dokja: to be cocooned. one with the moth. //
Yoo Jonghyuk: the blood is rushing to your head isn’t it //
Kim Dokja: yes. im about to black out."
88,"Feb 25, 2022","Sooyoung, rubbing her temple: I think it’s time I get my life in order. //Dokja, narrating: But she did not get her life in order. In fact, she got drunk last night and fought a raccoon. //
Han Sooyoung: Like you’re one to talk, Mr Sole Reader of a shit novel. //
Kim Dokja: Oi-"
88,"Feb 25, 2022",there is such a constalation who love k-pop??
88,"Feb 25, 2022",Damnnn Sangah has those many constellations?
88,"Feb 25, 2022",Constatation if the pizza God's is interested in how the rest of this will go and what happens at the end of novel. :3
88,"Feb 25, 2022",UGH I HATE THE PEOPLE AT CH 92. THEY'RE CALLING THE REASON WHY DOKJA IS CONSIDERED UGLY HILARIOUS 
88,"Feb 25, 2022",She didn’t only get one incarnation contract but the whole damn Olympos
88,"Feb 25, 2022",I know no one will see this comment but does anyone know what chapter this is in the webnovel 
88,"Feb 25, 2022","""infinite dimension""""it has limited number of pockets""
excuse me what?"
88,"Feb 25, 2022","Constellation: “Haunter of 6,000 Greens” is excited to see what will happen next "
88,"Feb 25, 2022",Aww man it’s the weenies from Olympos not even the neat Deity-level ones from Olympus but the non-Deity level ones from Olympos (You can probably tell I’m just joking at this point)
88,"Feb 25, 2022",not one of the blue screens saying [a constellation who loves kpop wants to be your supporting constellation] 🥴
88,"Feb 25, 2022","is it ALL of the olympians? no way, that'd be op"
88,"Feb 25, 2022","You're telling me Sangah is backed by all the Olympian gods? And it's looking like all the powerful people have long coats, Dokja finally got his true level-up. His clothes underneath match Junghyeok too."
88,"Feb 25, 2022",Yay it’s finally the fourth day
88,"Feb 25, 2022",NOOOO DONT LEAVE JUNGHEOK WITH THAT WOMAN!!!!!!!!!! he might like herrrr 😭😭 he needs to stay with Dokja! they even got a couple outfit
88,"Feb 25, 2022","The plant has meat, somehow that's the thing I found the weirdest"
88,"Feb 24, 2022",The damned cliff hanger
88,"Feb 24, 2022","Yoo Jonghyuk: I have no fear //Han Sooyoung: What if you wake up one day and Dokja is taller than you? //
Yoo Jonghyuk: I have one fear"
88,"Feb 24, 2022",Wow Sangah I got goosebumps just looking at your sudden transformation.  😱
88,"Feb 24, 2022",nerf miner
88,"Feb 24, 2022",I love the matching coats 
88,"Feb 24, 2022",yessssss the coat has finally arrived!!
88,"Feb 24, 2022","Please don't let Zeus be one, please don't let Zeus be one, please don't let Zeus be one, please tell me Zeus isn't one of the constalations of olympus"
88,"Feb 24, 2022",What happened to the little boy??? If something did happen and I forgot I need to know because I feel said he’s gone
88,"Feb 24, 2022",so cool 👀
88,"Feb 24, 2022",Now I feel stupid for being certain that Sangah's constellation is Perseus.
88,"Feb 24, 2022",Ah that’s perfect haha I was so scared for a minute he’s betray bihyeong whew
88,"Feb 24, 2022",sangah the loml
88,"Feb 24, 2022","Why ""The Constellation Olympic"" people look so haaat😤👌🏼😵🤤"
88,"Feb 24, 2022",SANGHA BEING THE (CURRENT) ONLY ONE TO HAVE MULTIPLE CONSTELLATIONS IS PERFECT
88,"Feb 24, 2022","gimmie more, I need more but I have no coins to spend"
88,"Feb 24, 2022",The Greek gods continues to mess with people
88,"Feb 24, 2022",[Constellation: blue-haired idol from the nebula Thousand computer voice is curious] 
88,"Feb 24, 2022",You better like that coat cause it will be his outfit from now on √°^°\
88,"Feb 24, 2022","damnit, I wanna see this conversation "
88,"Feb 24, 2022","Wait... by ""likes to change genders,"" does that mean their own gender or the gender of incarnations..."
88,"Feb 24, 2022",unus annus unus annus
88,"Feb 24, 2022",[constellation “Girl of the Furnace” is anticipating a great battle]
88,"Feb 24, 2022","hey Author, can you make a panel of just tiny ciying Dojekay (i know i spelled his anme wrong, im sorry. hes the white one) so i can screen shot it for my background? please?"
88,"Feb 24, 2022",HAHA CONSTELLATION THAT LIKES KPOP THATS SO ME
88,"Feb 24, 2022",you dokja was oringinally gay but the author was bullied into changing there sexualities it would have been a canon ship urghhh😭😭😭
88,"Feb 24, 2022",couples should wear matching clothes
88,"Feb 24, 2022",the constellation who likes to change genders is such a mood 
88,"Feb 24, 2022",NO WAY. MY GUY MADE LEAN!!!!!!!
88,"Feb 24, 2022",that explains why she seemed different sometimes .. also matching clothes ftw 🙌
88,"Feb 24, 2022","I WANNA HUG BIHYEONG,, HE'S SO ADORABLE XJRIEBSBHSSH ʕっ•ᴥ•ʔっ"
88,"Feb 24, 2022",I actually kinda don't like how dokja used sangah like that (put her to sleep just to call her constellations) but okay i guess.. 
88,"Feb 24, 2022",They have matching couple outfits now!!!! sjdgshdhdh
88,"Feb 23, 2022","Jihye: Did you see what Sangah did today? //
Dokja, leaning in curiously: No? What did she do? //

Jihye, ready to spill the tea: She winked at Sooyoung. //

Kim Dokja: Oh. //

Huiwon, confused: What do you mean, oh? Aren’t you shipping them? I thought you’d be excited over this? //

Kim Dokja: I thought everyone knew they was together already. It’s normal for that to happen.
// Huiwon and Jihye in shock: Since whenn??? //

Kim Dokja: Um, since a while? I thought at least you know, Huiwon."
88,"Feb 23, 2022",Awwwww Bihyeong tearing up 🥺
88,"Feb 23, 2022",HOLY CRAAAAP ITS THE WHOLE OLYMPUS!! AT SANGAH
88,"Feb 23, 2022",[Constellation 'The One Who Seeks Knowledge' is rubbing it's fins together in excitement] [Continued readership has been sponsored]
88,"Feb 23, 2022","[Constellation ""Kratos"" starts warming up]"
88,"Feb 23, 2022",He’s got the coat that it shows in the first episode! If that’s the same coat then the plagiarist girl should get one too right?
88,"Feb 23, 2022",Singularity??? That's the chapter's name??? [A Constellation That Loves KPOP loves the chapter name. 200 coins have been donated]
88,"Feb 23, 2022",AW SHIET
88,"Feb 23, 2022","Just realized I'm not sure how long we've been in ""Remaining time: 7 days"" "
88,"Feb 23, 2022",so sangah actually have the whole greek pantheon as her constellation
88,"Feb 23, 2022",I also again saw 'bigheaddick' who told me to relax lmaoo. They're in 481-510
88,"Feb 23, 2022",I LOVE THE GREEK MYTHS!!!!!
88,"Feb 23, 2022",I'm laughing at kendo fanboy's comment about Dokja's second sword lmao. They're talking to themselves.
88,"Feb 23, 2022","""A constellation who likes to change genders is intrigued"" oh my, give me your power (also, genderfluid representation!) "
88,"Feb 23, 2022",Ohhh gushhh .. 
88,"Feb 23, 2022",WOOOO 🥳 🎉 1000 COMMENTS REACHED
88,"Feb 23, 2022",it worries me that a constellation like gender changes. looked back and it was the constellation likes to change genders. interesting how two word swaps give different meanings here.
88,"Feb 23, 2022",k-pop who wants to be ur constellation?!?
88,"Feb 23, 2022",wait she got a WHOLE SET OF THEM?
88,"Feb 23, 2022",constellation of the icy Burritoes has seen Dokja worthy of a sponsor....now I must mind money
88,"Feb 23, 2022",what chapter is this in ln
88,"Feb 23, 2022",Holy mother of all cliffhangers. And this was the first day of the week.
88,"Feb 23, 2022",Constellation who loves KPOP ( please be my supporting constellation )
88,"Feb 23, 2022","""A CONSTELLATION WHO LOVES K-POP WANTS TO BE YOUR SUPPORTING CONSTELLATION"" HAHAHAHAHA LOOL😂😂😂😭"
88,"Feb 23, 2022",Link was one of her constellations?!
88,"Feb 23, 2022","""Insignificant"" ?!?!?! You know who you're talking to right?"
88,"Feb 23, 2022","""A constellation who loves K-pop wants to be your supporting constellation"" HEY DUDE COUNT ME IN"
88,"Feb 23, 2022",IS THAT ACHILLES ON THE RIGHT??????
88,"Feb 23, 2022","""A constellation who likes to change genders is intrigued"" oh my, give me your power (also, genderfluid representation!) "
88,"Feb 23, 2022",Ohhh gushhh .. 
88,"Feb 23, 2022",WOOOO 🥳 🎉 1000 COMMENTS REACHED
88,"Feb 23, 2022",it worries me that a constellation like gender changes. looked back and it was the constellation likes to change genders. interesting how two word swaps give different meanings here.
88,"Feb 23, 2022",k-pop who wants to be ur constellation?!?
88,"Feb 23, 2022",wait she got a WHOLE SET OF THEM?
88,"Feb 23, 2022",constellation of the icy Burritoes has seen Dokja worthy of a sponsor....now I must mind money
88,"Feb 23, 2022",what chapter is this in ln
88,"Feb 23, 2022",Holy mother of all cliffhangers. And this was the first day of the week.
88,"Feb 23, 2022",Constellation who loves KPOP ( please be my supporting constellation )
88,"Feb 23, 2022","""A CONSTELLATION WHO LOVES K-POP WANTS TO BE YOUR SUPPORTING CONSTELLATION"" HAHAHAHAHA LOOL😂😂😂😭"
88,"Feb 23, 2022",Link was one of her constellations?!
88,"Feb 23, 2022","""Insignificant"" ?!?!?! You know who you're talking to right?"
88,"Feb 23, 2022","""A constellation who loves K-pop wants to be your supporting constellation"" HEY DUDE COUNT ME IN"
88,"Feb 23, 2022",IS THAT ACHILLES ON THE RIGHT??????
88,"Feb 23, 2022",OMG FINALLY IT'S THE COAAAAAT
88,"Feb 23, 2022",He better not meet kratos
88,"Feb 23, 2022",What ever happened to the little guy and soldier dude
88,"Feb 23, 2022",Olympus? BRING KRATOS IN!!!
88,"Feb 23, 2022",OK SANGAH!!! 
88,"Feb 23, 2022",what happened to the constellation [Lazy Broke Weeb]?
88,"Feb 23, 2022",I'm actually surprised Bihyeong didn't adjust his aim to send Dokgak into a black hole of no return XD
88,"Feb 23, 2022",ayeee that jacket~ excited to hear from the Olympus people
88,"Feb 23, 2022",uriel is so relatable. also white coat is here! and sangah looks so badass and pretty 😳
88,"Feb 23, 2022","awwww bihyeong you deserved this, also Sangah looking pretty hot"
88,"Feb 23, 2022",Not me getting hyped when he came back like “dokja has a pretty cloak dokja has a pretty cloak dokjahasaprettycloakdokjahasaprettycloak”
88,"Feb 23, 2022",ily sangah starts crying*
88,"Feb 23, 2022",“olympos” 😭
