Episode,Date,Review
88,"May 17, 2022","I love how Bihyung is now drawn in a cutesy sort of way, compared to his original design when we first saw him. Even in the last chapter when he was really tall and buff, his scary face didn't look anywhere as menacing as it did in the first couple chapters! hahaha. I absolutely freaking love this little guy. I've said this before, but he's definitely in my top 3.  1. Dokja 
  2. Sooyoung
  3. Bihyung
  4. Gilyoung
  5. Junghyeok/Heewon
    - Can't decide between Yu & Jung for 5th place. "
88,"May 17, 2022",i knew it was the whole of olympus or atleast the ruling class who are her constellations.Aint no way she'd get that strong and ruthless in such a short time with one constellation.
88,"May 17, 2022",ngl the artwork in this is really beautiful
88,"May 17, 2022",bihyeong is so cute 🥰 (would pet even tho it would get me killed)
88,"May 15, 2022",seriously contradicted yourself with the coat infinity has no limit but in the discription it says coat has a limit....
88,"May 15, 2022",please i love this webtoon so much 😭♥️♥️
88,"May 14, 2022",Okay. Can we just appreciate all the absolute lovely and beautiful art work that they made? Like look at the damned constellation set work!
88,"May 14, 2022",Am I the only one who noticed “a constellation that wants to change genders”
88,"May 14, 2022",Twins👬❤️‍🔥
88,"May 14, 2022",My love of joondok 📈📈📈📈📈📈📈📈
88,"May 13, 2022",i see the demonic judge of fire is representing our emotions 
88,"May 13, 2022",the Demonic Judge of Fire is happy for some reason... we're the same🤝🏼
88,"May 12, 2022",Uhhhhh isn't it supposed to be the constellations of Olympus not Olympos??
88,"May 12, 2022",[A Constellation Who Loves K-Pop....] lmao 
88,"May 12, 2022",CONSTELLLATION WHO LIKES KPOP LOL
88,"May 12, 2022",Ah the classic same outfit opposing color scheme. My brother and I would do that in video games all the time.
88,"May 11, 2022",love the new dokja fit (๑♡⌓♡๑)
88,"May 11, 2022",I feel real happy that bihyeong has levelled up !!
88,"May 11, 2022",[A constellation who loves k-pop wants to be your supporting constellation] DAMN I WISH
88,"May 10, 2022","is he still passed out, means he hoping that he is not giving the death glare for real"
88,"May 10, 2022","Let's face it, Dokja is purposefully trying to dress like his hero"
88,"May 10, 2022","Constellation, ""Demonic Judge Of Fire"" is heavily shipping Dokja Kim and Junghyeok Yu. I love this constellation so much lol! They've been shipping them after the whole ""you have a kid?"" incident 🤣"
88,"May 9, 2022",The constellations of olympus are all so beautiful wth
88,"May 9, 2022",he knows everything that i didn't expect lol
88,"May 9, 2022",sangah!?!????? ㅠㅠ
88,"May 8, 2022",[Pls reply to the comments below Oniichan]
88,"May 8, 2022",[True colors unlocked]
88,"May 8, 2022",OH SHE HAW ALL OF THEM?? 
88,"May 8, 2022",some sussy constellations 
88,"May 8, 2022","""constellation who loves the kpop"" and ""change gender"" 👌🏻"
88,"May 6, 2022",wait wait who gave sangah a tail
88,"May 6, 2022",That was the longest day I've experienced since DBZ
88,"May 6, 2022",OMG YESS LET'S GOO
88,"Apr 29, 2022",The constellation who loves K-pop 
88,"Apr 28, 2022",Demonic Judge of Fire ships it too 😂😂
88,"Apr 28, 2022","wait, I thought that even touching the roots of that big flower plant would trigger it to attack them? how are they able to eat it??"
88,"Apr 25, 2022",Bihyeong is super cute... he is the best dokkaebi among them.
88,"Apr 24, 2022","""Have you two decided to wear matching outfits?"" plsssssss💀 ejdjfbjdndndifjsbsdhkdjdhdhehd"
88,"Apr 24, 2022",wait... chapter 19? Are we still at chapter 19 of the novel? and the novel is around 300 chapters right? Woah... we have looking way to go ( ◜‿◝ )♡
88,"Apr 24, 2022",Uriel is a shipper yessss
88,"Apr 24, 2022",Now we have couple outfit
88,"Apr 24, 2022",That final scene is crazyyy
88,"Apr 23, 2022",Dokja and Junghyeok are like the taeguek.
88,"Apr 23, 2022","So this was the famous coat I saw in novel art. I thought who is it because dokja and junghyeok look same to me in novel pictures and after all its dokja yayyyy. ""Demonic judge of fire""😏😏😂🤣"
88,"Apr 22, 2022","I wanna take a screenshot of bihyeongs happiness but i might get reported for ""pirating"" TvT i just wanna take a pic of my fav character😭"
88,"Apr 22, 2022",all of them?
88,"Apr 22, 2022",just joining webtoon and I can't seem to get enough of this 🤧
88,"Apr 22, 2022","[Constellation ""Manager Of Stranges"" Is Angry At The OLYMPOS CONSTELLATIANS, Of, Olympos Is Controlling Her!][Constellation ""Manager Of Stranges""]"
88,"Apr 22, 2022",Couple outfits ☺️
88,"Apr 22, 2022",Becomes an intergalactic cooking channel. 
88,"Apr 21, 2022",the constellations ships dokja and junghyeok lmao 😂😂😂
88,"Apr 21, 2022",Sangah so powerful
88,"Apr 18, 2022",aww couple goals
88,"Apr 17, 2022",THE WHITE COAT
88,"Apr 16, 2022","am i the only one who saw ""a constellation who loves k-pop"" in the panel at the beginning? 🤣"
88,"Apr 16, 2022","So many constellations in, one body...? It sure must be tough"
88,"Apr 16, 2022",a
88,"Apr 15, 2022",Good Chapter 👍
88,"Apr 14, 2022",looking hot Dokja
88,"Apr 14, 2022",Korean Kaiba 😂
88,"Apr 13, 2022",wait. only a month has passed????????
88,"Apr 13, 2022",OH MY GOSH 
88,"Apr 11, 2022",The artwork at the ends is *chefs kiss* 
88,"Apr 11, 2022",random thought but dokja would make a great therapist
88,"Apr 10, 2022",Bihyeong looks so happy and it makes me feel special 
88,"Apr 9, 2022","the constellation who likes to change genders
what is that even supposed to mean..."
88,"Apr 8, 2022",Lmao The Demonic Judge of Fire is just a girl into BL ships 🤣 She approves of the matching couples outfits 
88,"Apr 6, 2022",THE COUPLE THINGS
88,"Apr 4, 2022",where is the kid? is he???????
88,"Apr 4, 2022",couple outfits
88,"Apr 3, 2022","Wait?! How the hell does she have so many? She didn't have any good skills in the beginning to have that many supporters, so how did she get them?!"
88,"Apr 1, 2022",demonic judge of fire ships them.
88,"Apr 1, 2022",My gosh 
88,"Mar 31, 2022",ARIEL MY LOVE
88,"Mar 27, 2022",dokyeok be wearing couple outfits aye🤨📸
88,"Mar 27, 2022","wait so did dokja kill the catastrophe of questions coz he's not supposed to do that becuz of his oath... plus, he must have gained karma points coz he saved the poison beauty from the parasite, right? the notif of gaining karma points didn't show when he saved her... "
88,"Mar 26, 2022",I see some constellations have same opinion as me 😂 But i must say i enjoy mc changing outfit…(^q^)
88,"Mar 24, 2022",Duo OUTFIT Unlocked : Yin Yang Coat of Dimensions. or Indra and Asura are declared.
88,"Mar 23, 2022","AYAYAYAYA *Pillar men, er I mean constellations theme plays*"
88,"Mar 23, 2022",Wait ALL of the Olympics constellations?!?!
88,"Mar 22, 2022","Y’know, I really was wondering if her constellation was literally the entire pantheon. It’s cool to know I was right :)"
88,"Mar 21, 2022",I was con fused at first but it's cuz all of them are the same consolation  
88,"Mar 20, 2022",i really hate how quickly i manage to read things. im gonna catch up after just a couple days and i was taking my time. gotta love the series tho. keep up the great work author. 
88,"Mar 20, 2022","hahaha ""the constellation who loves kpop wants to be your supporting constellation"" dokja pick that one"
88,"Mar 20, 2022","""constelation who has lost her sense of taste is jotting down your recipe""..... ms girl..... I don't think you need to do that...."
88,"Mar 19, 2022","so no one noticed the ""a constellation who likes k-pop""!?"
88,"Mar 19, 2022",Every couple goal is to wear a matching clothes 😂 
88,"Mar 19, 2022",Omg SANGAH SO POWERFUL 
88,"Mar 19, 2022",Change Gendeeers
88,"Mar 17, 2022","""A constellation who loves kpop wants to be your supporting constellation"" ayee that's me"
88,"Mar 17, 2022",ENTIRE OLYMPUS?? DAFUQ
88,"Mar 17, 2022",😂😂he is calling hyeoseong sad looking soldier?😂this guy
88,"Mar 17, 2022",why did I bust out the mirror just to read loves kpop
88,"Mar 16, 2022",Did everyone not see the constellation that likes to change genders🥲
88,"Mar 16, 2022",dokja really loves pushing other people's buttons
88,"Mar 16, 2022",I miss the kid....wat was his name again?GILYEONG the kid with the insects....
88,"Mar 16, 2022","“a constellation who loves k-pop wants to be your supporting constellation” oh me oh my, it’s me 😩"
88,"Mar 16, 2022",dokja and bihyeong's friendship (?)
88,"Mar 16, 2022",cute outfits 
88,"Mar 16, 2022","Everyone: These chapters are so crazy. Me, an intellectual: There are still 6 more days left... we haven't even reached peak crazy"
88,"Mar 16, 2022",So now he’s the main character from reincarnated in another world with my smartphone 
88,"Mar 15, 2022",Joongdok✨
88,"Mar 15, 2022",cute fits
88,"Mar 14, 2022","Just a heads up, Olympos is the spelling used in the novel and is actually closer to a greek spelling of the word, saying this cus people in the novel comments reamed at the spelling "
88,"Mar 17, 2022","""A constellation who loves kpop wants to be your supporting constellation"" ayee that's me"
88,"Mar 17, 2022",ENTIRE OLYMPUS?? DAFUQ
88,"Mar 17, 2022",😂😂he is calling hyeoseong sad looking soldier?😂this guy
88,"Mar 17, 2022",why did I bust out the mirror just to read loves kpop
88,"Mar 16, 2022",Did everyone not see the constellation that likes to change genders🥲
88,"Mar 16, 2022",dokja really loves pushing other people's buttons
88,"Mar 16, 2022",I miss the kid....wat was his name again?GILYEONG the kid with the insects....
88,"Mar 16, 2022","“a constellation who loves k-pop wants to be your supporting constellation” oh me oh my, it’s me 😩"
88,"Mar 16, 2022",dokja and bihyeong's friendship (?)
88,"Mar 16, 2022",cute outfits 
88,"Mar 16, 2022","Everyone: These chapters are so crazy. Me, an intellectual: There are still 6 more days left... we haven't even reached peak crazy"
88,"Mar 16, 2022",So now he’s the main character from reincarnated in another world with my smartphone 
88,"Mar 15, 2022",Joongdok✨
88,"Mar 15, 2022",cute fits
88,"Mar 14, 2022","Just a heads up, Olympos is the spelling used in the novel and is actually closer to a greek spelling of the word, saying this cus people in the novel comments reamed at the spelling "
88,"Feb 23, 2022","Lol. “Infinite Dimension Space coat”, yet be warned!! Disclaimer: there is actually a limited amount of storage space 😂 "
88,"Feb 23, 2022","Well, glad his dokaebi is annoyes with the manipulation, but is glad with the upgrades, and is willing to keep the bargain going. Also, he was that one that suggested the coat because it has hidden skills."
88,"Feb 23, 2022",O-Olympus?!
88,"Feb 23, 2022",[the constellation Nukl34r_3rr0r is curious about the taste of the food.] [5 coins have been sponsored.]
88,"Feb 23, 2022",I love how he gets outfit changes 
88,"Feb 23, 2022",finally one day has passed 😂
88,"Feb 23, 2022",that's a lot of Constellations
88,"Feb 23, 2022",go back to 1st episode and you'll see that he's wearing the white coat in there part that goes to the future
88,"Feb 23, 2022","yeah, wooh, revelations and so on... but hear me out... Bihyeong looks like a panda on the thumbnail, right? RIGHT?! "
88,"Feb 23, 2022","a lot of cute things in here folks, a teary-eyed Bihyeong, the matching coats..."
88,"Feb 23, 2022",Oh crap I love Greek mythology 
88,"Feb 23, 2022","What a surprise, a world ending disaster and the Olympians are only making it worse, man the people at the Camps are gonna be pissed. "
88,"Feb 23, 2022",I was expecting a Shokugeki pulse when they tasted that food 😅
88,"Feb 23, 2022","My bet was correct, she was supported like by a entire galaxy "
88,"Feb 23, 2022",Either Arachne or Athena
88,"Feb 23, 2022","So, Olympos is one whole constellation? That seems kinda op considering it’s got people like Zeus and Poseidon"
88,"Feb 23, 2022",Our boy seems so grown up now 😭
88,"Feb 23, 2022",THERE WAS A GENDER FLUID CONSTELLATION LETS GOOO
88,"Feb 23, 2022",constellation that likes kpop- huh!? 
88,"Feb 23, 2022",Oh daaaang Sangah is basically a collection of gods that’s awesome 
88,"Feb 23, 2022","The grammatical error is bugging me: it's supposed to be *... unless you want to see ...."" That said, her supporting constellation is a constellation of constellations? Isn't that cheating?!"
88,"Feb 23, 2022","""A constellation that loves K-pop wants to be your support constellation""Why isn't anyone talking about this?"
88,"Feb 23, 2022",Ah yes matching clothes 😍👍
88,"Feb 23, 2022",ive been waiting for this
88,"Feb 23, 2022",UGH IM LEAVING. THERE'S SO MUCH TO DO. GODSPEED
88,"Feb 23, 2022",Who is this constellation who likes K-pop?
88,"Feb 23, 2022",sangah :(
88,"Feb 23, 2022",Yes yes yes yes yes yes yeeeeess YAAAAASSSSS
88,"Feb 23, 2022",So that's why those whips looked so familiar!
88,"Feb 23, 2022","I spy Odin All-Father as a constellation, potentially..."
88,"Feb 23, 2022","Not fair! Not fair! Not fair!!!! You can't just leave us broke watchers on such a cliffhanger!!! 😭😭 I was already planning to pull a Dokja and read the entire series 🤣 but this, THIS just cements that and makes every week worth the wait."
88,"Feb 23, 2022",Oh things just got even more interesting. 
88,"Feb 23, 2022",Will never get tired of saying this but the artwork in this webtoon is REALLY STUNNING. That last panel looked amazing! Looking forward to the next chapters! And lol I see Demonic Judge of Fire always ready with the Ho Yay glasses (same tbh lmao)
88,"Feb 23, 2022",a constellation who loves KPOP lol
88,"Feb 23, 2022",the art is just magnificent
88,"Feb 23, 2022",anyone else wanna know about the kid...??
88,"Feb 23, 2022","The damn gods of Olympus he says, in the most carefree tone. This man is a living legend."
88,"Feb 23, 2022",I'm 100% the constellation that likes to change genders 💃🏻🌹🕺🏻
88,"Feb 23, 2022",Bihyeong!!!! CUTE!!! ;0; <3
88,"Feb 23, 2022",THERE'S A CONSTELLATION WHO LOVES KPOP?!?! 
88,"Feb 23, 2022",THAT'S A LOT OF CONSTELLATIONS
88,"Feb 23, 2022","Is no one talking about the ""Constellation who can change genders""? Methinks that's Loki."
88,"Feb 23, 2022",OKAY OKAY. AT FIRST I CRITICIZED THE 'OLYMPOS' SPELLING TOO. BUT SOMEONE SAID TO ME THAT IT'S AN ALTERNATE SPELLING. AND IT'S THE MORE ANCIENT SPELLING TOO. IT'S THE SAME WITH HERACLES AND HERCULES 
88,"Feb 23, 2022","YOU DAMNED CONSTELLATIONS OF OLYMPUS, DID YOU JUST MAKE DOKJA SPIT SOME BLOOD?? 🤨 Y'ALL UGLY AS HECK!"
88,"Feb 23, 2022",WTF THE MAKER OF INFINITE DIMENSION SPACE COAR IS MASS PRODUCTION MAKER. WHO THE FCK IS MASS PRODUCER
88,"Feb 23, 2022",Dokja please point your sword at me toooo
88,"Feb 23, 2022",Dokja's pretty slender waist and MY big hands..I wonder if it's just a coincidence 🤔💭
88,"Feb 23, 2022","I swear an Oath of Existence that I, Natsumi_i will be by your side, forever. Kim Dokja. But please stop with your ■■■■■ it's hurting me so much!"
88,"Feb 23, 2022",Olympus means the abode of the gods and this is where Zeus has his throne
88,"Feb 23, 2022",[A Royal Burse Who Has Lost her Sense of Taste] I . .  I actually know who that is! Ih y'all are into K-dramas you shoukd watch 'Jewel in the Palace'. She's the main character and she's cool
88,"Feb 23, 2022",AYOOO dokja got lean????
88,"Feb 23, 2022",Pleaze comfort me too Kim Dokja..just because I love you and you cause me too much pain ☹
88,"Feb 23, 2022",LET ME EAT THAT MEAT DOKJAAA
88,"Feb 23, 2022",I'M GOING TO EAT MONSTER MEAT IF YOU'RE COOKING IT FOR ME DOKJAAA
88,"Feb 23, 2022",I'm proud to say that when this chapter just released. I changed my wallpaper into Dokja looking absolutely beautiful in his white coat :D
88,"Feb 23, 2022","""Infinite Dimension Space Coat"" ""Be mindful as there is limited storage space"" Something's wrong with this picture... 🤔"
88,"Feb 23, 2022",Ah finally plant lean
88,"Feb 23, 2022","If you're going for a couple look with Yjh, then go for one with me tooooo"
88,"Feb 23, 2022",POTANGINA THE COAT THE WHITE COQT ICAMMAMSHEIEISISHAJ9WE IRI F8WI2B2IE99CUXHWBQ IM SUCH A WHORE
88,"Feb 23, 2022",wow dokja has a new outfit and it fits 👏👏  
88,"Feb 23, 2022",Dokja please point your sword at me toooo
88,"Feb 23, 2022",Dokja's pretty slender waist and MY big hands..I wonder if it's just a coincidence 🤔💭
88,"Feb 23, 2022","I swear an Oath of Existence that I, Natsumi_i will be by your side, forever. Kim Dokja. But please stop with your ■■■■■ it's hurting me so much!"
88,"Feb 23, 2022",Olympus means the abode of the gods and this is where Zeus has his throne
88,"Feb 23, 2022",[A Royal Burse Who Has Lost her Sense of Taste] I . .  I actually know who that is! Ih y'all are into K-dramas you shoukd watch 'Jewel in the Palace'. She's the main character and she's cool
88,"Feb 23, 2022",AYOOO dokja got lean????
88,"Feb 23, 2022",Pleaze comfort me too Kim Dokja..just because I love you and you cause me too much pain ☹
88,"Feb 23, 2022",LET ME EAT THAT MEAT DOKJAAA
88,"Feb 23, 2022",I'M GOING TO EAT MONSTER MEAT IF YOU'RE COOKING IT FOR ME DOKJAAA
88,"Feb 23, 2022",I'm proud to say that when this chapter just released. I changed my wallpaper into Dokja looking absolutely beautiful in his white coat :D
88,"Feb 23, 2022","""Infinite Dimension Space Coat"" ""Be mindful as there is limited storage space"" Something's wrong with this picture... 🤔"
88,"Feb 23, 2022",Ah finally plant lean
88,"Feb 23, 2022","If you're going for a couple look with Yjh, then go for one with me tooooo"
88,"Feb 23, 2022",POTANGINA THE COAT THE WHITE COQT ICAMMAMSHEIEISISHAJ9WE IRI F8WI2B2IE99CUXHWBQ IM SUCH A WHORE
88,"Feb 23, 2022",wow dokja has a new outfit and it fits 👏👏  
88,"Feb 23, 2022",Yes! The look is complete
88,"Feb 17, 2022",SO COOL OLYMPOSSSS. am I a constellation too? I wonder what my defining feature would be? 
88,"Feb 16, 2022","So, dokja is a returnee, huh? Reading the book via the omniscient readers viewpoint must have been like a second life, first. "
88,"Feb 16, 2022","Damn, Bihyeong sure got visious as he lv up "
88,"Feb 16, 2022","oh my GOD THAT IS SO COOL, SANGAH IS POSSESSED BY *MULTIPLE* OLYMPIAN GODS!?!?!?"
88,"Feb 16, 2022",i spent my last coins on this. i love this webtoon so much
88,"Feb 16, 2022","I like to assume that the olympos constellations picked Sangah cause she has traits corresponding to each deity. Idk, just something I think could be possible"
88,"Feb 16, 2022",It really threw me when he says it's been a month since it all started. It's just been non-stop adventures for him. I thought it's been two weeks max lol.
88,"Feb 14, 2022",Jacket reminds me of the very first ep
88,"Feb 14, 2022",I can't help but think that the dokkaebi looks so cute!! I want him as my plushie !
88,"Feb 12, 2022",“Constellation who loves kpop men” LMAO
88,"Feb 10, 2022","[""A hooded figure with lavender eyes"" looks upon the story in delight. 5 coins have been sponsored]"
88,"Feb 10, 2022",anyone else think Sangah is actually the author 🤔 he can't use character profile on her and she's OP now 
88,"Feb 10, 2022",wait.what.
88,"Feb 10, 2022",[Constellation of One Who Chases Nypmhs is shocked losers got someone so cute.]
88,"Feb 9, 2022",there's a lot of them god sangah what a strong person 
88,"Feb 9, 2022",A CONSTELLATION THAT LIKES TO CHANGE GENDERS??????  that seems like fun heheheehegegeggegegegefeuwidj
88,"Feb 9, 2022",I see that! Constellation who loves kpop wants to support you! 
88,"Feb 9, 2022",[constellation conversekitty throws five coins for a good time. Meow!]
88,"Feb 6, 2022","Ah, the Seto Kaiba couture."
88,"Feb 5, 2022",Ohhh bihyung cutieee hjaaehehehhe but my mood really changed in a blink when i remembered the novel aaaaaaaaa goddammit and btw i saw some tiktok vid dunno the validity but they said there's gonna be a side stories for the novel? Ahhh im too gullible i know
88,"Feb 5, 2022","The translator didn't make it ""what is this? Are u two going for a couple look?"" it will be more gayer if it is🤬🤬jk lol its the same context so kkk that will do"
88,"Feb 5, 2022",Wooow they look coool
88,"Jan 31, 2022","aaah here it is, the matching coats 🥰"
88,"Jan 29, 2022",HQHAHHDHA THEY WERE HAVING MATCHING OUTFITS LMFAOOOO
88,"Jan 25, 2022",bihyung omoo my big boiii 😍😍
88,"Jan 25, 2022",[Constellation of Unrivaled Poverty] is shocked to see so much coins being donated
88,"Jan 25, 2022",Just read all this in under 24 hours... ill be back! 
88,"Jan 24, 2022",YES DOKJA IS MAKING FOOD FINALLY!!!!
88,"Jan 21, 2022",[Constellation Robot Freak is pleased with this outcome] [gifted 25 coins]
88,"Jan 21, 2022",and I'm all caught up! gimme more!
88,"Jan 21, 2022",I got chills seeing the constelations of olympus
88,"Jan 21, 2022",i have a feeling dojka will get zeus cause isn’t the olympo constellation the highest?
88,"Jan 20, 2022",:o
88,"Jan 20, 2022",Wow she can take a lot of people at once
88,"Jan 20, 2022","Guys, where’s gilyoung???"
88,"Jan 20, 2022","[Constellation ""She Who Feeds the Cats"" is pleased with the new style change. You have been awarded 3 coins.]"
88,"Jan 20, 2022",I can't believe it's only been one day 🤯😕 this like dragon ball z but faster results. 😁
88,"Jan 20, 2022",And it’s team rocket blasting off again 
88,"Jan 20, 2022",Sees Athena: oh hey mom
88,"Jan 20, 2022",[Constellation lord of fate] is impressed
88,"Jan 20, 2022",That escalated..so quickly. Damn
88,"Jan 20, 2022",Say whatever you want about him but he knows who his friends are..
88,"Jan 20, 2022",Constellation [Weaver of Worlds] applauds the channel level up. Donates 5 coins. 
88,"Jan 20, 2022",I won’t be surprised if they start pulling up Heroic Spirits from Fate/Zero. Imagine a battle between Incarnations and Heroic spirits!! 
88,"Jan 20, 2022",Wait why are they translating Olympus as Olympos…?
88,"Jan 19, 2022",WHITE COAT KIM DOKJA IS HERE!!!!!  😍😍😍
88,"Jan 19, 2022",Whaaa???? That’s the comment.  Whaa??
88,"Jan 19, 2022",😭😭😭the cliff hangers 
88,"Jan 19, 2022",wonder who has his name? gifts 5 coins
88,"Jan 19, 2022","[The Constellation ""The Red King"" suspected the use of many supporting constellations,  but not as many as Incarnation Sangah has. 1000 coins have been sponsored.]"
88,"Jan 19, 2022",wait is it even aloud for more then one consolation to support a person?
88,"Jan 19, 2022","I only recognize a Hermes and ares like figures, is it zues, Athena and hera??"
88,"Jan 19, 2022",[the Constellation One Whose Wings Melted supports your fashion choices] 
88,"Jan 19, 2022",Oh snap! She was posed by a whole group of gods!
88,"Jan 19, 2022",[The Constellation lildickgirl_666 is confused as to what this will lead to. 5 coins have been sponsored.]
88,"Jan 19, 2022",Olympos? Olympus? O_________o
88,"Jan 19, 2022",I sensed you a long time ago show yourself
88,"Jan 19, 2022",[Constellation”kendo fanboy” is ordering sounds blocking eye phones because of the sudden influx of “cheering” he hears behind him]
88,"Jan 19, 2022",That's a lot of support. Is that also her patreon? Jk 😂
88,"Jan 19, 2022",A moment of silence for are boy Bihyeong’s happiness 
88,"Jan 19, 2022",It's it just me or is this actually something on the big end? 
88,"Jan 19, 2022","On one of the panels when Sangah is letting it all out, she seems to have a tail. Also, Dokja vs Greek gods? Pfffft. You need at least someone as strong as Wukong to be considered a threat."
88,"Jan 19, 2022",stonks also Jungyeok y u mad bro
88,"Jan 19, 2022",PERCY JACKSON GENDER BENDER
88,"Jan 19, 2022",Bihyeong really sent him out like a shooting star 🌌🌠
88,"Sep 10, 2022",OMG its Yin and Yang
88,"Jun 2, 2022","""A constellation who likes to change genders is intrigued"" all I see is another shipper (◕ᴗ◕✿) I support the matching outfits, man 👀👀"
88,"Mar 11, 2022","guysare we talking about the constellation That's like reverse gender or idk what they were satisfied by seeing them wearing maching outfit XD
and imagine if dokja has found a black one XDDDD the shipers of dokja and junhyuk (i don't think it's his name but pls don't judge me i couldn't remember it😭)
would be on fire 🔥 like me right now 😭"
88,"Mar 1, 2022","Honestly, for those who can't wait, you could just read them at another website. No need to waste coins to fast pass. There's even a novel available 😚"
88,"Feb 24, 2022",what a clifhangers
88,"Feb 24, 2022",imagine if Kratos is a constellation 
88,"Feb 24, 2022","""a constellation that likes to change gender"" it's beautiful"
88,"Feb 24, 2022",I felt like someone was referring to me when I saw [The Constellation who likes to switch genders]
88,"Feb 23, 2022",HOLYY MOTHER OF GOD I WAS RIGHT!!! (sorta) I srsly only thought Ariadne was her sponsor not freaking Olympus tho 
88,"Jan 19, 2022",A moment of silence for are boy Bihyeong’s happiness 
88,"Jan 19, 2022",It's it just me or is this actually something on the big end? 
88,"Jan 19, 2022","On one of the panels when Sangah is letting it all out, she seems to have a tail. Also, Dokja vs Greek gods? Pfffft. You need at least someone as strong as Wukong to be considered a threat."
88,"Jan 19, 2022",stonks also Jungyeok y u mad bro
88,"Jan 19, 2022",PERCY JACKSON GENDER BENDER
88,"Jan 19, 2022",Bihyeong really sent him out like a shooting star 🌌🌠
88,"Sep 10, 2022",OMG its Yin and Yang
88,"Jun 2, 2022","""A constellation who likes to change genders is intrigued"" all I see is another shipper (◕ᴗ◕✿) I support the matching outfits, man 👀👀"
