Episode,Date,Review
102,"Jun 1, 2022",they really need to keep the honorification in the translation. it make the dialogue more powerful n story more impactfull. like gilyoung calling dokja hyung or yuseung calling him ahjushi coz it show level of their trust n respect to character.
102,"Jun 1, 2022","""Why do I miss him?"" is the hardest hitting line in this episode imo. I can't describe it but I think it really describes how she's feeling in this situation."
102,"Jun 1, 2022","""why does it feel like i miss him?"" Im tearing up😭😭"
102,"Jun 1, 2022",Dokja is such an amazing mc. man im falling in love with him aaaaa
102,"Jun 1, 2022",Disconnected Film Theory!
102,"Jun 1, 2022",this man is still missing a chunk out of his torso
102,"May 18, 2022",nice ultimate MC status activate
102,"Apr 27, 2022",This webtoon is puuure gold! 
102,"Apr 27, 2022","great chapter...I love the Artworks and the story, every week is a pleasure, thanks a lot"
102,"Aug 10, 2022",I wanted this to become series and this will the climax.... 
102,"Aug 9, 2022",I need every character to beat the sht out of Junghyeok after this. 
102,"Jul 7, 2022",This hit the feels way harder than expected
102,"Jul 7, 2022",THIS GAVE ME CHILLS IT’S EPIC
102,"Jul 6, 2022","Mantis can possible regrow arms if they moult, So I'm just praying for Titano"
102,"Jun 24, 2022",estoy viendo esto en ingles por q ya me lo vi el spanilsh xdddd
102,"Jun 23, 2022","is it just me or are these episodes shorter? maybe I'm reading to fast because of how intense everything is right now, and the art is just *chef's kiss*"
102,"Jun 12, 2022",HUIWON MY QUEEN 🛐🛐🛐
102,"Jun 8, 2022",Daddy Kim controlling the catastrophe 🤌
102,"Jun 7, 2022",IVE BEEN BINGE READING THIS SERIES SINCE YESTERDAY ITS ONE OF MY NEW FAVOURITES ON THIS APP!!! Amazing job author/artists!  
102,"Jun 6, 2022","In order to use first-person pov, he has to have a high understanding of the target, and they must be thinking of him. 🙂 Last time he did this, he got a little bonus, too. 😉🤫"
102,"Jun 6, 2022",CHILSSS
102,"Jun 6, 2022",shit I want moreeeee 😭
102,"Jun 5, 2022","I teared up a bit, not gonna lie. Everything is so well done! Dokja being so OP is actually satisfying. Because he gets  surprised like us but knows how to use it in a clever way."
102,"Jun 5, 2022",binge reading is the best bt nw what do I do I have caught up  😢
102,"Jun 5, 2022",ugh I have caught up. what an insane read loved it
102,"Jun 5, 2022",author kinda forgot about the constellations? xD
102,"Jun 4, 2022",I started omniscient reader about a week ago…. Now i need to wait for weekly update when its the best part :(((
102,"Jun 4, 2022","Gilyeong: Where is Dokja?Yeseung: Who is Dokja?

BUT why is Dokja?"
102,"Jun 4, 2022","orv novel spoilers //
whew his daughters "
102,"Jun 4, 2022",Dokja when will your new body be ready!?
102,"Jun 3, 2022",Still our 2 fav people are missing. Our two Queens where are you.. 
102,"Jun 12, 2022",HUIWON MY QUEEN 🛐🛐🛐
102,"Jun 8, 2022",Daddy Kim controlling the catastrophe 🤌
102,"Jun 7, 2022",IVE BEEN BINGE READING THIS SERIES SINCE YESTERDAY ITS ONE OF MY NEW FAVOURITES ON THIS APP!!! Amazing job author/artists!  
102,"Jun 6, 2022","In order to use first-person pov, he has to have a high understanding of the target, and they must be thinking of him. 🙂 Last time he did this, he got a little bonus, too. 😉🤫"
102,"Jun 6, 2022",CHILSSS
102,"Jun 6, 2022",shit I want moreeeee 😭
102,"Jun 5, 2022","I teared up a bit, not gonna lie. Everything is so well done! Dokja being so OP is actually satisfying. Because he gets  surprised like us but knows how to use it in a clever way."
102,"Jun 5, 2022",binge reading is the best bt nw what do I do I have caught up  😢
102,"Jun 5, 2022",ugh I have caught up. what an insane read loved it
102,"Jun 5, 2022",author kinda forgot about the constellations? xD
102,"Jun 4, 2022",I started omniscient reader about a week ago…. Now i need to wait for weekly update when its the best part :(((
102,"Jun 4, 2022","Gilyeong: Where is Dokja?Yeseung: Who is Dokja?

BUT why is Dokja?"
102,"Jun 4, 2022","orv novel spoilers //
whew his daughters "
102,"Jun 4, 2022",Dokja when will your new body be ready!?
102,"Jun 3, 2022",Still our 2 fav people are missing. Our two Queens where are you.. 
102,"Jun 2, 2022",Film theory at its finest.  
102,"Jun 2, 2022","this is so exciting, I'm shaking"
102,"Jun 2, 2022",This story is soo fascinating. I love how he is in the catastrophe 's mind and I think this is going to be exactly what Yuseung needs to not turn into a raging revengeful catastrophe. The art is amazing and the story line keeps getting better and better great job author.
102,"Jun 2, 2022",every art panel is impeccable 😍
102,"Jun 2, 2022",you made the Dokja Kim Family pissed now to feel pain
102,"Jun 2, 2022","Imagine what she went through to decide to kill all humans she knew, playing in the hands of the aliens she should be against instead. Just like that Questions guy."
102,"Jun 2, 2022","Dokja is so cool, uniting so many others in their feelings for him"
102,"Jun 2, 2022","OMG OF COURSE IT'D BE HER WHO WAS THINKING ABOUT HIM. I should've known but I didn't because of how well this was written out and -OMG I LOVE THIS COMIC (or novel ig lol, haven't read the novel yet tho)"
102,"Jun 2, 2022","woa those episodes are really awesome, and gorgeous at that, I had to use a lot of my will's strength to not fast pass lol"
102,"Jun 2, 2022","Gilyeong wanna become the insect master: ""GO, ANTINUS!"" "
102,"Jun 2, 2022",this episode is incredible. the panels are stunning i love it so much
102,"Jun 2, 2022",This art and story never fails to take my breath away 😍😍
102,"Jun 2, 2022",Damn cliffhanger
102,"Jun 2, 2022",no not titano 😭
102,"Jun 2, 2022",dang now i want the next episode here early lol
102,"Jun 2, 2022",Film theory at its finest.  
102,"Jun 2, 2022","this is so exciting, I'm shaking"
102,"Jun 2, 2022",This story is soo fascinating. I love how he is in the catastrophe 's mind and I think this is going to be exactly what Yuseung needs to not turn into a raging revengeful catastrophe. The art is amazing and the story line keeps getting better and better great job author.
102,"Jun 2, 2022",every art panel is impeccable 😍
102,"Jun 2, 2022",you made the Dokja Kim Family pissed now to feel pain
102,"Jun 2, 2022","Imagine what she went through to decide to kill all humans she knew, playing in the hands of the aliens she should be against instead. Just like that Questions guy."
102,"Jun 2, 2022","Dokja is so cool, uniting so many others in their feelings for him"
102,"Jun 2, 2022","OMG OF COURSE IT'D BE HER WHO WAS THINKING ABOUT HIM. I should've known but I didn't because of how well this was written out and -OMG I LOVE THIS COMIC (or novel ig lol, haven't read the novel yet tho)"
102,"Jun 2, 2022","woa those episodes are really awesome, and gorgeous at that, I had to use a lot of my will's strength to not fast pass lol"
102,"Jun 2, 2022","Gilyeong wanna become the insect master: ""GO, ANTINUS!"" "
102,"Jun 2, 2022",this episode is incredible. the panels are stunning i love it so much
102,"Jun 2, 2022",This art and story never fails to take my breath away 😍😍
102,"Jun 2, 2022",Damn cliffhanger
102,"Jun 2, 2022",no not titano 😭
102,"Jun 2, 2022",dang now i want the next episode here early lol
102,"Jun 1, 2022",“I’m your father”
102,"Jun 1, 2022","Influencing the characters' actions, à dream of many readers. "
102,"Jun 1, 2022",oh no. gilyeoungs pokemon fainted and there's no pokemon center
102,"Jun 1, 2022",THIS IS LIKE MY FAVOURITE CHAPTER SO FAAAAAR!!!!
102,"Jun 1, 2022","The eye glow, THE EYE GLOW!!!"
102,"Jun 1, 2022",I hate the author for leaving us in this much suspense 😭
102,"Jun 1, 2022",everyone go check out his other work 'the world after the fall' it is so good and loved this chapter
102,"Jun 1, 2022",why am I so confused
102,"Jun 1, 2022","that panel of Dokja still as a ""phantom""... FCK"
102,"Jun 1, 2022","This is the most cruel cliff hanger of them all.
I hope this series will become and stay as a classic on WEBTOON."
102,"Jun 1, 2022",man reading this chapter with devilmam crybaby inspired songs is ufff chef kiss 🤌
102,"Jun 1, 2022","damn, what a fucking good chapter"
102,"Jun 1, 2022","it still feels weird when the kids call dokja by his given name, aside from that we're getting the first ""why is it not me"" moment but not the last 🥲"
102,"Jun 1, 2022","Yuesung of the future that will never happen, you do not have a place here. And those who were part of the horrible future you lived in, is gone. While you can now only exist as a destroyer without a sense of happiness or joy. I think it is time to go. And let this past you, who can still become happy live"
102,"Jun 1, 2022",This was dope!! 🤩🤩
102,"Jun 1, 2022",I love how Dokja stole all the pivotal characters so now the catastrophe is like “dafuq?” 
102,"Jun 1, 2022",How to tame a catastrophe 101
102,"Jun 1, 2022",So her memories get overwritten now? 
102,"Jun 1, 2022",No it’s not funny I’ve got school
102,"Jun 1, 2022",OMG every episode is just better than the previous!
102,"Jun 1, 2022","Dokja, you didn't just let them touch, right? Of course I'm seeing things right? Oh shi-"
102,"Jun 1, 2022",Was about to create the catastrophe of floods with my eyes I thought Gilyeong was gonna die 🥲
102,"Jun 1, 2022",NOT THE CLIFFHANGER
102,"Jun 1, 2022","""Wait, a minute... Who are you?"" "
102,"Jun 1, 2022","disconnected film theory- bruh, the art's so amazing! "
102,"Jun 1, 2022",The disconnected film theory is activated
102,"Jun 1, 2022",who is dokja? out favorite son of a bitch
102,"Jun 1, 2022","so... if the wall between dokja and the world of twsa (always forget the exact letters) is the fourth wall, does that mean the wall between him and us is the fifth one?"
102,"Jun 1, 2022",I wonder if only the adult Yuseung is seeing the younger one's memories or are both seeing each other's.
102,"Jun 1, 2022",How can people say that Dokja is ugly!?!?
102,"Jun 1, 2022",this really hit the feels 😩🤌
102,"Jun 1, 2022",I wish ajusshi translated more clearly in English 'mister' is just so funny to me
102,"Jun 1, 2022",I've been wondering about the insect queen and OUR KIDDO HAD HER IN HIS INVENTORY THIS WHOLE TIME I-
102,"Jun 1, 2022",catching up to webtoons is the worst becayse now i actually have to wait weekly 😭😭
102,"Jun 1, 2022","We are up to this point and I'm already crying, I can't with what's about to come 🥲"
102,"Jun 1, 2022","in the LN I was scared for my boy Gilyeoung I screamed ""put him down"" over and over"
102,"Jun 1, 2022","im here, im broke, but im proud n happy"
102,"Jun 1, 2022","THAT.  WAS.  AMAZING.  
Thank you for ALL of that! The art, the story,  ALL OF IT.  "
102,"May 22, 2022",every chap passing I'm getting goosebumps a lot more
102,"May 22, 2022","Oh my god, just take my damn coins"
102,"May 12, 2022",I’m out of coins again ;-;
102,"May 11, 2022","EVERY CHAPTER IS A CLIFFHANGER, MY COOOOOINSSSS"
102,"May 11, 2022","Damn, this story’s hella fun!"
102,"May 1, 2022",The Consolation The Infinite NaughtZero has revealed his name(The consolation The Infinite NaughtZero thinks that this story is the best written story he’s ever read and wants the author to continue his hard work)you have been gifted 25 coins
102,"Apr 28, 2022",This will be another long week
102,"Apr 27, 2022",It is absolutely incredible how the author makes this story so intricately connected. This comic deserves more hype 
102,"Apr 27, 2022",I love this webtoon so so much
102,"Apr 27, 2022",Best chapter? Best chapter. 
102,"Apr 27, 2022",This was one of the coolest chapters yet 
102,"Apr 27, 2022",Didn't Dokja talk about splicing memories together in a previous chapter? trying to explain the differences in catastrophes to the others? time for another re-read!
102,"Apr 27, 2022",woo. a lot is happening 
102,"Apr 27, 2022",What in the paradox is this
102,"Apr 27, 2022",I reread the series right after the 100th episode just to rehype myself for this chapter 😭 love this series so much 
102,"Apr 27, 2022","I love this arch so much!! Can't wait to see how will Dokja manage come back to life, bcs we all know he will!! "
102,"Apr 27, 2022","I doubt anyone here is using the site, still I want to drop this lol—uploads.disquscdn.com/images/0b057ab8335be7d2c5892f8d64b55e6297ae309d043be61a366074181803f3a0.png (COPY THE LINK TO SEE BLACKBOX-NIM'S GODLY ILLUSTRATION OF SHIN YOOSUNG AND THE CATASTROPHE)"
102,"Jun 5, 2022",I want an official physical copy of the English version of the orv novel so bad 😭
102,"Jun 1, 2022",OK I GIVE UP. I'M GOING TO SLEEP. HAPPY PRIDE MONTH! (We'll make it to 1000 eventually!)
102,"Jun 1, 2022",crying cause im broke.. bye fast pass
102,"Oct 9, 2022",Some amazing perspective writing here. Truly top tier. 
102,"Sep 25, 2022",it's funny how everyone is enraged that she killed dokja while she doesn't even know who dokja is
102,"Sep 15, 2022",I knew it. Dokja will possess the future one 
102,"Sep 11, 2022",This chapter gave me chillllls!!!
102,"Sep 3, 2022",she came to this world and found out the main character isn't the main character anymore 
102,"Aug 25, 2022",Holycrap what a great episode
102,"Aug 21, 2022",the goosebumps I've felt in this chapter AAAAAAAAAAAAAAAAA
102,"Aug 17, 2022","At first, I'm only reading this because I'm waiting for my other ongoing series to update but now I'm i n v e s t e d."
102,"Aug 12, 2022","I'm so proud of Gilyeong being so strong on his own, for such a young age he's never let Dokja down "
102,"Aug 6, 2022",this reminds why I have a soft spot for shin yuseung
102,"Jul 30, 2022",I forgot Dokja is like renguko now💀
102,"Jul 27, 2022",I wish Gilyeong would've came in on Titano throwing Mjolnir at this girl face 🤣
102,"Jul 24, 2022",i’ve read to here in three days and this is my favorite intro so far 
102,"Jul 15, 2022","really hits how many lives dokja has impacted :,,)))"
102,"Jul 13, 2022",i can't 
102,"Jul 13, 2022","Damn, the amount of goosebumps I got from this chapter "
102,"Jul 4, 2022",they've become much stronger and all love dokja as their companion. I bet dokja gonna get first pov into older beast girl they fighting
102,"Sep 15, 2022",I knew it. Dokja will possess the future one 
102,"Sep 11, 2022",This chapter gave me chillllls!!!
102,"Sep 3, 2022",she came to this world and found out the main character isn't the main character anymore 
102,"Aug 25, 2022",Holycrap what a great episode
102,"Aug 21, 2022",the goosebumps I've felt in this chapter AAAAAAAAAAAAAAAAA
102,"Aug 17, 2022","At first, I'm only reading this because I'm waiting for my other ongoing series to update but now I'm i n v e s t e d."
102,"Aug 12, 2022","I'm so proud of Gilyeong being so strong on his own, for such a young age he's never let Dokja down "
102,"Aug 6, 2022",this reminds why I have a soft spot for shin yuseung
102,"Jul 30, 2022",I forgot Dokja is like renguko now💀
102,"Jul 27, 2022",I wish Gilyeong would've came in on Titano throwing Mjolnir at this girl face 🤣
102,"Jul 24, 2022",i’ve read to here in three days and this is my favorite intro so far 
102,"Jul 15, 2022","really hits how many lives dokja has impacted :,,)))"
102,"Jul 13, 2022",i can't 
102,"Jul 13, 2022","Damn, the amount of goosebumps I got from this chapter "
102,"Jul 4, 2022",they've become much stronger and all love dokja as their companion. I bet dokja gonna get first pov into older beast girl they fighting
102,"Jun 10, 2022",well dokja sure will get a beating from junghyeok when he sees him alive for sure........rip dokjaa
102,"Jun 8, 2022",It's so precious how every character is avenging Dokja
102,"Jun 8, 2022",AAAAAHHHHH
102,"Jun 8, 2022",I WANT TO FAST PASS SO BAD BUT IM BROKE💀👍
102,"Jun 8, 2022",THE PAST FEW EPISODES HAVE BEEN SO GOOD 
102,"Jun 8, 2022",i always get chills when I read it
102,"Jun 7, 2022",I love the recap of the scenes but with Dokja now in it and showing the changes he made
102,"Jun 7, 2022",BRO I GOT GOOSEBUMPS 
102,"Jun 7, 2022",DAMN IT! I CAUGHT UP TO A CLIFF HANGER!
102,"Jun 7, 2022","the thing the plagerist was writing was it twas and her from a diffrent ""movie"" is the author for this ""movies"" twas but who is the original author then or is she writing a story of what is happening right nog in the story. "
102,"Jun 7, 2022",hold up has this ended
102,"Jun 7, 2022","Just as much as I always hoped a letter from Hogwarts would one day arrive for me I'm now hoping that this story will never come true, although it's a great one👍"
102,"Jun 6, 2022","damn, new readers and webtoon readers- get ready for an rollercoaster of emotions throughout this story 👍"
102,"Jun 6, 2022",damn i caught up after finding this just a few days ago...
102,"Jun 6, 2022",just 1 day till free😭
102,"Jun 6, 2022",ඞ 
102,"Jun 6, 2022",Day 101 of voicing all the characters
102,"Jun 6, 2022","where are my episodes im waiting, dying in the inside"
102,"Jun 6, 2022",After beinge reading you choose to leave me here😭😭😭😭
102,"Jun 5, 2022",You are a Genius. This is the plot twist of the plot twists! An Epic twist! Goosebumps!! Thank you!!!!
102,"Jun 5, 2022",Ooh disconnected film theory coming in
102,"Jun 5, 2022","Gee, I’ve never had top comment!"
102,"Jun 4, 2022","I really love this and previous chapter because we can see the changing pov so clearly 'cause how different it was pictured, considering this is the first pov change in the entire 100+ chapters and the pov change is one of the most important and intriguing things in this story. seeing how the pov change was already devastating enough in this and previous chapter, I can't imagine how devastating it will be when joonghyuk's pov made it to the webtoon. guess I will need to go to therapy then"
102,"Jun 4, 2022",this is the best part can't wait for the next one 🕜🕜🕜 🕜 4 days to go
102,"Jun 4, 2022",wowowowoww I’m speechless ah I— 😶
102,"Jun 4, 2022",wow I just downloaded the web novel and the webcomic is only about 1/6 of the whole story. 
102,"Jun 4, 2022",OUR DEAR LOVELY AUTHOR DESERVES A GREAT AWARD FOR MAKING THIS COMIC🙌🏼🙌🏼🙌🏼🙌🏼 (pls im broke i wanna get a fastpass and pay the author too *cri)
102,"Jun 4, 2022",[THE FOURTH WALL IS SHAKING VIOLENTLY!]
102,"Jun 4, 2022",mind blowing I have nothing to say
102,"Jun 4, 2022","what the hell!!! how dare you cliffhangers!btw, I started reading this just yesterday and now I'm here waiting for the next episode! wtf!"
102,"Jun 4, 2022",bitin hahahaha
102,"Jun 4, 2022",I’m waiting for secretive plotter to equate to the unknown author. It probably won’t be true but one can hope 😂
102,"Jun 4, 2022",Sheeeesh
102,"Jun 3, 2022","I believe Dokja just defeated the catastrophe (the current encounter: Main Scenario #5 - Defeat the Catastrophe of Floods: Yuseung Shin) through his incarnation, the child ... Yuseung ... by relating the memory that she had forfeited her life to him. But instead of taking it (as she believed was the goal of Junghyeok just now), this Dokja spared it & took her under his wing as the one & only incarnation of a human, protecting & helping her to improve ever since."
102,"Jun 3, 2022",them caring about their ahjussi... :(
102,"Jun 3, 2022",Noooooooooooooooooooooooo! Not a cliffhanger. 😩
102,"Jun 3, 2022",AYO?????
102,"Jun 3, 2022",She's suppoed to hold her hand but their memories got connected to each other  
102,"Jun 2, 2022","whaa gilyoung is so cool when he fight, my boy has grown upp"
102,"Jun 2, 2022",I can’t wait another week for the next update 😭
102,"Jun 2, 2022",Banger chapter 
102,"Jun 2, 2022",im a new reader n omg tht cliffhanger ughhggygfh
102,"Jun 2, 2022",Does anybody know the name of the fonts they use? I really like them but I don’t know the names-?
102,"Jun 2, 2022",Bro this chapter was dope it gave me chills
102,"Jun 2, 2022",I TALKED TO THE LEGENDARY DAPPER FLOOF STAN OMG 
102,"Jun 2, 2022",i got goosebumps when the Catastrophe Yeseung had nostalgia with Dokja
102,"Jun 2, 2022",I was worried there’d be a D4C situation when the two touched.
102,"Jun 2, 2022","When that happened, I was scared that the young yusueng will mistake the future yuseung's memory as hers too... I am wondering if she will become like the future yuseung but her reaction made me relieved"
102,"Jun 2, 2022",This is a great chapter!
102,"Jun 2, 2022",Yuseung is me when amogus
102,"Jun 2, 2022","Catastrophe of Floods, because flood of memories! 🥺"
102,"Jun 2, 2022",This is gigabrain 6d chess.
102,"Jun 2, 2022",pls where can I read the original orv.🥺
102,"Jun 2, 2022","Aaaagh! I just started reading this last week, and now I have to start spending coins!"
102,"Jun 2, 2022",POTANGINANDWNSJDHWIMS
102,"Jun 2, 2022",just imagine producing 2 two catastrophy  of floods after this merge.... or twins 😋😋😅😅
102,"Jun 2, 2022",this was the best chapter by far
102,"Jun 2, 2022",So gooood 🤩🤯🥺🫣
102,"Jun 2, 2022",DAAMMNNN
102,"Jun 1, 2022",Woahhhhhh
102,"Jun 1, 2022","I KNOW EVERYONE'S FOCUSING ON 41ST YOOSUNG, BUT I WONDER HOW OUR PRECIOUS YOOSUNG FEELS SEEING THE CATASTROPHE'S MEMORIES AS WELL"
102,"Jun 1, 2022",🎶Get out get out get out of my heaad🎶.... Just me ok
102,"Jun 1, 2022",IT'S TIME TO REVIVE MY COMMENTS
102,"Jun 1, 2022",HOW ARE WE GONNA REACH OUR GOAL IF WE DELETE OUR REPLIES??
102,"Jun 1, 2022",pretty cool how Dokja was able to control a catastrophe 
102,"Jun 1, 2022",i love this story so much omfg im so excited for the next part to come out
102,"Jun 1, 2022",hmmmmmmmmm ahdygyerfg
102,"Jun 1, 2022",the art is just incredible. damn
102,"Jun 1, 2022",She really going insane 
102,"Jun 1, 2022","Goosebumps. When seeing Dokja opening his eye, damnnn"
102,"Jun 1, 2022",dokja be thinking he's not the protagonist of this story
102,"Jun 1, 2022",mam this was such a. great update it felt like avengers infinity war level 
102,"Jun 1, 2022",aaaaaaahhhhhrgh
102,"Jun 1, 2022",THIS CHAPTER SLAYYYYYYYYYYYYYYYYYYYYYYYYYYED OMFG
102,"Jun 1, 2022",DOPE
102,"Jun 1, 2022",man drawer draws Dokja so damn well
102,"Jun 1, 2022",I just want to say…GILYEONG DAMN SON 😳
102,"Jun 1, 2022","the manhwa does such a good job of portraying the emotions of the characters ,,, ❤❤ love it"
102,"Jun 1, 2022",This might be my favourite chapter like HECK YEAH! KIM DOKJA IS THE HERO. PERIOD
102,"Jun 1, 2022",this was an INCREDIBLE CHAPTER
102,"Jun 1, 2022",FAVE COMIC ON WEBTOON 
102,"Jun 1, 2022",the epic reunion
102,"Jun 1, 2022",eyyoooo this art is soooo good
102,"Jun 1, 2022",The artwork is sublime. This episode is sad 😪
102,"Jun 1, 2022",Ooooooooooh so GOOD!
102,"Jun 1, 2022",love this webtoon so much 😍💕🥰
102,"Jun 1, 2022",I saw Dokjak’s  eyes OMGGG
102,"Jun 1, 2022",This is such a great show by far one of my favorits and i cant wait for more 
102,"Jun 1, 2022",this my favourite episode so far!
102,"Jun 1, 2022","he retconned a catastrophe, what a mad man!I love this wt soo much, amazing chapter aaaaa"
102,"Jun 1, 2022",I’m so excited for the next chapter!
102,"Jun 1, 2022",To possess a catastrophe and control its power without letting it know until now! - Kim Dokja feat 107! - 'Kim ... Dokja Kim... you should have heard the name by now;)'
102,"Jun 1, 2022",When Eren kissed Historia's hand
102,"Jun 1, 2022",I was so scared for Gilyeong! Poor Titano! 😭
102,"Jun 1, 2022","I was so exciting reading this, the art and story telling is so good this episode! I hope one day this series can get animated because I would love to watch it all over again"
102,"Jun 1, 2022",Yeah ok I have no coins.
102,"Jun 1, 2022",new ability unlocked: controlling mind
102,"Jun 1, 2022",I'm mcLovin' it
102,"Jun 1, 2022",waaaahhh I hate u cliffhanger *sobs*
102,"Jun 1, 2022",titano please be okay 😭 and Gilyeong you're so mature now omg I love you! I'm balling my eyes out rn.
102,"Jun 1, 2022",yuseung will always be able to recognize dokja no matter what form he is. is why she one of my fav. her arc n biyoo arc make me cry q lot in novel. (n heewon n her constellation too is my fav)
102,"Jun 1, 2022","Why, Reader , Why do you have to be so good. You give us answers to questions and questions to answers and answers to answers! Man, this story is mostly a middle path. Not really heroic but not really villainous either."
102,"Jun 1, 2022","Junghyeok: ""You don't know who Dokja Kim is? He. He's my husb-companion.""  jk lol that panel where he's looking down at her was amazing. The way his eyes glowed *chef's kiss*"
102,"Jun 1, 2022",why torture me 😭😭
102,"Jun 1, 2022",Omg that warm scene of Dokja reaching out almost made me cryyyy
102,"Jun 1, 2022","""Where's Dokja?"" ""Who the hell is Dokja?"""
102,"Jun 1, 2022",Man... this is sad 
102,"Jun 1, 2022",TT-TT
102,"Jun 1, 2022",Ooo he on X-games mode
102,"Jun 1, 2022","I LEGIT THOUGHT ""megalovania starts playing"" IN THE PANEL WHERE DOKJA'S LEFT EYE WAS GLOWING LMAO"
102,"Jun 1, 2022",God damn I need to go into cryo until next week
102,"Jun 1, 2022",Gilyeong could control an insect guide???
102,"Jun 1, 2022",wow gilyoung is FIERCE
102,"Jun 1, 2022",damn cliffhanger-kun whyyyyyyy!!!!!!!!
102,"Jun 1, 2022","Defeating the catastrophe doesn't mean destroying it. All they need to do is splice the film strips, giving the catastrophe version of the girl the memories of being Dokja's companion. After that she won't be a catastrophe anymore. Thus defeating the catastrophe without killing or destroying the person/being."
102,"Jun 1, 2022",Wow i'm obsesse ith this webtoon like really really can't wait for the next episode cause i'm broke :)
102,"Jun 1, 2022",THIS EPISODE WAS SO BEAUTIFUL AHHHHHHHHHH 😭
102,"Jun 1, 2022","CRYING, BLEEDING, PALPITATING. HELP, I'M NOT READY FOR THIS :((("
102,"Jun 1, 2022",Rip titano 
