Episode,Date,Review
104,"Jun 15, 2022",I enjoy how there's lowkey 2 main characters both dokja and the regressor are amazing protags 
104,"Jun 15, 2022",I hope Dokja will beat the shit out of that dokkaebi Paul
104,"Jun 15, 2022","""It was the first time I noticed that Yoo Joonghyuk's back was so big and wide. His back was wide and lonely."" <//3"
104,"Jun 12, 2022",Oh man you know what f*ck cocaine or whatever drug you got this. This. Right. Here. Is some class A adictive substance and every poor fool who fast passed with me can not deny me this.
104,"Jun 11, 2022",gilyoung is such a deadass mood lmfao 😭😭
104,"Jun 9, 2022",In addition to there being no time limit. The words are defeat the catastrophe not kill it. Make her admit defeat you win. hehe
104,"Jun 9, 2022","""Have you been thinking that far ahead? ""Have you just found out? 😂😂😂"
104,"May 17, 2022",I started this yesterday… I’m caught up… why…
104,"May 13, 2022","im waiting excitedly for the next episode, and im glad to see what looks like a kind of prequel to this being made. it looks good from what i read. "
104,"May 13, 2022","I wonder if Dokja will end up falling for someone, but decide to stay a respectable distance to keep the shipping Constellations guessing 🤔 It'd be funny if he acknowledged that idea."
104,"May 11, 2022",doesn't he win if she surrenders?
104,"May 11, 2022",the rules:  go left dokja:   no thanks. I'll stay here
104,"May 11, 2022",That dokkaebi needs to stop challenging dokja on Uno
104,"May 11, 2022",Noooo I want to read more😭
104,"May 11, 2022",The team just “Sit your dumbass down!!”
104,"May 11, 2022","Ah yes welcome to episode 103 of Dokja Kim, the walking maguffin "
104,"May 11, 2022", how does he notice these small details it's so unbelievable I love it and I need more
104,"May 11, 2022","I hope she comes out of this alive, she deserves a chance to live after all she went through."
104,"May 11, 2022",If I die you coming with me 🤣
104,"May 11, 2022",Can’t wait for the older version of herself can be a powerful ally for the crew🙂
104,"Sep 23, 2022",I was really thinking that the loophole was that refreshing doesn't mean killing but i guess Dokja's going with the time limit loophole... Wonder how that'll work out...
104,"Sep 18, 2022",I forgot everyone’s name except Dokja’s
104,"Aug 17, 2022","So all the timelines exist at the same time?? Bc if the 41st round YS is the catastrophe, that means that there wouldn’t have been a catastrophe before that. And if she was sent back in time?????? Like idk all the timelines are linked, right? So even if YJH regresses the timeline doesn’t completely vanish..?"
104,"Jul 29, 2022","in my opinion, them recruiting the Catastrophe (In a way) is defeating her. because she's no longer trying to destroy Seoul"
104,"Jul 7, 2022",i want to know.. how can we actually kill this irritating dokaebi? the one with the glasses on ofc...i want to slap him real bad 
104,"Jul 6, 2022",they are so loyal to kim dokja 😭
104,"Jun 25, 2022","Of course Dokja planned this all out, he knows everything. >:3"
104,"Jun 22, 2022",Defeat her in checkers. Or thumb wrestling if you can’t find a board.
104,"Jun 22, 2022",GILYOUNG GOT VIOLENT IN THE SHORT TIME HE WAS AWAY FROM DOKJA LMAO
104,"Jun 22, 2022",omg this is my first comment ever and I'm glad it's on this I'm looking forward to the next episode 
104,"Jun 21, 2022",...is this the Omniscient Reader equivalent of method overloading?
104,"Jun 21, 2022","they already defeated her, it never says kill, just defeat"
104,"Jun 21, 2022", kim dokja isn’t the strongest or the smartest but he has this power to lead people and to make them follow him and that’s what I love about him.
104,"Jun 20, 2022",did I read it too fast? I intentionally did not read this like for a month... and now I'm caught up
104,"Jun 19, 2022",Started reading this webtoon a few dsys ago and now it's my fav among all I'm currently reading 
104,"Jun 18, 2022",What an unlucky day to ran out of coins. Any constellations there who's willing to support me lol
104,"Jun 18, 2022","No, he's been READING that far ahead"
104,"Jun 17, 2022",Glad that the other Kings are still supporting THE king
104,"Jun 17, 2022",the squad majing and Avengers pose all around to protect yoseun. epic
104,"Jun 17, 2022",1) SHIT HOW DID I FORGET THE DAY OF THE WEEK AND MISS THIS I’M TWO DAYS LATE AAAAAA 2) I love how they all just agree to Dokja’s decision and back him up <3 they really do love him haha 3) can we burn this dokkaebi and punch him to the farthest corner of the universe please and thank you— 4) Dokja’s face when the dokkaebi appeared—I don’t think we’ve ever seen that facial expression on him before :0 he looks truly annoyed for the first time in this webtoon I think
104,"Jun 17, 2022",Mans just KNEW what was gonna happen.
104,"Jun 17, 2022","I’ll admit the fan art led me to the WEBTOON. It’s great. It’s really, really great!"
104,"Jun 17, 2022",no spoilies but paul is about to f up himself
104,"Jun 16, 2022",Scribe of heaven u mo**** f***er u know what u will did and what you will do and I have an urge to chop your head off [the Constellation a smol child glares at the Constellations of the absolute good and evil system][the constellation a smol child gives the constellation demonic judge of fire (uriel) and lily pin of Aquarius(Gabriel) a sweet smile] this is for novel readers so I apologise:)
104,"Jun 16, 2022",It clearly says defeat not kill. Sir I would like to point out that the catastrophe's will was broken thus it is a mental defeat.
104,"Jun 16, 2022",bro i loved this istg
104,"Jun 16, 2022","Gee, I’ve never had top comment!"
104,"Jun 16, 2022",hahahah he has no idea HOW far ahead he is XD
104,"Jun 16, 2022",They should make a prequel 
104,"Jun 16, 2022",BRO HES SO AMAZING
104,"Jun 16, 2022",can someone tell me what chapter this is in the novel ? please 
104,"Jun 16, 2022",stop i started this yesterday what do you mean i’m all caught up-
104,"Jun 16, 2022","They have to defeat the catastrophe, not kill it. Just have the lady admit defeat, or renounce the title catastrophe of floods and therefore have defeated the catastrophe and gain the reward."
104,"Jun 16, 2022",I hope this Dokkaebi dies soon too🥰 can't stand that little sheep looking thing.
104,"Jun 16, 2022",I think we'll see a secound dokabi lose his powers soon enough
104,"Jun 16, 2022",dokja is so far ahead that bounce back!
104,"Jun 16, 2022","Yeah Dokja always thinking ahead, again with the dope chapter, Omni Reader👍"
104,"Jun 16, 2022",Just... Joonhyuk-ah
104,"Jun 15, 2022",is it stillfar
104,"Jun 15, 2022",This story is so ridiculously good! Every muscle in my body is clenched with excitement!!!
104,"Jun 15, 2022",Why is he even here for? I don't like this dokkaebi.
104,"Jun 15, 2022",I read all of this in 3 days >:3
104,"Jun 15, 2022",OH MY GOD I FOUND THE PERFECT SOLUTION. LET ME PUT ON SOME MUSIC. WE'RE MAKING IT FOLKS
104,"Jun 15, 2022","[Constellation ""Herald of the Black Dawn"" is happy that they are standing up for that lost soul]"
104,"Jun 15, 2022",Another episode of awesome Dokja  I love the dialogue 
104,"Jun 15, 2022",i love shin yoosung 
104,"Jun 15, 2022",wahh I really wanna read the next update now but i cant and it makes me crazy to know what will happen next  🤧 
104,"Jun 15, 2022",YESSSSSS WHAT A BADDIEEE
104,"Jun 15, 2022",he fine doe... that mid level dokkaebi
104,"Jun 15, 2022",hola 
104,"Jun 15, 2022",I respect this author...he/she is very clever
104,"Jun 15, 2022",This man is literally their leader without him even realising it
104,"Jun 15, 2022","Dokja, as always, is playing advanced 4D chess"
104,"Jun 15, 2022",All it says is to DEFEAT the Catastrophe... not kill. There are plenty of ways of defeating someone and keeping them alive at the same time
104,"Jun 15, 2022","ahhh there's this line that i really like from the novel, when yjh said to shin yoosung ""If you want, I will bear your hatred."" i remember it got me ugly crying lol"
104,"Jun 15, 2022",i really thought he was going to go with the whole defeat =\= kill thing
104,"Jun 15, 2022","Well, you don't have to kill someone to defeat them. So they could actually keep her alive and complete the main scenario"
104,"Jun 15, 2022","I mean, the scenario talks about defeating, not killing. If she surrenders, she is effectively defeated."
104,"Jun 15, 2022","This dokkaebi would be pissed to know just how far ahead Dokja's plans are... Unrelated, but I'm glad Junghyeok gave that talk. Regressor to pseudo-regressor(?). I got the impression that he understood why Yuseung hates him (makes sense why he walked away, probably bc she wouldn't actually want to see him). "
104,"Jun 15, 2022",I don't get it....is the Catastrophe from the 41st round or the 2nd round ? Please someone explain it in simple words....😭
104,"Jun 15, 2022",Give these chapters some love! The art is fantastic and I cant keep coming back for the story. Thank you author!!!
104,"Jun 15, 2022",This dokkaebi is being so childish rn just let it go!
104,"Jun 15, 2022","Well excuse me, mister $5 Ralsei Cosplay"
104,"Jun 15, 2022","""So quit pushing us"" this. Guy. Is. A. Frea. king. GENIUS!! "
104,"Jun 15, 2022",I get the feeling that he’s about to manipulate the scenario 
104,"Jun 15, 2022",That Mid-level Dokkaebi won't get things the way he wants now. 
104,"Jun 15, 2022","welcome back to another episode of ""where the heck is pildu""! "
104,"Jun 15, 2022",guys look the avengers
104,"Jun 15, 2022",dude im broke i cant do this
104,"Jun 15, 2022",Reader: I'm blackmail your ass til you die for being a cuck 
104,"Jun 15, 2022",I can't believe I just realized that's dokkaebi Paul
104,"Jun 15, 2022",Dokja is well above fifty parallel universe ahead of everyone else
104,"Jun 15, 2022",Well hello fellow Novel Readers/Fast passer who knows what is going to happen. Have fun people who are broke/haven't read the novel that far ahead yet
104,"Jun 15, 2022",these darn puffballs mess everything up 
104,"Jun 15, 2022",Dokja playing 5d chess I swear—
104,"Jun 15, 2022",this chapter makes me sad for yjh and sys 😭
104,"Jun 15, 2022",What am I here for...if no one speaks??? I will be gone....now
104,"Jun 15, 2022",paul s. annoying 
104,"Jun 13, 2022",AHHHHHHHHHHHH
104,"Jun 10, 2022",Aaaahhh I love how this is goingg
104,"Jun 9, 2022",I only had 5 free coins so now I need to wait 2 weeks
104,"Jun 9, 2022","this series has such great art and story, definitely is my favorite webtoon"
104,"Jun 7, 2022",goodbye coins may we meet again
104,"Jun 1, 2022",Dokja’s waist is SNATCHED
104,"May 18, 2022","Calling it now, they're going to kill Glasses at some point in the future. They'll bring the fight to the very constellations that brought ruin to their world."
104,"May 15, 2022","Are we just going to ignore how fluffy bihyeoung looks!??… lmao dokja, the fable of the overthinker "
104,"May 14, 2022","okay but all I can think about is his friend who can make copies of herself and how when he left she was watching and bummed out that he didn't even look for her. like, dokja makes big friend mistakes too"
104,"May 13, 2022","Hm... So Yuseung and Junghyeok are functionally like the Doctor and River Song? She started at his 41st regression, while he started at his first (obviously), the two of which are moving toward opposing ends of their stories. Junghyeok doesn't know the terrible things he will put her, and others through, when he's given up hope, and she's painfully aware, and wants revenge. She warned him, in the second regression, but like most heroes, he's too dense to listen, and gets himself killed, here..."
104,"May 12, 2022",The dokkaebi looking more and more human as the story progresses. Could this be a bit of visual metaphor or perhaps foreshadowing?
104,"May 12, 2022","all she has to do is say ""I admit defeat dokja. you beat me"" because the scenario says defeat, not kill"
104,"May 12, 2022","“Have you been thinking that far ahead already?” “Sir, I’ve been thinking 100 chapters ahead of you.”"
104,"May 12, 2022",this is the first time I've spent enough coins to catch up to all the pre-releases. and it was so worth it 😭
104,"May 11, 2022",Challenging the mid-level Dokkaebi by being Dokja. Sometimes people won't listen when they think they can't lose.
104,"May 11, 2022","Man, this really needs some mass dumps like Advanced Player Of The Tutorial Tower. C’mon, their Fast Pass is like 175 days ahead of regular readers. Once you’re that far in, you can’t just not Fast Pass. You aren’t going to wait 6 months for a new free chapter. And this series is so freaking good, they can take an extra 5 months of Fast Pass coins from me."
104,"May 11, 2022",Dokja really out here marked for death and manipulating beings with more power than gods.
104,"May 11, 2022",Mid tier dude getting shafted is my 2nd favorite thing behind Dokja being a dad
104,"May 11, 2022",I am your contempt…. Live your life 🕊
104,"Jun 15, 2022","hey author I just realized, you want to keep this going for many years right? Your not gonna pull one like the author in the book and start a whole thing like this in the real world......right?"
104,"Aug 29, 2022",I love jihye's face when people agree with dokja lmao
104,"Aug 25, 2022",all my homies hate the Intermediate Dokkaebi 
104,"Aug 25, 2022",Look at gilyeong 
104,"Jul 16, 2022",i love it everytime when dokja stands up against a dokkaebi
104,"Jul 14, 2022","This is what i call being a ""King"""
104,"Jul 14, 2022",I noticed this a while ago but she doesn’t have a shirt on just fur/feathers that cover her.
104,"Jul 12, 2022",I really am going to start counting how many times kdj has had a bounty on his head. It's been like what 3 WHOLE TIMES NOW.
104,"Jun 24, 2022",yes dokja protecc squads!!
104,"Jun 23, 2022",[The Constellation 'Unproductive Reader' is glaring at the mid-level dokkaebi]
104,"Jun 22, 2022","omg i'm finally caught up o3o. i just binge-read the s*** outta this manhwa. dude, it is so good. idk how the heck y'all update so frequently w/ such high quality art. good sh** 👍"
104,"Jun 21, 2022","This is probably the only episode where I've understood Junghyeok's logic. Because, honestly, I would do the same."
104,"Jun 21, 2022","wow, i caught up in less than a day..."
104,"Jun 21, 2022",I FEEL LIKE 112 WILL RELEASE TOMORROW 
104,"Jun 21, 2022",Anxious bihyeong is sooo cute 😩
104,"Jun 20, 2022",this is the best book I've read in a long time. keep up the good work👌
104,"Jun 20, 2022","I’ve binged this for weeks and I can honestly say I am genuinely disappointed that I actually caught up because now I have to wait for more episodes. ,ÓnÒ,"
104,"Jun 20, 2022",Day 103 of voicing all the characters
104,"Jun 20, 2022",I'm sorry I just cant imagine how bad he looks to them seeing as he's doing such important stuff with no face covering 
104,"Jun 20, 2022",HSVAJSBSKDKD I CAUGHT UPP NOOOO IM SO ANGRYYY 😭😭😭
104,"Jun 20, 2022",ayo the mid level dokkaebi is kinda…
104,"Jun 20, 2022",The constellation that eats schnaps chocs is bathing in the ensuing chaos!
104,"Jun 19, 2022",KEKRKEIWISKAKLYAAAAAAAAHHHHHHHHHHHHHHH
104,"Jun 19, 2022","hey guys, what chapter is this in the novel??"
104,"Jun 18, 2022",NOOOOO I NEED MORE…!
104,"Jun 18, 2022","No one who wants to live would go for the kill, right? There’s no time limit. So no one has to die. If they exchange it for another main scenario though…"
104,"Jun 18, 2022",what a d*ck
104,"Jun 17, 2022",Please tell me Dokja killed the catastrophe? 
104,"Jun 17, 2022",also for those saying she is defeated and dosen't have to be killed she is still fighting mentally so she isn't done just yet
104,"Jun 20, 2022",this is the best book I've read in a long time. keep up the good work👌
104,"Jun 20, 2022","I’ve binged this for weeks and I can honestly say I am genuinely disappointed that I actually caught up because now I have to wait for more episodes. ,ÓnÒ,"
104,"Jun 20, 2022",Day 103 of voicing all the characters
104,"Jun 20, 2022",I'm sorry I just cant imagine how bad he looks to them seeing as he's doing such important stuff with no face covering 
104,"Jun 20, 2022",HSVAJSBSKDKD I CAUGHT UPP NOOOO IM SO ANGRYYY 😭😭😭
104,"Jun 20, 2022",ayo the mid level dokkaebi is kinda…
104,"Jun 20, 2022",The constellation that eats schnaps chocs is bathing in the ensuing chaos!
104,"Jun 19, 2022",KEKRKEIWISKAKLYAAAAAAAAHHHHHHHHHHHHHHH
104,"Jun 19, 2022","hey guys, what chapter is this in the novel??"
104,"Jun 18, 2022",NOOOOO I NEED MORE…!
104,"Jun 18, 2022","No one who wants to live would go for the kill, right? There’s no time limit. So no one has to die. If they exchange it for another main scenario though…"
104,"Jun 18, 2022",what a d*ck
104,"Jun 17, 2022",Please tell me Dokja killed the catastrophe? 
104,"Jun 17, 2022",also for those saying she is defeated and dosen't have to be killed she is still fighting mentally so she isn't done just yet
104,"Jun 16, 2022",really dont like this translation 😢😢
104,"Jun 16, 2022",Less go dokja tell him!
104,"Jun 16, 2022","This doesn’t make up for what he did, but it’s a start I suppose"
104,"Jun 16, 2022",Oh gaaud.. I thought I won't comment this week
104,"Jun 16, 2022",I wouldn't call it thinking 
104,"Jun 16, 2022",I think I read this chapter too fast lol 😅😅
104,"Jun 16, 2022",nonononoooooo
104,"Jun 15, 2022","it only says to defeat the catastrophe, not kill :)"
104,"Jun 15, 2022",Bro it just says defeat the catastrophe not kill he already completed it
104,"Jun 15, 2022",dang it.... i forgot i fast passed last week and now i want more 😭😭
104,"Jun 15, 2022","HOLD UP!! Did… did they just use Dokja’s assets with a grey hoodie, minus a face, on one of the nameless nobody’s??? It has his hair and jawline!"
104,"Jun 15, 2022","it's coming, next chapter perhaps or the one next"
104,"Jun 15, 2022",bro just play roshanbo
104,"Jun 15, 2022",I hate this Mid Dokkaebi
104,"Jun 15, 2022",My theory is the Mid-Level Dokkaebi is the Cinema Master from the early episodes and he knows what Dokja is this whole time. He never died and has the same eyes.
104,"Jun 16, 2022",really dont like this translation 😢😢
104,"Jun 16, 2022",Less go dokja tell him!
104,"Jun 16, 2022","This doesn’t make up for what he did, but it’s a start I suppose"
104,"Jun 16, 2022",Oh gaaud.. I thought I won't comment this week
104,"Jun 16, 2022",I wouldn't call it thinking 
104,"Jun 16, 2022",I think I read this chapter too fast lol 😅😅
104,"Jun 16, 2022",nonononoooooo
104,"Jun 15, 2022","it only says to defeat the catastrophe, not kill :)"
104,"Jun 15, 2022",Bro it just says defeat the catastrophe not kill he already completed it
104,"Jun 15, 2022",dang it.... i forgot i fast passed last week and now i want more 😭😭
104,"Jun 15, 2022","HOLD UP!! Did… did they just use Dokja’s assets with a grey hoodie, minus a face, on one of the nameless nobody’s??? It has his hair and jawline!"
104,"Jun 15, 2022","it's coming, next chapter perhaps or the one next"
104,"Jun 15, 2022",bro just play roshanbo
104,"Jun 15, 2022",I hate this Mid Dokkaebi
104,"Jun 15, 2022",My theory is the Mid-Level Dokkaebi is the Cinema Master from the early episodes and he knows what Dokja is this whole time. He never died and has the same eyes.
104,"Jun 15, 2022","BUT CHEESY AS PIE...I SAID IT LAST EPISODE, AND I'M SAYING IT AGAIN. I'M ENVIOUS OF S CLASSES THAT I RAISED"
104,"Jun 15, 2022",How tragic and ironic. SYS understood YJH because she lived thousands of years because of him
104,"Jun 15, 2022",Dokja telling the dokkaebi what to do is just a whole other level of superiority Thanks for the amazing episode authors and translator-nim 💫💓
104,"Jun 15, 2022",can someone tell me where to read the novel??
104,"Jun 15, 2022","it took me FOREVER but I am FINALLY caught up with the latest non fast pass episode 
ahh dokja dokja dokja you are really something "
104,"Jun 15, 2022",I fking hate Paul 😭😭😭😭😭
104,"Jun 15, 2022","dude, he's fucking lightyears ahead what do you mean ""you've already thought that far ahead?"""
104,"Jun 15, 2022",So short
104,"Jun 15, 2022","oop- well damn , you go dokja"
104,"Jun 15, 2022",I bet Junghyuk Yu never had as much influence on so many people as Dokja has. The Catastrophe is amazed at how much the people listen to him. This is awesome
104,"Jun 15, 2022",this shit is getting better chapter by chapter
104,"Jun 15, 2022","""what is his deal"" - everyone about Dokja ever"
104,"Jun 15, 2022","Aww, future Yuseung looks sort of happy"
104,"Jun 15, 2022","The art's been so good lately- the fully rendered panels, man 😫👌"
104,"Jun 15, 2022",this damn dokkaebi paul. arghhh I REALLY HATE HIM
104,"Jun 15, 2022",PERIOD
104,"Jun 15, 2022",Dude you don't know who dealing with you mid-tier dokkeabi. THAT GUY IS BEYOND THE TIMELINE
104,"Jun 15, 2022",beautiful
104,"Jun 15, 2022","""I didn't know the incarnations of Seoul dome would be such cowards."" they aren't cowards, they just have morals, unlike you."
104,"Jun 12, 2022",The constellation webtoon reader is disappointed by the lack of coins to spend :(
104,"Jun 12, 2022",Dokja replacing Junhyeok
104,"Jun 11, 2022","He has plans of far far ahead sir mid- level dokkaebi... it might be difficult for the small bunch of neurons in your top level to map it all he has even executed so far, let alone plotted;) "
104,"Jun 10, 2022",The word defeat can be used to say kill but it can also mean to force them into submission or surrender also taking them as ally’s. Also it said double the main scenario so the sub scenario alone is 200k along with the main scenarios (100k) making to 300k instead of just 200k.
104,"Jun 3, 2022","although i know what will happen next, I kinda feel so sad about 41st Regression Yueseung. 😭😭😭"
104,"Jun 1, 2022",———————————No coins?——————————— ⠀⣞⢽⢪⢣⢣⢣⢫⡺⡵⣝⡮⣗⢷⢽⢽⢽⣮⡷⡽⣜⣜⢮⢺⣜⢷⢽⢝⡽⣝ ⠸⡸⠜⠕⠕⠁⢁⢇⢏⢽⢺⣪⡳⡝⣎⣏⢯⢞⡿⣟⣷⣳⢯⡷⣽⢽⢯⣳⣫⠇ ⠀⠀⢀⢀⢄⢬⢪⡪⡎⣆⡈⠚⠜⠕⠇⠗⠝⢕⢯⢫⣞⣯⣿⣻⡽⣏⢗⣗⠏⠀ ⠀⠪⡪⡪⣪⢪⢺⢸⢢⢓⢆⢤⢀⠀⠀⠀⠀⠈⢊⢞⡾⣿⡯⣏⢮⠷⠁⠀⠀ ⠀⠀⠀⠈⠊⠆⡃⠕⢕⢇⢇⢇⢇⢇⢏⢎⢎⢆⢄⠀⢑⣽⣿⢝⠲⠉⠀⠀⠀⠀ ⠀⠀⠀⠀⠀⡿⠂⠠⠀⡇⢇⠕⢈⣀⠀⠁⠡⠣⡣⡫⣂⣿⠯⢪⠰⠂⠀⠀⠀⠀ ⠀⠀⠀⠀⡦⡙⡂⢀⢤⢣⠣⡈⣾⡃⠠⠄⠀⡄⢱⣌⣶⢏⢊⠂⠀⠀⠀⠀⠀⠀ ⠀⠀⠀⠀⢝⡲⣜⡮⡏⢎⢌⢂⠙⠢⠐⢀⢘⢵⣽⣿⡿⠁⠁⠀⠀⠀⠀⠀⠀⠀ ⠀⠀⠀⠀⠨⣺⡺⡕⡕⡱⡑⡆⡕⡅⡕⡜⡼⢽⡻⠏⠀⠀⠀⠀⠀⠀⠀⠀⠀⠀ ⠀⠀⠀⠀⣼⣳⣫⣾⣵⣗⡵⡱⡡⢣⢑⢕⢜⢕⡝⠀⠀⠀⠀⠀⠀⠀⠀⠀⠀⠀ ⠀⠀⠀⣴⣿⣾⣿⣿⣿⡿⡽⡑⢌⠪⡢⡣⣣⡟⠀⠀⠀⠀⠀⠀⠀⠀⠀⠀⠀⠀ ⠀⠀⠀⡟⡾⣿⢿⢿⢵⣽⣾⣼⣘⢸⢸⣞⡟⠀⠀⠀⠀⠀⠀⠀⠀⠀⠀⠀⠀⠀ ⠀⠀⠀⠀⠁⠇⠡⠩⡫⢿⣝⡻⡮⣒⢽⠋⠀⠀⠀⠀⠀⠀⠀⠀⠀⠀⠀⠀⠀⠀ —————————————————————————————
104,"May 19, 2022","I never spent money on webtoon /other reading apps before, but after this mean cut in Episode 99 I had to.. and it is totally worth it!"
104,"May 17, 2022","Dokja is such a KING omg i live him. And also, im literally rolling — the way Junghyeok just says some gibberish to Yuseung, takes the blame on himself like nothing and walks away like ""Yeah, my work is done. My boyfriend will handle the rest."" AND DOKJA DOES HANDLE THE REST. I live for their dynamic. AND MID LEVEL DOKKAEBI U ARE NOTHING IN FRONT OF DOKJA SO JUST GO AWAY AND STOP TRYING!!!"
104,"May 16, 2022","It's gonna be so long before my favorite arc is even shown in the webtoon, but I'll wait because it's gonna be worth it when it is. Dark Castle is so fire. 🔥 "
104,"May 16, 2022",got free coins today and used it up on OR again :D why the heck is this so addicting thoo
104,"May 15, 2022",All my homies hate that mid level
104,"May 15, 2022","Haha, I love our sassy bug boi"
104,"May 14, 2022",I finally caught up after binging this for the past week or so. Now I get to know the pain of waiting for the next chapter!
104,"May 14, 2022",😭
104,"May 14, 2022",bruuuh
104,"May 13, 2022",Does anyone know what chapter of the novel this would be?
104,"May 13, 2022",Dokja is 99 scenarios ahead of you lol
104,"May 13, 2022","It’s always this MID-level dokkaebi, he whack and needs be fired."
104,"May 13, 2022","I really really like how useful Catastrophe!Yuseung is when it comes to character development, world building and going outside of the round the characters are currently in. I've said it before and I'll say it again, she's a great addition and a wonderful character "
104,"May 12, 2022","Technically it only says defeat, it doesn't say she needs to be killed."
104,"May 12, 2022",Papa Dokja is adding another family member. I guess this means twins (?)
104,"May 12, 2022",“You must defeat the catastrophe” Do we tho?🤷‍♂️
104,"May 12, 2022","Just f**k you Paul, just f**k you!"
104,"May 11, 2022",We demand more! 
104,"May 11, 2022",Thank goodness. This is exactly what I needed. I literally have been having the most horrible day and I was so happy to come home and see this. 
104,"May 11, 2022",I finally caved into buying coins and omg I regret nothing this series is amazing
104,"May 11, 2022","Ooooo... He might have overplayed his hand, the dokkaebi might be picking up that he has knowledge beyond the immediate scenerios "
104,"May 11, 2022",Duuuude...the Dokja squad goes HAAAAAARD. 
104,"May 11, 2022","Let the mayhem begin......


On the next chapter of Dokja's life! "
104,"May 11, 2022",🙈 i don't even want to know how many coins i just spent
