Episode,Date,Review
61,"Aug 8, 2022","the way the only hwarang of silla i know are seo joon, taehyung, and minho"
61,"Aug 4, 2022",Has anyone ever read solo leveling before? Cus I’m pretty sure this Webcomic was made from the same person.
61,"Aug 2, 2022",the way history is also involved in all of this is definitely incredible 
61,"Aug 2, 2022","Dokja may have knowledge, but he is plotting and schemings everything on his own. The man is a King, go take your throne, man."
61,"Jul 30, 2022","when dokja said ""attack"" while being possessed by a constellation was very cool *whistles*"
61,"Jul 4, 2022",sangah & her historical knowledge ❤️🙌
61,"May 27, 2022",This episode was ✨️🤌✨️
61,"May 21, 2022","it was a touching episode,It's my fav now. i'm now really gonna read novel after reading 100 ep of this.
i don't know the history but i really felt sad for gyebark.this series is really powerful it changed my feeling so powerfully! specially dokja and mine thinking style is fully same,It's scaring me now cz I'm falling in love with this series. and if i transmigrate any of my fav novel,I'll die immediately. i saw some spoiler so i know ending will be sad 😭😭😭
i hope I'll handle that 😭😭 "
61,"May 5, 2022",3minutes that's more than enough 😎
61,"Apr 30, 2022","""The power of the constellation artifact, blue dragon sword has entered unbreakable trust."" ..unbreakable trust.. unbreakable faith .       . 🤸‍♂️. . . . . .🏌️‍♀️"
61,"Apr 26, 2022",Checkmate
61,"Mar 24, 2022",I need the galaxy as a wallpaper without the sparkle texts😫😫
61,"Mar 17, 2022",One thing Dokja always manages to do is find an option which allows him to preferably not participate in battle and if he does his victory is usually eminent with his opponents LOLS HIS CHARACTER IS SO AWESOME AND SAVAGE ;)
61,"Mar 14, 2022",in the words of Zuko- -HONOR!!
61,"Mar 12, 2022",SHEeEeEEEeEEeeShH!!😍😍
61,"Feb 28, 2022",YOU'RE A KING DOKJA 👑!!! Thanks for the amazing episode authors and translator-nim 💫💫 !!!
61,"Feb 25, 2022","i dropped this before bc it's confusing me a lot, i am not that familiar w history but i'm glad i pick it up again, i'm now getting hype and even got interested in korean history!!"
61,"Feb 17, 2022",I never read somethibg like this before
61,"Feb 11, 2022","if this adapted into drama/movie/animated series, I absolutely ASAP watching it...I'm really addicted to this Webtoon...I read from 10th episode up to this episode, continuously from the morning, and I will continuously reading it until the last chapter that is available for me to read ☆"
61,"Feb 4, 2022",fourtl wall cancelled
61,"Feb 3, 2022",This whole chapter gave me goosebumps! Awesome! Especially when he summoned the army of dead. Gave me a little bit of Solo Leveling vibes and i like that! I really like it 😎😍
61,"Feb 3, 2022",This chapter is giving me serious Solo Leveling vibes.........
61,"Jan 31, 2022","When General Kim possessed Dokja and started speaking, did anyone else read those panels in a deep-harsh voice? or was it just me? "
61,"Jan 28, 2022",sung jinwoo bro…
61,"Jan 28, 2022","Screw him being a reader, I mean, hes a reader but DANG MAN. If you know the story well and get teleported there. You have an advantage"
61,"Jan 19, 2022",looking for hwarang kim taehyung like 👀
61,"Jan 2, 2022",dokja be lookin like jinwoo rn
61,"Jan 2, 2022",smells like solo leveling in here
61,"Dec 30, 2021",Gonna ignore Sangah with an actual sword now. Most likely from the museum though
61,"Dec 28, 2021",if you think about it dokja is doing what the original mc was supposed to do and sense some stuff was changing that wasn't originally in twsa so I'm thinking that's how he is going to become the mc 🤯
61,"Dec 25, 2021",ok this is probably my fav chapter so far. this was Epic
61,"Dec 22, 2021",ooh I'm getting smarter 😂 thank you author!
61,"Dec 21, 2021",these skeletons looks.... impressively fine looking
61,"Dec 14, 2021",I really hope this will have an Anime if possible
61,"Dec 13, 2021",ok that was epic 
61,"Dec 7, 2021",Day 60 of voicing all the characters
61,"Dec 4, 2021","The vigor with which I have enjoyed the fictions you weave is down right shocking. You have made such remarkable artwork and yet, craft such fantastic stories. well done."
61,"Dec 2, 2021","the korean history is really nicely put here, now i can understand it more rather than when i read the novel. props to the artist!❤️"
61,"Dec 1, 2021","Wow this episode really kinda touched me, now i wanna know more about korean history!"
61,"Nov 26, 2021","Ayo this feels like TWSA. What I mean is, the longer this drags out the less likes and comments there are"
61,"Nov 20, 2021",dokja looks so pretty omg
61,"Nov 18, 2021",its 3am and i'm contemplating if i should keep reading right now or not....
61,"Nov 17, 2021",oh my fck the spears stuck through gyebaek... one of them definitely pierced his spine ouch i feel it
61,"Nov 8, 2021",wait- 8 HOURS??!
61,"Nov 5, 2021",Oh my lord Dokja is so cool when he says attack Jesus crist 
61,"Nov 1, 2021",Dokja is pure proof that anyone can be an MC of course as long as you have the experience he has whether it's accumulated through books/LN/real life and afterwards mixing those and creating and recreating certain interpretations and obtaining the ability to search throughout your imagination for variables and opportunities
61,"Oct 25, 2021","this episode is soooo good bro, i love this chapter. The author really outdone themselves with this! Thank you to everyone who made this possible"
61,"Oct 21, 2021","the best story ever👈i can't think of any words right now..superb author! Ur writing are legend as it full with passion,historic,metaphore..ArghhhLOT OF LOVES♥️♥️♥️♥️"
61,"Oct 19, 2021",Imagine this episode as anime 😭
61,"Oct 11, 2021",I'm not sure if I like the translation of Plausibility over Probability
61,"Oct 4, 2021",I am so hyped with the art!!!! this story is getting more and more exciting 
61,"Oct 3, 2021",dangitt dass so cool!! and props to sangaaah ilhsm
61,"Sep 29, 2021",man I love this webtoon its so good
61,"Sep 23, 2021",y are the hwarang so good looking omg
61,"Sep 16, 2021",Woah so cool
61,"Sep 15, 2021",There is no way that the red eyed constellation did not like the blue eyed general Atleast tell me he admired him
61,"Sep 11, 2021",I LOVE EVERYTHING AHHHH
61,"Sep 8, 2021",I have never got chills reading an episode of any webtoon till yet . I really respect you writers. This webtoon is amazing you guys have left me speechless .
61,"Sep 8, 2021",Holy crow this chapter impressed me
61,"Sep 7, 2021",Arise
61,"Sep 6, 2021","This is the WEBTOON’s 1 year anniversary! Though this is some time after, thank you to the creator for this masterpiece!"
61,"Sep 5, 2021",So is it bad I read all 62 chapters in one day? I just want more. The author is doing a great job. I wish I could do this but I just started digital art so it will take some time. I hope when I start making one I can talk to the author for advice. 
61,"Sep 4, 2021","I really miss Dokja’s inner thoughts during the story, so i figured i’d share some of my favorite lines from this chapter in the novel: 
“It was cruel. They would raise their blades as long as Kim Yushin was here. This was despite their souls being worn down, their anger erased and even their hearts gone.
They were soldiers who fought to prevent the fall of their kingdom. Now they were fighting for a fallen kingdom.”"
61,"Sep 1, 2021",KING DOKJA
61,"Aug 30, 2021",I am ready to take 10 years to read this with 3000+ episodes Dokja 🔥🔥🙏
61,"Aug 30, 2021","For anyone who wants to know what's going on:So basically the King arc is reaching a climax. Dokja hasn't yet conquered his target station, and is too far away to do it now. The incarnations of some Historical-grade constellations recreated a historical battle. Dokja and a historical-grade constellation related to that history interfered with the recreation of the past events. All the kings are trying claim a Throne that will give the user absolute command over other kings and their people."
61,"Aug 29, 2021",imma cry author-nim knows so much abt history and here i am slacking off
61,"Aug 28, 2021",Stage Transformation....
61,"Aug 26, 2021",GOOSEBUMPS
61,"Aug 26, 2021",best chapter ever.
61,"Aug 25, 2021","Dokja is intelligent, using Yusin Kim to his advantage not only for the battle of Hwangsanbeol but to fight against the other stations was a power move"
61,"Aug 25, 2021",Sangah my girl
61,"Aug 24, 2021",this is such a good read
61,"Aug 24, 2021",j used speed read and regretted it until Wednesday 
61,"Aug 24, 2021","""it may be over for you but it's not over for us!"" "
61,"Aug 23, 2021",I wonder if dojka can transform into another species to circumvent the restriction 🤔
61,"Aug 23, 2021",last one
61,"Aug 21, 2021","777, A, BRAVE, A"
61,"Aug 21, 2021",i need more like rn
61,"Aug 20, 2021",Ok because that was too cool
61,"Aug 20, 2021",Well dang. That works
61,"Aug 19, 2021",666th comment. 😈
61,"Aug 19, 2021",That was Awesome!!!
61,"Aug 19, 2021",try readinh a world without a hero 🤷‍♂️
61,"Aug 19, 2021",so cool so cool so cool so cool 
61,"Aug 19, 2021",Dokja deserves to be the king 😳 🤩
61,"Aug 19, 2021",This ep is EPIC wow...!
61,"Aug 19, 2021",BRAVE
61,"Aug 19, 2021",HEAVEN 
61,"Aug 19, 2021",ANGELS 
61,"Aug 19, 2021","SUCCESSFUL, A"
61,"Aug 19, 2021",777 
61,"Aug 19, 2021",Wow every episode just keeps getting more and more unpredictable and I love it! 👍🔥
61,"Aug 18, 2021",The art is so good!!! 
61,"Aug 18, 2021",s a n s  but hd
61,"Aug 18, 2021",Every chapter of this webtoon makes me hold my breath and feel tingly inside 🥶
61,"Aug 18, 2021",I don't understand what's happening in this webtoon anymore
61,"Aug 18, 2021",Yes get it dojka
61,"Aug 18, 2021",UNDEAD ARMY! UNDEAD ARMY! 😄😁
61,"Aug 18, 2021",that was fucking sick. what the hell.
61,"Aug 18, 2021",I am so confused
61,"Aug 18, 2021","Wait in the ""kdrama Hawarang"" wasn't it Taehyung who was the youngest Hawarang who dies? "
61,"Aug 19, 2021",BRAVE
61,"Aug 19, 2021",HEAVEN 
61,"Aug 19, 2021",ANGELS 
61,"Aug 19, 2021","SUCCESSFUL, A"
61,"Aug 19, 2021",777 
61,"Aug 19, 2021",Wow every episode just keeps getting more and more unpredictable and I love it! 👍🔥
61,"Aug 18, 2021",The art is so good!!! 
61,"Aug 18, 2021",s a n s  but hd
61,"Aug 18, 2021",Every chapter of this webtoon makes me hold my breath and feel tingly inside 🥶
61,"Aug 18, 2021",I don't understand what's happening in this webtoon anymore
61,"Aug 18, 2021",Yes get it dojka
61,"Aug 18, 2021",UNDEAD ARMY! UNDEAD ARMY! 😄😁
61,"Aug 18, 2021",that was fucking sick. what the hell.
61,"Aug 18, 2021",I am so confused
61,"Aug 18, 2021","Wait in the ""kdrama Hawarang"" wasn't it Taehyung who was the youngest Hawarang who dies? "
61,"Aug 18, 2021",damn
61,"Aug 18, 2021",Dokja has evolved toooooo: Possesed hero Kim Dokja!!!
61,"Aug 18, 2021","After watching Saint Seiya for a while I'm starting to get vibes similar to it from this. It doesn't burn my Cosmo but, it is very interesting."
61,"Aug 18, 2021",this really gives me the best goosebumps (^o^;)
61,"Aug 18, 2021",YES
61,"Aug 18, 2021",goosebumps goosebumps goosebumps
61,"Aug 18, 2021",damn
61,"Aug 18, 2021",That's ! So Cool !!
61,"Aug 18, 2021",That was pretty badass to say the least 
61,"Aug 18, 2021",omg nico
61,"Aug 18, 2021","at that  point, I don't understand anything. But it's so darn good that I can't stop reading it 🤣🤣🤣"
61,"Aug 18, 2021",So AWESOME as always!!!\
61,"Aug 18, 2021",this greatness makes the episode seems short
61,"Aug 18, 2021","History is awesome, but I'm not sure I'd like it if certain historical figures just popped into human bodies."
61,"Aug 18, 2021",Why is everyone being so badass today?!?! First Ijin Yu from teenage Mercenary and now Dokja too?!?!
61,"Aug 18, 2021",damn
61,"Aug 18, 2021",Dokja has evolved toooooo: Possesed hero Kim Dokja!!!
61,"Aug 18, 2021","After watching Saint Seiya for a while I'm starting to get vibes similar to it from this. It doesn't burn my Cosmo but, it is very interesting."
61,"Aug 18, 2021",this really gives me the best goosebumps (^o^;)
61,"Aug 18, 2021",YES
61,"Aug 18, 2021",goosebumps goosebumps goosebumps
61,"Aug 18, 2021",damn
61,"Aug 18, 2021",That's ! So Cool !!
61,"Aug 18, 2021",That was pretty badass to say the least 
61,"Aug 18, 2021",omg nico
61,"Aug 18, 2021","at that  point, I don't understand anything. But it's so darn good that I can't stop reading it 🤣🤣🤣"
61,"Aug 18, 2021",So AWESOME as always!!!\
61,"Aug 18, 2021",this greatness makes the episode seems short
61,"Aug 18, 2021","History is awesome, but I'm not sure I'd like it if certain historical figures just popped into human bodies."
61,"Aug 18, 2021",Why is everyone being so badass today?!?! First Ijin Yu from teenage Mercenary and now Dokja too?!?!
61,"Jul 28, 2021",THAT WAS SUCH A BOSS MOVE 
61,"Jul 22, 2021",These Chapters Just Keep Getting Better And Better 
61,"Jul 21, 2021",thank you author for helping me through this journey. can't wait for the epilogue.
61,"Jul 17, 2021",Wow the Walking Dead army smashed it!! Dokja never fails to surprise lol
61,"Jul 17, 2021",oh no i have reaced the point of no return(5 coins have been sponsered)
61,"Jul 16, 2021","It truly is a skill to make the story so vivid that when an event so exciting like the constellation descending happens it makes the reader's heart race. First time I spent money on a webtoon, but I definitely do not regret it."
61,"Jul 15, 2021",Dokja straight up went super saiyan in this episode lol
61,"Jul 15, 2021","That's a pretty amazing episode! I just hope they could disclose how many times the relic Ganpyeongui could be used, cause i think it's quite op if he could use it numerous times without penalties nor drawbacks."
61,"Jul 15, 2021",I don't usually comment or say this but. That was awesome.
61,"Jul 14, 2021",Wow… quality of this WebToon is amazing!
61,"Jul 14, 2021",that was so cool
61,"Jul 14, 2021","[constellation""Dragon of the Peach Tree"" was moved by incarnation Sangah's speech. gifts 5 coins] "
61,"Jul 14, 2021",set us free are oath is completed
61,"Jul 14, 2021",Bro my boi dokja really with sung jinwoo from solo leveling
61,"Jul 14, 2021","I was accidentally playing some dramatic music and it made this so much better, please consider adding music to the episodes from time to time!"
61,"Oct 15, 2021",It’s just awesome seeing historical characters being a part of this story . 
61,"Aug 18, 2021",Dokja you're so cool 😍😍😍✨✨✨
61,"Aug 11, 2021",Jiwon Min is so pretty 🖐️😩
61,"Jul 14, 2021",The DnD campaign is looking a little deadly there 
61,"Jul 14, 2021","Regrets of never being able to fight your rival, one last time. Pain, but still such an amazing chapter."
61,1 days ago,......Oh hey look free pants.
61,6 days ago,Ikkeeeeee
61,6 days ago,Dokja: *gets posses by General Yusin Kim* My Hamifan brain: HERE COMES THE GENERAL 
61,6 days ago,"I feel like Dokja will become so immersed as a person, that he can choose to become a character. Maybe even switch places with Junghyeok? Since it's straying from the original story, and he finds himself in the situations where Junghyeok should have been, he might be/become a main character alongside Junghyeok"
61,"Oct 11, 2022","I appreciate this webtoon even more now that they've shown one of the major events in South Korean history. It's fascinating to know about another country's history, even if it's a tiny bit. "
61,"Oct 7, 2022",the dramatisation is SO COOL... i hope to see many more of these down the line
61,"Sep 26, 2022",I don’t like how the Dokkaebi keeps creating so many scenarios and changing the rules.
61,"Sep 26, 2022","If something you summon kills someone that counts as you killing someone.
The summoned skeletons have broken Dokja’s “King of No Killing” title."
61,"Aug 8, 2022","Kinda feel bad that even then, the general avoided killing the other dude one on one. He had one of his men do it for him."
61,"Aug 6, 2022",60
61,"Aug 3, 2022","i love how they also incorporate korean history into this just wow, and the art is as beautiful as always"
61,"Aug 3, 2022",i really appreciate the top comments for placing spoiler warnings of their reply section
61,"Aug 2, 2022","I just realize it, Dokja is already wearing shoes while that guy I forgot his name still don't have pants 🤔"
61,"Aug 2, 2022",does anyone else recognised the Hwarang and Gyebaek from taekwondo??
61,"Jul 30, 2022",I got chills in my spine 
61,"Jul 30, 2022","Does anyone else think that Dokja's eyes are pritty when a constellation is possessing his body?? ✨👁️👁️✨ I mean, there always pritty. but they look BEAUTIFUL."
61,"Jul 29, 2022",dokjas eyeliner just seems to get thicker with every single chapter and i am here for it
61,"Jul 28, 2022",That star scene was beautiful. 
61,"Jul 25, 2022","Man, I NEED this to become an anime. This is absolutely amazing. Beautifully drawn, dynamic characters and tense action.  I would pay a ton of money to own an animated version of this. Great job, author!"
61,"Jul 23, 2022",i know yusin kim from the great queen of seondeok 
61,"Jul 4, 2022",okay to Polish folks reading: imagine Zawisza Czarny as a constellation or Jeremi Wiśniowiecki or Stefan Czarniecki or like the most op Bolesław Chrobry and so on like imagine their divinations and special skill and all oh my god so cool
61,"Jul 4, 2022","I have goosebumps, this chapter was beautiful "
61,"Jul 4, 2022",that was so cool
61,"Jul 4, 2022","I refuse pretty boys dying, the Hwarang guy has to live this time"
61,"Jul 4, 2022",Dokja's eyes look so pretty that color. It suits him.
61,"Jul 4, 2022","this episode amazed meee, muchh! "
61,"Jul 3, 2022",His so smart lol
61,"Jul 1, 2022",KDJ is a true king. you have my praise and loyalty
61,"Jun 25, 2022",I could not stop reading! Your art and storytelling is impeccable. I enjoy the game vibe 🥰☺️
61,"Jun 24, 2022","Such a great, intricate, deep, interesting and provoking comic. I’m always curious and excited to read it. There’s so much to learn and even when you get some answers, you end up with more questions. A truly amazing piece."
61,"Jun 22, 2022",I'm not gonna sleep just to read this cause it so good
61,"Jun 22, 2022",if this were to happen in real life my life would get more exciting than just reading manhwas/mangas/webtoons laying down in bed
61,"Jun 22, 2022","[The Constellation 'Unproductive Reader' is quite confused that ""Stage Transformation"" has been changed to ""Dramatization"" but says that it's acceptable]"
61,"Jun 17, 2022",man if this gets a live adaptation..sure it will be hard
61,"Jun 17, 2022",I really do like that the constellations are basically just people
61,"Jun 13, 2022",Dokja or the constellation just pulled off epic arise moment
61,"Jun 11, 2022","Gagi, ANGAS!!"
61,"Jun 10, 2022",they got skeleton roasted
61,"Jun 10, 2022","I was really moved by the concept of setting history right. Even if the true history is over and done, having that chance to try again and protect your people..."
61,"Jun 10, 2022",summoning a constellation wow that was stunning
61,"Jun 5, 2022",Dokja is Nico confirmed?
61,"Jun 3, 2022",this is ep is one of my fav eps now 🙁
61,"Jun 3, 2022","What if he called on Sun Wukong ""because it'd be funny""
Old Monkey would've probably been convinced by just that"
61,"Jun 2, 2022",this is one of these historical accurate mangas that are my favorite!!!!
61,"May 22, 2022",imagine trying to play this as an MMO 
61,"May 16, 2022",[The constellation Keeper of Dreams is confused buy korean history]
61,"May 14, 2022",Dokja really went shadow Monarch huh
61,"May 9, 2022",man I'm a big history nut! and when fantasy meets history it's just *fireworks*
61,"May 5, 2022",damn.. dokja big brain 
61,"Apr 29, 2022","this is just necromancer jihu vs white mage kobek all over again ( these are 2 figures i made up, jihu is a high authority necromancer who can raise up to 9,000,000 undead,and kobek can use light magic ). its gonna be a mess"
61,"Apr 20, 2022","i just wanna express how much i love your work, i can't stop reading it"
61,"Apr 17, 2022",this chapter is just.. chills
61,"Apr 17, 2022",didn't Dokja killed 1 person in first scenario? possessive demon kid? 
61,"Apr 16, 2022","I must say that I didn't really like the last few chapters.  Sounds like history class lol.  I don't know the history of my country very well, to know that of Korea"
61,"Apr 14, 2022",OMFG DOKJAAAA
61,"Apr 13, 2022",*insert skeleton meme here*
61,"Apr 12, 2022",So foood
61,"Apr 11, 2022","so gooooooood! i got goosebumps, i think i'm okay to die now hehe"
61,"Apr 9, 2022",literallt what just happened with the skeletons?
61,"Apr 8, 2022",I want to see Dokja do that with secretive plotter!
61,"Mar 25, 2022","the author is like, ""if only the past could be changed, if only the once catastrophic stars motions could be reversed."""
61,"Mar 20, 2022","wow, as a korean who knows a bit of it's history this is one of the most intriguing webcomics i've ever read."
61,"Mar 10, 2022",Im finally decided to pick kff where i left from
61,"Mar 7, 2022",If only they taught history like this at my school-
61,"Mar 5, 2022",when they said calling all hearing I could just imagine calling all the monsters playing as the background music 😂😂
61,"Mar 3, 2022","Loved this episode and the way we learned more about the constellations--in addition to a small glimpse into what would happen to the real people that are in this dome. Not sure what that means for Sangah though (ToT) I hope she'll be okay...gahhh I'm addicted to reading this, I seriously can't stop"
61,"Feb 22, 2022",Holy moly he's playing them like a damm chess game 
61,"Feb 17, 2022",again ITS SO COOL!!!!!!!!
61,"Feb 17, 2022",IT'S SO COOL!!!!!!!!!!!!!
61,"Feb 16, 2022",I love dokja wtf man 
61,"Feb 14, 2022",I really love his character
61,"Feb 11, 2022",Goosebumps
61,"Feb 11, 2022",When he said “so that I may unwind my anguish” I knew THEN it was about to be some ish going down! 😍😍
61,"Feb 10, 2022",YOOOOOO THIS IS AWESOME I DID NOT EXPECT THAT
61,"Feb 3, 2022",Yay good episode!🤩
61,"Jan 22, 2022",this chapter was so cool and pretty bcs of the stars ~
61,"Jan 21, 2022",it is time for SKELETON WAR
61,"Jan 18, 2022",I'M SHAKING... AAAAAAAAAAAAAAAAAHHHHHHHHHHHHHHHHHHHHHHH!!!!!!!
61,"Jan 14, 2022",Sangah's negotiation scene brought tears to my eyes. War is a terrible thing. To see the noble will of those lost men carried on through the ages really touched me 😔
61,"Jan 12, 2022","I'm confused. Wasn't Dokja's sword supposed to be called “Unbreakable Faith"" and not “Unbreakable Trust”?"
61,"Jan 11, 2022",I can't wait for the dokkaebi *spoilers* to come in. His relationship with Dokja is hilarious.
61,"Jan 11, 2022",dang it reminded me a little bit of sung jinwoo
61,"Jan 4, 2022",15 push-ups
61,"Dec 27, 2021",Jesus loves you :)
61,"Dec 24, 2021","""King if No Killing"" *thinks back to the time he ""disarmed"" people...*"
61,"Dec 20, 2021",id like to point out the fact that this comic alone has done more to teach me about korean history than i have learned of US history through schooling
61,"Dec 14, 2021","Saw that there's 999 comments so imma be the 1000th one 😤 Also, Dokja is the best!💖"
61,"Dec 13, 2021","FAMOUS FACT: [Constellation ""Lazy Broke Weeb"" is the famous constellation among the readers]"
61,"Dec 13, 2021",i got goosebumps oh my god
61,"Dec 7, 2021",We Stan Yukon Kim
61,"Dec 4, 2021",goosebumps!!
61,"Dec 4, 2021",The constellation DARK FLAME PHOENIX is happy to see a war won by a normal incarnation but a smart one and is happy that he put in his all.
61,"Dec 2, 2021",LETSGOOOOOO
61,"Dec 2, 2021",that power reminds me of solo leveling
61,"Nov 30, 2021","ms. min is really pretty but, jihye in screen when? "
61,"Nov 28, 2021",dokja the best mc ever
61,"Nov 27, 2021",This chapter had such Solo Levelling vibes with the undead army!!!!
61,"Nov 25, 2021","""attack"" one simple word but put everything into a frenzy"
61,"Nov 17, 2021",ngl i wasn't a huge fan of this king arc but seeing this part and the ending part illustrated is pretty damn cool. i always had a hard time picturing scenes involving the ganpyeongui too
61,"Nov 17, 2021",Yooo Dokja looks so badass with the skeletons standing behind him
61,"Nov 14, 2021","Dojka probably does have the upper hand currently, but I fear the person who was watching over might now realize that it was a trap, and might tell the others.  If this occurs, Dojka would loose his upper hand that he has now.  "
61,"Nov 13, 2021",i feel so emotional about this chapter for some reason ㅠㅠ
61,"Nov 12, 2021",I’m glad I waited so long to keep reading ☺️🤩
61,"Nov 9, 2021",So a constellation can really posses their incarnation huh? Interesting
61,"Nov 7, 2021",Impressive 
61,"Nov 4, 2021","Wow, that was absolutely amazing. Although I might've only blinked like 3 times. Didn't want to miss a single thing."
61,"Nov 4, 2021",Dayum that was sexc
61,"Nov 3, 2021",Dokja hot asf
61,"Nov 2, 2021",intense! intense!!!!!! 😲😲😲😲
61,"Oct 28, 2021",this is so cool
61,"Oct 27, 2021",Yep thanks to tiktok I found this and i' very proud of myself reading this I'm not a reader but if this thing? BET
61,"Sep 13, 2021",That’s so cool!  
61,"Sep 13, 2021",This just came to me now but dramautzation was known as stage transformation in the novel and the skeleton army was called dragon flower tree unit or something
61,"Sep 11, 2021",Ohhh I know this is late but on August 18th Omniscient Reader’s first year birthday!! Happy birthday 🥳🥳
61,"Sep 8, 2021",woah I wasn't expecting that
61,"Sep 6, 2021",dramatisation is stage transformation right?i'm confused. or they're different?
61,"Sep 3, 2021",This is my favorite episode so far 
