Episode,Date,Review
118,2022-07-27 00:15,맨날...사기꾼 눈깔에....죽고...좀 탁한 눈동자였는데...별 처럼 빛나는 눈동자라 진짜 숨참고 봤다...그치...독자는 밤하늘의 별같은 사람이지...그치....✨✨✨
118,2022-07-27 00:14,동료 작가님이 돌아가셨는데 일이 손에 잡히겠냐??분량 적은것만 중요한 인간들 소름이 돋네
118,2022-07-27 00:14,같은 회사인 멸이세는 300원 받고 같은 날 연재하는 화귀도 300원인데 여기만 200원이라 인력비가 딸리는 것이 분명하다. 쿠키 값을 300원으로 늘려야 한다.
118,2022-07-27 00:13,오늘의 챕터는 짧게 느껴지지만 키르기오스를 기다릴 수 없습니다.
118,2022-07-27 00:12,김독자 누굴닮아서 저렇게 이쁜거야??ㅠㅠㅠ
118,2022-07-27 00:12,"삼가 고인의 명복을빕니다.
그거와 별개로 매번 농락당하는 기분이 큽니다.
얼마 안하는 쿠기로 갑질할 생각은 전혀 없습니다.

갈수록 느려지는 전개 의미없는 내용 줄어드는 분량

그냥 쉬시다 오시죠"
118,2022-07-27 00:12,이 퀄리티에 200원 받는데 여기 밖에 없다 그러니 가격 올리자. 가격 오르면 분량도 늘거다. 가격 올리자.
118,2022-07-27 00:12,독자 연령층이 낮아서 비판과 비난의 차이를 모름 분량이 평소보다 현저히 적은건 팩트임 오늘 부분에서 김독자가 명계 빠져나가고 신유승 영혼과 대화하는거 빼고 뭔장면이있어 적다고 말하는건 분명한 독자의권리임 거기에 욕이 섞이거나 인신공격해대면 비난이되는거고 제발 좀 구분해라 무지성으로 비추누르지말고.
118,2022-07-27 00:11,독자 이뻐졌다!!
118,2022-07-27 00:11,한 번 푹 쉬고 오시는 게 더 나을 것 같기도 해요 분량 짧은 건 사실이라 ㅠㅠ 무리하지 마세요
118,2022-07-27 00:11,역시 200원은 너무 싸서 그런거다. 다른 웹툰 가봐라 지금 다 300원인데 여기만 200원이라 분량이 적은게 분명하다. 그러니까 가격을 올리자. 그럼 우리는 분량이 많아져서 좋고 작가들은 가격을 더 받으니 좋을 거다.
118,2022-07-27 00:08,항상 좋은 웹툰 고마워용 ♡♡
118,2022-07-27 00:08,볼 때마다 분량이 많다고 생각했고 그만큼 작가님 건강이 걱정되었는데 이참에 휴재하시고 가는 게 어떨까 싶어요.. 타작품이지만 나혼렙의 장성락 작가님께서 별세하신 소식을 듣고 정말 믿기지가 않았었지만 과로로 건강이 얼마나 안 좋아지셨을지 감히 상상도 안되더라고요. 퀄리티 좋은 작품이 오랫동안 유지되기 위해서는 분량이 줄어도 작가님 건강이 정말 최우선이라고 생각해요ㅠ 
118,2022-07-27 00:08,이럴거면 휴재를 해야지 억지로 쉴드치네 ㅋㅋ
118,2022-07-27 00:08,유승아.....🥲🥲🥲🥲
118,2022-07-27 00:08,이번에 첫 컷부터 작붕에 놀랐다. 평소 작붕이 잘 없던 웹툰이라 더 놀랐는데 분량도 짧더라. 분량이나 작화가 평소 수준만큼 안된다면 네이버에서 휴재시키는게 맞다고 본다. 단골 가게가 음식 맛도 변하고 양도 반으로 줄면 팔면 안되듯이. 작가님 응원하고 이건 연재시킨 네이버 문제다.
118,2022-07-27 00:08,와 이번화 ㄹㅇ 개큰거 왔네.....
118,2022-07-27 00:07,와 유승이 대사봐라 진짜 스포일러 100%짜리 대사다...
118,2022-07-27 00:07,첫베뎃 대사가 전부 떡밥인데 웹툰에서 생략된게 아쉽네요 
118,2022-07-27 00:07,"전독시 작가들도 쉬었으면 좋겠다솔직히 쉬지않고 2년동안 달린거잖아요
푹 쉬고 왔으면 좋겠네요"
118,2022-07-27 00:06,"소설에서는 ""날 구해줘..""가 아니라 「ㅡ ㆍㆍㆍ  날 구원해줘요ㆍㆍㆍ, 제발.」이라 서술되었는데, 저는 이게 나름 떡밥이라고 생각했는데 웹툰에는 나오지 않아서 아쉽네요..

(이번화 김독자 작화 ■쳤어요..)"
118,2022-07-27 00:06,신유승의 성씨가 '신'이라는 것을 놓치지마세요
118,2022-07-27 00:06,"작가님들.. 저번에 댓글로도 말씀드렸지만 쉬시고 싶을 때 쉬셔도 됩니다. 세상에서 건강보다 중요한 건 없어요ㅠㅠ 보니까 작가님들께서 원작 소설 내용을 웹툰으로 그대로 표현하시기 위해 회의도 많이 하시는 것 같은데..(그냥 제 느낌입니다) 지난 번처럼 1년 정도 연재하시고 1~2달 휴재하시는 정도는 괜찮습니다.(물론 작가님들 사정에 따라 휴재 기간은 작가님들께서 정하시는 거고요 그냥 저번 휴재 휴재 기간이랑 비슷하게 말한 것 뿐입니다!) 작가님들께서는 더 좋은 작화를 보여주시기 위해 분량을 줄이시는 편이시고 분량을 줄이시는 만큼 작화가 더 예뻐지시죠 그것만으로도 독자들은 분량이 줄어든 것에 대해 할 말이 없어야 정상입니다. 작가님들 건강을 고려하지 않은 발언이니까요. 작가님들 건강을 고려하지 않았기에 작화가 더 예뻐졌는데 분량이 줄었다고 말할 수 있는 것입니다. 작가님들께서 더 좋은 작화를 보여주시기 위해, 더 많은 분량을 보여주시기 위해 많이 노력하시는 것은 독자들도 알고 있습니다."
118,2022-07-27 00:06,분량 ㅈㄴ 짧네. 그럴거면 쿠키를 내지말던가. 
118,2022-07-27 00:05,쿠키값 올리고 난후의 퀄리티가 이정도?네이버도 불매 맞아야하나?
118,2022-07-27 00:05,"작가님들 부디 건강해주세요...이렇게 좋은 작품 볼 수 있다는거에 항상 감사하고있어요ㅜ
저희 잠깐볼 사이 아니잖아여 ㅜㅜ 장기전이 될텐데..
몸 잘 돌보셔서 저희 오래오래 건강합시다 !!!! ㅠㅠ "
118,2022-07-27 00:04,쿠키2개로 이런웹툰 못본다
118,2022-07-27 00:04,작가님들 오늘 우리 독자 예쁘게 그려주셔서 너무 감사합니다ㅠ 별처럼 빛나는 눈과 긴 속눈썹이 예술이에요... 댓글에 분량 가지고 뭐라하는 이상한 사람들은 무시하시고 항상 건강 챙기시길 바랍니다
118,2022-07-27 00:03,짧든 말든 상관 없으니까 건강하게만 연재해주세요 제발
118,2022-07-27 00:02,"쿠키가격도 성과만큼 측정해야하는거 아닌감?요즘 물가상승 문제가 많지만
그림 그리는거도 물가상승 유통에 포함인가?
물감 흑탄 가격 전기 원자재 급등의 원인이 포함되는건가?
네이버 진짜 너무한거 아니여?"
118,2022-07-27 00:02,"이번화 의미 많이 담겨있는거 너무 좋다..독자41유승이 둘이 대화하는것도 너무 좋구ㅠㅠ
그나저나 김독자 속눈섭 너무 이뻐"
118,2022-07-27 00:02,눈물나ㅠㅠㅠㅠ아이고 유승아ㅠㅠㅠㅠㅠㅠㅠ
118,2022-07-27 00:02,작가님 응원하지만 이건 네이버 측에서 차라리 휴재하게 하는게 맞았을것같다. 어시 지원도 좀 더 하고
118,2022-07-26 23:58,영기야.. 드디어 띄워줬구나..
118,2022-07-26 23:58,"레드아이스 스튜디오 장성락 대표,작가님삼가 고인의 명복을 빕니다.
임직원분들도 항상 힘드실텐데 화이팅하세요
항상 좋은 작품 감사합니다"
118,2022-07-26 23:56,뭐지 오늘 겁나 짧는거 같은데
118,2022-07-26 23:56,당연히 더 많은 분량을 원하지만 작가님이 있어야 작품이 있는겁니다 당연히 작가님이 우선시 되어야하고요 부디  쉬시면서 작업해주세요 분량 적어도 괜찮습니다!
118,2022-07-26 23:56,채색없는 일본만화업계도 다들 힘들어서 뒤져나가는데..이퀄리티에 원래분량이 말이안댐
118,2022-07-26 23:55,"거의 휴재 없이 (있었나?? 모르겠네용) 쉼없이 달여 와주신 작가님께 감사합니다. 다른 작품의 작가님 언급하는건 실례지만, 얼마전 장성락 작가님(나혼랩 웹툰 작가)님께서 돌아가셨다는 소식을 듣고 마음이 철렁했습니다. 얼마나 힘드셨을까 하는 생각도 들더군요.. 부디 작가님들께서 건강까지 갈아 넣으시면서 작품을 그리지는 않으셨음 합니다. 독자들도 충분히 이해하고 공감해줄수 있어요. 웹툰 한 화 그리는게 얼마나 힘든 일인지 조금만 알아도 절대 웹툰 작가님들 닥달하지 못합니다. 특히 전독시나 나혼랩같은 작품같이 그림체가 엄청난 작품들은요.."
118,2022-07-26 23:55,분량 개에바맞는데 너무쉴드치네 피곤하고 힘들정도로 강행군이고 원래 분량유지못할정도면 휴재잠시하고 돌아오는게맞지않나 분량짧다고 얘기하면 안되는건가?? 공짜로풀리는 분량읽는거도아니고 쿠키사용하고 미리보기하는건데 불만사항얘기할수도있지
118,2022-07-26 23:54,오늘 분량 에반듯
118,2022-07-26 23:54,독자 눈이 별같다
118,2022-07-26 23:54,비유
118,2022-07-26 23:53,아 근대 은밀한 모략가가 멸살법쓴 작가아니냐 그럴꺼같은데
118,2022-07-26 23:53,"예전에 만화 그리던 사람인데, 진짜 죽을듯이 힘듭니다.이 정도 그림체, 퀄리티로 한 컷 그릴려면 적어도 몇시간은 들텐데 그거 하나하나에 비판하는 몇몇의 독자들이 어이없네요.
그리고 원작 소설의 표현력을 따라하려면 기획, 스케치 등 엄청난 시간이 필요할텐데....
200원 가지고 이 정도 웹툰 볼 수 있는 작가님들에게 감사해야할 판에 징징대지 마세요."
118,2022-07-26 23:53,난 진짜 이 장면이 너무 좋아ㅠㅠ
118,2022-07-26 23:52,작가님 짧지않지만 짧은 이 공허한느낌은 뭐죠 
118,2022-07-26 23:52,아니 인간적으로 분량 에바
118,2022-07-26 23:51,분량 이게 맞나
118,2022-07-26 23:51,김독자는 신이야..
118,2022-07-26 23:51,항상 좋은 작품 감사합니다.
118,2022-07-26 23:49,아이고....불쌍한 우리 유승아...ㅠㅠㅠㅠ이 형아가 꼭 널 위해 기도할께...독자가 꼭 무슨짓을 해서라도 널 구해줄끄야....ㅎㅇㅌ...
118,2022-07-26 23:46,인간은 이야기다...시간이 다르게 간다는건 혹시 깨어났을때 다들 시간이 훌쩍지나서 변해있는건 아니겠지 제발 아니길
118,2022-07-26 23:46,"""내가 정말로 신이라면, 세상에서 가장 무능한 신이겠지.""내가 좋아하는 대사였는데...ㅠㅠ 잘린게 좀 아쉽긴 하네요"
118,2022-07-26 23:46,"아 나만 분량 안짧나? 글로서 주는 감동을 그림으로 담아내는 게 얼마나 힘든 일인데 솔직히 일주일에 200원으로 이런 감동 얻는거 너무 좋은일이라고 생각하고 짧다고 여기는 사람들은 너무 휙휙보는 게 아닌가 그런 느낌이네.
독자는 눈이 빛날때 감정이 온전히 표정에 담길때 살아있는 거 같아서 제가 다 뿌듯해지는 기분 좋은 퀄리티 감사합니다 "
118,2022-07-26 23:45,유승아....
118,2022-07-26 23:45,오늘 내용 : ?
118,2022-07-26 23:43,아니 솔직히 짧은건 짧다하는거지 스토리전개도 몇주째 거의 동일하잖아.. 소설 전편 다읽고 소장까지 한사람인데 인간적으로 스토리전개 느린건 인정해야지. 작화와 감성에 몰빵하고 분량과 스토리전개는 뒷전으로 뒀는데 무슨 작화좋으니 그냥 봐라 소비자권리 머시기 하면서 커버를 침..? 인정할건 인정하자 좀
118,2022-07-26 23:42,어떻게 컷수를 세시길래100컷 이상이 나와요?? 45컷아님?
118,2022-07-26 23:42,난 재밌어 괞찬아 그거면 됐어 
118,2022-07-26 23:41,솔직히 분량 좀 짧네요.. 작가님 웹툰 그리시는 거 힘드신 건 알지만 그럴 땐 짧은 분량을 올릴 게 아니라 휴재를 하는 게 맞지 않을까요? 재밌게 보고 있는 웹툰 분량때문에 평가절하 당하는 것 같아서 아쉽네요.. 작가님 휴재 하시는 거 더 좋은 웹툰을 위해서라는 거 다 아니까 힘드시면 쉬시고 오셔도 돼요!!
118,2022-07-26 23:40,어차피 모두가 다음 내용을 기다리고 있는데 험담은 자제해 주셨으면 좋겠습니다
118,2022-07-26 23:40,돈내고 보는데 분량적다고 할 수 있지 근데 원래 분량 늘었다 줄었다 하는게 정상인데 좀 줄때마다 댓글에 거의 대부분이 분량 얘기밖에 없으니 문제인거임
118,2022-07-26 23:39,너무짧은데...?
118,2022-07-26 23:39,아니뭐지 오늘따라 작화가 더 예뻐졌는데...
118,2022-07-26 23:38,우리 독자 오늘 왜 이렇게 예뻐.. 눈에 별을 품은 것 같네..
118,2022-07-26 23:38,진짜 소설 안보고 웹툰 보고 사람으로써 다른 사람들이 말하는 소설 장면들 연출 안된거 한번쯤은 모아서 올려주는 그런것도 있었으면 하는 바램도 있어요. 진짜 이정도 작화면 뭘그리던지간에 그린 뭐든지 다 예쁠것 같아~~
118,2022-07-26 23:37,"유승이: 이상한 기분이야 나는 분면 당신을 잘 모르는데 이렇게 있으면 모든걸 이해받는 기분이 들어  마치 '신'앞에 있는것처럼
아마 독자가 멸살법을 읽어서 멸살법에 나오는 등장인물을 아니까 유승이는 몰라도 독자는 멸살법 유승이의 모든걸 아니까 유승이가 모든걸 이해받는 '신' 앞에 있다고 느끼는거 같아요."
118,2022-07-26 23:36,나혼렙 작가 장성락 작가님의 명복을 빕니다...ㅠㅠ
118,2022-07-26 23:36,중후반부 전독시느낌난다ㅜㅜ
118,2022-07-26 23:36,그럴게 할때 독자 아름답게 생겼네
118,2022-07-26 23:35,"오늘 분량이 많은 편이 아닌 건 맞지만... 댓글창에 내용 얘기보다 분량 얘기가 많은 건 좀 그러네요 ㅠ 
41회차 유승이가 독자를 신처럼 여기는 것도 아저씨라고 부르는 것도 너무 감동적이고 짠한 화였는데. 헤어지는 장면도 더 붙잡아두고 싶고 독자랑 유승이 너무 예쁘고(?아니근데맞는말이잖아요)... 아 그리고 유승이가 독자를 만난 적은 얼마 되지 않았지만 이해받는 것 같다? 그런 말은 멸살법 독자로써의 독자를 표현하는 것 같네요

웹툰작가님들 과로로 많이 힘들어하시는데 이 퀄리티로 연재해주시는 것만으로도 정말 감사해요 저는.. 작가님들 표현력도 너무 좋으시고 ㅠㅠ"
118,2022-07-26 23:35,이번화 작화 왜이리 쩔지..? 따땃한 느낌이 너무 좋아 ㅠㅠ여러분 독자 속눈썹도 생겻어요!! ㅠㅠㅠ
118,2022-07-26 23:34,독자가 화신체일때는 딱히 안느껴졌는데 영혼 모습은 눈이 별처럼 빛난다는 그 묘사가 너무 찰떡이야.
118,2022-07-26 23:34,설마 작가님은 소설과 같은 속도로 연재를 하실려는 큰그림을...
118,2022-07-26 23:34,더럽게 짧네
118,2022-07-26 23:33,돈 주고 보는데 짧다고 말도 못하나? 짧다면 짧다고 말할수도 있지..추모고 뭐고 다 좋은데 솔직히 웹툰보러 들어올때 추모하러 들어오는게 아니라 내가 귀한 여가시간 쪼개서 재밌는거 보러 들어오는 건데 슬퍼하는거 동조안한다고 뭐라 들을건 아닌듯 
118,2022-07-26 23:32,난 이해할수업서 김독자가 못생겼다는 작중묘사를 이해할수업숴
118,2022-07-26 23:32,ㅠㅠㅠㅠㅠㅠ독자야 유승아ㅠㅠㅠㅠㅠㅠ
118,2022-07-26 23:31,그림체가 뭔가 굵어진 느낌.. 그러다보니 캐릭터에 시선이 더 잘 꽂히는 것 같아요! 빛 표현이랑 표정 묘사도 정말 캄탄만 나오네요
118,2022-07-26 23:30,원작본놈들아 답글로 스포 하나만 부탁한다 신유승 멀쩡하게 구하냐? 기억 어느정도 잃은채로 구하냐?
118,2022-07-26 23:30,일주일에 풀컬러로 이정도 분량 뽑아내는것도 대단한건데 분량 적다고 입만 나불대는 사람들의 심리를 모르겠네
118,2022-07-26 23:30,ㄱㅌㅂㅌ 가 날 쿠키의 늪으로 여기까지 이끌었다...
118,2022-07-26 23:29,거 아주머니 길좀 여쭤봅시다
118,2022-07-26 23:29,오늘 김독자작화뭐냐 미친일러스트보는줄 
118,2022-07-26 23:28,양 보단 질이지 뭐...
118,2022-07-26 23:28,"오늘 동료 작가분 부고를 들었고 여기 댓글창 보니까 환멸이 나네요,,, 힘드시면 제발 휴재하셔서 1분이라도 휴식 취하시는게 좋을것 같습니다 다른 작가분들도 기존보다 분량 줄이면서까지 무리해서 쉬지 않으셨으면 좋겠어요"
118,2022-07-26 23:28,한 번 재정비하고 가라는 글들 많은데 이게 가능하게 만들어줄 최소한의 환경이 먼저지 않나 싶음... K웹툰 진짜로 사람 갈아서 만들어지는거 사람들이 좀 알아야됨... 몇 년째 개선이 필요하다 입이 닳도록 말하고 있는데 바뀌는건 ㄹㅇ 하나도 없음...
118,2022-07-26 23:28,장씨작가님 존경함다
118,2022-07-26 23:27,오늘자 연출 진짜 미쳤어요... 원작이랑 또 다른 감동...ㅠㅠㅠ
118,2022-07-26 23:26,아저씨라는 호칭이 겁나 슬프다.. 자기도 어린 유승이가 되고 싶은거 잖아ㅠ구원해줘 아저씨.
118,2022-07-26 23:26,멸살법의 작가가 다른 세계선의 독자인가 아니면 주인공들이 딱해서 신이 인간으로 강림한게 독자일까? 초반에 극장에서도 신이라고 극장의 주인이 독자를 보면서 말을 했고 지금은 신유승이 직접 언급을 했으니까 설마 독자가 알고보니 작가고 신인건가
118,2022-07-26 23:26,짧아...ㅠㅠㅠ 많이
118,2022-07-26 23:26,짧지만 굵다라는 표현은 이렇게 쓰는거다.
118,2022-07-26 23:26,"분량이 평소보다 적게 느껴지는게 사실이고 불만을 표현 할 수 있다고 생각함.그렇지만 이런 댓글이 작가에게 과로하도록 압박감을 주는게 아니라고 할 순 없음.
뭐, 소비자 입장에서는 위 말이 맞는 말이긴 함.
그냥 작가님들이 이런 글 보면서 스트레스 받는 거지."
118,2022-07-26 23:26,선생님 더 주세요
118,2022-07-26 23:25,엄청난 작화!
118,2022-07-26 23:25,"전지한 독자 시점으로 진행되는 이야기라는 게 가장 잘 드러났던 회차였던 기억이 난다 신유승에게 김독자는 자신을 이해해주는 구원자, 신이겠지"
118,2022-07-26 23:25,내 200원 어디감
118,2022-07-26 23:25,분량이 짜구나
118,2022-07-26 23:24,에혀 조온나 짧네? 눈을의심했다 여기 한국아니고 북한이냐? 자유민주국가 아니냐고? 작가가 힘들면 연재를 하지말든가 돈받고 하는거면 돈값을하세요 처 삐대지말고 또머 쿠키 2-3개가꼬 유세부린다 하는것들은 직장이나 있을까 아님 급식일까? 수준낮아서 ㅋ 대꾸해주기힘들듯?
118,2022-07-26 23:24,진짜 페르세포네 성좌들 중에 제일 친절해.. 역시 천사
118,2022-07-26 23:24,분량 말고 내용 이야기는 없나... 김독자는 자신의 과거를 함께해주고 지켜준 신과 같은 멸살법으로 41회차의 신유승을 기억했고 신이었던 멸살법의 등장인물이었던 신유승은 자신을 거의 유일하게 봐준 독자를 신으로 여기게 된 이 관계가 너무 소중함...
118,2022-07-26 23:24,그림체 진짜 이쁘다..🥺🥺
118,2022-07-26 23:23,"분량은 짧아도 작화가 지리고 
감동적인 회차다 "
118,2022-07-26 23:23,"100컷이 넘는데도 적다니 ;;;,"
118,2022-07-26 23:23,분량이 적은건 기분 탓?
118,2022-07-26 23:22,"다들 과로 과로 하는데 누가 시켜서 하는거 아니에요. 작가님들도 그에 합당한 페이를 받으면서 일을 하는거아닌가요? 
피로가 누적되고 그런상황이면 차라리 휴재를 하고 회복해서 좋은 컨디션으로 하시는게 맞다고 봅니다. 
쿠키 그거 고작 200원 아까운게 아니라 일주일 기다려서 재밌게 보려고 하는건데 오늘은 솔직히 스크롤 내리면서 엥? 벌써 끝났다고? 라는 느낌을 받았네요. 
작가님 건강 지키면서 오래 하셨으면 좋겠어요."
118,2022-07-26 23:22,뭐지 짧은 느낌이지만 굵빵한 기분....역시 꿀잼
118,2022-07-26 23:22,그 기존보자 3분의1도 안되는거같은데 cibar? 장난하냐?
118,2022-07-26 23:21,오늘 작화 너무 예뻐요
118,2022-07-26 23:20,좀 심하게 짧네ㅋㅋ
118,2022-07-26 23:20,오랜만에 유승이 봐서 좋다ㅠㅠ 인간은 이야기라니..다시 살아났을때 인생스토리 짧지 않고 오래오래 갔으면 ㅠ
118,2022-07-26 23:20,ㅋㅋㅋㅋㅋ영기 이제 시나리오 띄우는 법 배웠네 ㅋㅋㅋㅋㅋㅋㅋㅋㅋㅋㅋㅋㅋㅋㅋㅋㅋㅋㅋㅋ
118,2022-07-26 23:20,"작가님 좀 쉬셨으면.. 매화마다 퀄리티 높아지는 거 보이고(초반 부분이랑 비교해 보세요..) 좋은 건 아는데.. 쉬셨으면.. 지금 시기도 시기이고, 작가님 분량 보면 너무 힘들어 보여요.. ㅜㅜ 분량이 적다고 뭐라하는 게 아니라 휴식을 권장하는 것... "
118,2022-07-26 23:19,분량을 커버 치는 그림... 지렸다...
118,2022-07-26 23:19,...유중혁 이🐕🐦끼야
118,2022-07-26 23:19,그래서 우리는 이야기를 기억해야만 하지
118,2022-07-26 23:18,"4백원으로 늘 소장하지만, 단한번도 해당화 다 읽고 돈아깝다는 생각하지 않은 유일한 웹툰.."
118,2022-07-26 23:18,"[성좌, 화요일밤을 기다리는눈이 작가님들의 휴식을 바라고 있습니다.]"
118,2022-07-26 23:17,"요즘 김독자 눈동자 묘사 너무 좋다소설에서 서술되는 '별처럼 반짝이는 눈동자'의 느낌을 잘 살렸음
볼때마다 참 예쁘고 마음에 들어한 설정이었는데"
118,2022-07-26 23:17,분량 늘렸다가 작화퀄 떨어지고 나중에 장기휴재 하는것보다 이렇게 한 주는 좀 줄였다 다음번엔 좀 늘렸다 하면서 작화퀄도 유지하고 작가님들 컨디션도 유지하면서 연재하는게 더 낫다고 생각함
118,2022-07-26 23:16,독자 눈에 별이 있네
118,2022-07-26 23:16,"따지고 보면 저 세계, 멸살법 안에서 신유승을 포함한 모든 등장인물들을 알고 있는건 독자밖에 없으니까 신유승은 독자를 신이라고 느끼는거 같아요. 조회수가 1이었던 소설, 즉 보는 사람이 하나밖에 없었던 세상에서 사람들은 유일하게 자신들을 봐준 그 사람을 신이라고 생각하고 느끼는거죠."
118,2022-07-26 23:16,레드아이스 작가님들 지금 다 힘드시다 이번주는 이해해줘라 
118,2022-07-26 23:15,아 잠깐만 분량 에바..라기엔 너무 고퀄이였다
118,2022-07-26 23:15,많이 짧네
118,2022-07-26 23:15,아니 오늘 왜이래 분량 전독시도 화산귀환마냥 쿠키날먹하고 고구마만 굽는거로변해가는건가 ㅠ
118,2022-07-26 23:15,개짧노 
118,2022-07-26 23:14,"분ː량, 分量/불-/
명사
수량의 많고 적음이나 부피의 크고 작은 정도. 순화어는 `부피', `수량'.

수량은 적을지 모르나 부피의 크기는 충분한 것 같은데?"
118,2022-07-26 23:14,뒤는 이전 시나리오에서 유승이를 구하지 못했던 과거이면서도 그런 과거가 있었기에 유승이를 구한다는 목적을 가지고 미래로 나아갈 수 있었으니까 동시에 앞인 걸까
118,2022-07-26 23:14,다른건 다 모르겠고 유승이 너무 이쁜거 아니냐..
118,2022-07-26 23:14,분량 짧은건 맞는데 이전까지 작화고 내용이고 너무좋아서 이번화도 그림퀄은 진짜 좋은편이라 쉬어가는게 맞다고생각함
118,2022-07-26 23:13,웹툰 작가들 10일 연재로 바꿔주던가 3주에 한 번 쉬게 하는 시스템 꼭 필요하다고 생각합니다. 최소 업계에서는 채색은 2일 많아야 3일을 주고 선화는 더 짧게 요구합니다. 회사에서 어시스트 비용 안주는 경우도 많기에 작가들이 모든 생활을 책임져야하는 시스템 바뀌어야 하지 않을까요? 그러니 전독시 작가님들 너무 무리하지 않았으면 합니다... 이렇게 말해도 바뀌는게 쉽지 않아서 너무 마음이 아프네요
118,2022-07-26 23:13,소설 몇화쯤임?
118,2022-07-26 23:13,"""세계선을 넘어가는 초입, 그곳의 시간관념은 이곳과는 다르다.신유승에게는 벌써 몇년의 시간이 흘러갔을수도.."" 

독자 이런거 세세하게 다 아는거 진짜 오타쿠 같으면서도 대단하다구.."
118,2022-07-26 23:13,솔직히 이번화 분량 짧은 건 맞음ㅇㅇ
118,2022-07-26 23:13,분량이 짧긴 하지만 시각적으로 봤을때는 어느때처럼 완벽하다 생각함
118,2022-07-26 23:12,작화고 뭐고 아무리 큰 돈은 아니라지만 엄연히 돈을 지불하고 보는건데 이 분량은 좀 오바 아닌가
118,2022-07-26 23:12,나혼렙 작가이자 레드아이스 전대표이셨던만화가 장성락님의 명복을 빕니다🙏R.I.P
118,2022-07-26 23:11,?
118,2022-07-26 23:11,"분량에서 작가님이 힘들어하시는게 보이네요..ㅠㅠ 애초에 저정도 퀄리티에 이만큼 연재를 하셨으니..
작가님 푹 쉬시다가 오셔도 되요 ㅠㅠ"
118,2022-07-26 23:11,돈내고 보는데 분량 짧다고 할 수 있는거 아닌가;
118,2022-07-26 23:11,그 이름 뭐지 비유였나
118,2022-07-26 23:11,분량은 둘째치고 이 퀄리티로 후반부의 이야기를 풀어나갈 수 있을까...10년동안 작가님 손목 천천히 부식되겠는데...
118,2022-07-26 23:11,생각해보니까 작가님 웹툰 2개 하시지않나...? 괜찮으신거죠...?
118,2022-07-26 23:11,분량이 문제가 아니라 작화가 넘 미쳤어요...컷마다 정성 들인게 느껴져서 오늘도 감사했습니다!! 작가님 화이팅!
