Episode,Date,Review
46,2021-04-05 07:55,근데 사람 절반으로 줄여야돼서 입장을 못한다면 이미 돈을 지불한 분들은 화가 날 수도 있었을 듯... 물론 과도한 사이버불링은 확실히 잘못됐긴 하지만 환불하고 끝날 수도 있지 않았을까 싶네요... 안타까운 사건 ㅠㅠ
46,2021-04-05 07:28,하지만 그렇다고 죄가 없는 억울한 사람들을 무시하고 역싸불을 하는건 멈춰야해. 그게 얼마나 모순적인지 몰라서 그러는거야? 나이도 어린 사람한테 개개인이 찾아가서 죽으라고 하고 이건 비정상이잖아
46,2021-04-05 07:24,결론적으로는 전독시 팬덤이 더 반성하는 태도를 보여야 하는게 맞는것같아. 지금도 개개인 각자가 사과하고 있지만 이건 너ㅜ 인지도 없고 성의도 없어 보여 물론 그걸 보고  그 사람들을 아는 나는 모두 진심이고 죄책감이 크다는게 느껴졌어 그런데 뭔가 하나의 큰 움직임같이 필요할것 같아.
46,2021-04-05 07:19,그건 맞아 살아계시던 아니던 물론 살아계신게 중요한데 전독시 팬덤이 잘못한건 맞아. 우리가 그건 인정하고 사과해야해. 최대 피해자분이 그런 생각을 들 정도로 심했단 거잖아. 자살암시글도 있었는데 대부분이 무시하고 비웃은것도 우리 잘못이야. 억울한 생각이 드는것도 부끄럽지만 모두가 잘못한건 아니라서 내 주장같은 말이 나오는거지 잘못은 변함없어. 꼭 살아계셨으면 좋겠네요
46,2021-04-05 07:16,그 사건을 왜 여기까지 끌고 오고 지랄이야 ㅋㅋㅋㅋ 닥쳐
46,2021-04-05 07:16,와 대박....ㅠㅠ연출 미쳤네요...
46,2021-04-05 07:15,살아있을 가능성이 높음 ㅇㅈㄹ 니가 사람새끼냐 ㅋㅋ
46,2021-04-05 07:11,"행사 참가자와 입장객 사전신청을 받아서 대충 인원 예측이 가능했음에도 그에 비해 턱없이 협소한 장소를 빌림
그래서 먼길 찾아가서 2만원 내고 입장한 사람들이 30분만에 통제되어서 쫓겨남

입장료와 부스 참가자 비용에 비해 턱없는 장소였으니 횡령이 의심되어 문제제기하고 입장문을 요구했으나 주최자가 돈문제에 대해선 침묵하고 돌연 유서(?)를 올림
 
특히 처음 문제제기한 분은 유서에 닉네임이 박제되어 온 커뮤에서 욕을 먹음

닉네임 박제된 분이 직접 경찰조사를 받음

그리고 확인결과 주최의 생사는 아직 불분명. 자살의 경우 경찰조사부터 받는데 사망신고 들어온게 없다고함. 살아있을 가능성이 높음
(처음 부고 안내를 올린 언니 계정이 현재 사라졌음. 언니의 소재지는 집으로 파악된다고 경찰이 했다고 함 동생이 정말 자살했으면 가족장 한다고 했으니 빈소에 있었겠죠)"
46,2021-04-05 07:03,상아언니... 너무 멋져 나 상아언니 그 스킬쓰는장면 기다리고 있었어
46,2021-04-05 05:16,댓글 존나역하네
46,2021-04-05 03:52,김독자 갈수록 잘생겨지네
46,2021-04-05 03:01,왜 여기까지 와서 이러는거임..?
46,2021-04-05 02:40,트짹이나 남초나래 ㅋㅋㅋㅋㅋㅋㅋㅋㅋㅋㅋㅋㅋㅋㅋㅋㅋㅋㅋㅋㅋㅋㅋㅋㅋㅋㅋㅋㅋㅋㅋㅋㅋㅋㅋㅋㅋㅋㅋㅋㅋㅋㅋㅋㅋㅋㅋㅋㅋㅋㅋㅋㅋㅋㅋㅋㅋㅋㅋㅋㅋㅋㅋㅋㅋㅋㅋㅋㅋㅋㅋㅋㅋㅋㅋㅋㅋㅋㅋㅋㅋ
46,2021-04-05 02:37,특히 상아씨 스킬... 뭔데 나 운다ㅠㅠㅠㅠ
46,2021-04-05 02:36,작가님ㅜㅜ 작화가 소설에서 상상하던 그대로라 정말 놀랐어요 매주 이렇게 그려내시기 쉽지 않을텐데..ㅜㅜ 좋은 작화 작품 감사합니다!!
46,2021-04-05 02:33,트짹새끼들은 좀 꺼져 만화좀보자
46,2021-04-05 02:32,ㅇㄴㅋㅋㅋㅋ여기서 난리치지말고 아니 종나 팬들이 OOO 그랬다는건 ㅇㅈ 근데 모두가 그런것도 아니도 그리고 전독시는 OOO 욕먹을 이유 없지 않냐? 애들아 생각 좀 하고 달아 달거면 웹툰와서 이러지 말고 종나 작가님들은 생각 안함?? 작가님들이 뭘 잘못 했는데 여기와서 난리야
46,2021-04-05 02:22,웹툰 댓글들 왜 이래...?
46,2021-04-05 02:06,bl물이나 트짹들이나 거기서 거기지 ㅇㅇㅋㅋ
46,2021-04-05 01:57,살인마팬덤
46,2021-04-05 01:50,김독자 해맑게 웃는 모습 진짜 미치겠넼ㅋㅋㅋㅋㅋㅋㅋㅋㅋ 와 열받는데 귀여움ㅋㅋㅋㅋㅋㅋㅋ
46,2021-04-05 01:37,트위터 극혐
46,2021-04-05 01:29,사람이 안죽었어도 죽었다고 알려진 상태에서 트짹련들 그 지랄을 했다는게 소름이다
46,2021-04-05 01:29,짧게 스쳐지나간 애가 생각보다 잘생겼어요ㅋㅋ
46,2021-04-05 01:16,대단하다! 전지적 자살 시점 팬덤들!
46,2021-04-05 01:08,작가님 작품 잘보고있습니다~✧⁺⸜(･ ᗜ ･ )⸝⁺✧
46,2021-04-05 00:52,넘넘 재밌어요ㅠㅠㅠ
46,2021-04-05 00:52,나두 길영이 머리 쓰담쓰담 하구싶다..땅강아쥐 뼈칼도 좋으니 옆에서 같이 싸워주고싶다
46,2021-04-05 00:50,명동 대표님..저희동네에서 횟집하고 계신 분같아요 뭘까 이 친숙함..그나저나 충무로가 왕 시나리오 후발주자라더니 벌써 명동은 붉은 깃발이네요 깃발색깔 바꿔버려 독자야 우리 길영이는 무사한거 맞지??
46,2021-04-05 00:46,"댓글창 웹툰에 대해서 좋은말들 해주시는 분들이 생기니까 너무 좋네요. 원작 소설, 웹툰 작가님들 좋은 이야기, 좋은 작화로 좋은 작품을 연재해 주셔서 언제나 감사합니다!"
46,2021-04-05 00:43,"희원씨 새로 뽑은 칼 드는거랑 현성씨 방패 간지나게 뽑아드는거, 그리구 김독자 부러지지않는 신념 꺼내면서 빛 쫘악 퍼지는거 진짜 너무너무 멋있다.. 황금빛 실로 일행들 다 들어올리면서 동시에 바이크까지 부숴버린 상아씨도 진짜 최고에요... 심판의 시간 발동될때 나오는 천칭 너무 멋있고 충무로 위험하니까 달려가는 우리 김독자 얼굴은 또 왜이렇게 빛이나니 진짜 한화 한화 레전드다..매화가 리즈갱신 김독자, 유상아, 정희원, 이현성, 이길영, 공필두 최고다!! 이지혜 유중혁도 최고다악ㅜㅜㅜㅜ바로 방어태세 들어가는 필두아재도 멋있구 한부장님..잘 지내시죠..?ㅜㅜㅋㅋㄲㅋㅋㅋ"
46,2021-04-05 00:39,아 진짜 상아씨ㅜㅜㅜ 또 반하겠네 진짜 와중에 희원씨 머리풀어헤치고 싸우는거 멋있는거 봐ㅋㅋㅋㅋㅋㅋㅋㅋㄱㅋㅋㄱㅋㄱㄲㅋㅋ 뭔가 희원씨랑 김독자 은근 티키타카 잘맞는게 진짜 현실남매 같기두 하구..ㅋㅋㅋㅋㅋ 중간에 4명이서 기시감 느끼고 서로 쳐다보면서 눈치까는거 너무좋다 진짜 아 근데 역시 김독자 강일훈처럼 생긴사람을 고작 '훈훈하게 생긴사람 '  이라고만 하다니 너무했어ㅓ...고작 몇화 안나올 일훈이를 저렇게 잘 그려주시다니 작화진님ㅜㅜ 저 진짜 울어요ㅜㅜ
46,2021-04-05 00:32,진짜 재밌어요 ㅠㅠㅠ 작가님 돈많이벌어요 ㅠㅠㅠ 
46,2021-04-05 00:29,왜 여기서 이러시는지는 모르겠는데... 그냥 꺼져주세요... 해당 sns가서 계속하시고... 예... 정말 보기 추해요...
46,2021-04-05 00:23,"다들 당황한 표정할때 희원씨?언니?님?(뭐라해야하지 쉽게범접할수없는 다른 느낌의 멋있음임...알라뷰..내사랑..)만 김독자랑 표정 똑같어ㅋㅋㅋㅋ ㅍㅍ이눈빛임 진짜 둘이 남매냐고ㅋㅋㅋㅋ똑같이생김너무귀여워ㅠ어떻게 사람이 거적을 입어도 빛이날까,,.진짜최고다ㅠㅠㅠ"
46,2021-04-05 00:19,유상아당신역시 한국사자격증보유에 퇴근길에 스페인어공부하는 지적인사람!!!♥♥♥강일훈이한테 날카로운 질문하는거 진짜 치인다....너무멋이있어알라뷰혹시 언니 발닦개자리 공석인가요? 내가일빠임찜뽕다저리가
46,2021-04-05 00:19,여러분 더 이상 댓글달지마시고 신고누르세요.
46,2021-04-05 00:18,"작가님 작품 잘 보고 있습니다!너무 스트레스 받으시지 마시고 힘드시면
잠깐 쉬고오세요 (ง •̀ㅁ•́)ง✧"
46,2021-04-05 00:15,"아앗.,.....,,,,ㅠ 현성이랑 상아는 아직도 땅강아쥐 뼈다구무기네ㅠㅠ언니우리집에 식칼 잘 갈아놨어요 가져가도좋아ㅠㅠㅠㅠ들르는김에 사진도찍어줘요사랑해진짜쿨럭상상만해도심장과부하걸린다ㅠ"
46,2021-04-05 00:12,바이크 등장부터해서 퇴장까지 간지다..
46,2021-04-05 00:10,딴대서 말해 이새■들아
46,2021-04-05 00:10,설마우리언니바이크타는데 실로 쏙한걸 아직 안본사람있나????????인생절반 손해다ㅠㅠㅠ
46,2021-04-05 00:09,"아니길영이귀여운거 자꾸 생각나서 돌아왔다아니어쩜 사람이 저렇게 귀여워?응?어떻게 저렇게 귀여울수가 있냐고요진짜 볼따구 한번만 찔러봐도될까 진짜 맬렁해보여 찹쌀떡아니냐구요ㅠㅠㅠㅠㅠㅠㅠㅠ우리애 귀여운거 세상사람들 다 알아야한다솔직히
아근데 아가야 머리에서 바퀴벌레는 빼자ㅠㅠㅠ그것도귀엽긴한데바퀴벌레는안귀여워ㅠㅠㅠㅠ진짜우리다람지오구귀여워ㅠㅠ머리카락은 솜사탕이네아주ㅠㅠㅠ김독자너무부러워나도 길영이 머리쓰다듬을래ㅠㅠㅠㅠ나도유중혁실물영접할래ㅠㅠ나도김독자얼굴볼래ㅠㅠ김독자부러워진짜"
46,2021-04-05 00:07,이제 이틀만 지나면 화요일밤이다..가슴이 웅장해진다....
46,2021-04-05 00:06,유상아 스킬 쓰는거 개멋있네
46,2021-04-05 00:04,여기서 그러지 말고 트위터로 가....
46,2021-04-05 00:00,스크롤 내리다가 강일훈보고 3초 멈칫했습니다ㅋㅋㅋㅋㅋ  아니..원작에 이렇게 잘생긴 애가 나왔다고..? 근데 내가 몰랐다고...? 이게 어떻게 적당히 훈훈해 보이는 얼굴이냐 김독자아악 묘사 너무 빈약하잖아ㅋㅋㅋㄱㅋㅋㅋ쿠ㅜㅠ
46,2021-04-04 23:56,"전독시 너무 잘보고있습니다. 작화진 분들 너무너무 수고해주셔서 소설보면서 상상한 장면 그 이상으로 진짜 너무 예뻐서 화요일 밤만 되길 손꼽아 기다려요! 이번에 상아씨 능력쓰는 장면 진짜 너무 멋있었어요ㅜㅜ 소설에선 빠르게 넘긴 장면이었는데 진짜..작화보고 감탄밖에 안나왔습니다..상아씨ㅜㅜ 중간에 어벤져스마냥 넷이서 칼, 방패, 실 뽑아드는 장면도 너무너무 좋았어요ㅜㅜㅜ 진짜 유료분에서 보고 캡쳐하고싶어서 얼마나 기다렸는지..ㅜㅜㅜㅜㅠ 매화마다 엄청난 분량과 실력으로 전지적 독자시점을 재구성해주셔서 감사합니다! 늘 감사하며 보고있어요 그림작가님💕 작품을 세상에 내어주신 싱숑작가님께도 감사드립니다"
46,2021-04-04 23:54,이 팸덤왜 웹툰에서까지 이래
46,2021-04-04 23:50,ㅋㅋㅋㅋㅋㅋㅋ설마설마 했는데 웹툰에서까지 이러네.. 트위터가서 해결하세요~ 애꿎은 그림작가님과 글작가님께도 실례입니다~
46,2021-04-04 23:47,혹시나 해서 왔는데 역시나ㅋㅋㅋㅋ 제발 욕박을곳 말곳 구분좀합시다 sns에서 난리난건데 왜 관련없는 웹툰에 와서 분탕질인지
46,2021-04-04 23:46,이번화 희원 언니 스킬 쓸때 왜 이렇게 멋있냐...날 가져요 언니🤦‍♀️
46,2021-04-04 23:45,"또또 남초 탓 극단적인 선택을 하셨다는 얘기가 퍼졌을때 그래도 사불하면서 민폐다 죽음으로 도망쳤다 이러던거 맞잖아.
트짹들은 웹툰에서 나가주세요ㅠㅠ 웹툰 보는 사람들을 고인 모욕하는 사람들로 만들지 마시고."
46,2021-04-04 23:40,정정해줬는데 왜 그럼?
46,2021-04-04 23:40,선넘지마라; 일이 생겼으면 일 생긴곳에서 떠들고 결론내면 될걸 왜 멀쩡히 작품 잘 보고 있는 사람들 앞에서 빤쓰내리냐; 컴폰끄고 발닦고 자라;;
46,2021-04-04 23:39,그럼 나도 너 메갈워마드라고 부르면 되는 부분?? 역겨운짓좀 그만하지 ㅋㅋ 
46,2021-04-04 23:38,"한남이 거슬렸구나... 알았어, 디시 일베로 정정할게.  "
46,2021-04-04 23:36,또 또 한남 어쩌고 ㅋㅋㅋ 성별갈등 조장하지말라고 백날 얘기해봐야 저런것들 천지빼까리임 
46,2021-04-04 23:33,"현재 디시인XXX, 루XX을 비롯한 여러 사이트에 사실이 확인되지 않은 글이 퍼져 어그로가 끌리구 있습니다... 비추천과 신고 기능을 이용해 주시면 감사하겠습니다"
46,2021-04-04 23:32,그만해라
46,2021-04-04 23:32,무슨 1화 때부터 blㅋㅋㅋ 디시새끼들 지랄 한다고 다들 싸물고 있던거 똑똑히 기억나는데 한남아 또 기억 조작하지? 똥인지 된장인지 구별못하고 사칭하러 왔을때부터 알아봤닼ㅋㅋ
46,2021-04-04 23:29,작가님 작품 잘 보고 있습니다!
46,2021-04-04 23:27,1화때부터 베댓 대부분이 비엘 분위기 만들면서 ㅁㅇㅁㅇ 거리는 주접댓글이 태반이었는데 여기서 한소리 할 수도 있지 뭘 자꾸 말도 못꺼내게 하는거임??? 이런 말 안하게 그런 댓글들 베댓 쳐올리지말라고 그러면 
46,2021-04-04 23:25,"그니까 결국 모든 문제는 트위터에서 터졌다는거자너
웹툰에서 나가! 이 트짹이들아!

근데 그 2차 창작 행사는 작가님들한테 허락은 받은거임? 돈이 오갔다면서요."
46,2021-04-04 23:25,"? 2차창작인걸 알면서 왜 상관없는 웹툰에서 비엘얘기를 하시는건지..? 그건 2차창작하는 분들한테 말해야되는거 아닌가요? 이 웹툰에서 비엘로 엮는게 나온것도 아니고ㅋㅋㅋ그리고 페미랑 이 작품이랑도 무슨상관인지 잘 모르겠는데요
그냥 웹툰 전독시 얘기만 했음 좋겠네요"
46,2021-04-04 23:23,"❌웹독시와 관련없는 이야기를 끌어오지 마세요❌❌성별갈등 야기, 확인되지 않은 사실을 퍼트리지
마세요❌
❗️분란을 야기하는 글이 있으면 비추천 기능과 신고 기능을 사용해 주세요❗️
❌웹독시와 관련없는 이야기를 끌어오지 마세요❌
❌성별갈등 야기, 확인되지 않은 사실을 퍼트리지
마세요❌
❗️분란을 야기하는 글이 있으면 비추천 기능과 신고 기능을 사용해 주세요❗️
❌웹독시와 관련없는 이야기를 끌어오지 마세요❌
❌성별갈등 야기, 확인되지 않은 사실을 퍼트리지
마세요❌
❗️분란을 야기하는 글이 있으면 비추천 기능과 신고 기능을 사용해 주세요❗️
❌웹독시와 관련없는 이야기를 끌어오지 마세요❌
❌성별갈등 야기, 확인되지 않은 사실을 퍼트리지
마세요❌
❗️분란을 야기하는 글이 있으면 비추천 기능과 신고 기능을 사용해 주세요❗️"
46,2021-04-04 23:22,★★★★★웹툰 전독시 얘기만 합시다★★★★★
46,2021-04-04 23:22,지금 이때다싶어서 분탕치는 사람들이 많은듯 ㅋㅋㅋ 진짜 고인의 명복 빌고있긴 하나요? 얼마나 까고싶었으면.. 계기하나 생기니까 우루루 몰려오네
46,2021-04-04 23:21,왜 트위터에서 일어난 일을 네이버에서 웹툰 읽고 있는 독자들에게까지 피해 끼치시죠? 작가님도 댓글창이 이렇게 도배 되는걸 원하진 않으셨을텐데요. 다른 인터넷 사정은 거기서 풀자구요 하나도 안 궁금해요 왜 여기까지 구질구질하게 끌고 와서 이러세요? 전혀 관심 없구요 작품에까지 피해주는거랑 순수하게 원작만 즐기시는 분들한테까지 피해 주시는거 눈살 찌푸려집니다. 주최자님 자살 정말 확실한 건가요? 정말로 돌아가신 거라면 안타깝고 마음이 무겁지만 제발 저같이 그냥 웹툰 보고 댓글창에 즐거운 마음으로 댓쓰러 왔는데 자살이니 뭐니 다른 SNS이야기 듣기 싫네요 다들 여기까지 합시다
46,2021-04-04 23:19,"댓글 분탕질 치는 인간들은 캡처하거나 무시하고작품 잘보고 계시는 분들 모두 '작가님 작품 잘 보고 있습니다!' 라고 남겨주시면 안될까요
작가님께 응원남기고 싶습니다ㅠ 이게 무슨 마른 하늘에 날벼락인지"
46,2021-04-04 23:19,"타 SNS와 관련된 이야기를 꺼내지 말아주세요. 아직 사실확인이 되지 않았을 뿐더러, 웹독시와 전독시는 별개의 작품입니다. 트리거 요소가 들어가 있으므로 언급을 조심해야 하는것도 맞고요. 웹독시의 독자분들을 지켜주세요."
46,2021-04-04 23:17,ㆍ
46,2021-04-04 23:17,애초에 전독시 작품 자체를 깐 사람들은 여기 안남고 떠났는데 왜 엄한사람 붙잡고 추하니어쩌니하는거지? 댓글내려보던가 내가 작품 깐 댓글이 있는지 
46,2021-04-04 23:16,"주최자 극단적인 선택 여부 - 확실치 않음트위터에서 주최자가 자살 한 걸로 알고있는 상태에서도 사불 - 맞음
자기 동생 죽은거 맞다고 얘기한 계정 - 사칭

어질어질하네요. 웹툰에서 나가! 이 트짹이들아!
"
46,2021-04-04 23:14,일단 이번 일을 계기로 원작 소설 팬덤들 싸그리 박멸돼서 BL놀이하는 역겨운 베댓좀 안봤으면 좋겠음 원작이랑 선긋기하면서 왜 자꾸 베댓에서 눈살찌푸려지는 BL놀이 하는지 모르겠다
46,2021-04-04 23:13,아니 제발 그럼 거기 갔던 놈들만 욕하든지 2차 창작물 1도 관심없는 걍 팬들도 싸잡아서 욕하냐;; 
46,2021-04-04 23:13,밑에분 말이 제말입니다. 사건에 대해 자세히 모르겠지만 관심도 없구요. 단순히 웹툰을 애정하고 챙겨보는건데 같이 싸잡혀서 욕먹는 거 정말 속상하고요. 왜 여기까지 와서 더럽히는지 모르겠네요. 작가님들은 무슨 잘못입니까
46,2021-04-04 23:10,여기서 싸우지 마세요 제발 좀..
46,2021-04-04 23:09,댓글창 그냥 안보는게 정신건강에 이로울것 같네요. 작품과 관련된 이야기를 나누는 공간인데 관련도 없는 이야기로 뒤덮이는게 너무 안타깝습니다
46,2021-04-04 23:08,"진짜 여러 의미로 대단하네요.....전체 댓글 중 절반 정도가 이번 일 관련 댓글이라니. 심지어 이 곳에서 벌어진 일도 아닌데 말이죠. 참...제 3자라면 확실하지 않은 이상 가만히 있는게 제일 정상적인 행동 아닌가요?여러가지 깨닫고 갑니다,,,,"
46,2021-04-04 23:07,"웹독시는 전독시와는 별개의 작품이며, 아직 사실확인이 제대로 되지 않은 이야기를 여러 명이 도배하는 것은 그냥 분탕질이라고 밖에 생각이 안 듭니다 더군다나 현재 벌어지고 있는 사건이 트리거를 자극할 요소가 있어 더 그렇고요
이런저런 일이 벌어져 분위기가 술렁이는 건 이해를 하겠으나 제 삼자가 몰려와 사실확인이 되지 않은 이야기를 퍼트리고, 순수하게 웹독시를 즐기시는 이곳의 독자분들께 피해를 끼치는 행위를 지양해 주시기 바랍니다
"
46,2021-04-04 23:06,과도한 일반화는 멈춰주세요. 원작과 상관없는 곳 이야기를 끌어오면서 원작과 원작만을 즐기는 독자들 싸잡아서 욕하지 말아주세요. 영문도 모르고 전독시 본다고 욕먹는 기분이 뭔지 아시나요?
46,2021-04-04 23:04,왜 여기서 싸워...여기서 일 났어?
46,2021-04-04 23:03,"성별, sns 같은걸로 편 나누어서 싸우지 말아주세요. 여긴 전지적 독자 시점 원작 웹툰에 대한 이야기를 사는곳입니다"
46,2021-04-04 23:02,2차창작에서 벌어진일 웹툰에 끌고 오는 일 = 베댓에서 주접떠는 애들 아님?? 얘네도 같이 욕하지 왜 얘네한텐 좋아요박음?? 
46,2021-04-04 23:02,타 sns 여기로 끌고와서 욕하는것도 솔직히 눈살 찌푸려집니다. 아무상관없이 웹툰만 즐기는사람은 무슨 죈가요
46,2021-04-04 23:02,돈문제 회피하려고 자살 주작 한 인간 하나 때문에 이게 뭐람
46,2021-04-04 23:01,트위터 => 정신병 환자들 수용소
46,2021-04-04 23:00,"2차창작에서 벌어진일 원작에 까지 끌고오는 일 자제해주시구요, 원작이나 전혀 상관없이 원작만 즐기는 분들까지 싸잡아서 욕하는것도 자제해주세요. 이제 그만"
46,2021-04-04 22:58,여기 댓창 왜이런건데 그래서 굳이 여기서 싸워야하나?
46,2021-04-04 22:57,댓글 보러 오신분들은 다시 웹툰화면으로 돌아가주세요.
46,2021-04-04 22:57,트위터 얘기는 트위터에서 하세요 하나도 안 궁금하니까.. 웹툰 보는 사람들은 그 정도로 과몰입 하는 사람도 없고 딱히 팬이라고 할 만한 사람들도 아니에요 그냥 일주일에 한번 웹툰 하나 보는 것뿐인데 뭐 그런 구구절절 팬덤판 이야기까지 봐야하나..
46,2021-04-04 22:56,"성별, sns활동 유무 등등 으로 편 나눠서 욕하지 말아주세요. 제발요"
46,2021-04-04 22:55,밑에 이와름같은 애들이 자꾸 와서 성별싸움을 조장하는구만 뭘 ㅋㅋ
46,2021-04-04 22:55,그니까 이제 좀 작작하시라구요~ 안 지겹냐고요~ 안 죽은 사람 죽었다고 하는게 즐거우시냐구요~ 2차창작이니 뭐니 결국 작가님이 연재하시는 이 작품이랑 하등상관없는걸 왜 여기 댓글창에서 말하고 계시냐고요~ㅋㅋ 아 진짜
46,2021-04-04 22:55,만우절 그림 넘 훈훈하다라고 할려했는데 댓글 상태가..
46,2021-04-04 22:54,남자들은 지금까지 많이 그래왔으면서.. 뭘..
46,2021-04-04 22:54,여기서 사건설명하지 마시구요... 물론 저도 무척이나 안타깝고 이렇게 되어버린게 많이 슬프지만 원작에까지 와서 그러시는건 예의가 아니라고 생각합니다. 해당 작품의 팬덤에서 벌어진 일이지 원작때문에 터진것도 아닙니다. 아무상관없는 원작 댓글까지 와서 물 흐리고싶으신건가요
46,2021-04-04 22:53,괜히 이번 일로 전독시 웹툰에까지 피해와서 연중당할까 걱정되니까 이번사건 욕하는거지 뭘 자꾸 웹툰에서 원작얘기를 하지말래 어이가 없네 
46,2021-04-04 22:53,주최자 자살 확실하지 않습니다
46,2021-04-04 22:52,. 결국 주최자 자살.
46,2021-04-04 22:52,4. 결국 주최자가 멘탈 터져서 자살 암시글 올림.
46,2021-04-04 22:52,2차 창작물 뭐이런건 ㅈ도 관심없고 걍 순수하게 원작 소설이 좋아서 주구장창 읽고있는데 이런 사건 터지니까 집중이나 몰입이 안됨.... 전독시 팬덤이라는게 미친듯이 파고 2차창작물 이런거 만드는 사람들을 말하는건지 나같이 순수하게 원작 좋아하는 사람들까지 다 말하는건지 존나 회의감이 들음
46,2021-04-04 22:51,"3. 이에 입장 못한 사람들이 항의하기 시작하고, 뭐 돈 많이 모였을텐데 왜 이렇게 작은 대관처를 대여했냐면서 트위터에서 단체로 주최자한테 욕박고 조리돌림 시작함."
46,2021-04-04 22:51,제발 트위터 판에서 일어난 일은 그쪽에서 해결하세요... 잘못은 인정 해야지ㅋㅋ
46,2021-04-04 22:51,2. 주최자가 사전에 시에게 인원 이정도 들어간다는거 미리 체크받고 허가 받았는데도 행사 당일 공무원들이 인원 반 이하로 줄이라고 함.
46,2021-04-04 22:51,1. '독자튜브'라는 사람이 소설 '전지적 독자 시점'의 동인행사(팬아트나 동인지 만들어 파는거)를 열음. 기업에서 여는 것도 아니고 걍 개인이 여는 거임.
46,2021-04-04 22:50,그니까  ... 잘보는데 갑자기 기분 잡쳤네 알아서 해결하던가 댓글에서 왜
46,2021-04-04 22:50,트위터 여러분들 그만해주세요세상은 트위터속에 있는게 아니에요
46,2021-04-04 22:50,"싸울거면 해당 sns가서 싸워주세요. 원작 까지도, 논점 흐리지도 마시구요. 솔직히 2차창작 판에 있었던일인데 아무상관없는 원작까지 와서 이러는거 솔직히 추합니다."
46,2021-04-04 22:49,"누가 죽었는지, 누구의 잘못인지 저희는 전혀 관심이 없습니다. 여기는 웹툰을 보는 곳이지 당신네들이 싸움을 하는 곳이 아닙니다. 싸움을 할거면 다른곳에가서 싸우시고 괜히 작가님에게 피해를 끼치지 말아주세요."
46,2021-04-04 22:48,"특정성별떡밥 엮이기도싫고 관심도없는데전독시 진짜 재밌게읽었는데도 그놈의 팬덤들 병크때문에 친구들한테 소개도못해주고있다.
저밑에 댓쓴거 통한의비추당한거보니 그팬덤들 몰려와서 정신승리하고있는데 제발 그만해라....좀....
사람이 죽었는데 여전히 자존심이니 남탓이니 돌리지말고"
46,2021-04-04 22:48,댓글에서 왜 이러고 있는지 모르겠는데 뭔상황인지도 모르겠고 ㅋㅋ... 
46,2021-04-04 22:46,이상황에서 왜 서로 남탓을 함? 애초에 처음 잘못한건 전독시 팬덤 사람들 맞고 그거에 대해 사과하고 그러면 되지 이때다 싶어서 욕하는 애들은 뭐고 사과 한 마디 없는 애들은 또 뭔데
46,2021-04-04 22:46,트위터든 페북이든 인스타든 sns하는사람중 정상인은 없습니다...sns에서 하는 머저리짓을 현실까지 끌고오면 그건진짜 답도없는 새끼고 sns에서만 지롤떠는 놈들은 걍 익명 뒤에 숨어서 신난 놈들임...
