Episode,Date,Review
46,2021-04-04 18:03,속보))포비스 선정 세상에서 가장 이상한 SNS 사이트 1위...'트위터'
46,2021-04-04 18:02,그저...대단하다 ^파랑새^
46,2021-04-04 18:02,근데 심지어 그 행사 동인지 사고 팔고 서로 나누는 행사라며 얼마나 2D망상에 젖어서 살았으면 동인지딸이나 칠라고 모이려다 못모였다고 사라 죽을때까지 욕하던거임?
46,2021-04-04 18:01,트짹분들 제발 나가주세요ㅠㅠ
46,2021-04-04 17:57,왜 이런사건 터질때마다 항상 파란새하고 관련이 있을까 ㅋㅋ
46,2021-04-04 17:53,"hong아 닉 바꿨니 부계정이니 ""전독시 팬덤에서 터진 일을 왜 트위터하는 사람 병ㅅ만들음????ㅋㅋㅋㅋㅋㅋㅋ""너가 한 말 잘 보렴"
46,2021-04-04 17:52,"공식적인 작품과 작가님과는 전혀 연관 없는 일이고요, 따라서 여기서 싸울 건 아니라고 봅니다."
46,2021-04-04 17:52,트인낭
46,2021-04-04 17:52,트위터 뜡땡이녀ㄴ들 또 사람죽였네 
46,2021-04-04 17:51,디즈니에서도 너무 더럽다면서 인수를 안한 트위터를 하면서 네이버 웹툰 댓글을 욕하는건 좀 양심이? 없는거? 같아요.
46,2021-04-04 17:50,그 팬덤이 트위터에서 모인 팬덤이니까요...아까부터 누가봐도 닉네임이랑 아이디가 대충 만든 가계정인거 같은 사람들이 성별갈등으로 몰고갈려고 분탕치는데 왜 그러는건지...
46,2021-04-04 17:50,asv님 제가 그 계정이랑 동일계정이라고 착각하시는 것 같아서 제 계정 알려드렸는데 인증은 필요 없나요?
46,2021-04-04 17:49,트위터에서 주최자님에게 욕박고 조리돌림한거니까ㅋㅋ
46,2021-04-04 17:49,왜 여기서 난리야 뇌절 좀 하지마
46,2021-04-04 17:49,트위터에서 일어난 일인데 왜 트위터하는 사람 병ㅅ 만드냰다 우와...
46,2021-04-04 17:48,↓트위터 수준보단 나아요..!
46,2021-04-04 17:47,사람죽인 웹툰 알페스 소비하는 그년들 수준
46,2021-04-04 17:47,"cchjij님 단어선택이 잘못됐다는 점은 동의하며, 그 점에 관해선 고인 및 유가족께 죄송합니다."
46,2021-04-04 17:45,트위터하는사람들은 믿고거르세요 트위터하는애들이 전부 한ㄴ들은 아니지만 한ㄴ들은 다 트위터합니다ㅋㅋ
46,2021-04-04 17:44,"작품 댓글창에서 싸울 일은 아닙니다. 정당한 비판을 받아야 하는 안타까운 일은 맞고요, 여기보단 다른 곳에서 이야기하는 것이 더 옳다고 봅니다. 작가님, 그리고 전지적 독자 시점 작품과는 무관한 내용이니 여기서는 싸우지 않길 바랍니다."
46,2021-04-04 17:44,"""극단적인 선택을 하지 않으셨다면 어떤 생각이 드셨겠나요?"" 가 대체 왜 필요한 겁니까... 지금 님께서 하신 감정팔이  등등의 말은 총대께서 돌아가신 지금 현 상황을 보고서 하신 말이에요... 님이 진심으로 안타까워하는 게 사실이더라도 단어 선택이 진심으로 잘못됐단 말입니다"
46,2021-04-04 17:43,트위터 ㅈㄴ 역겹다
46,2021-04-04 17:43,작가님 잘못이 없는건 맞는데 이거 관련해서는 뭐라 하셔야하지않나 안그럼 살인마들이 보는 웹툰이라고 꼬리표 달릴텐데 ㅋㅋ
46,2021-04-04 17:43,ㅡㅡㅡㅡㅡㅡㅡㅡ트위터 얘기 그만ㅡㅡㅡㅡㅡㅡㅡㅡㅡ
46,2021-04-04 17:42,팬덤이 존나 싸불했는데 거기에 피해자분도 있는건 좀 알아두세요 그분은 피해자에서 가해자로 낙인찍히고 쓰러지셔서 응급실 갔다함
46,2021-04-04 17:42,"코코냥냥님 트위터에 ""죽음으로 도피한건 진짜..."" 라고 직접 죽음으로 도피한거라 주장하셨으면서 왜 여기선 아닌척 하세요ㅠㅠ"
46,2021-04-04 17:41,..더러워... 트위터.... 지금까지 정보 빠른 거 때문에 했는데.. 이 앱이 제 핸드폰에 있다는 거가 좀 꺼려지네요..
46,2021-04-04 17:40,"cchjij님, 한가지 말씀드리자면 저는 고인의 죽음에 진심으로 안타까워하고 있습니다. 빈말이 아니며, 어제 해당 ㅈ살 암시글을 보고 신고를 했었습니다. 트위터에 ㅈ살 암시글 신고기능을 사용했습니다.
반대로 하나만 물어보죠.
만일 총대님께서 극단적인 선택을 하지 않으셨다면 cchjij님은 저 글을 보고 어떤 생각이 드셨겠나요?

제 발언이 ""죽음으로 도피한다""라는 말에 동조한다고 느끼셨다면 유감입니다."
46,2021-04-04 17:40,트위터 애들 역시 ㅈㄴ 더러움
46,2021-04-04 17:40,트위터 극성 팬덤 잘못이에요 공식 행사 아닙니다
46,2021-04-04 17:38,작가님과 전독시의 본편 내용과는 전혀 무관한 사건이었구요비공식 행사 개최도중 일어난 안타까운 사건입니다...
46,2021-04-04 17:37,이번 사건에서 작가님 잘못은 없습니다 여러분~ 잘못은 트위터쪽 팬덤이 했어요.
46,2021-04-04 17:36,전독시 판 넓은건 알고 있었지만 이렇게까지 더러울 줄은
46,2021-04-04 17:34,웹툰 보러왔다가 이게 무슨일이람...
46,2021-04-04 17:33,트위터 BL충들의 악플과 비난으로 안타깝게 사망하신 고인에게 죽음으로의 도피라는 2차 가해 멈춰~~!
46,2021-04-04 17:33,전독시가 bl인지는 모르겠는데 bl아니라는 분들이 왜 bl베댓은 칼같이 올리면서 bl로 소비하는지 모르겠음
46,2021-04-04 17:29,"코코냥냥님 ""해명을 요구했다면 해명을 해줘야 됩니다. 해명이 필요없다 생각할지라도 금전이 얽힌 부분은 해명해야 되는 것이 맞구요. 그렇게 기다린 해명문에 기재되어 있는 내용은 주최가 미숙해서 죄다, 스탭이 미숙해서 죄다,이 2개를 되돌림밖에 안하는데 해명이 아닌 감정팔이지 무엇일까요"" 이 말씀은 해명 안하세요? 죽은 사람한테 감정팔이요? 죽음으로 도피 라는 말은 다른 글 퍼온거라고 해도 그런 뒤에 저런 글을 올리면 그 죽음으로 도피 라는 말에 동의한다는 것밖에 더 됩니까?"
46,2021-04-04 17:29,BL 좋아하는 애들 평균임 정상인 없음
46,2021-04-04 17:29,역시 트위터는 정신병이다
46,2021-04-04 17:29,만우절 사진 보러왔는데 댓굴이 싸우는거보니 기분이 조금 그렇네요
46,2021-04-04 17:29,계속 트위터 팬덤분들 특징이 불리해지면 성별갈등으로 넘어간다는건데 다른 사람들은 당신들을 애초에 사람으로 보질 않아요. 왜 자기들이 여성을 대표하는것 마냥 말하는지 모르겠네요.
46,2021-04-04 17:28,성별싸움은 그쪽분들이 원하는 대로 흘러가는 길이라는걸 모르냐 그러면 안돼
46,2021-04-04 17:26,엔번방이 공론화 안되고 전독시만 논란된거도 아니고 ㅋㅋㅋㅋ
46,2021-04-04 17:26,트짹 욕해야할걸 남녀싸움하고 앉았네ㅋㅋ 팝콘냠냠
46,2021-04-04 17:26,?이번 사건은 팬덤이 잘못한거 아닌가요? 왜 또 개뜬금없이 성별갈등으로 몰고가는지..ㅋㅋ 여기서 남혐 여혐이라는 단어가 나올일이 뭐가있나요?
46,2021-04-04 17:26,잘못했으면 잘못한 점만 말하면 되지 굳이 엔번방 끌고와서 보고싶은거만 보네 라고 한 이유는 뭔데?
46,2021-04-04 17:25,하여간 주작이 없으면 남혐을 못해요 ㅋㅋ
46,2021-04-04 17:25,네 제보하세요~ 고인모독 혹은 고인음 죽음으로 몰고갔던 싸불러들에 대한 고소 등의 법적인 조취는 유가족 몫이지 왜 asv님이 열을 내시는지 모르겠네요
46,2021-04-04 17:25,한녀한녀 거리는거보고 예상했는데 결국 성별싸움됐네 어휴
46,2021-04-04 17:23,그래서 n번방 인원이 결국 몇명이엇는지는 아시나요? 사내 성희롱을 당했다는 질문에 당했다는 답변이 남성에서 더 많았던건 아시나요? 딥페이크는 관련 보고서에 25%가 한국 연예인 대상이며 대부분 '중국'에서 만들어진다는 내용이 있다는건 아시나요? 알페스는 누가 했죠? 그래놓고 자신들이 돈 벌어다 준다면서 빼액거리는건 누가했죠? 보고싶은것만 보는건 님인것같고 그 얘기를 관련이 1도 없는 여기서 왜 하시는지 모르겠네요. 관련 있는 사건은 왜 여기서 얘기하냐고 하시던 사람이.
46,2021-04-04 17:23,"비공식 행사 관련 사건인데 왜 전독시 댓글에서 욕하고 토론하시는건지.... 트위터 가서 해주시면 안될까요...? 애초에 작가님과 전독시라는 작품과는 아무런 관련이 없는데....
그래도 사람 한분이 목숨을 잃었다는 점은 정말 안타까운 일이네요..
삼가 고인의 명복을 빕니다....."
46,2021-04-04 17:22,luci야 사람 그렇게 만들었으면 미안한 마음이라도 가져야지 너네도 잘못했으니까 우리도 잘못한다하면 어떡하냐
46,2021-04-04 17:22,코코냥냥님 덕분에 제보할 내용이 많아지고 있습니다 감사합니다^^
46,2021-04-04 17:22,작가야 한마디 해라 느그 독자들이 사람죽였다
46,2021-04-04 17:22,난 전독시 모든화 시리즈 영구소장인데 BL댓글들 존~나 꼴보기싫어서 최신화 나온날에 시리즈로 보고 대여기간끝나면 다시들어가서 댓글봄ㅋㅋ 베댓은 그때도 거르고 어떻게 시발 주접싸지르는애들 싹사라짐 베댓도 단톡방에서 주접댓글 주작하는데 걔네들 대여기간끝나면 보이지도않음
46,2021-04-04 17:21,↓↓ 알페스 섹테 500배
46,2021-04-04 17:20,"윤슬님 저는 싸불을 한 사람들이 잘했다, 옳은 행동이었다 등 지지한 적 없습니:) 해명을 요구하는 과정이 과열됐어도 피해를 입었던 사람들이 입을 열어 해명을 요구한 것까지 싸잡아 싸불로 취급되는 지금 상황이 안타깝다는 겁니다:)"
46,2021-04-04 17:18,트짹들이 손가락으로 사람죽인게 어디 하루이틀이냐? 연예인들 악플 자살 99%가 트짹년이 죽인건데 걔들은 죄책감이라는 감정 자체가 없는 괴물들임
46,2021-04-04 17:18,이제는 보니까 사불은 자기들이 안했고 타 소설 팬들이 와서 그런거라고 지들이 와전시키네요. 이거를 여기서 얘기 안하고 냅두면 아주 이런 일이 없었던것마냥 행동하겠어요.
46,2021-04-04 17:18,코코냥냥(ajru****) 그 계정 글을 복붙한거라고 쳐도 지금 님께서 그게 감정팔이지 무엇이냐고 말하신건 죽음으로 도피라던가 저런 말에 동의하신 거라고 보겠습니다.
46,2021-04-04 17:18,그러게요 유료분보면 트짹이랑  Bl충 욕하는댓글만있던데 똥꼬파티 펼치다가 대여기간 끝나자마자 싹 사라지는 그 성별 가성비성별ㄹㅇㅋㅋ
46,2021-04-04 17:17,카라케케님 말씀대로 그런 요소들 때문에 웹소설 좋아하는 남자독자들 사이에선 이미지 아주 안좋죠 그래서 요즘 웹소설 남자 조연 많으면 바로 의심부터함 ㅋㅋ bl노선 타는거 아니냐고
46,2021-04-04 17:16,??? 웹툰댓글 말고 트위터에서 이야기 하는게 좋지 않을까...
46,2021-04-04 17:16,코코냥냥(ajru****)전후사정을 헷갈려 하시는 것 같은데해명요구->ㅈ살 암시글->싸불 이라고 하셨는데 힘들다는 사람 괴롭힌것도 정상은 아닌데 뭘 자랑이라고 전후사정이니 뭐니 떠드시는지 모르겠음...
46,2021-04-04 17:15,"cchjij님 아래 글 중 ""죽음으로 도피""가 언급된 글은 트위터계정 @cyans_novels님 글을 복붙한 겁니다.
순서를 인지하고 계신다고 하니 첨언하겠습니다.

해명을 요구했다면 해명을 해줘야 됩니다. 해명이 필요없다 생각할지라도 금전이 얽힌 부분은 해명해야 되는 것이 맞구요. 

그렇게 기다린 해명문에 기재되어 있는 내용은 주최가 미숙해서 죄다, 스탭이 미숙해서 죄다,

이 2개를 되돌림밖에 안하는데 해명이 아닌 감정팔이지 무엇일까요"
46,2021-04-04 17:15,ㅋㅋㅋㅋㅋ 유료분은 돈 없어서 못가겠고 차마 돈 쓰기는 싫어서 무료분에 분탕치는 가성비 성별 너무 투명해서 눈에 보인다
46,2021-04-04 17:15,"bl은 일부 팬덤이 언급한다기엔 작품 내에 관련 요소가 계속해서 있었고, 그거에 그런거 좋아하는 사람들이 유입해서 팬덤을 이루었는데요? '인간이 저런 외모를 가졌다는게 말이 안되니까. 저명한 화가가 일필휘지로 그린 듯한 눈썹. 조잡한 인간의 각도기로는 감히 잴 수 없을 듯 완벽한 각도로 뻗은 콧선과 턱선. 세상 모든 불행을 모아 보석으로~' 라는 글이 소설에서 김독자가 유중혁 보고 하는 생각인데 정말 당당하게 그런게 없다고 할 수 있어요? bl이라 할 수 있는 수준인데 그게 왜 와전인지는 잘 모르겠네요. 누가 소설에서 둘이 키스하고 그런다고 한게 아니라면 와전은 아닌거 같은데."
46,2021-04-04 17:14,"틀릴수 있음전독시 비공식 행사를 열었는데 인원이 몰려 민원이 들어와 유료로 입장하는 사람들까지 퇴장해야되는 일이 벌어짐 이후에 공무원이나 경찰들도 들어와 인원압박을 하는 상황까지 벌어져 행사를 제대로 못즐김 이 이후에 항의가 계속됐고 주최자분은 pc메모장으로 쓴듯한 사과문을 주최자 계정에 제출, 사과문 내용중에 옥상에 있다는 자살암시글이 있자 트윗 인용으로 옥상인데 어떻게 컴퓨터를 가지고 있냐 등의 싸불(사이버 불링)이 지속되고 다음날 부고 소식이 전해짐

트위터에서 일어난일
비공식 행사였음
주최자분에게 싸불한 사람 있음
싸불한 사람들에게 너무 심하지 않냐는 의견도 있었음
논란이 되서 트위터안에 전독시 팬덤뿐만 아니라 실트에도 오르고 네웹에도 관련글이 올라오고 있음
부고 소식이 올라온 뒤에 죄책감 가지지 말자는 얘기 나왔었음
떡볶이로 조롱했단건 잘못된 정보인것같음 시간대가 다르고 전독시 팬이 아니라고 계정주분이 말함
...아니 그냥 너무 충격임 삼가 고인의 명복을 빕니다"
46,2021-04-04 17:13,nmpl** 이새끼 글삭보소ㅋㅋㅋㅋㅋㅋ별 nmpl** : 애초에 전독시가 없었으면 행사 안열려서 이런 일 없을거아니냐 작가탓이네 
46,2021-04-04 17:12,"죽음으로 도피, 자업자득이란 워딩은 진짜 아니지 않나요...고인에 대한 최소한의 예의는 지켜주세요 "
46,2021-04-04 17:11,사람 죽여놓고 트윗질하는 꼬라지 참 아릅답더라 너네
46,2021-04-04 17:09,진짜 트위터 하는 사람들은 거르고 보는게 맞다
46,2021-04-04 17:07,아 그리고 유족들한테 사망확인차 전화했다면서요 
46,2021-04-04 17:06,"코코냥냥님 아니 그 순서를 누가 몰라서 그런가요. 지금 님이 하신 ""감정팔이"" ""소동"" ""죽음으로 도피"" 라는 말을 대체 무슨 생각으로 했는지 말을 해달라니까 무슨 전후사정이랍니까?"
46,2021-04-04 17:06,트위터계정 @cyans_novels을 쳐서 들어가보면 제가 복붙한 글 있습니다. 경찰조사를 받겠다고 하신 분 이야기 언급은 지웠구요.
46,2021-04-04 17:05,해명 이지랄 공무원이 와서 하지마세요 했는데 무시하고 진행하냐 ㅋㅋㅋㅋㅋㅋㅋㅋㅋ
46,2021-04-04 17:05,고인 명복 빌거면 빌고 팬덤 욕할거면 욕하고 근데 점점 한녀거리는 애들은 뭐냐? 어디서 몰려온거 투명하네 ㅋㅋㅋ
46,2021-04-04 17:04,"전후사정을 헷갈려 하시는 것 같은데
해명요구->ㅈ살 암시글->싸불->현재

이렇습니다. 피해자였던 사람들이 소리를 모았더니 싸불로 취급되고, 결국 총대님께서 운명을 달리하시면서 피해자들이 가해자가 되었네요. 실제로 싸불한 사람들은 있지만 앞뒤 맥락도 모른 채 전부 싸불로 취급하는 건 아니라고 봅니다."
46,2021-04-04 17:03,전독시 팬덤은 진짜 개악질인게 예전에 은소로 작가 작품 보고 표절이니 뭐니 뇌피셜 씨부리면서 자살직전으로 내몰고 마녀사냥함
46,2021-04-04 17:03,사실 돈까지 주고 참가한 행사가 제대로 진행 안 되서 화내는 것 까지는 이해하지만 죽으라고 부추겨놓고 진짜 죽으니까 책임전가하는 건 학폭 가해자들이나 범죄자들이랑 똑같은 행태 아니냐?
46,2021-04-04 17:03,"사람이 죽었는데 감정팔이에, 소동..ㅋㅋ 참..."
46,2021-04-04 17:03,나도 덕질 땜에 어쩔 수 없이 트위터 하는데 역시 트위터는 믿을게 못 됨 걸러야해
46,2021-04-04 17:02,사람들간 말이 전해지다 보면 어떻게든 어떤 방식으로든 작품 이미지에 피해가는 방향으로 와전되게 됩니다. 특히 이런 자극적인 일은 더더욱요. bl 관련해서도 싱숑이 bl이라 한 적 한 번도 없는데 일부 팬덤이 언급하다 결국 프레임 씌워졌고 싱숑한테 피해갔죠? 똑같아요 이것도 나중가면 어떤 식으로 피해가 갈지 모른다구요. 묻으려는 것도 아니고 걔들 욕먹는거 전 상관 없다니까요? 욕 하시라구요 근데 왜 여기서 난리피우냐 이말이죠 트위터 가서 싸우세요 제발
46,2021-04-04 17:01,"코코냥냥 님, 그래서 자업자득, 죽음으로 도피 라는 발언은 무슨 생각으로 하신건가요?"
46,2021-04-04 17:00,누가보면 이 사건으로 작품이 욕 먹는 줄 알겠네요. 사건 터져서 사람모일 때 딴 얘기 들고와서 저러는거면 그 얘길 하지 말라고 해야지 왜 사건 얘기를 하지 말라고하세요?
46,2021-04-04 17:00,여자연예인 악플단것도 그 성별이고 남자연예인 몸캠피싱당한 거 조리돌림한것도 그 성별이였다. 정말 막장이구나
46,2021-04-04 16:59,여기가 사람죽이기 좋아하고 시체에 낄낄거리는 혐오스런 사람들이 보든 웹툰인가요?
46,2021-04-04 16:58,작품 욕하지마세요 BL 좋아하는 트짹이들이 문제인거지 작품은 문제 1도 없습니다 욕할거면 BL충들 욕하세요
46,2021-04-04 16:57,"해명을 요구한 것 자체는 싸불도 아니고 정당하게 요구할 수 있는 걸 요구한 것 아닌가요. 다른건 해명할 의무가 없을지 몰라도 돈에 얽힌건 요구하는 게 맞습니다.
다소 과열된 분위기였지만 제대로 해명에 응했으면 될 일이며 트위터에 마지막으로 올리신 본문 80%가 감정팔이였네요.

그 감정팔이를 조롱하며 비웃고 싸불한 것 때문에 ㅈ살소동이 있던 거구요.

총대님의 마지막 글에 언급되신 분은 경찰과 연락해 진술을 한다고 하셔서 그분 이야기는 안하겠습니다."
46,2021-04-04 16:57,"악플로 사람 죽이는 건 기가막히게 잘하는 ""그 성별"""
46,2021-04-04 16:57,그니까 팬덤 욕하는건 맞는건데 작가님이 쓴 작품 자체를 욕하니까 문제라는거잖아요ㅋㅋㅋ 누가보면 다들 정직하게 팬덤만 깐줄알겠네;; 아래로 조금만 내려보면 작품 욕도 수두룩하더만 이게 작가님한테 피해가 가지 않는다니...ㅋㅋㅋ
46,2021-04-04 16:57,'일부' 악질 트위터 덕분에 사람이 한명 죽었는데 고인모독하고.. 조리돌림하고.. 참 좋아하는웹툰의 팬들 수준이라니 이게... 참안타깝네요 진짜 니들이 사람한명 죽인거다
46,2021-04-04 16:57,"밑에 내리면 작품탓이라는 얘기, 똥꼬충소설 욕 많은데 뭔소리하는거죠"
46,2021-04-04 16:56,아니 지금 팬들이 모여서 만든 비공식 행사에서 일이 일어난건데 웹툰에 몰려와서 싸우면 일이 해결되냐고요
46,2021-04-04 16:55,잘못 와전이 어떻게 되죠? 무슨 행사에 작가님도 참여했다고 와전이 될까요? 계속 작가님들한테 피해간다면서 묻으려하는데 여기 어디서 이 사건으로 작가님을 욕하고 있죠? 님들 언급하지 말고 말하지 말라고 그러는건 그냥 스리슬쩍 묻으려는거로 밖에 안 보여요
46,2021-04-04 16:52,진짜 트위터는 사회악이다
46,2021-04-04 16:52,작가님들 당연히 잘못 없죠ㅋㅋㅋ 저는 뭐 트위터 옹호하는 입장도 아니고 걔들이 백번 천번 잘못한거 맞다는 것도 알고 욕 먹어야한다는 것도 압니다. 근데 여기서 언급하다 잘못 와전되면요? 작품 이미지 훅 떨어질텐데 이게 싱숑한테 피해주는 게 아니면 뭔가요?
46,2021-04-04 16:52,작가님도 bl 부정하신거로 아는데 자꾸 bl물 생산해대는 트짹이들이 문제임
46,2021-04-04 16:52,죽음으로 도피...? 이게 무슨 소리임 되게 소름돋는데
46,2021-04-04 16:51,"도둑이 제발저린다고.. 누구보다 전독시 BL요소 좋아하는 애들이 댓글에선 ""전독시 BL아닙니다 욕하지마세요~"" 이러더라.. 그러면서 베댓은 '중혁아 니부인(김독자)왔다' 이런거만 좋아요 박아서 베댓올리고다님.  전독시욕먹는게 BL내용 때문에 욕처먹는게 아니라 댓글에 BL주접싸지르는애들땜에 욕처먹는건데 눈치도없이 이작품BL아님 이러면서 눈가리고아웅하는거보면 진짜 역겨워죽겠음 지금 자살사건 관련해서 작품욕하지말고 트위터가서 욕하라는애들도 정작 까보면 사불에 가담했을확률 다분함.  지금 어딜봐서 작품이 욕먹고있냐? 니들이욕처먹고있는데 니들이 셀프논점흐리기하고있는거지"
46,2021-04-04 16:51,"작가님한테 피해가 가지 않는다고요??? 이미 몇몇 댓글도 보이는데 옛날 사건들 때문에 작가님 이미지 안 좋아진 거 사실임 트짹들이 벌인 사건 때문에 왜 작가님 이미지가 실추되어야 하는지 설명 좀; 작품 좋아하고 작가님 좋아하는 팬으로서 트짹 때문에 작품, 작가님 욕 먹는 게 개싫음 진짜"
46,2021-04-04 16:50,밑님 누구누구 잘못 따지는게 아니라 사건 터지고 나서도 욕한 트짹이들 떡볶이 추천받고 모밀 먹으러 다니는데 이게 맞는거임?
46,2021-04-04 16:50,"이번 사건 곧 언론사에 제보하겠습니다. 억울하게 돌아가신 분의 억울함을 알려야 하고, 익명의 세상에서 다른 사람에게 단체로 몰려가 악플로 죽이고 뻔뻔하게 있는 사람들은 처벌을 받아야 한다 생각합니다"
46,2021-04-04 16:47,bl 보는것들이 문제다 이번 사건 트위터 글 쓴 애들 보니 죄다 bl좋아하는것들임
46,2021-04-04 16:47,아래 본문은 퍼온겁니다
46,2021-04-04 16:46,그리고 이런일이 일어났다고 알린다고 작가님들한테 무슨 피해가 가는지는 잘 모르겠네요. 팬덤에 악질이고 역겨운 사람들이 있고 그런 것들이 사고쳤구나 라고 사람들이 생각하지 누가 작가님들이 잘못했다고 생각하나요?
46,2021-04-04 16:46,bl을 왜봄? 
46,2021-04-04 16:46,OOO 지들한테는 조금만 쓴소리해도 공론화해야한다면어 손이 덜덜 떨리고 가슴에 못이 박히고 일주일 불면증 생기고 우울증 걸려서 약먹고 거식증 생기고 진짜 시한부 인생 살기시작하면서 지들이 한짓에 사람죽으니까 우리는 정당한 비판을 한거다하면서 책임 회피임? 니네는 진짜 지옥갈거다
46,2021-04-04 16:45,"일부 트위터 사람들)자기 책임 다 안다하고 ㅈㅅ하면서 피해자분 유서에 적고 간거 진짜 피해자분 입장에선 굉장히 어이없을거 같은데 더는 말 안꺼낼건데 좀 어이가 사라짐...
그 주최 지인들한테는 미안하지만 난... 이번사건이 안타깝지 않고... 그냥 자업자득으로밖에 안보임...
온리전 민원 들어오는거? 독튜브만 그런거 아님. 애초에 다른 장르쪽에서는 아예 민원으로 터지자마자 타 대관처 찾아서 살린 사례(ㅎㅇㅋ)도 있었고(이건 행사 당일 민원이 아니긴 함) 애초에 지금은 이시국이라 민원 들어오는건 어쩔 수 없는거라고 봄.

공무원이 집합한 사람들 세면서 압박했다? 나 ㅎㄴㅇ 갔을때도 공무원은 있었고 사람 수 세던것도 맞을거고 근데 그쪽은 왜 문제가 안터졌을까요?
당연히 그쪽은 예정 인원 수에 맞는 대관처를 골라놨으니까가 아닐까?
그래놓고 갑자기 입장문에서 미숙한 스탭 어쩌고 해버려서 스탭분들 탓을 한다?
솔직히 원래 주최 하면 안될사람이었던거임... 그러고 죽음으로 도피한건 진짜.."
46,2021-04-04 16:44,밑에 bl 욕하는 댓글 썻더니 비추폭탄 박히네 ㅋㅋ 아직도 많구나 bl충들 ㅋㅋ
46,2021-04-04 16:42,전독시 팬덤에서 일어난 일이니까 모르는 사람들한테 알리려고 전독시에서 얘기하죠. 트위터에서 뭐라 해봤자 차단하고 응 아무튼 내가 맞아~ 이럴게 뻔한데 무슨 소용이 있겠습니까? 사람들한테 이런일이 있었다는걸 알려야죠. 근데 참 이상해요. 원래 올라오지 않는 날에는 댓글 거의 안올라오는데 갑자기 어디서 좌표찍힌거마냥 어떻게든 트위터 팬덤 실드칠려고하고 왜 여기서 이러냐고 하고. 왜요. 니들이 한 짓이 알려지는게 무서워요?
46,2021-04-04 16:39,트위터 팬덤 반응들이 더 가관이네요. 자신들이 자살협박을 받았다며 자신들한테 2차사불하지 말라는데 이게 사람이 할 소리인가?
46,2021-04-04 16:34,밑밑 재기하라는 애도 악질이네 고인모독 하면서 트위터 욕하는꼴 ㅋㅋㅋㅋㅋ
