Episode,Date,Review
46,4일 전,근데 철로로 오토바이를 달린다고?
46,6일 전,ㅈㄴ 재밌다… 시험기간에 몰아보기..
46,2022-10-10 21:37,???:나 대표에요~
46,2022-10-07 23:23,지역 쟁탈전이네명동파 충무로파 동대문파 ㅋㅋㅋㅋㅋ
46,2022-10-06 18:17,다시 코인으로 바꼈다
46,2022-10-04 13:05,갑자기 생각난건데 북한은 저때 무슨 상황일까?
46,2022-09-10 09:04,유상아 능력이 금색 실 비슷한거니까 성좌가 원더우먼일 가능성도 있나...?
46,2022-08-30 21:10,유상아 능력 은근 쓸모 많아
46,2022-08-30 02:14,왕좌의 게임
46,2022-08-15 23:34,연출 좋고 그림 좋다. 속도감! 
46,2022-08-02 16:43,독자 왜 이렇게 잘생겼어우리 독자 걍 아이돌해!!!
46,2022-07-06 10:35,다른 웹툰과 다르게 거의 인간들끼리 싸우고 죽이고 하니까 좀 그럼 ㅜㅜ
46,2022-06-10 17:18,혹시 밑에서 5번째 컷에 '김씨'가 누구 말하는건지 아시는 분? 왜 모르겠지
46,2022-05-25 19:28,실 다루는거 되게 스파이더맨 같넹
46,2022-05-08 15:28,껙 길어?
46,2022-04-27 14:40,슈퍼커브 c125만 눈에보이네..
46,2022-04-21 08:08,개멋있어
46,2022-04-21 01:31,.
46,2022-03-27 05:41,근데 저 철길  실제론 오토바이로 가면 궁디 진짜 아플것 같은뎈ㅋㅋㅋ
46,2022-03-24 00:09,공필두두두두두두두두두두두
46,2022-03-23 22:55,유상아 배후성좌 거미한테 물린 빨간전신타이즈 입고 다니는 걔 아냐?
46,2022-02-27 00:40,상아씨 스파이더먄
46,2022-02-11 19:35,머리에 묶을수있는거면 난 팬티로 만들렛!
46,2022-01-27 16:31,정주행1392회차
46,2022-01-16 21:03,우앙 창신역
46,2022-01-12 17:27,쳐라 할때 컷 개멋있네 진짜 
46,2022-01-05 17:44,45
46,2022-01-02 11:24,다시 봐도 독자 일행 4인방 동시에 바이크에서 뛰어오르는 거 멋있어...
46,2021-12-30 00:15,길영아... 꼭 살아남자ㅠㅠㅠ
46,2021-12-28 12:34,정해진시일내에 표적역을 점거하지못하면 전원사망인데 깃발꽂이당한 그룹의 처우는 빼앗은 그룹에 의해 처우가 결정된다는 건 뭔가 이상해요 저만 이해못하나요?
46,2021-12-26 11:58,동묘앞 할아버지 할머니 휏션
46,2021-12-12 23:35,길영이 지켜ㅠ
46,2021-12-10 18:16,이야 이거 미쳤다 너무 재밌네 ㅋㅋㅋㅋㅋㅋ
46,2021-12-04 08:34,배경이 자취방 근처라서 몰입감 오진다 ㅋㅋㅋㅋ
46,2021-12-02 22:21,잘봤습니다 
46,2021-12-01 23:47,저기서 오토바이타면 덜컹덜컹 하겠네
46,2021-11-17 19:11,유상아 능력 개멋잇다
46,2021-11-09 20:00,진짜 재밌네
46,2021-11-09 06:41,ㅇ
46,2021-11-02 10:01,강일훈 바지가 참 이쁘네
46,2021-10-20 20:31,철로 에서  오토바이가 저케  달릴수있나?
46,2021-10-16 15:19,자살하러 왔구나??
46,2021-10-08 01:11,조만간 런닝맨 하겠네
46,2021-09-30 19:07,아니 근데 '좋은 제안' 저거 약간 도를 아십니까에서 '좋은말씀'전해준다고 하는 느낌인뎈ㅋㅋㅋㅋ
46,2021-09-28 05:10,가의 어벤져스급
46,2021-09-22 16:19,놀방이네
46,2021-09-21 09:51,❤💜❤💜❤💜❤
46,2021-09-15 15:07,걍 대표 목 따셈
46,2021-09-10 04:08,뭔가 살인해도 괜찮은 단체 런닝맨을 보고있는 느낌이다
46,2021-09-03 03:23,깃발 발바닥에 넣고 신발 신으면 안되겠지..
46,2021-08-30 15:00,"명동 ,  동대문 ㅋ 야인시대네 ㅋ"
46,2021-08-29 14:14,유상아 원더우먼 성좌예상했는데 거미인간성좌인가...
46,2021-08-29 14:13,나만 s펜광광고 밖에 안보이나..
46,2021-08-29 00:30,김독자 이쁜이
46,2021-08-28 23:04,헐 개멋져 
46,2021-08-28 18:37,ㅋㅋㅋㅋ터널에서 무슨 어벤져스 등장씬같앸ㅋㅋ
46,2021-08-26 07:58,김독자 💕 강일훈
46,2021-08-23 10:17,이현성은 아직도 뼈다귀 들고 싸우냐고ㅠㅠ
46,2021-08-22 15:18,좋아요가 딱 30000개라 못누르겠어 ㅠㅠㅠ
46,2021-08-19 10:35,오케이 일훈이 일로와
46,2021-08-18 20:57,와 네명 점프할때 개멋있었다;; 어벤져스인줄
46,2021-08-17 17:43,오 유상아능력개좋아
46,2021-08-15 13:52,희원이 코어가 대단한 걸....허리만 묶여잇는데 서잇다니....
46,2021-08-14 00:35,헐 정주행했는데 개재밌네요 시바 개 재밌어 시바 이런 명작을 이때까지 몰랐지?이런 시바 개 떵멍충이같은 이상한 놈이다있나
46,2021-08-12 15:13,아니 강일훈왤케잘생김.. 일회성캐릭터라면 너무아까운데ㅠㅠㅠㅠ
46,2021-08-06 23:56,주인공 일행 여캐들 다 섹싀하네..
46,2021-07-31 13:49,눈치가 없어서 잘 모르겠어서 그러는데요 유중혁을 모른다고 한게 왜 이상하다고 눈치를 챈거가요?
46,2021-07-29 07:52,원근법이 있는건 이해하는데 발이 너무작지 않나ㅋㅋㅋㅋㅋ 애들 하체운동좀 시켜야겠네
46,2021-07-23 12:07,다덴 생각나네 ㅋㅋ
46,2021-07-21 19:30,생각보다 주인공 김독자의 주변인물인 유상아가 돋보이는 것 같습니다. 제가 좋아하는 캐릭터이기도 하고요. 항상 재밌게 보고 있습니다. 항상응원하겠습니다 화이팅입니다.
46,2021-07-18 13:45,핰ㅋㄱㅌㄱㅋㄱㅋㄲㄱㅋ
46,2021-07-17 01:02,여기서 강남 뜨면 어케되는거임?
46,2021-07-16 22:20,김독자라 해서 놀란이유가 소설 댓글에서 싸운놈이라 그런거 아님?ㅋㅋㅋㅋㅋㅋ
46,2021-07-13 03:51,와 정희원-김독자-이현성-유상아 구도 미쳤네...
46,2021-07-10 21:28,상아씌 스킬쓸때 너무 멋지다. 촥 촤 착! 크!
46,2021-07-08 20:50,"일훈오빠, 내 남편할래?"
46,2021-07-07 13:15,와ㅋㅋㅋ 멤버들 동시에 떨어지는거 개멋지다
46,2021-07-07 01:56,저 밥 처럼 생긴 애는 뭐냐..
46,2021-07-06 21:53,와... 확실히 소설과 웹툰 각각의 장단점이 있구나.. 연출력 대박
46,2021-07-05 21:04,재밌다.....공필두 존나 길영이 보호자같아 ㅋㅋㅋㅋㅋㅋㅋㅋㅋㅋㅋㅋ케
46,2021-07-05 21:03,"메인스테이지 #4- 깃발쟁탈전 명동역 -> 충무로역 기습 ,동대문 역 김독자 일행 은신해 있다가 공격 "
46,2021-06-30 21:02,역시 초반회차 읽은 사람은 독자 말고도 어느정도 있으니 이런일이 일어나는것도 무리는 아니지..... 그래도 얼마 안있으면 안통하겠지 멸살법 내용을 전부 아는건 유일한 독자인 김독자 뿐이니까..........그리고 ㅋㅋㅋㅋㅋㅋㅋ 저 사람 뭐야 내가 대표요 나잡아가쇼 하는것도 아니고 머리에 묶고 있냐고 그것도 시뻘건 깃발을 ㅋㅋㅋㅋㅋㅋㅋㅋㅋㅋ 누가봐도 눈에띄잖아 ㅋㅋㅋㅋㅋ
46,2021-06-27 19:16,쳐라! 할때 충무로 애들 존멋
46,2021-06-22 15:37,그래서 유상아씨가 얻은 아이템은 뭔가요?
46,2021-06-18 19:25,아니 그림작가 진짜 천재임??? 이부분은 이렇게 저긴 저렇게 그려야겠다 소설 읽을때부터 생각한 사람이 아니고서야 일주일마다 뚝딱뚝딱 원작에 충실하면서 완벽한 연출이 나올수가 없는데..
46,2021-06-17 12:37,유중혁이랑 이지혜만 있으면 충분히 인력 보충이 되는데ㅠㅠ 아직 유중혁이 체력 회복이 안되서ㅠㅠ
46,2021-06-17 01:12,횟집사장 개웃기네ㅋㅋㅋ
46,2021-06-06 20:38,밑댓아 당연한걸 마치대단한발견한듯이 말하지말지? 역겨운데
46,2021-06-06 00:08,자살도 여러가지 방법이 있지
46,2021-06-04 02:56,와 간지오짐
46,2021-06-03 13:50,종로로 갈까요~ 명동으로 갈까요~ 차라리 청량리로 갈까요~???: 저질이군 쳐ㄹ
46,2021-06-02 14:06,"내 밑밑밑밑밑 댓글님, 중도하차하시면 어찌 되는 지, 궁금하지 않아요?그럼 50화로 ㄱㄱ"
46,2021-06-02 13:34,와씨...유상아 연출 오진다...
46,2021-06-01 10:35,땅따먹기인가 ㅋㅋㅋ 잼나네
46,2021-05-27 16:22,자구있는 길영이 이쁘당
46,2021-05-25 00:13,진짜 소설보다가 이거 보면 진짜 다르네. 아! 전 300화까지만 봤어요.ㅠㅠ
46,2021-05-21 18:11,밑댓 찡찡대지마셈 어차피 김독자가 얼마안지나서 쟤들다바르니깐
46,2021-05-16 23:22,"실묶기 연출이 엄청 잘됐네..이럼 다른 스킬도 기대하게되는데;;아ㅋㅋ
"
46,2021-05-15 16:41,아니 처음에는 갑자기 도깨비가 찾아와서 퀘스트 깨라고 지랄인데 왜 점점 목표가 생기냐고.....
46,2021-05-13 23:30,♡
46,2021-05-13 01:30,ㅎㅇㅌ
46,2021-05-10 22:59,나는 전독시 초반 좋던데
46,2021-05-01 18:22,하긴 초반부터 주인공 일행 빼곤 죄다 살인자들만 살아남았다는 설정이라 그런가
46,2021-05-01 18:21,다들 사람 죽이고 있는건데 이제는 게임에서 몬스터 잡듯 하고있음 허허
46,2021-05-01 02:33,웹툰에서 울동네 나오니까 신기하네
46,2021-04-29 19:49,ㅋㅋ
46,2021-04-29 13:09,이야  세상이  망하니까  인간  내면의  어둠들이  깨어나는  구나  여태까지는  도덕과  법이라는 체계에서  쉽게 못 드러나는  안개에  불과했었는데  그  체계가  무너지니  저렇게  웃으면서  살인을 하다니 약간  이거보면서  생각드는  게  인간은  미묘하게 나마  사이코패스적  성향이  있는거  아닌가 생각이  드네
46,2021-04-29 02:05,런닝맨?
46,2021-04-28 21:10,와씨 개미쳤네 몇달안보다 봤더니 너무좋다 아직 4편이나 남았다 행복하다
46,2021-04-28 19:51,이 작가님 못생기게 못그리시나... 일훈이가 생각보다 잘생겨서 당황......
46,2021-04-28 17:19,김독자 웃는거 너무 좋아..
46,2021-04-28 13:33,저거 김씨가 들고있던 무기야!역시 주인공을 떠나면 뒤짐
46,2021-04-26 18:14,진짜잼있다
46,2021-04-24 14:42,저 열차길을 바이크로 달리면 엉덩이 박살날거같은데...
46,2021-04-24 12:12,어후 ㄴ짜 존잼이다;;;
46,2021-04-23 14:02,깃발꼿이가 아니라 깃발을 소지해야지만 처우 정하는거 아님? 오타인가
46,2021-04-21 19:00,밑에서 두번째 베댓...초반부가 재미없다는 사람이 있다고?? 나중엔 대체 얼마나 재밌어지는 거임
46,2021-04-21 17:41,"흠,,,"
46,2021-04-21 17:06,작가님 구도 천재시네요스토리도 넘 재밌고 그림보는 재미도 있어요
46,2021-04-21 16:02,너무 재밌어서 육성으로 소리지를뻔 진짜
46,2021-04-20 14:12,"으엥유ㅠㅠㅠ 우리 독자 개잘생겼네 진짜.. 데뷔 왜 안하냐 독자야.. 싸우기 직전 씬 미쳤어요, 작가님 사랑해요... "
46,2021-04-20 02:10,크 넷이 걸어나오는데 간지난다잉
46,2021-04-17 12:37,오토바이에서 날아오르는거 왜캐 멋있냐..드르륵..탁..드르륵..탁
46,2021-04-15 01:24,정희원 진짜 저런 사람 있으면 결혼하고 싶다 너무 예쁘고 유쾌하고 진지할땐 무게있네
46,2021-04-14 12:37,와...
46,2021-04-14 10:19,희원이 왤케 멋짐
46,2021-04-14 09:28,쳐라가 쳐맞아라의 준말이였나
46,2021-04-14 08:23,김독자 : ^p^
46,2021-04-13 01:43,종로로 갈까요~~명동으로 갈까요~~
46,2021-04-12 22:49,독자야 깃빌을 그렇게 보여주면 어떡해
46,2021-04-12 10:25,누구보다 스포를 싫어하지만 캐릭터 나올 때 마다 소설이랑 다르네? 이게 이렇게 표현됐구나? 하면서 열렬히 원작 언급하시는 분들 ㅋ
46,2021-04-12 03:19,4명 걸어나서는 컷 멋있다 어벤져스 같아 와우😝
46,2021-04-12 00:55,탱커+딜러+딜러+서포터라니..조합 좋네
46,2021-04-11 20:12,독자 너무 활짝 웃어서 보기 좋다...
46,2021-04-10 21:55,역시 명동 페션
46,2021-04-08 21:01,압구정 대표는 날라리 겠네
46,2021-04-08 17:40,와 날 때 개멋지노..
46,2021-04-08 10:17,저 사람이 명동 대표? 저 사람은 그냥 방구석 패인같이 생겼는데...
46,2021-04-07 23:34,오토바이 번지씬 개간지네요
46,2021-04-07 20:59,김필두 되게 맘에 든다 ㄹㅇ. 되게 자라같이 귀여움 ㄹㅇ.
46,2021-04-07 20:57,상아 눈나 이쁘다♡
46,2021-04-07 20:33,전독시 진짜 사랑햐
46,2021-04-07 19:22,김컴 사랑해!
46,2021-04-07 18:36,작화도 작환데 액션 연출 점점 좋아지네
46,2021-04-07 16:57,오토바이타고간거리를 순식간에
46,2021-04-07 14:37,아씨 진짜 전독시 웹툰 볼때마다 ㄹㅇ 벅차오르고 뿌듯하네. 캬아
46,2021-04-07 14:37,충무로 깃발 되게 시강이야ㅋㅋㅋㅋㅋㅋㅋㅋㅋㅋㅋㅋ
46,2021-04-07 14:17,ㅋㅋㅌㅊㅊㅌㅋㅋㅋㅋㅋㅋ머리 개웃기네
46,2021-04-07 09:44,패션의 도시 명동이라 이건가 깃발을 머리에 묶고다니네
46,2021-04-07 02:40,유상아 멋지다
46,2021-04-07 01:02,왜 트위터 얘기로 꽉 차있노 이럴거면 트위터 가입 전에 과몰입 진단서 하나 뜯어야 되는 거 아니냐 ㅋㅋ 
46,2021-04-07 00:25,팬덤 이라는 이유를 가지고 악의적으로 여기서 오시는 분들 참 징하시네; 본인들 태도 전혀 자각이 없다는게 가장 큰 문제다. 처음 전독시 접하신 분들은 모르시는데 그분들까지 짊어져야 할 문제인가? 깽판 치고 있네;
46,2021-04-07 00:02,독자 12등신인듯
46,2021-04-06 23:07,"나도 소설로 봤는데 누가 가짜 스포하고 있냐, 아니 이야기 지어냐고 있냐 ㅋㅋ 암튼 난 스포할 생각 없음"
46,2021-04-06 23:02,님들아 ㅈㅂ 트위터 일은 트위터에서 해
46,2021-04-06 23:01,지각
46,2021-04-06 22:59,"주최자 분이 극단적인 선택을 했다고 알려진 상태에서 악성팬덤들이 조리돌림하면서 책임전가하던건 팩트구연은소로 작가님한테 사불할때랑 하는 짓이 달라진게 없다는데 그걸 끝난 옛날 일이라고 말하는게 역겹다는 얘기고연
밑에 스포하는 놈은 머리를 머V리로 만들어줘야하고연"
46,2021-04-06 22:50,여기서 스포하는 애들 보면 정작 제일 중요한 포인트들은 빼먹더라 너네 제대로 읽긴 했어? ㅋㅋ
46,2021-04-06 22:41,있어요 아래
46,2021-04-06 22:41,"스포ㆍㆍ
ㆍ

ㆍ
ㆍ
ㆍ
ㆍ
ㆍ
ㆍ

ㆍ
ㆍ
ㆍ
ㆍ
ㆍ
ㆍ
ㆍ
ㆍ
ㆍ

ㆍ
ㆍ
ㆍ
ㆍ
ㆍ
ㆍ

ㆍ
ㆍ
ㆍ
ㆍ
ㆍ

ㆍ
ㆍ
ㆍ
ㆍ

ㆍ"
46,2021-04-06 22:29,우리 모두 독자를 보며 정화합시다 ☆☆☆☆☆☆☆☆☆☆☆☆☆☆☆☆☆☆☆☆
46,2021-04-06 21:37,전독시 사랑해ㅜㅜ
46,2021-04-06 21:13,팩폭맞아서 신고했노ㅋㅋ
46,2021-04-06 20:26,팩트는 할말없으니까 옛날일 끌고와서 물고늘어지는 놈들이 싫어요 누르고 있는거 ㅇㅅㅇ 행사 사건은 쏙 들어가고 이젠 옛날일 들먹이고 있잖음
46,2021-04-06 20:08,다음화 뭐나오는거였지.. 예습하고 와야겠다
46,2021-04-06 19:32,4시간만 더 있으면 다음편 나온다!! 너무 기대된다 😍😍
46,2021-04-06 19:22,우리 동훈이 언제 나오누
46,2021-04-06 19:18,대충 그린 컷이 하나도 없네 이건 진짜 전설이다
46,2021-04-06 18:37,"지금 제 3자분들이 트위터 어쩌구하시면서 말 얹으시는 것도 싸불이에요😭 아무리 자살은 거짓이었지만, 다들 이번 사건을 계기로 조금 깨닭음을 얻으셨으면 좋겠네요🥺"
46,2021-04-06 18:34,왜 여기서 난리지 본인들은 뭐 ㅇㅅㄹ작가 욕하던 애들이랑 다른줄아나 자기들이 지금 하는게 걔들이 하던거랑 똑같은짓 하고있는건 모르나보다 자기들이 당했다고 똑같은짓하면 쌍방과실 밖에 더 됨? 자꾸 이번일이랑 관계없는 작가 끌구와서 욕하면 뭐 대단한 정의의 사도처럼 보일거같음? 여기서 이러지말고 실트올리던가 여기선 웹툰 감상만 보고싶음
46,2021-04-06 18:24,"비계로 하는 애들때문에 그렇고 상관없고 다 끝난 옛날 일ㅋㅋㅋ
그래서 그때 은소로 작가님 욕하는게 계속 실트에 있었구나~ 자기들이 전독시 팬이라면서 은소로 작가님께 별 말에 담지도 못할 인신공격과 별 욕은 다 했었으면서 다 끝난 옛날 일?

그건 니네가 정하는게 아니에요~ 사람 칼로 찔러 놓고 그건 옛날일인데 왜 끌고오냐고 하는 꼴ㅋㅋㅋ

제발 더러운 악성팬덤들은 웹툰에서 나가주세요. 작가님들이랑 작품, 그리고 멀쩡한 다른 독자들한테 피해주지말고."
46,2021-04-06 17:59,트위터 일은 트위터에서 해주세요. 전독시 팬이 아니더라도 평범하게 웹툰을 좋아하는 사람들에게는 눈살 찌푸려지는 댓글들이 있네요.
46,2021-04-06 17:53,트위터 좀 꺼라 사회부적응자들아...왜 여기와서 지랄이냐;;
46,2021-04-06 17:36,김독자 멋있다!!! 제발 그렇게만 살아줘!!! 제발
46,2021-04-06 17:33,저 쿠키다써서 봤어요 다음화 빨리보고싶어요!!너무재밌어요!!  사랑해요!!!
46,2021-04-06 17:07,작가님 감사합니다!!!! 김독자 전독시 사랑해♥♥♥♥♥
46,2021-04-06 16:57,트위터는 계폭튀하면 그만인 비계 알계로 선동질하는 놈들 때문에 더러운거지 여긴 뭐냐? 계폭해도 증거 다 남는 곳에서 추하다~ 상관없도 없고 다 끝난 옛날일 질질 끌고와서 2차로 선동하는 게 네웹 댓글수준임?
46,2021-04-06 16:56,김독자 사랑해!!!
46,2021-04-06 16:40,김독잨ㅋㄱㅋㅋ
46,2021-04-06 15:54,겁나 재밌네..하....... 걍 지금 당장 완결 나줬으면... 존잼...하. 언제기다려
46,2021-04-06 15:45,트위터가 사회악인거 너희빼고 다알아
46,2021-04-06 15:36,제발 작품을 욕하진 말란 말이야ㅠㅠ 작품은 잘못업ㅎ다고요ㅠㅠ 별테좀 작작 하고ㅠㅠ 
46,2021-04-06 15:35,김독자 사랑해
46,2021-04-06 15:28,"타커뮤캡처ㅋㅋ 뭐지? 목숨으로 남 협박한다, 자살협박, 죄책감가질 필요없다, 죽음으로 회피했다 이러던건 다른 세계의 트위터였나? 트위터에서 그러던게 한 두명이 아니던데ㅋㅋㅋ
은소로 작가님 때도 그렇고 어떻게든 다른 곳이 한 걸로 돌리려는거 진짜 역겹네요."
46,2021-04-06 15:26,정희원이 입고 있는거 분명 거적떼기 아니었나 ㅋㅋㅋㅋ 얘가 입으니까 고급 코트가 됐네 ㅋㅋㅌㅋ
46,2021-04-06 14:15,유상아 능력 그림으로 보니까 확 와닿는다 간지 작살이네 미쳤다 ㄹㅇ
46,2021-04-06 14:10,와 작화진 진짜 갈려나갔겠다 그림작가가 한명이 아니라서 다행이네
46,2021-04-06 14:08,중혁쿤 도와달라능
46,2021-04-06 14:01,작가님 화이팅!!독자야 사랑해~~!!
46,2021-04-06 13:59,정희원 사랑해!
46,2021-04-06 13:41,찐따같은건 트짹들이었고ㅋㅋ 정상이없어 하여간
46,2021-04-06 13:38,전독시 특유의 푸른 색감 너무 좋아 ㅠㅠ
46,2021-04-06 13:37,이젠 꼬투리잡을 게 없어지니까 뇌피셜로 지랄하네 네웹 댓창 수준이 트위터보다 낫다며? 수준을 보여줘봐ㅋㅋ 트위터보다 더 더러우니까
46,2021-04-06 13:23,어벤져스냐고 개머싯어
46,2021-04-06 13:21,"제발 트위터에서 일어난 일은 트위터에서 말해;;;여기까지 몰려와서 이러지좀 말아...웹툰 보던 사람들은 뭔 낙벼락이야
ㅈㅂ 트위터 사람들이 한 일을 일반화 시키지 마 "
46,2021-04-06 13:15,부추기는 놈들이 더 소름끼쳐...싸패같아
46,2021-04-06 13:11,이번 편이 작화 씹레전든거 같은데..? 작붕이 없네
46,2021-04-06 13:05,김독자 사랑해 내 영원한 최애...진짜 너의 결말이 너무 기다려져....
46,2021-04-06 12:41,작가와 작품은 진짜 좋은데 그놈의 전독시 팬덤들 중에 악질들이 너무 많아서 괜히 작가와 정상독자만 피해받고 이게 뭐냐고
46,2021-04-06 12:34,근데 전독시는 작품은 ㅈㄴ 재밌는데 ㄹㅇ 악질이 ㅈㄴ 많음 자살주작치는새끼나 악플 ㅈㄴ 다는 새끼들이나 ㄹㅇ 이거땜에 피해본 작가도 있는데 괜히 작품이미지만 안좋아짐
46,2021-04-06 12:33,"아니ㅋㅋㅋ 자꾸 폐미들이 blblbl 개소리 하니까 진짜로 bl인줄 알았어ㅋㅋ 이건 현대판타지 성좌물입니다. 좀 작작 좀 bl 언급하지마셈 작가도 남자,여자 같이하는데 얼마나 ㅈㄹ을 떨면 개그로도 나옴?ㅋㅋ 그만좀 ㅈㄹ을 떠세요"
46,2021-04-06 12:23,김독자 사랑해
46,2021-04-06 12:10,BL 트짹충 냄새남
46,2021-04-06 11:57,기습 눈치채는거 신기하다.. 나였으면 댕청하게 있다가 개끔살 당했을 듯
46,2021-04-06 11:34,김독자 사랑해! 작가님 사랑합니다! 우리 이쁜댓글만 남겨요^^>;;
46,2021-04-06 11:33,진짜 상상만 했던 장면이 정리된거같아서 너무 좋아요ㅠㅜㅜㅠㅠㅠ작가님 감사합니다ㅠㅜㅜㅠㅠ
46,2021-04-06 11:24,근데 진짜 오토바이 퀄리티랑 빛표현 미쳤다.. 너무 자연스레 녹아들어서 이제서야 보이네
46,2021-04-06 11:17,김독자 사랑해😭😭
46,2021-04-06 11:08,?? 강일훈 쟤 엑스트란거 같은데 왤케 잘생겼냐 ㅋㅋㅋㅋ 당황했네
46,2021-04-06 10:15,독자야 사랑해!!
46,2021-04-06 10:13,"뭐야 미쳤네 정주행 한지 얼마나 됐다고 벌써 다봄. 아, 해떴네..."
46,2021-04-06 10:03,와 너무 재밌다 진짜 김독자사랑해!!!!
46,2021-04-06 09:47,엉엉엉ㅇ엉ㅇ엉ㅇ엉ㅇㅇ엉ㅇ엉ㅇ 김독자..........1일 1독자 하고 있음 
46,2021-04-06 09:46,김독자 미친듯이 사랑해!
46,2021-04-06 09:21,이 편은 그렇게 좋아하진않았는데 웹툰으로다시보니까 신기하긴하닼ㅋㅋㅋ 깃발떼서 묶는겈ㅋ 왜 못본거같지 웃기네
46,2021-04-06 09:17,독자야 사랑해ㅠㅠㅠㅠ 평생 행복하자~~~~~~~~~
46,2021-04-06 09:17,김독자 김컴 파이팅!
46,2021-04-06 09:16,아 개꿀잼일줄 알고 왔는데 잊고있었다..... 2억배는 역한 돼지한남새기들이 몰려왔을것이란걸... 아 니네 여자 염탐하는 티좀 그만내 토할거같아 ㅋㅋㅋㅋㅋㅋㅋㅋ
46,2021-04-06 09:07,ㅈㄴ 역겨워 얘들아 작품이랑 아무 관련 없다고 작가님한테 욕하는 새끼들 다 입 처 닫고 꺼져
46,2021-04-06 09:05,남초새끼들아 댓창 흐리지 말고 ㄲㅈ 진짜 추하고 찐따같다
46,2021-04-06 08:56,악플 법적대응 쌉가능인데 세상 무서운줄모르고 ㅋㅋ
46,2021-04-06 08:52,김독자 사랑해~ 독자야 예쁘다!!🥰
46,2021-04-06 08:46,김독자 사랑해
46,2021-04-06 08:38,김독자 사랑해
46,2021-04-06 08:17,김독자 사랑해!
46,2021-04-06 08:06,김독자 사랑해
46,2021-04-06 07:46,김독자 사랑해!
46,2021-04-06 07:45,"뭔가 필두가 멋지게 해결할거 가틈 ,, 필두 화이팅 ,,!"
46,2021-04-06 07:17,길영이도 사랑해
46,2021-04-06 07:16,김독자 정희원 이현성 유상아 유중혁 이지혜 사랑해
46,2021-04-06 07:14,댓글 왜이런지 모르겠고 그냥 빨리 11시 왔으면 좋겠다
46,2021-04-06 05:53,일단 자살이 주작이고 트위터에선 가해자로 지목된 애 먼 사람 하나 잡을 뻔 했단 걸 기억하시고... 다시는 이런 일 없도록 하고 자중 좀 하고 사실무근 자료 퍼나른 사람들 반성을 하고... 해야지 정정 자료 안 보고 욕하는 건 단순히 못 본 건가요 아님 인정하기 싫은건가요...
46,2021-04-06 05:37,안 올라왔으면 좋겠다는 건 이 댓글 싸움이 다음화까지 이어질까봐 입니다. 전독시 싫어하는 건 절대 아니에요.
46,2021-04-06 02:36,작품과 관련해서 그 어떠한 일도 없었습니다.... 다 작품 외의 전혀 관련없는 얘기입니다
46,2021-04-06 02:25,댓글꼬라지 봐라 ㅋㅋ 트짹이 60마리가 댓글 추천조작하고 다니네 ㅋㅋ
46,2021-04-06 02:18,"유       오      본      손     음상      도       사      해    사
아      방      람      임     랑
실       구      ?       개    해
로        슉     인      오
쇽       한     생      져
해      거     절      멋
서       안     반     있"
46,2021-04-06 02:04,"전독시를 최근 보게 됬고 정말 좋아합니다보는 동안 너무 재밌게 읽고 즐긴 소설,웹툰이고 
앞으로도 좋아할거고 계속 몇번이든 읽고싶은 작품이에요
좋은 작품 정말 감사합니다 작가님들
"
46,2021-04-06 02:03,자살 주작에 관해선 아무 말도 없네... 결국 아무것도 모른채로 딴 사람한테 살인자니 뭐니 한 사람들 다 어디 간겁니까?
46,2021-04-06 01:55,팬덤이 웹툰 소설 모든 이미지 망친 사례1
46,2021-04-06 01:48,아고..희원누나랑 독자형이랑 현성이형 이랑 상아 누나 나란히 서있는거 보고 진심 심쿵했다...당신들 내 심장 훔쳐갔어..
46,2021-04-06 01:48,팬덤 어쩌고 분탕 치시려면 그냥 나가요.
46,2021-04-06 01:14,발이 너무 작은데 한번보이니까 계속 보여요ㅋㅋ ㅋㅋ ㅋ ㅋ
46,2021-04-06 01:13,독자야 사랑해 결혼하자 날 가져 
46,2021-04-06 00:40,상아야ㅜㅜㅜㅠㅜㅠㅜㅠㅜㅠ
46,2021-04-06 00:37,넷이서 걷는 장면 너무 깐지작살... (＾ω＾)ﾉｼ
46,2021-04-06 00:35,작가님 매주 정말 잘보고있습니다!! 감사합니다:)
46,2021-04-06 00:25,"아...완결까지 10년...그럼 나는..대학생이겠군,. 독자야 좀만 기다려 아니 우리 김컴 쫌만 기다려 내가 돈 왕창벌어서 너네한테 쓸께ㅠㅠ 우리 희원이 간지나고!! 상아는 이쁘고!! 독자는 그냥 인생의 낙이고!! 현성이는 든든한 사람이다!!! 끼약호!!!"
46,2021-04-06 00:20,너무 재밌다...... 기다렸다가 모아서 보는게 이렇게 힘들줄이야
46,2021-04-06 00:06,작가님 잘보고 있습니다. 감사합니다!!!!
46,2021-04-05 23:49,일훈아 난 널 믿었다고 너와 결혼까지 생각했어 워어어~~~
